post_id,title,score,url,num_comments,created_utc,author,selftext,comment1_comment_id,comment1_comment_body,comment1_comment_score,comment1_comment_author,comment2_comment_id,comment2_comment_body,comment2_comment_score,comment2_comment_author,comment3_comment_id,comment3_comment_body,comment3_comment_score,comment3_comment_author
gfd6bo,"And just like that, my last class at UT is done",479,https://www.reddit.com/r/UTAustin/comments/gfd6bo/and_just_like_that_my_last_class_at_ut_is_done/,40,2020-05-07 19:19:44+00:00,None,"The title says it all - no finals, tests or presentations left. I am a graduating senior and about an hour and a half ago finished up my last class. I feel nothing and everything at all. I still remember so much, and have gone through an incredible transformation over the last four years here. I wanted to write down my story briefly for you longhorns; I hope you feel comfortable enough to share something as well. 

I come from a small town in Texas, and about only four of our class came to UT. I roomed for three years with one of my best friends, and came into college in a relationships with my then girlfriend. We broke up mid-way through the first semester and it absolutely crushed me. I spent a lot of time isolating, lamenting and being dejected. I was a pretty bad person and so I felt like it was punishment for me to suffer and not enjoy college. I spent most of my time my first two years just studying. I did not make many friends, and the ones I did make I did not keep up with. I played in a sports club but I only made two good friends (still good friends with both). However, most of my time was miserable - I put on weight, struggled with becoming a better person, felt like I didn't deserve much and just wanted to suffer a lot. It was the only sensation I felt really strongly. I didn't have any friends to confide in and just didn't feel like it was worth it. Although this never hurt my studies - I really enjoyed my classes and felt like my professors were the best people in my life. Additionally, I spent much time reflecting and keeping up a journal (which I still do), and reading books. These two things kept me afloat, and actually made me a better person.  

But I realized that holding grudges against myself was wasting so much energy - I was tired of being so sad on purpose and living a miserable life. I started to eat right, work out in the mornings, took up a part time job on campus, and started saying ""yes"" to life more often. Life didn't change magically change or get amazing - but it did get better. I made a few more friends, got nice internships, expanded my network, stayed healthy, got back into my numerous hobbies, went out more and just...lived life. I never did anything I didn't want to, or felt pressured to do something. I made many great memories, and I am thankful for my pain because it gave me wisdom and through that I grew. I am proud of what my four years meant to me, even though it wasn't the most ideal. All my friends have been supportive in their own capacities, and I have grown close to many professors. Everything isn't fine and dandy, but it is better. 

And now it has all come to an end. I really don't know what will happen with commencement. I really don't think it will go through if I am being honest. I am upset my parents won't get to fulfill their own dream of seeing their son graduate and walk. Or that I won't get to take pictures with my professors and friends at graduation. I plan on writing a letter to every professor, TA, and friend that inspired me and meant something to me. This isn't the end of things though. I will also be back here for my dual Master's program, so I am very thankful I don't have to part ways with Austin and UT yet. This isn't the way I imagined it, but that is okay. I have achieved so much, and I have so much to achieve. 

Thank you for reading. I hope that those who read this also share their story - I would love to read it.",fpszgd3,"I'm just some dude on the internet, but I'm proud of you, and of your school choice.

My wife says it's a shame you couldn't go to a real college.

But since she's an A&M grad, she doesn't know what that is.",203.0,AngusVanhookHinson,fpt2w7y,"I'm also a graduating senior. It was a strange and slightly sad moment to realize in the middle of spring break that I had already experienced my last day in an actual classroom. 

I'm glad UT was such a positively transforming experience for you as well. I wouldn't worry, I'm sure your parents are proud as hell despite the ceremony not being what any of us expected.",33.0,IIIBRaSSIII,fpsyuc6,"Thank you for sharing this. I agree so much with all that you said in the ways UT has changed you.

 I was supposed to be class of 2020 but thanks to my own dumbassery I have to add on another year. But after four years here, my heart breaks for you all in the true class of 2020, and I can't begin to imagine the emotions being felt with all this. 

But you made it! I hope you know you will continue to change the world after graduation. Hook em.",22.0,for-the_love-of_cake
fuzf6a,It looks like UT squirrels are getting accustomed to online classes. 🐿️🤘,476,https://i.redd.it/xt7okw9bouq41.png,16,2020-04-04 19:11:55+00:00,squirrelsofut,,fmfnuf3,Does anybody know if the squirrels are going to have enough food without everybody there to feed them? If not I may have to make some new friends 😝,32.0,None,fmfpc8x,Haha I love all these names,9.0,None,fmfnrma,I like Nutmeg,6.0,eyesuxdix
b72wu9,How to study for midterms at UT,479,https://v.redd.it/smyjmq7vk4p21,20,2019-03-29 21:24:44+00:00,Atomical1,,ejp1252,The irony that you made this *when you should have been studying for midterms*.,112.0,lukipedia,ejp0m6u,Lmao there’s gonna be a whole UT Anime soon enough ,89.0,sentinel1588,ejp14nc,Wow this is a level of effort I was not expecting from this sub,69.0,TheRedGerund
ptwdaf,Did a photoshoot with crossing guard Michael Shaw the other day 📸🤘,477,https://www.reddit.com/gallery/ptwdaf,14,2021-09-23 14:23:56+00:00,drewsz724,,hdz0j5t,I love that guy,55.0,Izacundo1,hdz5738,Yes!! Michael is the absolute best human. I love him!,33.0,AllThotsAllowed,hdywk8q,Love it!,18.0,JohnHwagi
kko3b2,The tower from Mount Bonnell this morning,477,https://i.redd.it/suue1nke0l761.jpg,13,2020-12-26 19:19:30+00:00,shanew21,,gh45zz1,What kind of lens did you use to take this all the way from Mount Bonnell?,40.0,tennismenace3,gh46bp1,"Mount Bonnell has some great city views but I fell in love with whatever street this is (I’ll have to figure out which) that went right towards the tower. 

Gear was the Sony A7Riv with a 135mm lens (and cropped pretty heavily in post)

If you’re interested in any more of my photography I post it here: https://www.instagram.com/shanewarephoto/",21.0,shanew21,gh5rnrg,This pic is fucking dope 🔥,5.0,baller21bush
m9oifs,Pain,474,https://i.redd.it/0aqiam0d8bo61.jpg,6,2021-03-21 04:36:33+00:00,degogo_,,grpa8av,A day that will go down in infamy.,22.0,yobymmij2,grpy1bg,Living in Spain without the S,6.0,TurboJelly25,grqmitc,lol my dad graduated from Illinois we're both bitten by something I swear man,5.0,Dinoswarleaf
hnqyge,I think I’ll pass on this,470,https://i.redd.it/47evgfl5lp951.jpg,19,2020-07-08 22:22:22+00:00,abocado3,,fxdccq4,A fall semester without football will be pretty rough. Hopefully they can find a way to make empty stadium broadcasted games without compromising player safety.,36.0,AirGundz,fxdk50v,"A big Big Ticket advertisement was sent to my inbox in early June. I’m a senior now, so that may factor in, but it’s definitely the earliest I’ve ever received it",23.0,HoneyBiscuit420,fxdi57t,"So, did anyone here actually purchase the big ticket? Are they offering any kind of refund or anything",15.0,King_of_Fish
g0op9n,Nothing but respect for my (university) president,472,https://i.redd.it/6adviqd9pms41.jpg,6,2020-04-13 18:30:12+00:00,longhorn089,,fnavyjq,Domino just accepted a position at Rutgers.,57.0,chiarde,fnb45gj,Sure he'll do a feline job.,24.0,prybot,fndtb3i,"I can't believe I may never see him again, this was my last semester at UT :(",7.0,Globuseuropa
mo9tw0,the pandemic is over....the clone wars is now,477,https://www.reddit.com/gallery/mo9tw0,20,2021-04-10 18:09:23+00:00,the_mrfancypants,,gu2ol00,This is the white boy summer we were warned about,196.0,B_wiggle,gu2uj5d,For the republic,90.0,Htmlpro19,gu3axd2,"I was noticing the same thing when I was out earlier. Lo and behold, my car is one of these pics",40.0,stretchthelegs
fwdb27,I think we all know there’s only one individual who can step up and run this university...,470,https://i.redd.it/grdjw7jpgbr41.jpg,8,2020-04-07 03:38:07+00:00,DeerOnTheRocks,,fmno4e2,It’s about time he claws his way to the top.,64.0,DeerOnTheRocks,fmns7l1,Domino!,31.0,None,fmnorpv,master plan has been revealed,27.0,rzzzvvs
gdvcnw,It really do be like that sometimes.,462,https://i.redd.it/jg7px5c2cxw41.jpg,9,2020-05-05 10:31:55+00:00,Lanzhou77,,fpkeilr,a big hook em for pass fail,61.0,Treesru101,fplcy51,[deleted],2.0,None,fplan45,Same,1.0,Auhsoj753
g9ry4o,"The help I am getting from most of my professors during the pandemic (2020, colorized)",464,https://i.redd.it/qenf0v10klv41.jpg,11,2020-04-28 17:51:54+00:00,for-the_love-of_cake,,fow9l19,What classes are y'all taking? All of my professors have been understanding and helpful. I'm sorry to hear that there are professors out there that are being asses.,50.0,MythicalNightPhoenix,fowguh5,Facts,5.0,sadboi-cake,foxetxd,@ alison norman,4.0,TeeDroo
aqwsc3,RIP,465,https://i.redd.it/6rsmi9wxmqg21.jpg,9,2019-02-15 13:56:37+00:00,Rynneer,,egjj1go,Why am I crying in the club rn,20.0,WiseSoup_,egjaaed,F(atality),10.0,zombiesartre,egjcg7g,[https://i.imgur.com/XS5LK.gif](https://i.imgur.com/XS5LK.gif),9.0,shiruken
g7xftp,All good boys go to UT,465,https://i.redd.it/4tu3oxha5yu41.jpg,6,2020-04-25 17:27:36+00:00,kkristina10,,fok5i5r,...and all bad boys go to Cabo,73.0,carlsligh,fokfseb,She’s got a very Texan room,20.0,WitheringRiser,fokdjb8,*woof* *woof* hook em'!,14.0,weasted_
in56zx,I thought I was going to UT. I'm actually attending University of Google.,463,https://i.redd.it/4bgr8vos6dl51.png,9,2020-09-05 17:32:08+00:00,reeroh,,g45dom7,[deleted],70.0,None,g45wx1o,"Lmao this is me and anatomy lab. There's no ""lecture"" for the lab, I've been googling everything and learning things on my own (their computer app is useless). But Im also paranoid that Google may be wrong. I also feel kinda stupid asking the TAs again and again to explain concepts, but I do it anyway bcs I'm paying 40k an year so that people can answer my questions w/o me feeling stupid about it. Oh well...",31.0,weasted_,g46z7ia,"Oof, good luck that",4.0,None
hudonq,Oh dear,465,https://i.redd.it/dunftrcqgxb51.jpg,23,2020-07-20 03:00:06+00:00,TurboJelly25,,fymhhzh,Swiggity swine your meme is now mine.,41.0,Lanzhou77,fymqp9x,"That is not a great trigger, because it is not reassuring to the students or the faculty. While the death of a student is unlikely, other triggers would be better in this case.

What UT should have done instead is set a threshold for the maximum number of cases among students before they shutdown. If a high number of cases occur, then the odds of a death among the students is increased (but still unlikely) and they should shut down.

Not a great move on UTs part to include that as one of the triggers.",32.0,M3L0NM4N,fymipq0,Time to take that gap semester,21.0,AirGundz
i5hn7z,Was told by UT Health to take an Uber to get COVID tested when I'm symptomatic!,465,https://www.reddit.com/r/UTAustin/comments/i5hn7z/was_told_by_ut_health_to_take_an_uber_to_get/,36,2020-08-07 17:06:46+00:00,heyyimbored,"Title says it all. I am UT staff and since I don't have a car, UT health won't test me unless I get an Uber. They only take drive-through.

When I said it was crazy to ask a symptomatic person to expose an Uber driver, I was told to ""wear a mask"".

I am completely shocked.

&#x200B;

Edit: I live a mile from the facility and can easily walk there.

&#x200B;

Edit 2: I left feedback on the UT Health website and within an hour, I received a call apologizing and saying that is NOT their policy, and they will let all people answering the phone know that they do NOT recommend ride sharing to the testing facility,",g0p8azp,That’s insane! Can’t wait to learn the way they apply this special brand of idiocy to students.,173.0,beancounterzz,g0pf1ao,PLEASE order thru Pixel Labs. I've done it twice now. It's so easy and covered by insurance or the CARES act. results in 3-ish days.,53.0,kayelar,g0p8b1r,"OP, do you have some communication from UT Health, or was this via phone? They do say they're doing [drive-in testing here,](https://uthealthaustin.org/blog/coronavirus-updates) but do not elaborate further about how to obtain testing. Frankly, it is ridiculous that they are not considering the many, many people in the city that do not own a vehicle.",20.0,kazaanabanana
m8z3ik,King Domino,454,https://i.redd.it/k112vmaxx3o61.jpg,1,2021-03-20 04:05:37+00:00,aaples5,,,,,,,,,,,,,
g1l5km,"Instead of studying for a chemistry test, I made this",458,https://v.redd.it/qo66aikgvws41,10,2020-04-15 04:42:40+00:00,sooshibear,,fnge4yo,I’m browsing reddit and I have a chem test on Thurs :( RIP us,23.0,None,fnga0fe,Nice.,9.0,CatsAndGeese,fnh4x92,u/vredditdownloader,1.0,rkapi24
gcfqeh,Until next year...,444,https://i.redd.it/b4zm9t8ylfw41.jpg,6,2020-05-02 22:56:29+00:00,origamistofthenets,,fpb8wpe,Wish us graduates could say the same,60.0,DeerOnTheRocks,fpb1pen,Taken from my (former) apartment on a Canon EOS Rebel T4i,23.0,origamistofthenets,fpb4jr3,What a great photo!,8.0,flubflubflubflubflub
fra6ph,Made a UT cap for all ur island chores,449,https://i.redd.it/svl1nxv3jnp41.jpg,14,2020-03-29 18:04:39+00:00,favoritelauren,,flunkjt,Just bought the game it looks cool,28.0,ForwardPlate,fluoy52,"love it, ty",17.0,psychometrics1,fluv5mh,That is awesome! Can you do a shirt as well?,9.0,FoamythePuppy
hwdz4r,3am Jendy’s > Any other time Jendy’s,448,https://i.redd.it/yo4982atdlc51.jpg,12,2020-07-23 11:26:29+00:00,TurboJelly25,,fyz1q1u,3 am Jendy's hits different,45.0,bottleflavor,fyz91mr,I’ve eaten so many late nights meals at Wendy’s that it disgusts me now.,37.0,alpaca417,fz0ae8d,"Went to Jendys at 2 am one night. Turns out it was the same night the UT swim team had won the Big 12 and they were all in there with the trophy filling it with french fries. Was a surreal sight. 

Jendys at night is just a fever dream.",23.0,orioneft1
fhlh45,UT Prof here. We’re here for you.,446,https://www.reddit.com/r/UTAustin/comments/fhlh45/ut_prof_here_were_here_for_you/,50,2020-03-12 18:57:19+00:00,IReallyLoveAvocados,"Hey so I am a professor (in a humanities subject, I won’t say more here). I think it’s important that you know that your professors have your back. We know there’s a lot going on right now, and our top priority is your health and well being. So take it easy, stay healthy, and we’re here to work with you to make sure the semester goes as smoothly as possible.",fkbudih,"How much do you like avacados? Do you expect avacadoe stocks may be affected by COVID19? Can avacados catch corona?

(More seriously thank you and stay safe! Wash your hands for 20 seconds with hot water and soap to defeat coronavirus!)",123.0,None,fkbv41r,"Prof, how is the online class format going to work come exam time? Will most humanities courses shift to essay style finals?",44.0,9994L,fkbwyb8,Solidarity to y'all from the Staff side.,32.0,JeSuisUnScintille
ivmqdr,I was cleaning out my wallet when I starting crying a little,444,https://i.redd.it/d7dm1e9sk1o51.jpg,25,2020-09-19 05:39:54+00:00,young_d484,,g5socib,Fun fact: Moojo is where I had my first date with the mother of my child,130.0,rodvn,g5sxprd,"tfw you will never have an ultimate roast beef from fricano’s again

big sad",54.0,None,g5sq0rt,[deleted],44.0,None
bbsc0m,Talk fancy to me,440,https://i.redd.it/54a063p9jir21.jpg,9,2019-04-10 22:27:15+00:00,neilader,,ekl7azy,Public Ivy,82.0,KingIsles,eklftg2,Just say “Texas” for the biggest flex.,33.0,thepro7864,ekl6ubz,Yee the haw my good sir,27.0,WitheringRiser
rab99m,My Probably Last Invasions on Blackboards,445,https://www.reddit.com/gallery/rab99m,18,2021-12-06 16:30:22+00:00,YunJang,,hnh833k,That Engineer drawing tho.,30.0,TheEngine,hnhyisx,They need to erect a statue of you on campus,19.0,Roddaddie,hnh6ekr,Where do you find blackboards these days? This is gorgeous!,10.0,victotronics
ay13rl,Petition to make Matthew McConneghey the voice of the UT Emergency Alert test.,439,https://www.reddit.com/r/UTAustin/comments/ay13rl/petition_to_make_matthew_mcconneghey_the_voice_of/,19,2019-03-06 17:03:24+00:00,drpinkcream,"Seriously, just imagine that.  It'd be an upgrade.",ehxjtyq,"""Alright alright alright...this is a teessst of the UT Austin emergency nofitification system. Mmmmm this is only a tesssst.""",86.0,CSThr0waway123,ehxffrj,"I second, provided his announcement is in the style of his Buick ad copy.",52.0,gatotacos,ehxut7m,Is he a knockoff of Matthew McConaughey?,28.0,crotchcritters
ikowh1,She will find you,439,https://i.redd.it/erfkp5hsokk51.jpg,20,2020-09-01 17:39:19+00:00,coasterwizard15,,g3mqcw2,"In fairness, it was 7 AM. But yes, I will find you. 

\-Dr. R",351.0,mhr554,g3n2gwi,Professor Redlick says she browses Reddit. Hi professor!,93.0,HalesOwnShrek,g3mawsu,Can someone explain the story?,71.0,Pandamonium98
jrsrdm,How UT Handled the Pandemic,435,https://v.redd.it/bx3ipkiu1hy51,14,2020-11-10 20:23:22+00:00,MikuMillian,,gbvcop4,"I don't understand the meme, but upvoted due to cat and awesome dude.",115.0,DogGoesWooof,gbve5bu,"Tbf they haven't done that bad; cases have been controlled-no spikes, adequate testing, free masks/sanitizers, occupancy limits and distanced furniture, among other things.",64.0,None,gbvwy0b,Ochem lab crisis really did hit us hard,13.0,Chuyo3000
k9wzy0,"Perfectly balanced, as all things should be",430,https://i.redd.it/xqpklhssb7461.jpg,13,2020-12-09 18:06:04+00:00,None,,gf6wtjy,"Neither of those thanos lines really work, maybe “I guide others to a treasure I cannot possess” would be more fitting",89.0,Terrowin42,gf7a4gi,Why ut always gotta have the good memes,18.0,RomanianDraculaIasi,gf72br8,I’m in this meme and I don’t like it 😞,12.0,milkteaisreallygood
huudiy,Helth,434,https://i.redd.it/d5h18pl703c51.jpg,10,2020-07-20 21:38:11+00:00,TurboJelly25,,fypzrp1,"and just like UT, the lives of staff aren’t even considered here",27.0,discther,fypfebq,"To be fair, the money car only comes with a single dead student. 🙄


https://www.google.com/amp/s/www.texastribune.org/2020/07/17/ut-austin-reopening-closure-fall-death/amp/",23.0,beancounterzz,fyqgtks,"mhm yes this does indeed take the whole situation into account

UT is legally not allowed to take on debt or make decisions they have evidence will cause them to take on debt. Decisions that reduce enrollment will certainly put UT in debt. With 10% of the budget already cut, the institution literally has no choice. If you wanna blame someone don't blame admin, blame the legislature that enshrined this in the fucking constitution of the state.",11.0,None
r927mv,idk who the fuck chairman gonzalez is I’m just trying to go home,435,https://i.redd.it/yyc3eq2t2m381.jpg,57,2021-12-04 23:35:53+00:00,Reaniro,,hn9cwdm,Yeah can someone please explain to me what this was about? 😂I could see them walking up and down Guad,53.0,lauren_mo,hno9zo9,gonzalez apologists are NOT allowed to comment on this post unless they can prove they have boiled at least ONE baby,6.0,big_ooga_booga,hnc59sk,"oh look, the red cops.",5.0,seraph9888
jrvlw5,I think y'all need a little Domino to relieve that stress ;),430,https://www.reddit.com/gallery/jrvlw5,15,2020-11-10 22:51:22+00:00,Bunizs,,gbwod3h,The best part of freshman year is finding out that everyone else knows about the cat living in the bushes at the FAC and that they’re actually kind of a big deal,39.0,hedgehog-fuzz,gbvzcmn,Domino blep! This is super high quality! God I miss this cat (and I have 3 of my own even).,24.0,renegade500,gbw04b2,"Oh whoa whoa, Domino 🎶🎵",6.0,soulmindbody
g19d9b,I want to go back...,421,https://i.redd.it/44esak2rets41.jpg,9,2020-04-14 17:03:35+00:00,utpics,,fne6e5s,[deleted],92.0,None,fnekkvk,[deleted],36.0,None,fneqq3k,"I can see my window in this pic, made me sad",13.0,jrratx
pkpngm,creepy dude at the silent disco at Greg: Just a warning for other students (particularly girls in small groups at night),424,https://www.reddit.com/r/UTAustin/comments/pkpngm/creepy_dude_at_the_silent_disco_at_greg_just_a/,29,2021-09-09 03:22:05+00:00,nutmeg4096,"Okay y’all I never post but I honestly feel like I just need to say this in hopes of warning anyone/making people aware. 

But my friends and I went to the silent disco tonight at Greg. It was pretty low key, but enough people for it to feel safe and such at night. Plus there’s always some people out on speedway at night anyways. So my friend and I are chilling on the side and this guy comes over to sit with us. Initially he seems chill, kinda interesting, whatever. First red flag was that he didn’t even go to UT. He said he was giving his friend a tour of Austin and stopped by campus. Second red flag was that he was obviously significantly older than us and actually showed excitement (ew) when we said we were freshman/sophomores. Then, when we asked him what he does (since he’s apparently not in school), he literally says “you don’t want to know what I do.” Finally after a really awkward few minutes of him calling us “party girls” and “freshies” he asks if we want to go get smoothies?? We both don’t really answer and I think he FINALLY gets the vibe and says he’s gonna go find his friend (who he said was this dude dancing in front of us.) Well when he gets up he goes no where near his “friend” and actually just walks away to a nearby staircase where he sits down and stares at us. 

THEN a group of girls (who were the best people ever like thank you so much for checking on us) comes up to us and repeats everything he told us because he had tried the same lines/story on them JUST BEFORE US. Asking to get smoothies and everything. Lemme just say that gave me freaking chills. We waited for him to get up and leave before even considering walking back to our dorm. 

Anyways. This is tame compared to some situations, I get that. But I just had to say something because I’d never want to hear that some girl actually took him up on the smoothie offer and something happened. And no, there really wasn’t an option to “report” him or anything  as the whole thing was just students (even though I’m honestly thinking I should’ve done more). But just please be careful. I feel stupid that I even entertained a conversation with this man. The first half seemed fine but if he hadn’t been so outwardly creepy something really could’ve happened. Please stay safe y’all💖",hc59okb,"Unidentifiable man hitting on freshman girls on campus? That is certainly an incident where you would be in the right to call UTPD and let them handle it. At best he’s trespassing, and at worst he might be intending to commit a more severe crime.",253.0,LukaDoncicMFFL,hc55rir,"Hey, I feel you. I had a similar experience when I was taking a walk coincidentally before a football game, this middle aged white man who was going to the game with his friend asked me hey, where's the stadium? I gave him directions, tried to leave. He starts introducing himself, asked my name, if i go to college, and wanted to shake my hand. I quickly said my name, shook his hand and wanted to leave AGAIN ASAP. Zoomed away 6 ft from him, he's like HEY, do you wanna get dinner? I was like no, bye.

Meanwhile his friend was standing 10 feet away from him, and then i realized, he fucking knew where the stadium was, his friend seen this shit happen before, and he used ""if i go to college"" as an implicit way to find out if I was of LEGAL age. ffs I immediately went back home and washed my hand like 5 times cuz I was so grossed out.

Protip: If any shady guy asks if you go to college, just tell them you're in high school and if they wanna go to jail. PLUS DON'T INTRODUCE YOURSELF EVEN WHEN HE INTRODUCES HIMSELF FOR NO REASON. klsjlfjalkfdjaljsdfa

Stay safe yall.",116.0,may51234,hc5d0o3,"Y'all please stay safe out there. Please remember that it is not your obligation to be nice to people if you're uncomfortable. F*ck being polite if you feel uncomfortable, you don't owe anyone else anything.",104.0,chaosinthemind
iymd3q,Gg,418,https://i.redd.it/payajooskzo51.jpg,9,2020-09-24 00:00:21+00:00,alabaminkid,,g6djwl8,"GPA: 📉
Covid: 📈",118.0,realscholarofficial,g6do53m,"A&M has 6k Covid cases, y'all doing fine kek",35.0,GENERALPOTATO243,g6dq6wr,This is a great meme format,27.0,zzshake
l6zj1s,West Campus sunrise hues from this morning,416,https://www.reddit.com/gallery/l6zj1s,3,2021-01-28 15:22:50+00:00,maruthgoyal,,gl5mi14,"No wifi, just vibes",14.0,chris_likes_science,gl4z1s1,That’s beautiful!,5.0,None,gl5zm4p,I miss being there.,2.0,thematterasserted
