post_id,title,score,url,num_comments,created_utc,author,selftext,comment1_comment_id,comment1_comment_body,comment1_comment_score,comment1_comment_author,comment2_comment_id,comment2_comment_body,comment2_comment_score,comment2_comment_author,comment3_comment_id,comment3_comment_body,comment3_comment_score,comment3_comment_author
fikhzq,Coincidence?,598,https://i.redd.it/il8skcpounm41.jpg,9,2020-03-14 15:57:08+00:00,None,,fkhtxv9,"Lmfao, I dont know why I found this so funny",39.0,Tommy1623,fki1kc5,Name a better duo. I’ll wait.,14.0,Leifbron,fkioz1j,Illuminati confirmed.,5.0,dc469
go46s2,Would have loved to know I was failing 3 weeks ago,599,https://i.redd.it/px9s5u1cd6051.png,7,2020-05-21 20:07:33+00:00,deadface008,,frdsw14,Feel ya. My acc prof told us we'd be able to correct our labs and then he didn't get them in until the semester was already over and he put in the grade in our book. So we had no opportunity to fix anything and we couldn't fixed any mistakes we repeated.,98.0,RTBC5555,fre8w4x,"Email prof. Explain that he told the class that we would be able to correct the labs, but he did not get them in until semester was already over, and he had put the grade in the book.  This providr no opportunity to fix anything or learn from mistakes. Would appreciate an assignment or opportunity to bring grade up. (With a D, can at least pass fail. ) Also contact your Dean's or advisor's office.",36.0,alligattor,frf24s6,We out here on at that Q-drop life fam,4.0,AristosTotalis
g2qxe8,Me: Doesn't study for exam because it's now online and open note. Exam: Difficult. Also me:,587,https://i.redd.it/pfgzh3z2r9t41.jpg,22,2020-04-17 00:02:49+00:00,for-the_love-of_cake,,fnn5w5g,Someone took the chem test,77.0,MuffinTheMan35,fnn3rlx,CH302 gang 😪🤘🏼,77.0,Chuyo3000,fnnahyc,Is this the CH 302 exam,57.0,ThatVolt
lq85i9,Sleepless nights here we come!!!,584,https://i.redd.it/3vht4yjrd5j61.jpg,11,2021-02-23 03:35:29+00:00,Visible-Challenge356,,gof71mg,It’s GG my friends. Hook em’🤘😔🤘,46.0,johnnyjoemama2,gofd355,Don't forget that you can use the 3 COVID-19 P/Fs this semester as well (if you didn't use all 3 last semester). EZ.,40.0,anshshard,gofj5bc,I'm so glad I graduated before this pandemic. sounds like it totally sucks. shouldn't have to pay full tuition for that honestly,25.0,None
hhixst,"I made a 3D Model of the tower, gave it arms and legs, and made it into a VRChat Avatar",576,https://i.imgur.com/IyoHgsT.png,14,2020-06-28 17:55:06+00:00,annoyingWanderer_,,fwajrpi,What starts here changes the world.,86.0,yellow_porsche,fwavumk,This is why cockrell school of engineering is in the top 10 Enginnering schools in this country,41.0,TreeCutter101,fwafz5c,high art,24.0,toasterstove
hc5iht,Finally a genuine & authentic email from UT,565,https://i.redd.it/fcixfdcvow551.png,14,2020-06-19 18:02:21+00:00,eulestadt,,fvczdfe,this is the first time i've ever felt valued/heard by UT administration tbh,154.0,fairy6870,fvd76qb,That’s a nice note. I’m glad to have someone like her in the administration.,127.0,CF5300,fvd9upj,Dean Reagins-Lilly always has the best messaging to students. If we lived in a fair world she would be our interim president and future university president. Sad we get 🐍,91.0,antmbel
pvlcxn,How the turn tables,565,https://i.redd.it/7xrn5189irp71.png,5,2021-09-26 02:53:53+00:00,BX1959,,hgkbgt5,I go to A&M and yes,4.0,steven_chapa10,,,,,,,,
jww82z,pleased to say that domino is doing well these days,567,https://www.reddit.com/gallery/jww82z,14,2020-11-19 04:41:00+00:00,thaiearltea,,gcst5nz,Thank you! I miss Domino.,31.0,BEWinATX,gcsu6mn,When did you take these? I saw him in basically the exact same spot last night.,27.0,thematterasserted,gctp57k,I miss seeing him. And he sits so prettily.,11.0,renegade500
qznwh9,Spotted in a GDC computer lab,567,https://i.imgur.com/YWR9P4j.jpg,16,2021-11-22 15:26:36+00:00,Malwake,,hlnwd9w,"As ex CS/Cola I agree 100 percent. Whoever put this up is a hero, but the worst smells I ever smelt came from a Philosophy major. Still the underground CS lab has the worst consistent smell, so shower up",79.0,Sexy_Chocolate,hlnp13l,"A tale as old as time, or at least the Painter computer lab",32.0,kalpol,hlp8qk0,It’s not apart of the undergraduate core curriculum,18.0,Lyin25
jzl5no,PASS / FAIL Approved by UT Faculty Council,568,https://i.redd.it/a2jpfszuq0161.jpg,105,2020-11-23 16:45:34+00:00,hsdropout19,,gdcg2jz,I really could have used this before the Q-drop deadline.,167.0,mr_buildmore,gdcffom,Ah yes. Perfect timing for me to do no work over break,89.0,decc2399,gdcraam,[deleted],80.0,None
jabul6,Domino is overseeing the early voting activities st FAC to make sure there are no shenanigans,566,https://www.reddit.com/gallery/jabul6,11,2020-10-13 11:53:40+00:00,renegade500,,g8p5e7g,[deleted],37.0,None,g8pcdd2,The only poll watcher I approve of,36.0,shaand24,g8one5g,"I came to campus early to vote (and in the few minutes I've been here around 30 people have gotten in line). I also wanted to see Domino, because I've missed him so much!",24.0,renegade500
lr408k,Domino is the main character.,549,https://i.redd.it/93pb6oomvcj61.jpg,4,2021-02-24 04:48:06+00:00,ak2024,,gojy2tk,its dominos world and we’re just living in it,43.0,pulltogetherson,gojyx09,next stop: world (domino)tion,24.0,ayyojosh,gok4256,HI AUSTIN!!!! NICE POST ! HI DOMINO!!!!,8.0,_frncsc
ixy2dd,Domino let me sit with him and give him some pets today,548,https://i.redd.it/2hhrbub22so51.jpg,12,2020-09-22 22:42:44+00:00,parsnips445,,g6a7w86,I’m still not over the one time he randomly crawled in and laid in my lap for a few minutes. I honeslty think it was the peak of my life and everything is downhill from there,72.0,__jerbear_,g6bjdsd,Domino owns this university,23.0,HoneyBiscuit420,g69kgc7,Who is this omg,22.0,Ayyyitskayyy
i0mt3x,UT in a Nutshell,547,https://v.redd.it/zvb2p8xl60e51,19,2020-07-30 14:17:17+00:00,nothingamusing,,fzqjelf,We NeEd EvErYoNe tO dO ThEiR PaRt,50.0,YoAten,fzqonpe,UT's response to COVID has made me too ashamed to want to associate with the uni anymore,44.0,None,fzqipat,r/formuladank is leaking,43.0,None
in7s8k,"Lo-Fi Girl, UT Austin Edition! (Created by a student in Texas Immersive)",549,https://i.redd.it/6np9x5ixwdl51.jpg,6,2020-09-05 19:58:26+00:00,UT_Texas_Immersive,,g46fd5r,Cat in the window should be colored like Domino. 👌🏼,84.0,glotz,g45rlk0,Now we’re talking,9.0,WitheringRiser,g47982i,God bless you,5.0,JeremyTheRhino
iia4sp,Every time I try to log into Canvas...,547,https://i.redd.it/36b56bq4rrj51.png,13,2020-08-28 16:21:06+00:00,Rynneer,,g35cnac,That's why u gotta hit that remember for 30 days,136.0,kaladin139,g35ehyz,My “Remember Me for 30 Days” is always grayed out. Any ideas how to fix this?,47.0,TheRealMe54321,g36d9t5,"""Welcome to Duo""

 \*Press 1\*

 ""Goodbye""",8.0,None
l8lyyf,Flyover of Austin and UT in Microsoft Flight Simulator,551,https://v.redd.it/lh748r113he61,28,2021-01-30 13:43:56+00:00,PetrolMan77,,gldagw0,me: chanting “land on speedway!” as you flew in from downtown,69.0,53Dude,gldvy3l,"Horribly unrealistic. 

Traffic is light and moving on 35.",47.0,lukipedia,gldcd07,"As a UT student that has msfs, this was a mandatory flight for me the first time I got it, definitely amazing! :)",31.0,thesafinster
i00ftw,Most in the nation baby!! HOOK 'EM🤘🤘🤘,541,https://i.redd.it/7096forvpsd51.jpg,60,2020-07-29 13:10:44+00:00,NickTheGladiator,,fzmch4g,LETS FUCKING GOOOOOOOOOO 🤘🤘🤘,173.0,nothingamusing,fzmk5sr,What starts here infects the world?,147.0,hunchojack1,fzmf063,"Well deserved, thank you frat boys and sorority girls. We couldn’t have done it without your ignorance",123.0,CatsAndGeese
isfzdg,Or maybe it's just my lack of organization skills who knows,540,https://i.redd.it/h9273qlma0n51.jpg,10,2020-09-14 07:00:13+00:00,lautau32,,g588cha,*cries in ADHD*,71.0,Rynneer,g58fksi,[deleted],62.0,None,g59902f,I literally spent a week just trying to get my workflow sorted and now I’m perpetually behind.,19.0,TheRealMe54321
fkt8zi,You could try Zoom instead :/,543,https://i.redd.it/ll7ru5gatgn41.jpg,3,2020-03-18 17:20:59+00:00,jeffw16,,fkuurxe,Graduation should still go on with the seniors in hazmat suits,38.0,CSThr0waway123,fkvtyim,Nurse: guess what mr and mrs fenves don’t have sex he said it in an email,11.0,None,,,,
kysb7m,I’m getting desperate..,539,https://www.reddit.com/gallery/kysb7m,39,2021-01-16 21:54:29+00:00,happymoe,,gjidtdl,Good on you!,77.0,CharmingProfession27,gjiduue,Heck yeah! Good for you for reaching out!! Wishing you many friends. ;),61.0,ms-raz,gjimok1,hey! i’m on campus in the dorms. if you ever wanna hang out and get coffee or something feel free to dm!,44.0,Windyxeazy_
m1x5ri,Mom re-admitted after 7 years!,528,https://www.reddit.com/r/UTAustin/comments/m1x5ri/mom_readmitted_after_7_years/,31,2021-03-10 13:12:06+00:00,None,"Like the title states, I’ll be returning to UT at the age of 26 after a 7 year break from my undergrad studies as a mom! 

I still have a lot of things to get in order before telling people in my life but I thought I’d share it here for some support!",gqg5okf,So happy for you! I wish you the best of luck,56.0,rootedtiger,gqfz5zj,Congrats!!! 40 acres is happy to have you back. Hook ‘em! & enjoy every moment here.,36.0,Some_Ad_7636,gqgalzc,"Congratulations! A former employee of mine in a similar situation came back and completed her bachelor's while raising two kids. It's hard work, but absolutely possible. Welcome back, much respect, and all the best!",16.0,samureiser
iu8qj3,Me after realizing school will never get back to normal,530,https://www.reddit.com/gallery/iu8qj3,8,2020-09-17 00:43:09+00:00,Laserslayer2000,,g5k8as9,"“guys i swear i was in electrical, i was nowhere near kappa sig!!”",53.0,discther,g5jhm3s,10/10 meme,45.0,Deltahawk24,g5jblfn,I love this! Terrible context but appreciate the effort haha,20.0,None
dtggna,"Domino is warm and dry this chilly, wet morning",531,https://i.redd.it/roskfjub7hx31.jpg,17,2019-11-08 14:52:11+00:00,renegade500,,f6wgjog,that is so cute,55.0,None,f6wiqkh,"Yay! I saw Domino outside the FAC yesterday, and I was worried he was freezing. Glad he has a little warm box!",40.0,spawnymint,f6whe34,I think this is the best Domino picture yet.,34.0,thematterasserted
gaidha,This is ridiculous. And genius.,521,https://i.redd.it/1j0w95qpttv41.jpg,108,2020-04-29 21:39:36+00:00,kaizenn7,,fp01oa6,"Yeah, I'm not a fan of this. 

Impossible, or incorrectly worded, problems suck up time from other problems that can actually be solved on the test. If the test was timed, this can lead to some students missing questions simply by virtue of the fact that they spent half of their time trying to answer an impossible question.",205.0,None,fozupwl,[deleted],165.0,None,fozwn02,Imagine being such a petty asshole you go through that many hoops to fuck your students over,69.0,None
l0jxsp,Welcome back... kinda,524,https://i.redd.it/q7o5hdgzkac61.jpg,17,2021-01-19 13:35:55+00:00,TurboJelly25,,gjui65h,"Here’s to another miserable semester of online classes. Good luck, everyone!",59.0,politicaloutcast,gju93rb,At least tuition was lower this semester!  /s,34.0,Xrandom_usernameX,gjuvnfc,Kanye is you snoring in my class?!,18.0,not_my_usual_name
q3yln9,The entire subreddit when the godly Domino is spotted and posted,524,https://i.redd.it/bte9i6dmi8s71.jpg,3,2021-10-08 14:14:05+00:00,None,,hfv4cml,Cute but that’s literally not domino—,21.0,ak2024,hfwzjw5,you’re not wrong lol,11.0,Ayyyitskayyy,,,,
h9lfjy,Didn't know Obama visited Greg Gym,513,https://i.redd.it/pplc0dbko2551.jpg,45,2020-06-15 18:04:59+00:00,44Scholar,,fuxi1cz,Oh shit I’ve used that exact scale,94.0,windwardmark,fuxo8kx,not gonna be surprised if they had to pay the daily admission fee in order to enter lol,61.0,555VS66,fuxlols,I miss Obama and Greg (gym) so much,53.0,jchandler4
fg14tl,Gave the EER directory screen a lil update,513,https://v.redd.it/1b4q40v7hpl41,25,2020-03-09 20:21:45+00:00,jasonm412128,,fk1vbkc,"Here at UT, we make sure to provide our students with only the best opportunities to practice their skills 🤘",105.0,running-tiger,fk1z0x0,this is what a top 10 ECE program looks like,86.0,Anceint,fk1y47z,What starts here changes the world,49.0,TheLuckyJon13
as4000,UT Engineering at it's finest,513,https://i.redd.it/tofifcxa3fh21.jpg,19,2019-02-19 00:11:21+00:00,voltron560,,egrwe9d,"I know this is in jest, but [24% of undergraduates in the Mechanical Engineering department are women](http://www.me.utexas.edu/about). That's [well above](https://www.asee.org/documents/papers-and-publications/publications/college-profiles/2017-Engineering-by-Numbers-Engineering-Statistics.pdf) the national average over the past decade of 14.8% for that field.",78.0,shiruken,egrrw5h,*cries in engineer*,58.0,dudethatsguy,egrly5l,That’s the tea sis,47.0,mome133
gourjj,Failed all my classes and left UT in Fall 2018. First semester back and I've made a 4.0 and University Honors!,508,https://www.reddit.com/r/UTAustin/comments/gourjj/failed_all_my_classes_and_left_ut_in_fall_2018/,21,2020-05-22 23:57:08+00:00,heywhocutthebrie,"This was my first time making an A in any class at UT, much less 4 at once. I don't have many people to share this achievement with so I wanted to post here! Now I'm just waiting to see if my internal transfer gets accepted 🤘",fri9843,Congrats! I was in a similar boat. What's ur major?,48.0,None,fri5ttm,Congrats! Hook em🤘,35.0,justuraverageboi,fri9ikr,[deleted],14.0,None
fobitj,What a strange first year here,509,https://i.redd.it/djp5q4uxaoo41.jpg,35,2020-03-24 19:36:31+00:00,Magic-Man-Man,,flexvc5,Sadly it is my last :(,56.0,DeerOnTheRocks,flejtql,Definitely not the expected outcome for my freshman year of college but it was fun while it lasted?...,43.0,trendingskimmilk,fleesyi,Now that’s a vintage quote.,38.0,lunchbane
ihkvy1,"On the first day of Acornology 101, all students were required to bring in an acorn to present for their first assignment. The class showed great participation -- except for poor Ace who stayed silent the entire time, praying that the teacher wouldn't call on him. He forgot his. 😂",504,https://i.redd.it/meozfkzppjj51.png,10,2020-08-27 13:19:55+00:00,squirrelsofut,,g30wj1r,"Wholesome content. Also, poor Ace, I hope he finds a nice acorn for next class. And Ace should remember to reach out to his advisor if he finds himself struggling with classes.",54.0,renegade500,g30xkd3,I’ve looked through your history and what a treat it is! Such cute!,13.0,Wentthruurhistory,g31dakv,They look cute here but they are savages. Will eat baby birds! I hope they will eventually be learning to stay out of bird nests and stick to acorns!,9.0,warcloud714
mci51r,A king still requires his daily nap,504,https://i.redd.it/h067w490v1p61.jpg,4,2021-03-24 22:09:53+00:00,ak2024,,gs52751,Upvoting for the architecture not the cat,-36.0,CiggieButtBrian,,,,,,,,
k2u7ck,Sweet revenge...,501,https://i.redd.it/fltmbydgb1261.jpg,10,2020-11-28 19:45:08+00:00,coinguy58,,gdx0o47,that moment when the professor doesn't give a shit since he's tenured and about to retire,144.0,None,gdx5wvm,Some of them will die. But that's a sacrifice I'm willing to make.,58.0,thewhiteraisin,gdyju6f,Wow,7.0,bacterio-paige
gfsacu,Me: I miss being on campus. Me when campus opens again:,499,https://i.redd.it/7sgo73hhbjx41.jpg,2,2020-05-08 12:27:52+00:00,Lanzhou77,,fpvq4ey,Ah yes... K I T T Y C A T S,15.0,ThiccyDicc,fpw2r0c,This is a high quality assortment of cats,14.0,gatohy,,,,
hmyqyw,how it feels being an international student right now,494,https://i.redd.it/adb8ozexxg951.jpg,42,2020-07-07 17:17:55+00:00,creamcheese5,,fx86lk9,[deleted],131.0,None,fx8fvhq,"Create a dummy in-person class which all international students can register for, even if it never actually meets.",112.0,wolf2600,fx88ul9, I pick ICE should be abolished,48.0,goldistastey
pzi5ca,Just sharing my works after seeing a post that featured my drawings.,499,https://www.reddit.com/gallery/pzi5ca,17,2021-10-01 22:00:02+00:00,YunJang,,hf10ae0,Did you draw in a lecture hall in Painter?,24.0,ak2024,hf138mk,[deleted],18.0,None,hf15haa,You are so talented!,12.0,UpyrAg
qbfo4p,Me asking professors for letters of rec after being a hermit all my college life,496,https://i.redd.it/arh96mk9tfu71.jpg,18,2021-10-19 16:54:29+00:00,milkteaisreallygood,,hh9gnnl,The big brain move is to just shape your career to never be in a situation to have to ask for letters of rec,85.0,AlexTheRedditor97,hhap034,"Prof here.  I write a lot of rec letters, but I also say no to students I don't know.  In large lecture classes I may never have even seen you, so you are basically a stranger about whom I know a few test grades.  That is fine in the academic setting, but I have no grounds to recommend you.  I could write something like ""he got a B- in my class,"" but that is not enough for a rec letter.  

Let this be a warning to other folks reading this - go to office hours, ask questions, form relationships.  Sure office hours are weird and intimidating and all that.  Buck up.  Make yourself go, make yourself talk, if you got nothing to say and no one else is talking there is always the great standby question of ""what is your research about?""  Most profs love talking about their research and they'll remember that you showed an interest.  Then stay in touch if you think you are going to need a rec letter one day.  Profs love to hear from past students, so just send an email once a semester saying hi and what you've been up to.  You'll get awesome rec letters and it won't even be that awkward to ask.",63.0,pW9pqAwE87,hhaoyqb,"I feel this so much.

Zoom office hours with professors are the single most awkward interactions imaginable. When I was a teenager my dad once walked into my room and caught me trying to suck my own dick and I would rather do that again than endure one more second of awkward silence.",43.0,None
lksgsc,I made a snow compilation of UT,496,https://v.redd.it/xeiho13psqh61,16,2021-02-16 01:29:13+00:00,rxveadlvft,,gnm1cah,That looks so fun.,26.0,mysterious-stranger0,gnmouoy,I wish I was in Texas but I'm doing remote study from India 😭,8.0,living_bot,gnm45wk,Video looks dope. Keep up the good work.,7.0,augustusbennius
lw8vz1,ERCOT might want to look into it.,494,https://i.redd.it/cqepxyztqnk61.jpg,3,2021-03-02 18:24:56+00:00,12_Semitones,,gpge2s8,"I literally watched this movie last week, I’m so upset I didn’t come up with this",23.0,czarfalcon,gpgo6a6,This is amazing here's my poor man's gold 🥇,9.0,SgtStealYoKill,gphc2y2,iT’s ThE gReEn NeW dEaL aNd AOC.,0.0,AvocadoFishy
j8s6c8,Same,492,https://i.redd.it/s30gtt9szbs51.jpg,10,2020-10-10 20:58:00+00:00,Ovarian-,,g8dgisu,They are who we thought they were,52.0,Lieutenant_Corgi,g8dm9wv,"We didn’t deserve the win, its a miracle we were even in the game",38.0,AirGundz,g8dndxl,[Related](https://twitter.com/yannickrizvi/status/1315031654973480966?s=20),18.0,121910
jykntw,We need to find a way to stop RHO.,489,https://v.redd.it/rtkvpotado061,101,2020-11-21 23:09:02+00:00,TravisScottBatman,,gd5lx7l,[deleted],210.0,None,gd5nrf0,"Idk about y’all, but all I’m seeing is a petri dish... 🤷‍♂️",186.0,None,gd5smz1,This shit pisses me off so much. I love to party and I haven’t been to one since February before everything got crazy. It’s so frustrating to be continuously making sacrifices (small as they may be) and being boring but responsible only for some entitled idiots to decide they don’t have to follow the rules.,175.0,Queso_and_Molasses
hygdz9,Daddy Fenves Update: He's Leaving Austin,493,https://i.redd.it/x58jt7bc4ad51.jpg,36,2020-07-26 22:38:18+00:00,CatsAndGeese,,fzd4upr,And the background is Minecraft...,65.0,riolio11,fzcn7yf,What starts here changes the world,39.0,mome133,fzd739p,WAIT THERES A MINECRAFT UT AUSTIN ???,30.0,Boomdigity102
jj5y20,Every week the cycle repeats,486,https://i.redd.it/8achd378bov51.png,10,2020-10-27 17:46:47+00:00,HookedOnDaBait,,gaamavk,Has anyone actually ever won?,39.0,None,gaamv9m,I audibly laughed,24.0,HopScotch-,gab9vsn,"I love how Healthy Horns, of all departments, is the one promoting greasy food every week LOL. Not complaining though, I'd take it.",15.0,whisperedslowly
nvtg2o,UT Tower looking cute,487,https://i.imgur.com/hk2SiXY.jpg,6,2021-06-09 11:24:53+00:00,cttieu,,h157i02,Thanks for the new wallpaper,16.0,TheAllKnowingCharles,h15zihw,Sorority filter :P,16.0,121910,h15ber4,Wow!!! Where did you take that pic from??,2.0,Lia_MK
mupw5q,I’m burnt out.,477,https://i.redd.it/udl03vtsubu61.jpg,23,2021-04-20 13:07:08+00:00,12_Semitones,,gv7i3v3,I burned out last semester May 2020 and I’m just now starting to have a desire to get a job due to the sheer ptsd and burnout UT gave me. Word to the wise don’t do two programs at the same time just because you want to challenge yourself. Doing one thing at UT is more than enough to destroy your soul,70.0,Reddituseranynomous,gv7q0cz,[deleted],29.0,None,gv8tge1,[deleted],19.0,None
lfl1hw,I’m horrendously behind in every single one of my classes but you know what this is the week I get caught up if you’re behind too you’re not alone let’s kill it baby don’t get discouraged,483,https://www.reddit.com/r/UTAustin/comments/lfl1hw/im_horrendously_behind_in_every_single_one_of_my/,23,2021-02-08 20:30:54+00:00,nickdagangsta,"Just posting this just in case anyone is in the same boat as me and needs a lil push. Good luck everyone the struggle will be worth it in the end we are stronger than our procrastination💪💪
Time to go to the first week of class and start watching all the lectures let’s GO

P.S.

Attitude is a little thing that makes a big difference and tough times don’t last, tough people do",gmmd7be,"thank u brother, feels good to know we’re on the same boat",68.0,AngeltheGreat3,gmmdwki,hell yeah brother let’s get some gains!,39.0,coolsocksjoe,gmmh7b3,Thank you I needed this,28.0,prezjalopy
