post_id,title,score,url,num_comments,created_utc,author,selftext,comment1_comment_id,comment1_comment_body,comment1_comment_score,comment1_comment_author,comment2_comment_id,comment2_comment_body,comment2_comment_score,comment2_comment_author,comment3_comment_id,comment3_comment_body,comment3_comment_score,comment3_comment_author
e7l23l,Prof McCanaughey and a Jonas brother on campus right now,383,https://i.redd.it/tfe1xu82ga341.jpg,10,2019-12-07 22:33:29+00:00,None,,fa0qtau,SANSA,144.0,laurenovitch,fa13l7s,SOPHIE TURNER,71.0,Nymeria2604,fa192o8,"The Sansa erasure tho lolol

Badass though ^.^",24.0,simondufresne
boi9bq,Domino wishes you all good luck with finals!,379,https://i.redd.it/akr1h5wz66y21.jpg,18,2019-05-14 12:26:02+00:00,renegade500,,engogfh,I think you just woke Domino up. He's a sleep grump.,57.0,None,enhijzm,Doesn’t look like he’s wishing me good luck with my finals:(,21.0,pinapplepizza,enhj8av,Is....is he though? Lol,15.0,UncommonBond
mzhg99,I don’t know if I can last another 2 weeks...,375,https://i.redd.it/ygz1gruvknv61.jpg,9,2021-04-27 05:37:04+00:00,12_Semitones,,gw0qfe1,very relatable,32.0,Hshah0182,gw0uzr6,Bro just Kaio-Ken x10,17.0,C0rvuz,gw2hbos,Pass fail gang,13.0,rithpath
g5gxme,Does anyone know about this absolute unit that lives in the turtle pond? How old is he? Where does he hide? What’s his name?,372,https://v.redd.it/2rlcr2xds6u41,33,2020-04-21 15:09:13+00:00,hannah22a,,fo3cm6e,"His name is Tank, he’s been there as long as I can remember. He’s a Snapping Turtle! The pond was built between 1934-1939, so I’m not sure how long he’s been around, but he is a confirmed resident. It’s hard to keep track of all their names, but seeing Tank is always a rare treat!",151.0,None,fo39y7x,"His name is Big Henry O'Brien Duke. He was the longtime trusty companion of Mary Francis Duke, daughter of Thomas Marshall Duke, of the Old Three Hundred. After her death in the mid-1930s, he was donated to the University of Texas and eventually made his home in the UT Turtle Pond. It is estimated that he is approximately 150 years old. You can read more about him on his wikipedia page [here](https://www.youtube.com/watch?v=oHg5SJYRHA0).",104.0,JDSchu,fo3d0oe,[deleted],83.0,None
i1nnwy,R O L L,378,https://i.redd.it/qs86gxgi4ce51.jpg,4,2020-08-01 06:26:36+00:00,TurboJelly25,,fzzof3x,mezes is the other way,60.0,None,fzztag6,I have 4 in-person classrooms /:,10.0,rlicky,,,,
n9mmof,It is finals week. I wish everyone the best of luck on their exams! The semester is almost over! Then it’s summer time!,374,https://i.redd.it/j6k59vi1jey61.jpg,1,2021-05-11 02:23:07+00:00,TurboJelly25,,gxsf354,Isn’t local gravity 9.79m/s^2,1.0,spunkyenigma,,,,,,,,
cna5b6,Big sad mehm,379,https://i.redd.it/1sr4kmqns2f31.jpg,5,2019-08-07 19:10:36+00:00,LordFlubbernaut,,ew8974c,UT Android gang where y'all at 😤😤😤😤,33.0,None,ew8nlk7,Who tf wakes up at 11:50 /s,13.0,None,,,,
fcy5a0,This is a fake Chick Fil A and that is not up for debate,380,https://i.redd.it/31jpumi8uhk41.jpg,20,2020-03-03 17:36:05+00:00,goodshotbiga,,fje65be,Doesn't accept gift cards or the app. Also doesn't have the grilled chicken cool wrap. Irredeemable 😤,118.0,camwow64,fje2ea9,I think UT students can all agree the quality is significantly worse than other chick’s,79.0,goodshotbiga,fjejasc,"Chick-fil-a Employee: My pleasure! 

Chick-fil-a Express Employee: Go fuck yourself, I spit in your food",64.0,SJdport57
mvlaki,I didn't know that people actually win this,369,https://i.redd.it/hnwj1f0heku61.jpg,14,2021-04-21 17:53:39+00:00,None,,gvckz2h,based,80.0,nothingamusing,gvcsmtr,omg wth congrats,45.0,Untrainslatable,gvcsvot,"In fall 2017, I got my flu shot and entered in a competition on Instagram to win prizes from healthy horns. I won! I got a thermal reusable bag, a pocket 1st aid kit, a thermometer, a stress ball, and a plastic massage thing. It was pretty cool.",45.0,RubyRed_Cherry
g6iwr3,A little something to lift your spirits,375,https://i.redd.it/pek2l2hw1ju41.jpg,5,2020-04-23 08:22:01+00:00,photo_cr2,,fo9t2nu,Here’s a photo I took of Bevo shortly before we went on lockdown (3/6/20).,22.0,photo_cr2,foadtjf,"For some reason I really need Mathew McConaughey riding Bevo with a Longhorns t-shirt and a Cowboy hat pic! Can this be my ""make a wish"" quarantine blues remedy?",13.0,BangkokQrientalCity,fobc2i1,🤘,4.0,BunchOfDaisys
ft2aav,Tuesday @Noon,370,https://i.redd.it/vggnrl7x98q41.jpg,13,2020-04-01 15:50:42+00:00,OrganBlackMarket,,fm58q44,So now they turn the fountains on?,33.0,frenchcowboy9818,fm50q9u,Beautiful shot. Stay safe/healthy everyone!,20.0,tx_drew,fm4xfui,How long do you think this closure will take place?,7.0,bhargav_akula01
bgacpm,utrejects.com,370,https://i.redd.it/b8rl4hhv3xt21.jpg,13,2019-04-23 01:37:46+00:00,bgmn17,,eljloqo,CAPPPPED REACTS ONLY,41.0,matthew6645,elk2cvh,Home? You mean non A&M students live in College Station?,11.0,KingIsles,eljrxr1,"[proper version in Comic Sans](https://i.imgur.com/QkqLOB6.png)

credit to /u/spaceforce on /r/cfb",11.0,Stellafera
e8s4fn,The GDC Staircase,375,https://i.redd.it/ir5791dest341.jpg,14,2019-12-10 15:36:31+00:00,utpics,,fae710b,I'd be interested in seeing one of the staircase in the atrium!,19.0,DrJustinWHart,fae7rz3,Drop the phone.,11.0,Kerisma123,faegk4g,Strong Tame Impala vibes from these stairs,7.0,MAndrew16021
ie22ud,"just used proctorio for the first time, this makes me really uncomfortable",365,https://i.redd.it/qlrym7hadei51.jpg,56,2020-08-21 18:15:53+00:00,sunburstbox,,g2cz904,"I had a professor that was going to use Proctorio last semester, but a few people complained and listed their concerns. She looked into it and decided not to use it because she wouldn’t want to give up that much privacy either. We ended up doing open note exams instead through Canvas",218.0,1cyWind,g2culqp,•Your SSN •Your credit card number •The date •The numbet on the back,163.0,billyswaggins,g2cqbeg,I can't imagine being expected to focus on a test/etc. when you know that even your eye movements are being tracked. That would just make me too self-conscious to focus.,122.0,None
q1ijol,did anyone lose a dog near NHB? he doesn't have a collar on,364,https://www.reddit.com/gallery/q1ijol,5,2021-10-04 23:49:17+00:00,toasterstove,,hffc7a8,"bring him home, your cat needs a friend <3",19.0,kazaanabanana,hff9t3t,Aww what a good boy,13.0,MrProvacative,hfhll0q,Once I saw a raccoon crawl down that drain lol,4.0,meghookem
ilm1ya,UT COVID-19 Training Any% Speedrun in 1:58.33 (WR),368,https://streamable.com/e1hl4s,15,2020-09-03 03:40:07+00:00,CoogsOfCV3,,g3t1k97,"Criteria:

Run begins when you press begin on Intro

Run ends when you press exit course

^ ^ These are due to loading times

You must interact with all parts of the module. All videos must be played, but you can go on to the next page when it's loading (just press play and move on)

The Mental Health portion is an exception to this. You can press one category, submit it, then move on to the next.

The answer doesn't have to be correct (The two Y/N questions).

As long as you've clicked on an item and it flips or shows a check mark, it counts. It might close itself or flip back due to double clicks. 

Any questions, post! Have at it!

IF YOU BEAT YOUR PB, REPOST",74.0,CoogsOfCV3,g3t7hdz,"This needs to get bigger, I love this",43.0,EveningOrange,g3t3jzx,i found the minecraft player,31.0,sunburstbox
ezp6fn,Snow at the fountain,372,https://i.redd.it/hp3itclpg9f41.jpg,6,2020-02-06 08:04:57+00:00,ManishBH73,,fgps9gs,kinda looks like stars,18.0,idunnobroseph,fgopnmt,Incredible pic,13.0,SpotlightR,fgq0pn4,I love this pic!!,7.0,emg0d
i3xkg2,Does anyone know approximately how many of us will be on campus in the fall? Curious.,369,https://i.redd.it/p0n9yhysn3f51.jpg,27,2020-08-05 03:02:49+00:00,TurboJelly25,,g0en4g3,I will not be there.,46.0,None,g0etrop,45-50% have opted for fully online [https://twitter.com/Tris\_Balagtas/status/1290721627920113665](https://twitter.com/Tris_Balagtas/status/1290721627920113665),23.0,revengefrank,g0fvmyn,"I do contact tracing and we’re transitioning to the UT population. I’m also a student at UT. We’re being told to expect about 30,000 people back on campus.",21.0,None
kw6f3v,But they’re ALBINO...,366,https://i.redd.it/m4q55q0scza61.jpg,15,2021-01-13 02:02:05+00:00,kylieb209,,gj2rvnv,I went to a school where some students shaved a squirrel once. That was kinda different.,30.0,kbodennith,gj303we,The squirrels at angelo state throw shit at you. I like UT squirrels better.,18.0,itsafuckingalligator,gj503dz,"I once saw a squirrel trying to steal fries from a guy outside the SAC. After a few minutes, the guy relented and threw one fry a few feet away for the squirrel. But before he could get there, a bird swooped in and stole it from him. I’d never seen so much disappointment on the face of a squirrel.",11.0,heichwozhwbxorb
d2mhe5,You can cross as long as you Hook 'em,368,https://i.redd.it/p2bm9qe45xl31.jpg,7,2019-09-11 07:38:46+00:00,potatoasad,,ezwrvcx,God damn it i cross this path daily how have i not noticed this.,33.0,Thaloneblarg,ezx08md,12 for McCoy,14.0,MonkeyDude77,ezvoc81,"🤘

*I am a bot, and this action was performed automatically. Please [contact the moderators of this subreddit](/message/compose/?to=/r/UTAustin) if you have any questions or concerns.*",7.0,AutoModerator
pnoqyd,"Before every lecture, someone does these amazing superhero drawings. Thank you for brightening up the end of each day :)",365,https://www.reddit.com/gallery/pnoqyd,14,2021-09-13 21:22:28+00:00,nadia0004,,hcrpfk8,Awww man now I feel bad. People draw epic shit like this. Meanwhile today I found an empty white board and just wrote “amogus”,55.0,TurboJelly25,hcr4z24,What room?,13.0,flaminghostar,hcr79cz,Are people allowed to just go into empty classrooms and draw? Cuz that seems really fun,13.0,MintChucclatechip
gey8dc,Registering for classes got me like,359,https://i.redd.it/nb8g8s6t89x41.jpg,12,2020-05-07 02:36:07+00:00,Lieutenant_Corgi,,fpqmfmx,Until you see the class is waitlisted or closed lol,61.0,None,fpqrze1,And then you get a C+,26.0,JewishDoggy,fpqou2q,Wait how do I see this? I'm an incoming freshman so I don't know anything haha,12.0,None
g9a2cg,"Ah, yes, I'll have one mental breakdown with a side of fries. Thank you",365,https://i.redd.it/54qp8s6h1bv41.jpg,22,2020-04-27 21:38:39+00:00,deadface008,,foshoq3,This to a fucking T,41.0,SkyRocket456,fosjvrt,"My Spanish professor now gives us a different chapter every week with double the HW, and wants us all to show up to zoom if not, we won’t get full credit on our “Participation assignment”",25.0,cglzzz,fossumi,"Hey as a TA, all that extra work for you is also extra work for me! I feel way worse for y'all though, an undergraduate degree is already torturous.

Edit: and BTW my opinion is that you didn't sing up for this shit, it wasn't in the syllabus, and no professor should be harsh. From what I've seen, they are quite understanding, but this thread says otherwise.",23.0,letsgetmolecular
eopkwn,Last night on campus,357,https://i.imgur.com/gR9bkiP.jpg,16,2020-01-14 18:55:34+00:00,FoamythePuppy,,feef760,Excellent and exceptional photo.  Did you use a tripod?,15.0,greenfrogfox,fee9ohm,https://www.reddit.com/r/Austin/comments/eomewv/speedway_at_6am_looked_stunning_imo/,10.0,wolf2600,fef7p0a,the classic doomer walk after spending the whole day studying... *shudders*,8.0,None
jtsfuc,Please remove yourself from a waitlist if you don't actually plan on taking that class/don't need the class!,362,https://i.redd.it/ehhsewavr3z51.jpg,9,2020-11-14 00:48:18+00:00,rommbook,,gc7ju9n,This is both a meme and an announcement.,53.0,rommbook,gc7tbb2,Please y’all I only have 6 hours,36.0,ovoxo90210,gc7sskn,Tfw a registration is at the same time as your exams,22.0,None
hjr473,I miss campus,359,https://i.redd.it/w7msevcbrd851.jpg,8,2020-07-02 05:31:28+00:00,kylie1945,,fwoab05,Where is this?,11.0,DaSemicolon,fwop213,Looks a lot greener than I remembered,8.0,Typhastor,,,,
e1k2zt,who knew there was a monument in Jester dedicated to the founding of the McCombs School of Business,361,https://i.redd.it/t1ipws79jv041.jpg,12,2019-11-25 18:16:22+00:00,bronbroncommiecon,,f8q5nl2,quality shitpost,43.0,kayelar,f8q3gfj,McCombs folks gonna downvote you but this is good stuff.,32.0,CowboySocialism,f8qeezp,"House of Slytherin - ""that wasnt very cash money of you""",26.0,StaticSleet
dffeld,"John B. Goodenough, UT ECE professor, wins Nobel Prize in Chemistry",364,https://reut.rs/310beI8,18,2019-10-09 11:01:14+00:00,ATXBeermaker,,f32xilt,He is officially now GoodEnough,107.0,andrew01burch,f32s5jm,"It's about time! I think it's safe to say that without his work, the world would be a very different place.",62.0,Halatinous,f32uf6f,Took long enough!,47.0,shiruken
gjwf00,About to finish my first year of grad school and UT sends me this...thanks I still have 3 more years left,360,https://i.redd.it/x60lf5432ty41.jpg,31,2020-05-14 22:17:13+00:00,mooeysteph,,fqnslbh,Try to apply for your degree. Save some time and money if they give it to you,125.0,cuntsaurus,fqo7sra,"As an added benefit, you can get free donuts at Krispy Kreme next Tuesday!

https://www.krispykreme.com/promos/2020seniorweek",28.0,NobiLi-ty,fqo41m5,Congrats grad! We’re proud of u,26.0,jchandler4
ftq8q3,Still had to come to campus to take the Texas Government Exam...probabaly my last time on this campus for a while,364,https://i.redd.it/si2g35lqtfq41.jpg,23,2020-04-02 17:14:09+00:00,jellyfishii,,fm8jt7y,They allow this even in light of Covid-19...? Wtf.,145.0,CompulsiveSleeper,fm8njvx,"It’s not even this empty during summer, kinda crazy",48.0,Darrothan,fm8nzph,"same lmfao how did you did i didn't know most of the questions

edit: I PASSED BOYS WE GOOD",36.0,yami-yumi
qxtsmp,A degree's a degree,356,https://i.redd.it/a6bqpvtjdn081.jpg,9,2021-11-20 00:45:38+00:00,None,,hlc0hd6,Yup. A top 10 school as well,37.0,kalashnikovBaby,hlc3tl0,You know what they call someone who graduated at the bottom of their medical school class?,34.0,delimitedjest,,,,
ilxpcw,Saw a squirrel eating a strawberry off a fork on my way to class,355,https://i.redd.it/ku6da3fj3xk51.jpg,6,2020-09-03 17:14:54+00:00,Splooorky,,g3x8z6d,awe cutie,9.0,sugarplumfairy1234,g3z1uv5,That squirrel definitely stole that....probably right out of the hand of an unsuspecting college freshmen.,8.0,Qubed,g3xgnoe,he's so talented,7.0,toasterstove
f3xzrg,Happy Valentines Day! Here’s a pic of Domino peacefully enjoying the day. He deserves all the love in the world.,353,https://i.redd.it/6ynnhx2s5yg41.jpg,5,2020-02-14 20:12:34+00:00,Naga912,,fhmruyn,"Precious picture! I don't get to see him daily anymore, because I'm in a new job on campus, and I've been missing him. I always like a Domino fix.",11.0,renegade500,fhnwkzr,omg i got scared. i thought he died or something. happy valentine’s day domino!,6.0,BriennetheBrave,fhneda7,[deleted],5.0,None
9sdt3i,Texas is back,354,https://i.redd.it/z2u7rl5h25v11.jpg,6,2018-10-29 14:57:41+00:00,BobBeasta,,e8o8u6w,can I drink the urinal water yet,30.0,lilstin,e8nzvfz,🤘🏼,20.0,None,e8odv16,TEXAS!,6.0,good4steve
pr0k0v,Texas takes their anger out on Rice,355,https://www.reddit.com/gallery/pr0k0v,15,2021-09-19 03:36:11+00:00,None,,hdf8qmm,“Why does rice play Texas”,133.0,kylieb209,hdffvtu,Actual paid actors,56.0,AirGundz,hdfkjfo,"Next time we play Rice, I’m bringing our rice cooker to the game for the memes",48.0,Scoute248
k2h3ko,After 5 years on campus I finally got a one on one interaction with Domino!,356,https://imgur.com/vvw5Y0p,18,2020-11-28 04:25:32+00:00,RenegadeBevo,,gdua5jy,Awww good on you! And thank you for sharing with us. I miss that handsome man.,31.0,renegade500,gdw0rz9,I don’t know how Domino is so friendly to hundreds of UT students he’s never met before and my cat still runs under the couch when she sees me,15.0,I-dont-like-batsoup,gdvfl62,Wait so is domino a stray?,10.0,just_a_fan123
p748gy,Domino eating tuna after his bushes were cut down,352,https://i.redd.it/gnaa9ilno7i71.jpg,7,2021-08-19 00:45:36+00:00,floodrefugeekitties,,h9h4qj6,"I want to thank Grounds for contacting the Campus Cat Coalition to let us know in advance this was going to happen.  

I think SNOVID killed a lot of campus bushes and they've had to be cut down and replanted, so a lot of campus cats are losing some of their shade temporarily.",78.0,floodrefugeekitties,h9hc8fh,I'm so happy to see he's okay!,14.0,renegade500,h9hi5t6,Great to see the king enjoying a tasty snack after a crazy day. We love you Domino!!!,10.0,quorrathelastiso
nfqf9d,saw domino for the first time today,352,https://i.redd.it/y7kklp9rxyz61.jpg,17,2021-05-19 00:05:24+00:00,Liberty72521,,gymx38a,"See an albino squirrel = pass your finals

Pet Domino = pass finals, graduate with honors, and immediately get hired in the career of your choice",70.0,VincentVanGoof,gymw95t,"incoming freshman here, I saw domino for the first time earlier today as I was getting my UT ID, thought i’d share",23.0,Liberty72521,gyn2t3e,WHY did I read this as “last time” and start tearing up?? God that scared me.,10.0,imdefinitelyaturtle
hcee11,"It’s tough times, but Hook ‘Em, y’all.",348,https://i.redd.it/tfqdimgjbz551.jpg,3,2020-06-20 02:49:46+00:00,TheRealMe54321,,fveyrfw,"We'll get through it. Things may not look the same, but we'll make something out of it.",21.0,tmd429,fvf2lu3,I had a class at the moody center here it’s tough sledding getting up that hill,13.0,None,fvhbeha,Hook ‘Em in these trying times,4.0,probably_confused_rn
fbktax,UT from the sky!,350,https://imgur.com/DZXa3sJ,10,2020-02-29 23:08:30+00:00,AustinArmadillo,,fj5je8h,It’s my whole life in a photo...,23.0,ReubixCubes,fj5l1ld,i spent way too long zooming in trying to figure out which building is what,9.0,Himtiffant,fj694sr,Such good memories here :’),5.0,CiggieButtBrian
hr8fqy,International students can stay in U.S. while taking only online classes,349,https://www.texastribune.org/2020/07/14/international-students-online-classes/,23,2020-07-14 19:45:12+00:00,None,,fy2ih0r,"I know there's a mega thread, but I figure that good news should be shared. Texas tribune was the only news source that didnt have a paywall that I could find.",73.0,None,fy2j015,Big W for us international students. Still unsure if returning for fall is the best move for myself though,71.0,AirGundz,fy2nai9,Now UT needs to seriously consider moving all classes that do not need to be in person online.,38.0,shaand24
ffpchh,Fun fact: You can see the Dobie and part of the tower in the background of the final scene of spy kids 3,343,https://i.redd.it/xw86irc4tkl41.jpg,15,2020-03-09 04:38:53+00:00,Drakeadrong,,fjzwpo2,We're fucking famous,113.0,CSThr0waway123,fk01aua,This is the kind of content I wanna see on this sub,56.0,None,fk00ktx,Also can see The Cactus Cafe and Dobie in the music video for the early millennium hit “On the Way Down” by Ryan Cabrera.,28.0,PrsnPersuasion
i4968h,All around me are familiar faces,352,https://i.redd.it/roicdcunt7f51.jpg,7,2020-08-05 17:02:47+00:00,TurboJelly25,,g0h9p44,Does anyone know how to unsubscribe from these? I graduated and left Austin so I kind of don’t need them anymore...,38.0,PaulyD67,g0i587u,"Worn out places, worn out faces...",2.0,InkedFrog,g0j4wi5,THIS.....IS A TEST!,1.0,None
jxzupc,"ACCEPTED 🥳 (4.0 GPA, no SAT scores)",346,https://i.redd.it/hixx7w57ah061.jpg,86,2020-11-20 23:18:20+00:00,viviansalazar,,gczqely,Welcome! Hook em’!,31.0,aswiftymanz,gczyz80,Congrats Vivian!,22.0,Apprehensive-Web-112,gd080tx,Congrats! A little less to worry about during your senior year :),15.0,gooodkush
cewz3n,Saw this squirrel partying hard on campus today,346,https://i.redd.it/541fpyjy44b31.jpg,7,2019-07-18 19:24:48+00:00,annies__boobs,,eu67nc5,actually kinda sad,37.0,cookie0_0,eu5rc5o,even the squirrels are fiends,22.0,S0G3L,eu5tqog,Hook ‘em!  🤘🏻,12.0,PanamaFrog
q8erzb,"After a tough day of midterms, I was blessed to encounter the king",346,https://i.redd.it/mzru14fp0jt71.jpg,4,2021-10-15 02:37:26+00:00,None,,hgozib3,My liege,22.0,Sketchdudeonabike,hgp5h4k,those H I P S,20.0,bimmer92,hgqymtp,The goat,7.0,DeerOnTheRocks
i61853,"UT wants US to donate to support needy students with housing, food, and healthcare. Is this a joke? They have the resources and infrastructure to provide all of these things already--easily, efficiently, and with no significant impact on their bottom line.",345,https://i.redd.it/z3yywsqotsf51.png,49,2020-08-08 15:44:30+00:00,ATXNYCESQ,,g0svgks,"well, this is proof enough that the execs have determined it would affect their bottom line and can't afford to lose any of their fat paycheck. super shitty of them to try and milk even more dollars out of us. fuck them",92.0,BECOME_INFINITE,g0szmck,i like how they refuse to lower tuition yet pretend to care about their students (while shouldering the burden on said students),76.0,raphaelworks,g0t1bpv,"I mean.... it absolutely would affect their bottom line and their bottom line is already significantly affected. Universities do not run on a large profit margin. That said, it's kinda scummy to ask us to make up the difference lol.",72.0,Minumot
o0ngk8,"University of Texas Main Building, Austin, TX",344,https://i.redd.it/xu638wgplh571.jpg,17,2021-06-15 20:12:27+00:00,None,,h1w0jik,You cropped the tip. L'Chaim!,93.0,KillerrCatssup,h1wqnoy,Literally never gets old,49.0,rawhide_koba,h1xnruh,University Cock Tower,27.0,MrProvacative
lhbz4g,Guys I’m dead,347,https://i.redd.it/0gp22wx5rrg61.jpg,8,2021-02-11 03:37:24+00:00,None,,gmwk58h,u just know there was a traumatic incident that warranted this rule,110.0,gengargooble,gmwq27h,"I stood up in class with my camera on today and I forgot I wasn’t wearing pants. Sat down quickly, but still..... sorry class",60.0,texasnymph,gmxeoc1,Last semester a dude was naked and the professor in the lecture hall stopped everybody in person and online and said “please turn your camera off!” I felt bad but couldn’t stop laughing,22.0,Cnastydawg
9ft8tk,Jester Wendy's is officially Jendy's,341,https://i.imgur.com/fYynsvE.jpg,21,2018-09-14 16:01:31+00:00,DumpCakes,,e5z0doh,"If you guys are gonna call it Jendy's, we might as well too. ",164.0,Wendys,e5z0zhw,This is amazing. Long live the Legend! 🤘🏻🐂. ,36.0,None,e5z6dsr,"Wow, that's awesome. Is it still the Wendy's with the most traffic in the world?",24.0,vectorix108
fsgsa0,"Group of Austin spring breakers test positive for coronavirus after trip, many are UT students",338,https://www.kvue.com/article/news/health/coronavirus/austin-health-officials-investigating-after-group-of-spring-breakers-return-test-positive-for-covid-19/269-0fc400da-9712-455d-b884-99e7b5c2fa34,41,2020-03-31 17:09:04+00:00,Tunaonwhite,,fm1dqxv,"Wow who could’ve predicted this, says everyone who could’ve predicted this",262.0,adamjm99,fm1efnf,[deleted],119.0,None,fm1cxxn,"This comes as no surprise seeing how many people are out and about as usual, at least according to my Instagram feed. Flatten the damn curve, people. It’s not all about you.",87.0,HappyGangsta
nbr1w3,Eid Mubarak to all my Longhorn brothers and sisters!! ☪️ 🕌 🕋,337,https://i.redd.it/3pcnijr5ayy61.jpg,1,2021-05-13 20:48:58+00:00,ALYMSTFY,,gy24lbu,Eid Mubarak! Here is to a better year,13.0,Thaloneblarg,,,,,,,,
d15z6j,My Mammary glands!,336,https://i.redd.it/aslcsaww5al31.png,16,2019-09-08 03:34:06+00:00,RTBC5555,,ezi6wdg,Watching this was so stupid...literally 6 (maybe 7) injury timeouts in one drive,41.0,Ap2626,ezhsjrf,"Yeah, pretty much.",12.0,twister121,,,,
b0qi7r,The turtles have discovered it's spring!,344,https://i.redd.it/17gmjnwsyxl21.jpg,16,2019-03-13 19:56:15+00:00,renegade500,,eige255,I love when turtle pics season returns ,28.0,uteropharmaceutical,eigj5tp,Discovered murder too apparently....,12.0,dpolygon,eigjs6i,"Where tf do they go during the winter? I swear I saw them during January, and I was wondering if they were cold",11.0,MastofBeight
b00nnq,Being Not-Rich at UT: The Ultimate Guide to Surviving life @ UT,336,https://www.reddit.com/r/UTAustin/comments/b00nnq/being_notrich_at_ut_the_ultimate_guide_to/,17,2019-03-11 23:44:35+00:00,tailoredforservice,"Crowd Sourced Google Document with 50 pages of juicy info on financial and social independence.

[~~https://docs.google.com/document/d/1zH2jZCDEln1lNmSA4XUjaWqQkrLDLf-u8\_0r3wjyJVs/edit~~](https://docs.google.com/document/d/1zH2jZCDEln1lNmSA4XUjaWqQkrLDLf-u8_0r3wjyJVs/edit)

EDIT 
JAN26 2023
NEW LINK
[Being Not Rich at UT](https://docs.google.com/document/d/1G61g7nhmk4qAJHyVO7qM55AMAbjJPAOxeWo1opd1l4A/edit?usp=sharing)",eibqdhg,yo this is mad helpful for someone who doesnt qualify for aid but is still broke af. thank you <3,62.0,S0G3L,eic022d,Ah seeing this takes me back. The wealth gap between the students at UT is insane,47.0,awesomeqasim,eibxc9j,Just got my financial aid report today and im super grateful there is a lot of work study info here. Superb stuff guys.,20.0,Phyterr
mmiamg,"Domino encounters 2 raccoons (1837, colorized)",338,https://i.redd.it/zapbfbs05vr61.jpg,5,2021-04-08 02:45:54+00:00,None,,gtsjp7q,"Ah yes, just a year after Domino was seen at the battle of San Jacinto. Really nice historical piece here.",35.0,Texas_EY,gts1qw9,they're friends <3,20.0,Untrainslatable,gtt89st,The color saturation of Domino's white and black colors are spot on!,7.0,BangkokQrientalCity
