post_id,title,score,url,num_comments,created_utc,author,selftext,comment1_comment_id,comment1_comment_body,comment1_comment_score,comment1_comment_author,comment2_comment_id,comment2_comment_body,comment2_comment_score,comment2_comment_author,comment3_comment_id,comment3_comment_body,comment3_comment_score,comment3_comment_author
lchtq9,UT Austin Pokémon. Welcome to the Jester region. Pick your starter Pokémon.,1838,https://i.redd.it/0pipm3qm9hf61.jpg,38,2021-02-04 15:17:28+00:00,TurboJelly25,,gm00xo8,This is the best post I’ve seen on this subreddit in a while lol,157.0,None,glzxhrs,Zigzagoon 100%,91.0,Pandamonium98,glzyuvl,This makes albino squirrels shiny,65.0,JerryTOP13
ig124u,"What starts here, ends the world...",1325,https://i.redd.it/wqh0mx2eh1j51.jpg,211,2020-08-24 23:59:51+00:00,perketguin,,g2r82gb,"Uhggggggggggg I just want to go out with my friends on a Saturday night. Is that too much to ask? But every time I see a group like this I know that I’ve got to add an extra two weeks onto the amount of time it’s safe to go out and by this point it feels like that it’s never going to arrive. If we had just all sat down and waited during the summer we might have already been done with this, but because a bunch of short-term thinkers couldn’t handle the idea of not going to a rave for a single weekend or putting on a mask for a few minutes when they go out, we’re still stuck in this mess and it’s worse now than ever.

Sorry for the rant. I’m just tired, man.",383.0,Drakeadrong,g2qysqm,"Damn, i was originally so disappointed that i had to graduate with no graduation ceremony, but I'm so glad I don't have to come back to this shitshow.",276.0,writinginthemargins,g2qzyjz,Is anyone really surprised? I wonder how many of them went to Cabo for spring break.,210.0,Realistic_Round_9730
heefgd,UT's Fall Planning,1251,https://i.redd.it/6ph9mgi5un651.jpg,23,2020-06-23 13:16:50+00:00,Honey_Cider,,fvrc6a0,Check your schedules; all of my classes are online now.,49.0,PlainDelight,fvqqu8p,shit rhymes yo,33.0,beepbopflipflop,fvqpa7i,Accurate,9.0,socomalol
mpyume,Oh?,1242,https://i.redd.it/na4tp50kuws61.jpg,18,2021-04-13 09:34:54+00:00,TurboJelly25,,gudbuay,"HEB does know how to business. Look at their world class logistics network, being better vaccine distribution and natural disaster response than our own government, much can be learned from just taking a close look at how HEB runs. I'm into this.",156.0,electric_taco,gudb826,Smart investment decision in my opinion,75.0,None,guduz91,Lol the thought of the UT admin getting an official change.org letter made me sign it,44.0,bam891
nijnbi,"My favorite graduation photo, bar none",1133,https://i.imgur.com/6Oz5r3O.jpg,24,2021-05-22 14:20:33+00:00,AllThotsAllowed,,gz24i46,"This guy’s name is Michael, and he’s at 24th and Whitis Monday to Friday, 8:30 to 4:30. 

Before everything, I used to skate by his little lookout and stop at the stop signs because I was on the road. He noticed and gave me props for that, and words of encouragement from then on.

I stopped by a few times and had a few conversations with him after that. I could tell this guy was a kind soul with a lot of love to share, and hot damn was I right!

Since I graduated literally yesterday and I’ve already moved to a different city and state, I figured I’d take one last cruise around campus, and I ran into this beautiful soul!

Michael and I caught up, he said he was very proud of me and that I’m eventually gonna get married. When that happens, he wants an invite, and he’s the first person on the list! He prayed over me, which isn’t my wave, but I still feel the love there, and I can’t say enough good things about Michael. He’s got a heart of gold, and he deserves the world ❤️

If you go by this intersection on a regular basis as classes start back up, or even if you don’t, please make some time to drop by and have a chat with Michael. It’ll brighten your day and he loves when people do that! Tell him Wes sent ya ;)",385.0,AllThotsAllowed,gz261k3,"He's so awesome! When I worked in MAI and had to drive to campus, he frequently did me a few solids. And he's just got such a great, positive attitude.",38.0,renegade500,gz2nyi2,"This dude was kind enough to let me stay in an illegal parked position in front of pcl just for another 10 min to drop off some stuff before the golden brick road existed. Small interaction, but he was cool and nice!",31.0,kawangkoankid
aoc7pb,Here's a photo I took of Domino on a foggy night,1128,https://i.redd.it/hleek114i9f21.jpg,27,2019-02-08 03:15:12+00:00,_rchr,,efzuwxm,Best picture of UT I’ve ever seen! Bravo!,92.0,Senior_Muffin,efzyi4s,"If you look closely he has a little heart on his back. I had no idea his name was Domino! He just walked by the tower as I was pulling out my camera and sat right there. This photo was a happy accident.

If you like this, here's a [shameless Instagram plug](https://instagram.com/joshuaraichur) lol.",59.0,_rchr,efzv8kr,[deleted],27.0,None
mjo2cc,"Someone noticed me playing Country Roads earlier on the UT Tower, and I'm glad that I recorded it! Enjoy!",1101,https://v.redd.it/p36md4qes2r61,52,2021-04-04 03:29:22+00:00,texascarillon,,gtbbbg5,"THATS HOW THEY PLAY THE BELLS IN THE TOWER!!!! Thanks for posting this, solves a longtime mental mystery for me.",110.0,Texas_EY,gtbcr6x,Epic moment. 10/10,91.0,TurboJelly25,gtbcz8w,Can you Rick Roll the entire school?,82.0,TurboJelly25
n4z1v7,there seems to be a siesta at duren today,948,https://i.redd.it/e5didxrsa6x61.jpg,22,2021-05-04 21:38:35+00:00,gengargooble,,gwyd9s5,"That is ridiculously adorable! I bet the Cats of West Campus folks would love to see this photo!

&#x200B;

ETA: at first I only saw 4 cats, I didn't even see the 5th one over on the right at first!",92.0,renegade500,gwygkz2,The one in the middle seems to have melted.,57.0,MichaelBluthover9000,gwykee4,Last week of classes checkkkk!,27.0,Lucky_Bee8318
fy40sk,I did it! After getting denied two times I got in,934,https://i.redd.it/n5y7i2newvr41.jpg,54,2020-04-10 00:21:42+00:00,None,,fmy8n3x,Congrats Santiago! Here's the start of something great! :) Proud of you for your resilience and determination.,48.0,jay_5iah,fmyb92h,You going to law school after that major?,32.0,hypotyposis,fmy72ql,Big congrats and best of luck!,25.0,tx_drew
kupsme,Snow day from the fountain,887,https://i.redd.it/4o6e26cj9la61.jpg,12,2021-01-10 23:23:05+00:00,shanew21,,gitb1uv,"Hey everybody! I’m a UT grad who still lives in the Austin area and I grabbed this photo during today’s snow day! I figured the students who are remote or haven’t returned to campus yet would appreciate the view.

If you’re interested in any more of my photography of Austin and beyond, my Instagram can be found here: https://www.instagram.com/shanewarephoto/",44.0,shanew21,gith8k0,"All it wants for is some detergent.

Left in 1991 — do people still periodically put soap in the fountain?",13.0,guruscotty,giu8iis,"You're supoosed to be _in_ the shot

and _on_ the sculptures

and also _naked_


*kids these days, geez...*",6.0,AnotherAustinWeirdo
hyx7m8,I made an AR bus map using the back of the UT ID! Check it out!,878,https://v.redd.it/tkdr7iyjufd51,17,2020-07-27 17:55:31+00:00,denali22,,fzfe88q,Wow! Where do you even start with that? Who thinks of these things? i-,95.0,Wh0_Ev3n_,fzft04i,"Wow, awesome job! Make this publicly accessible somehow",55.0,OilofOregano,fzfuep1,Dude great job You should try to get this in front of pts. Make sure you get credit for this!,36.0,Rene4591
nde1ig,Rickrolling the entire UT campus,877,https://v.redd.it/ucsy0rgi3ez61,21,2021-05-16 02:02:40+00:00,texascarillon,,gya525t,"As requested, I rickrolled the entire campus a few nights ago :) And I hope finals are going well for everyone! Since it’s my last semester as a UT student, I wanted to perform a final concert, so tomorrow evening 5/16 at 7pm, I’ll be playing the bells, rain or shine. I made a [lil mock program](https://imgur.com/a/qQ48zZW) for it, just for fun :) So take a study break and come listen to some tunes!",149.0,texascarillon,gya5ebv,Nice! I would've loved to be on campus when this happened.,37.0,vandirbelt,gyara9c,petition to make never gonna give you up the new school song,25.0,lolbsters
qx65xu,Has anyone else been solicited for donations by so called “fellow students” inside campus buildings?,859,https://www.reddit.com/r/UTAustin/comments/qx65xu/has_anyone_else_been_solicited_for_donations_by/,82,2021-11-19 02:35:56+00:00,None,"Every now and then I would have someone who obviously doesn’t speak English hand me a card saying they’re a student at UT struggling to survive and need help. 

For one thing, it’s obvious to me that these people are not UT students. It’s ok to not know perfect English but whenever I try speaking back at them, they just give blank stares. How these people could be UT students while not knowing any English is beyond me.

Furthermore, it’s always different people but with the same MO. They all wear the same outfit and look like students. They all look like they’re in their upper 20’s or lower 30’s. Same pamphlet. Same “gifts” (crackers or cookies). 

I’ve also had this happen to me in multiple occasions in different locations. They’ve come to me in different floors of the PCL and even around midnight at the EER. 

Some are even a bit aggressive. Just a few minutes ago one lady of this group solicited me and whenever I had to respectfully say no (I’m hella poor) she left in a huff. On the 4th floor of the PCL mind you.

At this point I’m worried about their safety. It could be that these people are not even aware of what they’re doing and are being exploited by some exterior group.

This is creepy to me. I’ll make sure to provide pictures the next time they approach me.


Edit:
After doing some research using the additional information given to me from the comment below. We were able to track down one of the solicitors to a “news anchor” called Princess Laranas using one of the venmo handles they use for donations. This lead us to their official Facebook profile.

Princess Laranas is a news anchor for this group called SMNI News. SMNI is owned and operated by Swara Sug Media Corporation which is the parent company of Sonshine Media Network International. This company is the broadcasting arm for Filipino televangelist and church leader Pastor Apollo C. Quiboloy.

Besides making grand claims such as being the “Appointed Son of God” and being the “Owner of the Universe”, Mr. Quiboloy was also accused of brainwashing a former church member, and was indicted for sex trafficking.

Mr. Quiboloy is the founder of the church “Kingdom of Jesus Christ”. This church practices tithing which has made Mr. Quiboloy very wealthy.

Besides that, the church is also guilty of human trafficking, abuse and are required to meet tithing quotas (which is probably why they’re soliciting us for money)

Check out the article yourself:

https://en.wikipedia.org/wiki/Kingdom_of_Jesus_Christ_(church)?wprov=sfti1



tldr; It’s a cult, go figure.",hl7e9ml,"Yes, had this happen to me a few times in the EER Freshman year. Recently had it happen to me for the first time in a while in the PCL, and I've seen it a few times since. No clue why they all have the exact same approach",131.0,SpotlightR,hl7l99t,"Omg yes!!! A few weeks ago, I was in the SAC when a girl came up to me and tried to sell me a cheap mask for $10. I tried to decline but she got pushy so I caved in and venmoed her a dollar. It was a bizarre interaction and I watched as she went around the room and did the same routine with everyone else. 

I didn’t think much of it until yesterday, when a man came up to me in the Union with the exact same schtick. 

In hindsight, I’m kind of glad I venmoed that girl. I googled her Venmo handle and she has some personal accounts on other websites with the same username. Maybe I could reach out and see if she’d be willing to tell me what’s going on?

edit: alright, this is weird. Their display name on Venmo is “Princess Laranas.” If you Google that, the first result is an Austin-based “news personality” that works for SMNI USA, a Filipino televangelist network. If you scroll down, you’ll start getting weird Christian stuff. This could be a coincidence, but idk",93.0,politicaloutcast,hl7f0e5,"Yeah, this happened to me in the EER. There's no way they're students here at UT and don't give them anything.",37.0,None
ggamo5,I’M OFFICIALLY DONE WITH MY UNDERGRADUATE DEGREE!!!!!!!,840,https://i.redd.it/bvfp8lotsox41.jpg,32,2020-05-09 06:53:59+00:00,DeerOnTheRocks,,fpyp7kc,"It’s over!!!! It was a tough, long journey with literally blood, sweet, and tears...but I’m done y’all. 

I’d like to thank my mom, my loved ones, this sub, Domino, Jendys, Fricanos, Varsity Pizza, the PCL, old and new Speedway, Daddy Fenves, The Tower, The Tower balls, Mike the crossing guard, Chic Fila, Hornsy Meme page, Vine, the subway thief, the clowns, Wampus, Pluckers, the turtle pond, the canoe statue, the stress of registration, Einstein bagels, Chegg, ACL, CAVA, the CO-OP, the albino squirrels, whoever strangely decided to allow me into this school, 6th Street, Dicker the Kicker, Fat Sals, J2 Dining, JCL, and not RLM.

To all the other graduates I’m so proud of y’all. You will change the world.

To all the current students. Enjoy every moment you will have back at UT. I wish I could’ve end it all back there. Embrace and even enjoy all the struggles you will go through. Work hard and soak it all in. It will feel so great when you get to the finish line. HOOK EM!!!",129.0,DeerOnTheRocks,fpzengz,Congrats! What major?,15.0,blazinggod123,fpyq8b5,Beautiful!,10.0,Uterus-tax
fjdekn,Fenves rn,772,https://i.redd.it/orde7bw53ym41.jpg,33,2020-03-16 02:22:28+00:00,GERGEZ5000,,fkmike0,Didn’t one of their relatives test positive?,120.0,None,fkmiw5a,This was literally the first thing I said when I read that email,76.0,None,fkmzzxd,This made me literally laugh out loud in a very quiet cafe thank you for making me look like a psychopath.,32.0,estalber
axcs0w,[Meme] When you see another UT student.,767,https://v.redd.it/mn0fu7oq86k21,23,2019-03-04 21:40:34+00:00,Jonny3645,,ehsqx8f,[deleted],109.0,None,ehstnbu,Is it normal for me to want to watch a full episode of this UT anime,89.0,UTaltacc,ehsqxla,Quality content,54.0,CSThr0waway123
ien141,The 'em has been hooked,753,https://i.redd.it/ls9ugfz8eli51.jpg,41,2020-08-22 17:53:45+00:00,deadface008,,g2hx745,Pretty much,54.0,socomalol,g2i4ijp,I think taking a year off would be a good idea. Don't get stuck thinking you need to fly through university in a set amount of time.,49.0,Captainhkkrz,g2ibxlf,too bad Fenves isn't here anymore to see the memes. Probably why he left- to get paid more without getting roasted so hard through memes,24.0,UnusualHeart
gqbkiw,Congrats to the 2020 graduates!,732,https://i.redd.it/atw805245x051.jpg,16,2020-05-25 14:09:30+00:00,shanew21,,frrtc3x,"Did you take this picture? That seriously looks insane, nice job!",46.0,tbh-idk-,frrwn27,I’m not sure whether I should take the storm as an exciting metaphor or an ominous one...,33.0,running-tiger,frs3x3w,Wow this is exactly how graduating in 2020 felt. You nailed it.,28.0,flowerbhai
gbhzw6,Remembering a friend on this day.,726,https://www.reddit.com/r/UTAustin/comments/gbhzw6/remembering_a_friend_on_this_day/,68,2020-05-01 13:22:09+00:00,spencefence1996,"On this day 3 years ago I lost my friend Harrison to the senseless attack on campus. I just wanted him to be remembered today.. also the memorial that was made for him is beautiful.
Have a good day.",fp64541,🤘🏼🤘🏼🤘🏼🤘🏼 Horns up for Harrison.,154.0,scientiafem,fp5uwao,"Thanks for posting. I was there when it happened, I didn’t know him but I think about him often. Im sorry for your loss.",132.0,CaptainHalitosis,fp5ygv5,[deleted],48.0,None
fkgdmz,It is what it is,716,https://i.redd.it/a17dzw65tbn41.jpg,5,2020-03-18 00:31:15+00:00,izzyMcdrizzy,,fkssanj,[deleted],42.0,None,fkskjni,I'm not as disappointed 🤷🏻‍♂️ I hate online classes but life goes on,38.0,None,fksu8ak,This made me laugh out loud,12.0,deadface008
fwogc3,He’s just going out for cigarettes,713,https://i.redd.it/r0shjj35jfr41.jpg,8,2020-04-07 17:18:51+00:00,Local_Lurker_,,fmplnu2,"I know this is a meme, and I got a kick out of it. Truth is, Atlanta is WAY worse than Austin right now for cases of the virus. So, joke's on him, I guess.",85.0,moochs,fmpgdjv,"Hey, that's a lie. That's what I told my son when I was planning to leave my ex wife and leave the country. He asked me where I was going, and I said that I was getting a pack of Marlboro lights and a gallon of milk. Don't worry son, I'll be back 🤦🏻‍♂️",26.0,None,fmr0idk,funny af,2.0,None
hn45g1,UT reassuring us about the coming semester,708,https://i.redd.it/2tl0h1jjci951.jpg,19,2020-07-07 22:02:14+00:00,Imagine_Baggins,,fx9n2uz,[deleted],39.0,None,fx9qhe3,I just signed my dorm contract yesterday oop,6.0,Thatonegaylifter,fx9ys4h,"When god said secure the bag, he said to secure it by any means necessary",2.0,redditgod16
ipc6gi,I hate it,695,https://i.redd.it/80aaaiq533m51.jpg,16,2020-09-09 08:36:03+00:00,DexFPV,,g4jngy8,Whenever they give us a problem to work out they always overestimate how long it’ll take rip,89.0,None,g4jsfda,"I taught a course in the summer and had students fill out a detailed post-course survey. The people who didn't talk/work together in breakout rooms were pretty likely to say that breakout rooms were the worst part of the class.

On the other hand, people who did talk and work together were pretty likely to say that breakout rooms were the most helpful part of the class.

I get this is just a meme and all, but to anyone checking comments, I thought that might be useful to know.",85.0,superotterman,g4jwtaa,"You serious? o.O

IF the people in the breakout room actually try to socialize and have a light-hearted chat about how college is going and where they're coming from, it can do wonders. It's strange, after being put in the same room with the same people for more than one zoom mtg, you'll be surprised at how people start to be more open and friendly. They - GASP - actually start looking like they're not some virtual COVID-19 variant trying to destroy your day.

That's only IF. To all you peeps in breakout rooms, if you don't step up, who will? Y'all should just go ""F it"" and say what you wanna say, it's likely 99% more fun and interesting than all those jerks ignoring you who'll probably fail the class for not participating.",37.0,Critical_Row
hbu8pq,Inside The Mind of UT,684,https://i.redd.it/8p1e5hkjqs551.jpg,32,2020-06-19 04:41:23+00:00,JustinTwo,,fvb3l4g,Next step: Massive outbreak of Covid among the student body traced to dorms.,125.0,Unnamed_Bystander,fvb4xro,Or a class with online lecture and one discussion hour in person.,57.0,imarobotlmao,fvbctt3,So THATS why only 1/6 of my classes are in person... smh,16.0,m0o0ooo
lnx1ai,I heard unboiled water is all the rage...,685,https://i.redd.it/hxvcnpf6nji61.png,3,2021-02-20 02:30:10+00:00,HookedOnDaBait,,go2xwpw,This aged pretty well,83.0,RTBC5555,go2z2pd,Didn't they just delayed the break back up to next Wednesday though? :/,45.0,TheFreeJournalist,,,,
imwka1,UT every few weeks,664,https://i.redd.it/sgpojidnz9l51.jpg,12,2020-09-05 06:44:44+00:00,Laserslayer2000,,g44r6zn,how dare you insult Uncle Iroh by attaching UT's name to him. You have brought great dishonor upon yourself,74.0,maruthgoyal,g44siau,I'm the biggest football fan I know and I ain't buying that big ticket,51.0,Stellafera,g45c753,Top-tier meme holy shit,15.0,Blootzz
ih11kb,At least it is better than nothing.,657,https://i.redd.it/sqcbabv69dj51.jpg,12,2020-08-26 15:35:28+00:00,12_Semitones,,g2xov3q,Is that a T-posing Sully under the Gmail app?,68.0,TurboJelly25,g2xe1wt,"As a grad student I’ll be honest I don’t feel that cheated by remote learning. Most of what I do is on my own at my computer anyways. 

I am, however, distraught that the Ransom Center is closed indefinitely :(",63.0,MohnJilton,g2xrns5,"online classes are fine, once profs have gotten adjusted to them. my biggest issue is when things are online, it's way too easy to just ignore and procrastinate and do shittily on everything",48.0,None
hl81bo,The new upvote as Hookem and downvote as A&M is weak af and stoops to their level revolving our identity around theirs.,654,https://www.reddit.com/r/UTAustin/comments/hl81bo/the_new_upvote_as_hookem_and_downvote_as_am_is/,71,2020-07-04 18:23:56+00:00,cincopea,"When I spent some time with aggies and at college station they couldn't stop talking shit and hissing at UT. It was kind of embarrassing to see so much inferiority complex. They have so much to talk about us. like TU and all this kind of stuff. I realized at UT, we never really talked about A&M, but they're obsessed with talking about us.

Now we're doing the same thing and it's embarrassing. There's now just as much A&M logos on our own subreddit.",fwxe3l9,Petition to change it to OU,252.0,Despuhration,fwxnyhn,"The thing I love about UT is that we literally never talk about A&M in our day to day because we could not care less. The two times I went to College Station, UT is all anyone talked about (even when they didn’t know I was from there).",146.0,flowerbhai,fwxmd5v,FYI: “utrejects.com” will bring you to A&M website.,108.0,None
gj73so,I did it guys! I finished a semester at Zoom university!!,632,https://i.redd.it/z43ynytcely41.jpg,17,2020-05-13 20:31:43+00:00,Nternal37,,fqiy74j,But at what cost,61.0,None,fqjaiee,Proud of you kid,10.0,androidMeAway,fqjd9aa,Good on you for surviving it!,7.0,renegade500
itxtla,How to handle donation requests,635,https://i.redd.it/vtetgqpr3jn51.jpg,49,2020-09-16 15:32:06+00:00,mgnmky,,g5hhjwr,"That’s pretty funny. Just remember, everyone, to keep it light like this. They are usually undergrad interns and volunteers.",190.0,JeremyTheRhino,g5hjyca,"To give you an idea on how persistent UT is about pestering you for donations, the ""diploma"" I was given when I walked to stage upon graduation was actually a rolled up memo asking me to donate to the alumni association. I had been an alumni for all of technically the walk from the stage back to my seat before UT hit me up for money.",85.0,Rocketsponge,g5hilpq,wait they’re real people 😳,73.0,ummbitchwhatthefuck
i34b26,I'm lazy,636,https://i.redd.it/aa42zohdfue51.png,23,2020-08-03 19:59:47+00:00,TurboJelly25,,g099480,I feel like I work for the NSA or something every time I log in to MyUT,110.0,salesman_jordan,g09ajx4,"Serious tip tho, Make sure u do the “Remember me for 30 days” for convenience, especially if u use the same device to log in. A couple of friends and I didn’t notice that option, and it slowed down our registration",82.0,boss1927,g09gdah,"I honestly thought they recalled my admission since I was getting the ""duo identification not complete, Contact IT for more information."" thought I maybe didn't submit my documents or messed something up",7.0,Flufypear
nojbxa,(A far too expensive) UT Austin wedding cake,622,https://i.redd.it/k84h3emvdb271.jpg,32,2021-05-30 20:05:54+00:00,enterguild,,h00enxn,That's a lot of fondant...,130.0,llamalibrarian,h00jyf8,I want to sit on it and see how far up it goes,59.0,ThiccyDicc,h00ldlt,Is this a UT MD grad? I'm assuming so because of the stethoscope,42.0,Prinz_
gp7uwz,"Long ago, the class of 2020 lived together in harmony ....",615,https://i.redd.it/ymanpafgkj051.jpg,22,2020-05-23 16:30:44+00:00,feministlunchbox,,frkat0i,this one hit hard 😥,21.0,LeBryant-Jordan,frkd4bx,"Oh, this is amazing. ATLA+UT,  my heart",19.0,dontforgethetrailmix,frmbjvw,"Yeah, my grandmother used to tell me stories about the old days, a time of peace when Fenves kept balance between the Dallasites, Houstonians, Austinites, and San Antonians.",8.0,None
ho4pdt,Official Statement from Interim President Jay Hartzell,611,https://i.imgur.com/UTeT1O2.png,55,2020-07-09 15:07:26+00:00,OneStrangeOnion,,fxfkq0k,"wow you got me on that, I was shocked for a minute",143.0,theholyassasin,fxfkit2,Fuck them kids,115.0,CatsAndGeese,fxfusqa,Wer'e doing thi$ for the $tudents.,76.0,socomalol
loonfk,Domino is fine,602,https://i.redd.it/wqtdooj0ari61.jpg,9,2021-02-21 04:10:27+00:00,floodrefugeekitties,,go6zff2,"We wanted to get a dramatic photo of him in the snow, but instead here's a pic of him chowing down on sardines!

During the snowpocalypse, we brought food to him 3 times a day. We delivered food straight into his underground shelter so he didn't have to go out into the cold. 

We heard him meowing in his lair the night after the worst freeze, so we knew he survived the coldest night -- but we hadn't seen any sign of him since then.

All of the other cats emerged in the nice weather, but still no Domino. We were starting to get pretty worried about him...

But he just came out tonight to get a meal delivery from his personal assistant! We are getting misty-eyed <3

(Check out [Cats of West Campus](https://www.facebook.com/catsofwestcampus) on facebook for more pics of all the campus kitties.)",102.0,floodrefugeekitties,go7a84h,THANK GOODNESS I WAS SO WORRIED,51.0,y1kv-mrpf,go7h6od,Our little trooper,34.0,None
lk23zp,Snow Day on Campus,597,https://i.redd.it/nlp7hu25kjh61.jpg,26,2021-02-15 01:09:03+00:00,acapfer,,gnhr43r,Who's lugging around an iMac on campus during a snow day? Is the FAC getting raided?,87.0,Dr_Findro,gnhiwov,"They hit the bushy area and rolled, but both were completely fine. I just really liked the blur when I took the picture.",79.0,acapfer,gnhx25m,"This photo is everything. The clarity, the blurriness, the hill, the Mac desktop.",55.0,DeerOnTheRocks
