post_id,title,score,url,num_comments,created_utc,author,selftext
lchtq9,UT Austin Pokémon. Welcome to the Jester region. Pick your starter Pokémon.,1838,https://i.redd.it/0pipm3qm9hf61.jpg,38,2021-02-04 15:17:28+00:00,TurboJelly25,
ig124u,"What starts here, ends the world...",1325,https://i.redd.it/wqh0mx2eh1j51.jpg,211,2020-08-24 23:59:51+00:00,perketguin,
heefgd,UT's Fall Planning,1251,https://i.redd.it/6ph9mgi5un651.jpg,23,2020-06-23 13:16:50+00:00,Honey_Cider,
mpyume,Oh?,1242,https://i.redd.it/na4tp50kuws61.jpg,18,2021-04-13 09:34:54+00:00,TurboJelly25,
nijnbi,"My favorite graduation photo, bar none",1133,https://i.imgur.com/6Oz5r3O.jpg,24,2021-05-22 14:20:33+00:00,AllThotsAllowed,
aoc7pb,Here's a photo I took of Domino on a foggy night,1128,https://i.redd.it/hleek114i9f21.jpg,27,2019-02-08 03:15:12+00:00,_rchr,
mjo2cc,"Someone noticed me playing Country Roads earlier on the UT Tower, and I'm glad that I recorded it! Enjoy!",1101,https://v.redd.it/p36md4qes2r61,52,2021-04-04 03:29:22+00:00,texascarillon,
n4z1v7,there seems to be a siesta at duren today,948,https://i.redd.it/e5didxrsa6x61.jpg,22,2021-05-04 21:38:35+00:00,gengargooble,
fy40sk,I did it! After getting denied two times I got in,934,https://i.redd.it/n5y7i2newvr41.jpg,54,2020-04-10 00:21:42+00:00,None,
kupsme,Snow day from the fountain,887,https://i.redd.it/4o6e26cj9la61.jpg,12,2021-01-10 23:23:05+00:00,shanew21,
hyx7m8,I made an AR bus map using the back of the UT ID! Check it out!,878,https://v.redd.it/tkdr7iyjufd51,17,2020-07-27 17:55:31+00:00,denali22,
nde1ig,Rickrolling the entire UT campus,877,https://v.redd.it/ucsy0rgi3ez61,21,2021-05-16 02:02:40+00:00,texascarillon,
qx65xu,Has anyone else been solicited for donations by so called “fellow students” inside campus buildings?,859,https://www.reddit.com/r/UTAustin/comments/qx65xu/has_anyone_else_been_solicited_for_donations_by/,82,2021-11-19 02:35:56+00:00,None,"Every now and then I would have someone who obviously doesn’t speak English hand me a card saying they’re a student at UT struggling to survive and need help. 

For one thing, it’s obvious to me that these people are not UT students. It’s ok to not know perfect English but whenever I try speaking back at them, they just give blank stares. How these people could be UT students while not knowing any English is beyond me.

Furthermore, it’s always different people but with the same MO. They all wear the same outfit and look like students. They all look like they’re in their upper 20’s or lower 30’s. Same pamphlet. Same “gifts” (crackers or cookies). 

I’ve also had this happen to me in multiple occasions in different locations. They’ve come to me in different floors of the PCL and even around midnight at the EER. 

Some are even a bit aggressive. Just a few minutes ago one lady of this group solicited me and whenever I had to respectfully say no (I’m hella poor) she left in a huff. On the 4th floor of the PCL mind you.

At this point I’m worried about their safety. It could be that these people are not even aware of what they’re doing and are being exploited by some exterior group.

This is creepy to me. I’ll make sure to provide pictures the next time they approach me.


Edit:
After doing some research using the additional information given to me from the comment below. We were able to track down one of the solicitors to a “news anchor” called Princess Laranas using one of the venmo handles they use for donations. This lead us to their official Facebook profile.

Princess Laranas is a news anchor for this group called SMNI News. SMNI is owned and operated by Swara Sug Media Corporation which is the parent company of Sonshine Media Network International. This company is the broadcasting arm for Filipino televangelist and church leader Pastor Apollo C. Quiboloy.

Besides making grand claims such as being the “Appointed Son of God” and being the “Owner of the Universe”, Mr. Quiboloy was also accused of brainwashing a former church member, and was indicted for sex trafficking.

Mr. Quiboloy is the founder of the church “Kingdom of Jesus Christ”. This church practices tithing which has made Mr. Quiboloy very wealthy.

Besides that, the church is also guilty of human trafficking, abuse and are required to meet tithing quotas (which is probably why they’re soliciting us for money)

Check out the article yourself:

https://en.wikipedia.org/wiki/Kingdom_of_Jesus_Christ_(church)?wprov=sfti1



tldr; It’s a cult, go figure."
ggamo5,I’M OFFICIALLY DONE WITH MY UNDERGRADUATE DEGREE!!!!!!!,840,https://i.redd.it/bvfp8lotsox41.jpg,32,2020-05-09 06:53:59+00:00,DeerOnTheRocks,
fjdekn,Fenves rn,772,https://i.redd.it/orde7bw53ym41.jpg,33,2020-03-16 02:22:28+00:00,GERGEZ5000,
axcs0w,[Meme] When you see another UT student.,767,https://v.redd.it/mn0fu7oq86k21,23,2019-03-04 21:40:34+00:00,Jonny3645,
ien141,The 'em has been hooked,753,https://i.redd.it/ls9ugfz8eli51.jpg,41,2020-08-22 17:53:45+00:00,deadface008,
gqbkiw,Congrats to the 2020 graduates!,732,https://i.redd.it/atw805245x051.jpg,16,2020-05-25 14:09:30+00:00,shanew21,
gbhzw6,Remembering a friend on this day.,726,https://www.reddit.com/r/UTAustin/comments/gbhzw6/remembering_a_friend_on_this_day/,68,2020-05-01 13:22:09+00:00,spencefence1996,"On this day 3 years ago I lost my friend Harrison to the senseless attack on campus. I just wanted him to be remembered today.. also the memorial that was made for him is beautiful.
Have a good day."
fkgdmz,It is what it is,716,https://i.redd.it/a17dzw65tbn41.jpg,5,2020-03-18 00:31:15+00:00,izzyMcdrizzy,
fwogc3,He’s just going out for cigarettes,713,https://i.redd.it/r0shjj35jfr41.jpg,8,2020-04-07 17:18:51+00:00,Local_Lurker_,
hn45g1,UT reassuring us about the coming semester,708,https://i.redd.it/2tl0h1jjci951.jpg,19,2020-07-07 22:02:14+00:00,Imagine_Baggins,
ipc6gi,I hate it,695,https://i.redd.it/80aaaiq533m51.jpg,16,2020-09-09 08:36:03+00:00,DexFPV,
hbu8pq,Inside The Mind of UT,684,https://i.redd.it/8p1e5hkjqs551.jpg,32,2020-06-19 04:41:23+00:00,JustinTwo,
lnx1ai,I heard unboiled water is all the rage...,685,https://i.redd.it/hxvcnpf6nji61.png,3,2021-02-20 02:30:10+00:00,HookedOnDaBait,
imwka1,UT every few weeks,664,https://i.redd.it/sgpojidnz9l51.jpg,12,2020-09-05 06:44:44+00:00,Laserslayer2000,
ih11kb,At least it is better than nothing.,657,https://i.redd.it/sqcbabv69dj51.jpg,12,2020-08-26 15:35:28+00:00,12_Semitones,
hl81bo,The new upvote as Hookem and downvote as A&M is weak af and stoops to their level revolving our identity around theirs.,654,https://www.reddit.com/r/UTAustin/comments/hl81bo/the_new_upvote_as_hookem_and_downvote_as_am_is/,71,2020-07-04 18:23:56+00:00,cincopea,"When I spent some time with aggies and at college station they couldn't stop talking shit and hissing at UT. It was kind of embarrassing to see so much inferiority complex. They have so much to talk about us. like TU and all this kind of stuff. I realized at UT, we never really talked about A&M, but they're obsessed with talking about us.

Now we're doing the same thing and it's embarrassing. There's now just as much A&M logos on our own subreddit."
gj73so,I did it guys! I finished a semester at Zoom university!!,632,https://i.redd.it/z43ynytcely41.jpg,17,2020-05-13 20:31:43+00:00,Nternal37,
itxtla,How to handle donation requests,635,https://i.redd.it/vtetgqpr3jn51.jpg,49,2020-09-16 15:32:06+00:00,mgnmky,
i34b26,I'm lazy,636,https://i.redd.it/aa42zohdfue51.png,23,2020-08-03 19:59:47+00:00,TurboJelly25,
nojbxa,(A far too expensive) UT Austin wedding cake,622,https://i.redd.it/k84h3emvdb271.jpg,32,2021-05-30 20:05:54+00:00,enterguild,
gp7uwz,"Long ago, the class of 2020 lived together in harmony ....",615,https://i.redd.it/ymanpafgkj051.jpg,22,2020-05-23 16:30:44+00:00,feministlunchbox,
ho4pdt,Official Statement from Interim President Jay Hartzell,611,https://i.imgur.com/UTeT1O2.png,55,2020-07-09 15:07:26+00:00,OneStrangeOnion,
loonfk,Domino is fine,602,https://i.redd.it/wqtdooj0ari61.jpg,9,2021-02-21 04:10:27+00:00,floodrefugeekitties,
lk23zp,Snow Day on Campus,597,https://i.redd.it/nlp7hu25kjh61.jpg,26,2021-02-15 01:09:03+00:00,acapfer,
fikhzq,Coincidence?,598,https://i.redd.it/il8skcpounm41.jpg,9,2020-03-14 15:57:08+00:00,None,
go46s2,Would have loved to know I was failing 3 weeks ago,599,https://i.redd.it/px9s5u1cd6051.png,7,2020-05-21 20:07:33+00:00,deadface008,
g2qxe8,Me: Doesn't study for exam because it's now online and open note. Exam: Difficult. Also me:,587,https://i.redd.it/pfgzh3z2r9t41.jpg,22,2020-04-17 00:02:49+00:00,for-the_love-of_cake,
lq85i9,Sleepless nights here we come!!!,584,https://i.redd.it/3vht4yjrd5j61.jpg,11,2021-02-23 03:35:29+00:00,Visible-Challenge356,
hhixst,"I made a 3D Model of the tower, gave it arms and legs, and made it into a VRChat Avatar",576,https://i.imgur.com/IyoHgsT.png,14,2020-06-28 17:55:06+00:00,annoyingWanderer_,
hc5iht,Finally a genuine & authentic email from UT,565,https://i.redd.it/fcixfdcvow551.png,14,2020-06-19 18:02:21+00:00,eulestadt,
pvlcxn,How the turn tables,565,https://i.redd.it/7xrn5189irp71.png,5,2021-09-26 02:53:53+00:00,BX1959,
jww82z,pleased to say that domino is doing well these days,567,https://www.reddit.com/gallery/jww82z,14,2020-11-19 04:41:00+00:00,thaiearltea,
qznwh9,Spotted in a GDC computer lab,567,https://i.imgur.com/YWR9P4j.jpg,16,2021-11-22 15:26:36+00:00,Malwake,
jzl5no,PASS / FAIL Approved by UT Faculty Council,568,https://i.redd.it/a2jpfszuq0161.jpg,105,2020-11-23 16:45:34+00:00,hsdropout19,
jabul6,Domino is overseeing the early voting activities st FAC to make sure there are no shenanigans,566,https://www.reddit.com/gallery/jabul6,11,2020-10-13 11:53:40+00:00,renegade500,
lr408k,Domino is the main character.,549,https://i.redd.it/93pb6oomvcj61.jpg,4,2021-02-24 04:48:06+00:00,ak2024,
ixy2dd,Domino let me sit with him and give him some pets today,548,https://i.redd.it/2hhrbub22so51.jpg,12,2020-09-22 22:42:44+00:00,parsnips445,
i0mt3x,UT in a Nutshell,547,https://v.redd.it/zvb2p8xl60e51,19,2020-07-30 14:17:17+00:00,nothingamusing,
in7s8k,"Lo-Fi Girl, UT Austin Edition! (Created by a student in Texas Immersive)",549,https://i.redd.it/6np9x5ixwdl51.jpg,6,2020-09-05 19:58:26+00:00,UT_Texas_Immersive,
iia4sp,Every time I try to log into Canvas...,547,https://i.redd.it/36b56bq4rrj51.png,13,2020-08-28 16:21:06+00:00,Rynneer,
l8lyyf,Flyover of Austin and UT in Microsoft Flight Simulator,551,https://v.redd.it/lh748r113he61,28,2021-01-30 13:43:56+00:00,PetrolMan77,
i00ftw,Most in the nation baby!! HOOK 'EM🤘🤘🤘,541,https://i.redd.it/7096forvpsd51.jpg,60,2020-07-29 13:10:44+00:00,NickTheGladiator,
isfzdg,Or maybe it's just my lack of organization skills who knows,540,https://i.redd.it/h9273qlma0n51.jpg,10,2020-09-14 07:00:13+00:00,lautau32,
fkt8zi,You could try Zoom instead :/,543,https://i.redd.it/ll7ru5gatgn41.jpg,3,2020-03-18 17:20:59+00:00,jeffw16,
kysb7m,I’m getting desperate..,539,https://www.reddit.com/gallery/kysb7m,39,2021-01-16 21:54:29+00:00,happymoe,
m1x5ri,Mom re-admitted after 7 years!,528,https://www.reddit.com/r/UTAustin/comments/m1x5ri/mom_readmitted_after_7_years/,31,2021-03-10 13:12:06+00:00,None,"Like the title states, I’ll be returning to UT at the age of 26 after a 7 year break from my undergrad studies as a mom! 

I still have a lot of things to get in order before telling people in my life but I thought I’d share it here for some support!"
iu8qj3,Me after realizing school will never get back to normal,530,https://www.reddit.com/gallery/iu8qj3,8,2020-09-17 00:43:09+00:00,Laserslayer2000,
dtggna,"Domino is warm and dry this chilly, wet morning",531,https://i.redd.it/roskfjub7hx31.jpg,17,2019-11-08 14:52:11+00:00,renegade500,
gaidha,This is ridiculous. And genius.,521,https://i.redd.it/1j0w95qpttv41.jpg,108,2020-04-29 21:39:36+00:00,kaizenn7,
l0jxsp,Welcome back... kinda,524,https://i.redd.it/q7o5hdgzkac61.jpg,17,2021-01-19 13:35:55+00:00,TurboJelly25,
q3yln9,The entire subreddit when the godly Domino is spotted and posted,524,https://i.redd.it/bte9i6dmi8s71.jpg,3,2021-10-08 14:14:05+00:00,None,
h9lfjy,Didn't know Obama visited Greg Gym,513,https://i.redd.it/pplc0dbko2551.jpg,45,2020-06-15 18:04:59+00:00,44Scholar,
fg14tl,Gave the EER directory screen a lil update,513,https://v.redd.it/1b4q40v7hpl41,25,2020-03-09 20:21:45+00:00,jasonm412128,
as4000,UT Engineering at it's finest,513,https://i.redd.it/tofifcxa3fh21.jpg,19,2019-02-19 00:11:21+00:00,voltron560,
gourjj,Failed all my classes and left UT in Fall 2018. First semester back and I've made a 4.0 and University Honors!,508,https://www.reddit.com/r/UTAustin/comments/gourjj/failed_all_my_classes_and_left_ut_in_fall_2018/,21,2020-05-22 23:57:08+00:00,heywhocutthebrie,"This was my first time making an A in any class at UT, much less 4 at once. I don't have many people to share this achievement with so I wanted to post here! Now I'm just waiting to see if my internal transfer gets accepted 🤘"
fobitj,What a strange first year here,509,https://i.redd.it/djp5q4uxaoo41.jpg,35,2020-03-24 19:36:31+00:00,Magic-Man-Man,
ihkvy1,"On the first day of Acornology 101, all students were required to bring in an acorn to present for their first assignment. The class showed great participation -- except for poor Ace who stayed silent the entire time, praying that the teacher wouldn't call on him. He forgot his. 😂",504,https://i.redd.it/meozfkzppjj51.png,10,2020-08-27 13:19:55+00:00,squirrelsofut,
mci51r,A king still requires his daily nap,504,https://i.redd.it/h067w490v1p61.jpg,4,2021-03-24 22:09:53+00:00,ak2024,
k2u7ck,Sweet revenge...,501,https://i.redd.it/fltmbydgb1261.jpg,10,2020-11-28 19:45:08+00:00,coinguy58,
gfsacu,Me: I miss being on campus. Me when campus opens again:,499,https://i.redd.it/7sgo73hhbjx41.jpg,2,2020-05-08 12:27:52+00:00,Lanzhou77,
hmyqyw,how it feels being an international student right now,494,https://i.redd.it/adb8ozexxg951.jpg,42,2020-07-07 17:17:55+00:00,creamcheese5,
pzi5ca,Just sharing my works after seeing a post that featured my drawings.,499,https://www.reddit.com/gallery/pzi5ca,17,2021-10-01 22:00:02+00:00,YunJang,
qbfo4p,Me asking professors for letters of rec after being a hermit all my college life,496,https://i.redd.it/arh96mk9tfu71.jpg,18,2021-10-19 16:54:29+00:00,milkteaisreallygood,
lksgsc,I made a snow compilation of UT,496,https://v.redd.it/xeiho13psqh61,16,2021-02-16 01:29:13+00:00,rxveadlvft,
lw8vz1,ERCOT might want to look into it.,494,https://i.redd.it/cqepxyztqnk61.jpg,3,2021-03-02 18:24:56+00:00,12_Semitones,
j8s6c8,Same,492,https://i.redd.it/s30gtt9szbs51.jpg,10,2020-10-10 20:58:00+00:00,Ovarian-,
jykntw,We need to find a way to stop RHO.,489,https://v.redd.it/rtkvpotado061,101,2020-11-21 23:09:02+00:00,TravisScottBatman,
hygdz9,Daddy Fenves Update: He's Leaving Austin,493,https://i.redd.it/x58jt7bc4ad51.jpg,36,2020-07-26 22:38:18+00:00,CatsAndGeese,
jj5y20,Every week the cycle repeats,486,https://i.redd.it/8achd378bov51.png,10,2020-10-27 17:46:47+00:00,HookedOnDaBait,
nvtg2o,UT Tower looking cute,487,https://i.imgur.com/hk2SiXY.jpg,6,2021-06-09 11:24:53+00:00,cttieu,
mupw5q,I’m burnt out.,477,https://i.redd.it/udl03vtsubu61.jpg,23,2021-04-20 13:07:08+00:00,12_Semitones,
lfl1hw,I’m horrendously behind in every single one of my classes but you know what this is the week I get caught up if you’re behind too you’re not alone let’s kill it baby don’t get discouraged,483,https://www.reddit.com/r/UTAustin/comments/lfl1hw/im_horrendously_behind_in_every_single_one_of_my/,23,2021-02-08 20:30:54+00:00,nickdagangsta,"Just posting this just in case anyone is in the same boat as me and needs a lil push. Good luck everyone the struggle will be worth it in the end we are stronger than our procrastination💪💪
Time to go to the first week of class and start watching all the lectures let’s GO

P.S.

Attitude is a little thing that makes a big difference and tough times don’t last, tough people do"
gfd6bo,"And just like that, my last class at UT is done",479,https://www.reddit.com/r/UTAustin/comments/gfd6bo/and_just_like_that_my_last_class_at_ut_is_done/,40,2020-05-07 19:19:44+00:00,None,"The title says it all - no finals, tests or presentations left. I am a graduating senior and about an hour and a half ago finished up my last class. I feel nothing and everything at all. I still remember so much, and have gone through an incredible transformation over the last four years here. I wanted to write down my story briefly for you longhorns; I hope you feel comfortable enough to share something as well. 

I come from a small town in Texas, and about only four of our class came to UT. I roomed for three years with one of my best friends, and came into college in a relationships with my then girlfriend. We broke up mid-way through the first semester and it absolutely crushed me. I spent a lot of time isolating, lamenting and being dejected. I was a pretty bad person and so I felt like it was punishment for me to suffer and not enjoy college. I spent most of my time my first two years just studying. I did not make many friends, and the ones I did make I did not keep up with. I played in a sports club but I only made two good friends (still good friends with both). However, most of my time was miserable - I put on weight, struggled with becoming a better person, felt like I didn't deserve much and just wanted to suffer a lot. It was the only sensation I felt really strongly. I didn't have any friends to confide in and just didn't feel like it was worth it. Although this never hurt my studies - I really enjoyed my classes and felt like my professors were the best people in my life. Additionally, I spent much time reflecting and keeping up a journal (which I still do), and reading books. These two things kept me afloat, and actually made me a better person.  

But I realized that holding grudges against myself was wasting so much energy - I was tired of being so sad on purpose and living a miserable life. I started to eat right, work out in the mornings, took up a part time job on campus, and started saying ""yes"" to life more often. Life didn't change magically change or get amazing - but it did get better. I made a few more friends, got nice internships, expanded my network, stayed healthy, got back into my numerous hobbies, went out more and just...lived life. I never did anything I didn't want to, or felt pressured to do something. I made many great memories, and I am thankful for my pain because it gave me wisdom and through that I grew. I am proud of what my four years meant to me, even though it wasn't the most ideal. All my friends have been supportive in their own capacities, and I have grown close to many professors. Everything isn't fine and dandy, but it is better. 

And now it has all come to an end. I really don't know what will happen with commencement. I really don't think it will go through if I am being honest. I am upset my parents won't get to fulfill their own dream of seeing their son graduate and walk. Or that I won't get to take pictures with my professors and friends at graduation. I plan on writing a letter to every professor, TA, and friend that inspired me and meant something to me. This isn't the end of things though. I will also be back here for my dual Master's program, so I am very thankful I don't have to part ways with Austin and UT yet. This isn't the way I imagined it, but that is okay. I have achieved so much, and I have so much to achieve. 

Thank you for reading. I hope that those who read this also share their story - I would love to read it."
fuzf6a,It looks like UT squirrels are getting accustomed to online classes. 🐿️🤘,476,https://i.redd.it/xt7okw9bouq41.png,16,2020-04-04 19:11:55+00:00,squirrelsofut,
b72wu9,How to study for midterms at UT,479,https://v.redd.it/smyjmq7vk4p21,20,2019-03-29 21:24:44+00:00,Atomical1,
ptwdaf,Did a photoshoot with crossing guard Michael Shaw the other day 📸🤘,477,https://www.reddit.com/gallery/ptwdaf,14,2021-09-23 14:23:56+00:00,drewsz724,
kko3b2,The tower from Mount Bonnell this morning,477,https://i.redd.it/suue1nke0l761.jpg,13,2020-12-26 19:19:30+00:00,shanew21,
m9oifs,Pain,474,https://i.redd.it/0aqiam0d8bo61.jpg,6,2021-03-21 04:36:33+00:00,degogo_,
hnqyge,I think I’ll pass on this,470,https://i.redd.it/47evgfl5lp951.jpg,19,2020-07-08 22:22:22+00:00,abocado3,
g0op9n,Nothing but respect for my (university) president,472,https://i.redd.it/6adviqd9pms41.jpg,6,2020-04-13 18:30:12+00:00,longhorn089,
mo9tw0,the pandemic is over....the clone wars is now,477,https://www.reddit.com/gallery/mo9tw0,20,2021-04-10 18:09:23+00:00,the_mrfancypants,
fwdb27,I think we all know there’s only one individual who can step up and run this university...,470,https://i.redd.it/grdjw7jpgbr41.jpg,8,2020-04-07 03:38:07+00:00,DeerOnTheRocks,
gdvcnw,It really do be like that sometimes.,462,https://i.redd.it/jg7px5c2cxw41.jpg,9,2020-05-05 10:31:55+00:00,Lanzhou77,
g9ry4o,"The help I am getting from most of my professors during the pandemic (2020, colorized)",464,https://i.redd.it/qenf0v10klv41.jpg,11,2020-04-28 17:51:54+00:00,for-the_love-of_cake,
aqwsc3,RIP,465,https://i.redd.it/6rsmi9wxmqg21.jpg,9,2019-02-15 13:56:37+00:00,Rynneer,
g7xftp,All good boys go to UT,465,https://i.redd.it/4tu3oxha5yu41.jpg,6,2020-04-25 17:27:36+00:00,kkristina10,
in56zx,I thought I was going to UT. I'm actually attending University of Google.,463,https://i.redd.it/4bgr8vos6dl51.png,9,2020-09-05 17:32:08+00:00,reeroh,
hudonq,Oh dear,465,https://i.redd.it/dunftrcqgxb51.jpg,23,2020-07-20 03:00:06+00:00,TurboJelly25,
i5hn7z,Was told by UT Health to take an Uber to get COVID tested when I'm symptomatic!,465,https://www.reddit.com/r/UTAustin/comments/i5hn7z/was_told_by_ut_health_to_take_an_uber_to_get/,36,2020-08-07 17:06:46+00:00,heyyimbored,"Title says it all. I am UT staff and since I don't have a car, UT health won't test me unless I get an Uber. They only take drive-through.

When I said it was crazy to ask a symptomatic person to expose an Uber driver, I was told to ""wear a mask"".

I am completely shocked.

&#x200B;

Edit: I live a mile from the facility and can easily walk there.

&#x200B;

Edit 2: I left feedback on the UT Health website and within an hour, I received a call apologizing and saying that is NOT their policy, and they will let all people answering the phone know that they do NOT recommend ride sharing to the testing facility,"
m8z3ik,King Domino,454,https://i.redd.it/k112vmaxx3o61.jpg,1,2021-03-20 04:05:37+00:00,aaples5,
g1l5km,"Instead of studying for a chemistry test, I made this",458,https://v.redd.it/qo66aikgvws41,10,2020-04-15 04:42:40+00:00,sooshibear,
gcfqeh,Until next year...,444,https://i.redd.it/b4zm9t8ylfw41.jpg,6,2020-05-02 22:56:29+00:00,origamistofthenets,
fra6ph,Made a UT cap for all ur island chores,449,https://i.redd.it/svl1nxv3jnp41.jpg,14,2020-03-29 18:04:39+00:00,favoritelauren,
hwdz4r,3am Jendy’s > Any other time Jendy’s,448,https://i.redd.it/yo4982atdlc51.jpg,12,2020-07-23 11:26:29+00:00,TurboJelly25,
fhlh45,UT Prof here. We’re here for you.,446,https://www.reddit.com/r/UTAustin/comments/fhlh45/ut_prof_here_were_here_for_you/,50,2020-03-12 18:57:19+00:00,IReallyLoveAvocados,"Hey so I am a professor (in a humanities subject, I won’t say more here). I think it’s important that you know that your professors have your back. We know there’s a lot going on right now, and our top priority is your health and well being. So take it easy, stay healthy, and we’re here to work with you to make sure the semester goes as smoothly as possible."
ivmqdr,I was cleaning out my wallet when I starting crying a little,444,https://i.redd.it/d7dm1e9sk1o51.jpg,25,2020-09-19 05:39:54+00:00,young_d484,
bbsc0m,Talk fancy to me,440,https://i.redd.it/54a063p9jir21.jpg,9,2019-04-10 22:27:15+00:00,neilader,
rab99m,My Probably Last Invasions on Blackboards,445,https://www.reddit.com/gallery/rab99m,18,2021-12-06 16:30:22+00:00,YunJang,
ay13rl,Petition to make Matthew McConneghey the voice of the UT Emergency Alert test.,439,https://www.reddit.com/r/UTAustin/comments/ay13rl/petition_to_make_matthew_mcconneghey_the_voice_of/,19,2019-03-06 17:03:24+00:00,drpinkcream,"Seriously, just imagine that.  It'd be an upgrade."
ikowh1,She will find you,439,https://i.redd.it/erfkp5hsokk51.jpg,20,2020-09-01 17:39:19+00:00,coasterwizard15,
jrsrdm,How UT Handled the Pandemic,435,https://v.redd.it/bx3ipkiu1hy51,14,2020-11-10 20:23:22+00:00,MikuMillian,
k9wzy0,"Perfectly balanced, as all things should be",430,https://i.redd.it/xqpklhssb7461.jpg,13,2020-12-09 18:06:04+00:00,None,
huudiy,Helth,434,https://i.redd.it/d5h18pl703c51.jpg,10,2020-07-20 21:38:11+00:00,TurboJelly25,
r927mv,idk who the fuck chairman gonzalez is I’m just trying to go home,435,https://i.redd.it/yyc3eq2t2m381.jpg,57,2021-12-04 23:35:53+00:00,Reaniro,
jrvlw5,I think y'all need a little Domino to relieve that stress ;),430,https://www.reddit.com/gallery/jrvlw5,15,2020-11-10 22:51:22+00:00,Bunizs,
g19d9b,I want to go back...,421,https://i.redd.it/44esak2rets41.jpg,9,2020-04-14 17:03:35+00:00,utpics,
