post_id,title,score,url,num_comments,created_utc,author,selftext
pkpngm,creepy dude at the silent disco at Greg: Just a warning for other students (particularly girls in small groups at night),424,https://www.reddit.com/r/UTAustin/comments/pkpngm/creepy_dude_at_the_silent_disco_at_greg_just_a/,29,2021-09-09 03:22:05+00:00,nutmeg4096,"Okay y’all I never post but I honestly feel like I just need to say this in hopes of warning anyone/making people aware. 

But my friends and I went to the silent disco tonight at Greg. It was pretty low key, but enough people for it to feel safe and such at night. Plus there’s always some people out on speedway at night anyways. So my friend and I are chilling on the side and this guy comes over to sit with us. Initially he seems chill, kinda interesting, whatever. First red flag was that he didn’t even go to UT. He said he was giving his friend a tour of Austin and stopped by campus. Second red flag was that he was obviously significantly older than us and actually showed excitement (ew) when we said we were freshman/sophomores. Then, when we asked him what he does (since he’s apparently not in school), he literally says “you don’t want to know what I do.” Finally after a really awkward few minutes of him calling us “party girls” and “freshies” he asks if we want to go get smoothies?? We both don’t really answer and I think he FINALLY gets the vibe and says he’s gonna go find his friend (who he said was this dude dancing in front of us.) Well when he gets up he goes no where near his “friend” and actually just walks away to a nearby staircase where he sits down and stares at us. 

THEN a group of girls (who were the best people ever like thank you so much for checking on us) comes up to us and repeats everything he told us because he had tried the same lines/story on them JUST BEFORE US. Asking to get smoothies and everything. Lemme just say that gave me freaking chills. We waited for him to get up and leave before even considering walking back to our dorm. 

Anyways. This is tame compared to some situations, I get that. But I just had to say something because I’d never want to hear that some girl actually took him up on the smoothie offer and something happened. And no, there really wasn’t an option to “report” him or anything  as the whole thing was just students (even though I’m honestly thinking I should’ve done more). But just please be careful. I feel stupid that I even entertained a conversation with this man. The first half seemed fine but if he hadn’t been so outwardly creepy something really could’ve happened. Please stay safe y’all💖"
iymd3q,Gg,418,https://i.redd.it/payajooskzo51.jpg,9,2020-09-24 00:00:21+00:00,alabaminkid,
l6zj1s,West Campus sunrise hues from this morning,416,https://www.reddit.com/gallery/l6zj1s,3,2021-01-28 15:22:50+00:00,maruthgoyal,
ijzx5v,"Two UT-Austin dorm residents test positive for COVID-19. One in Jester, one in San Jacinto.",416,https://thedailytexan.com/2020/08/31/two-ut-austin-dorm-residents-test-positive-for-covid-19,39,2020-08-31 15:21:04+00:00,shiruken,
d39uaq,Yesterday I put an urban legend to the test,416,https://www.reddit.com/r/UTAustin/comments/d39uaq/yesterday_i_put_an_urban_legend_to_the_test/,22,2019-09-12 15:49:49+00:00,JewishDoggy,"I picked C for every answer on the Texas Government exam for credit (or rather, the third answer since there’s no lettered answers)

I passed. Truly, never study for this joke of an exam that is meant to give the university an extra $25."
gt47g0,I walked through campus to my office for the first time in months. It was nice to see speedway.,413,https://i.redd.it/esyd8xt6ms151.jpg,19,2020-05-30 00:00:30+00:00,iamevilbear,
fu8qfm,you could not live with your own failure,413,https://i.redd.it/jkimvl63ylq41.jpg,11,2020-04-03 13:49:12+00:00,420MemeIt_,
jxihmp,Y’all. I JUST GOT ADMITTED TO UT AUSTIN AS THE CLASS OF 2025 FOR NEXT FALL,418,https://www.reddit.com/r/UTAustin/comments/jxihmp/yall_i_just_got_admitted_to_ut_austin_as_the/,109,2020-11-20 04:26:57+00:00,celium04,"Brb currently crying. I was a non-auto with a 1310 sat outside of the top 10%. My school was crazy competitive. Grades and SAT ARE NOT EVERYTHING.

UPDATE: got into Plan 2 honors too!"
fcmdue,Anyone have empty juul pods? (read below),413,https://www.reddit.com/r/UTAustin/comments/fcmdue/anyone_have_empty_juul_pods_read_below/,19,2020-03-03 00:52:38+00:00,Minimum-Garden,"No, this is not to fuel my nicotine addiction (I kicked it about 2 months ago). For my progressive arts class at ACC I'm required to create an artwork that covers any recent issue/worldly event. So I'm making a sculpture out of juul pods in order to commemorate JUUL getting a whole generation of teens hooked on nicotine.

 I'm about 3/4 of the way done, and would appreciate anyone willing to donate their old juul pods to me. I can come pick them up on campus or west campus. The project is due this week so I am quite desperate. Thank you for listening to my odd request!"
hjh1e6,"Are ya winnin, son?",407,https://i.redd.it/60l4y70cqa851.jpg,20,2020-07-01 19:20:32+00:00,deadface008,
jt8afc,Welcome to your FIG at Zoom University!,415,https://i.redd.it/ajfklxv1zwy51.jpg,4,2020-11-13 01:56:05+00:00,deadface008,
hqklq9,I miss seeing the tower walking to class everyday.,413,https://i.redd.it/fq9ouha22oa51.jpg,8,2020-07-13 18:18:08+00:00,Leah1098,
bi2xnq,"To the HS Senior debating whether to go to Texas or Michigan, another datapoint: Top is UT’s Canoe Sculpture, Below is UM’s Canoe Sculpture (in a dog park nearby campus)",411,https://i.redd.it/6rzas3p74vu21.jpg,24,2019-04-27 19:58:26+00:00,Original88,
kk5pwy,Happy Holidays from Domino and Cats of West Campus!,404,https://i.redd.it/mzzsg2xqae761.jpg,7,2020-12-25 20:46:29+00:00,floodrefugeekitties,
iva043,Saw this little guy sprouting on the third floor escalator landing at the UTC.,403,https://i.redd.it/1tqlv24otxn51.jpg,26,2020-09-18 17:02:14+00:00,None,
iharyk,"Speedway, 1 o'clock, first day of classes",410,https://i.redd.it/gfboybfgtfj51.jpg,20,2020-08-27 00:16:24+00:00,12StringGeetar,
g4a1ea,Time was when...,402,https://i.redd.it/8f5xfji2sst41.jpg,5,2020-04-19 16:00:19+00:00,HPScots,
atzduw,"Life Sciences Library, my favorite spot on campus!",401,https://i.redd.it/jqpuj6rgidi21.jpg,25,2019-02-23 19:57:02+00:00,viviantr4n,
hi7ka0,UT responds to questions about off-campus contagion,395,https://i.redd.it/g25wb3mmow751.jpg,56,2020-06-29 20:06:02+00:00,larryofks,
9qs1mw,Who has it better?,403,https://i.redd.it/ygwc9xhdhzt11.jpg,24,2018-10-23 19:06:21+00:00,retr0_7274,
jh7omz,"College students in Goodall Wooten Dorm at the University of Texas at Austin (March 7, 1962) Photo by Dewey G. Mears",397,https://i.redd.it/cszjvd2t71v51.png,21,2020-10-24 11:55:55+00:00,AxlCobainVedder,
j7qs1l,Me lately,396,https://i.redd.it/mml7sg2abzr51.png,9,2020-10-09 02:19:21+00:00,for-the_love-of_cake,
py7bnt,"Took juice to campus today, I think he really liked it",396,https://i.redd.it/8ep78inp0jq71.jpg,34,2021-09-29 23:25:04+00:00,Roddaddie,
n2t0z8,Just one more week to go...,395,https://i.redd.it/677pqt3w3lw61.jpg,11,2021-05-01 22:22:23+00:00,12_Semitones,
f3b6ed,I was supposed to be doing homework...,397,https://i.redd.it/cbwkd3c1hpg41.jpg,6,2020-02-13 14:59:23+00:00,utpics,
iwjnft,"Bright blue skies, orange in our eyes 🤘🏾",392,https://i.redd.it/lkq3hlwpmco51.jpg,8,2020-09-20 18:49:59+00:00,msuv,
psxzlm,the day has come. it is the 21st night of september,394,https://v.redd.it/90gptdtotyo71,25,2021-09-22 02:29:18+00:00,toasterstove,
g09cp9,Last light on campus this evening,388,https://i.redd.it/kylaaaiaqhs41.jpg,9,2020-04-13 01:46:38+00:00,hoevaries,
e99xhm,I feel personally attacked,393,https://i.redd.it/0op80bc7f1441.jpg,9,2019-12-11 17:16:45+00:00,buddhabignipple,
n5tbmh,"So close, yet so far...",391,https://i.redd.it/3v9xbahzvdx61.jpg,8,2021-05-05 23:09:45+00:00,12_Semitones,
h7sdk0,"UT student athletes will not help recruit new players or go to donor events until certain campus buildings are renamed (RLM, Painter, Littlefield, Hogg), new students are educated about history of campus racism, and The Eyes of Texas is replaced with a new song",390,https://twitter.com/lindsayaellis/status/1271523034143260672,210,2020-06-12 20:23:38+00:00,shiruken,
dzkx0e,So this is a thing....,386,https://i.imgur.com/kzw6jUi.jpg,58,2019-11-21 15:32:12+00:00,Beotex,
ja2lfj,I've never hated college more in my life,382,https://www.reddit.com/r/UTAustin/comments/ja2lfj/ive_never_hated_college_more_in_my_life/,34,2020-10-13 00:01:49+00:00,RennocC213,"I've been developing what could be considered an outright hatred for college. To summarize my experience here at UT it's been nothing but one pile of bullshit after another. This started the moment I got into college but it's now being exacerbated by online classes. It's like the professors are just spraying a fully automatic UZI with extended mag at students except instead of bullets it's menial assignments. I have actually gotten dumber since I've come to college. Every day I look at the calendar and every day there are more and more assignments due at all hours of the day. All of this for what? A piece of paper so I can work a desk job until I die? I'm tired of ""education"" just being a bunch of nonsense. To accurately define how I feel on a daily basis I have chosen a meme that is most fitting: ""Thomas had never seen such bullshit before."" I know there are others that feel exactly the same way.

Anyways, that concludes my spill."
dqv20n,This little fella was interested in my camera this morning,387,https://i.redd.it/qfqz8bbd2ew31.jpg,22,2019-11-03 03:15:13+00:00,MrZmann,
hrqmoy,"Hot take: We should keep RLM, as it has tarnished Moore's name more than it has honored",384,https://www.reddit.com/r/UTAustin/comments/hrqmoy/hot_take_we_should_keep_rlm_as_it_has_tarnished/,51,2020-07-15 16:21:59+00:00,ThrowRA-raceparent,"You hate RLM. I hate RLM. We all hate RLM. The shitty bathrooms. The escalators. The ground floor being the fourth floor. The eyesore brutalist architecture. The air of depression and hopelessness. The peeling faux wood veneer that peers into our nihilistic souls.

By connecting Moore with such a shitty building, it tarnishes his name, not glorifies it. Simply muttering the words ""RLM"" incites such a negative emotion into any UT student that has had the misfortune of stepping into that God forsaken hellhole.

Not that I'm against renaming the RLM to PMA or anything. Just a thought that passed by in my mind."
qnpa4i,I whipped my phone out and King Domino started to pose,383,https://www.reddit.com/gallery/qnpa4i,5,2021-11-06 01:04:31+00:00,ak2024,
fi3smn,Email from Daddy Fenves: UT has its first confirmed case.,382,https://i.redd.it/lcwt9nmcbhm41.jpg,49,2020-03-13 17:58:04+00:00,PandaIsLove,
ji0f0f,Don’t worry. My professor was joking.,382,https://i.redd.it/liyu1xadvav51.jpg,2,2020-10-25 20:23:50+00:00,12_Semitones,
ijbj42,"Meet the Lucky Bunch! 🐿️🤘These 8 special squirrels are commonly mistaken as the legendary albino squirrel, and while not albino, (their fur is white due to leucism), they will certainly do their best to help you ace your exams! Meet: Sweetpea, Potato, Legolas, Gandalf, Ace, Elle, Bowie, & Walter!",380,https://www.reddit.com/gallery/ijbj42,13,2020-08-30 11:56:06+00:00,squirrelsofut,
hfg8wc,"was worrying about fall semester today, saw domino tonight. good omen.",381,https://i.redd.it/u9tn8aq4lz651.jpg,5,2020-06-25 04:47:54+00:00,hoovsarah,
i1xc85,*Traffic intensifies*,377,https://i.redd.it/epdrtlgtsfe51.jpg,1,2020-08-01 18:48:10+00:00,TurboJelly25,
9xgo35,A good luck picture before finals (A+ Guaranteed on your next test),379,https://i.redd.it/a9b9nsn50ly11.jpg,10,2018-11-15 23:45:36+00:00,Nternal37,
pjdmh7,Someone took a shit in front of the SAC,376,https://www.reddit.com/r/UTAustin/comments/pjdmh7/someone_took_a_shit_in_front_of_the_sac/,57,2021-09-07 02:04:16+00:00,None,"Just felt like I needed to say this. I was studying in front of the SAC and someone literally walks in front of a bush, pulls his pants down, and takes a literal shit. It was so fucking nasty and I am still shocked."
e7l23l,Prof McCanaughey and a Jonas brother on campus right now,383,https://i.redd.it/tfe1xu82ga341.jpg,10,2019-12-07 22:33:29+00:00,None,
boi9bq,Domino wishes you all good luck with finals!,379,https://i.redd.it/akr1h5wz66y21.jpg,18,2019-05-14 12:26:02+00:00,renegade500,
mzhg99,I don’t know if I can last another 2 weeks...,375,https://i.redd.it/ygz1gruvknv61.jpg,9,2021-04-27 05:37:04+00:00,12_Semitones,
g5gxme,Does anyone know about this absolute unit that lives in the turtle pond? How old is he? Where does he hide? What’s his name?,372,https://v.redd.it/2rlcr2xds6u41,33,2020-04-21 15:09:13+00:00,hannah22a,
i1nnwy,R O L L,378,https://i.redd.it/qs86gxgi4ce51.jpg,4,2020-08-01 06:26:36+00:00,TurboJelly25,
n9mmof,It is finals week. I wish everyone the best of luck on their exams! The semester is almost over! Then it’s summer time!,374,https://i.redd.it/j6k59vi1jey61.jpg,1,2021-05-11 02:23:07+00:00,TurboJelly25,
cna5b6,Big sad mehm,379,https://i.redd.it/1sr4kmqns2f31.jpg,5,2019-08-07 19:10:36+00:00,LordFlubbernaut,
fcy5a0,This is a fake Chick Fil A and that is not up for debate,380,https://i.redd.it/31jpumi8uhk41.jpg,20,2020-03-03 17:36:05+00:00,goodshotbiga,
mvlaki,I didn't know that people actually win this,369,https://i.redd.it/hnwj1f0heku61.jpg,14,2021-04-21 17:53:39+00:00,None,
g6iwr3,A little something to lift your spirits,375,https://i.redd.it/pek2l2hw1ju41.jpg,5,2020-04-23 08:22:01+00:00,photo_cr2,
ft2aav,Tuesday @Noon,370,https://i.redd.it/vggnrl7x98q41.jpg,13,2020-04-01 15:50:42+00:00,OrganBlackMarket,
bgacpm,utrejects.com,370,https://i.redd.it/b8rl4hhv3xt21.jpg,13,2019-04-23 01:37:46+00:00,bgmn17,
e8s4fn,The GDC Staircase,375,https://i.redd.it/ir5791dest341.jpg,14,2019-12-10 15:36:31+00:00,utpics,
ie22ud,"just used proctorio for the first time, this makes me really uncomfortable",365,https://i.redd.it/qlrym7hadei51.jpg,56,2020-08-21 18:15:53+00:00,sunburstbox,
q1ijol,did anyone lose a dog near NHB? he doesn't have a collar on,364,https://www.reddit.com/gallery/q1ijol,5,2021-10-04 23:49:17+00:00,toasterstove,
ilm1ya,UT COVID-19 Training Any% Speedrun in 1:58.33 (WR),368,https://streamable.com/e1hl4s,15,2020-09-03 03:40:07+00:00,CoogsOfCV3,
ezp6fn,Snow at the fountain,372,https://i.redd.it/hp3itclpg9f41.jpg,6,2020-02-06 08:04:57+00:00,ManishBH73,
i3xkg2,Does anyone know approximately how many of us will be on campus in the fall? Curious.,369,https://i.redd.it/p0n9yhysn3f51.jpg,27,2020-08-05 03:02:49+00:00,TurboJelly25,
kw6f3v,But they’re ALBINO...,366,https://i.redd.it/m4q55q0scza61.jpg,15,2021-01-13 02:02:05+00:00,kylieb209,
d2mhe5,You can cross as long as you Hook 'em,368,https://i.redd.it/p2bm9qe45xl31.jpg,7,2019-09-11 07:38:46+00:00,potatoasad,
pnoqyd,"Before every lecture, someone does these amazing superhero drawings. Thank you for brightening up the end of each day :)",365,https://www.reddit.com/gallery/pnoqyd,14,2021-09-13 21:22:28+00:00,nadia0004,
gey8dc,Registering for classes got me like,359,https://i.redd.it/nb8g8s6t89x41.jpg,12,2020-05-07 02:36:07+00:00,Lieutenant_Corgi,
g9a2cg,"Ah, yes, I'll have one mental breakdown with a side of fries. Thank you",365,https://i.redd.it/54qp8s6h1bv41.jpg,22,2020-04-27 21:38:39+00:00,deadface008,
eopkwn,Last night on campus,357,https://i.imgur.com/gR9bkiP.jpg,16,2020-01-14 18:55:34+00:00,FoamythePuppy,
jtsfuc,Please remove yourself from a waitlist if you don't actually plan on taking that class/don't need the class!,362,https://i.redd.it/ehhsewavr3z51.jpg,9,2020-11-14 00:48:18+00:00,rommbook,
hjr473,I miss campus,359,https://i.redd.it/w7msevcbrd851.jpg,8,2020-07-02 05:31:28+00:00,kylie1945,
e1k2zt,who knew there was a monument in Jester dedicated to the founding of the McCombs School of Business,361,https://i.redd.it/t1ipws79jv041.jpg,12,2019-11-25 18:16:22+00:00,bronbroncommiecon,
dffeld,"John B. Goodenough, UT ECE professor, wins Nobel Prize in Chemistry",364,https://reut.rs/310beI8,18,2019-10-09 11:01:14+00:00,ATXBeermaker,
gjwf00,About to finish my first year of grad school and UT sends me this...thanks I still have 3 more years left,360,https://i.redd.it/x60lf5432ty41.jpg,31,2020-05-14 22:17:13+00:00,mooeysteph,
ftq8q3,Still had to come to campus to take the Texas Government Exam...probabaly my last time on this campus for a while,364,https://i.redd.it/si2g35lqtfq41.jpg,23,2020-04-02 17:14:09+00:00,jellyfishii,
qxtsmp,A degree's a degree,356,https://i.redd.it/a6bqpvtjdn081.jpg,9,2021-11-20 00:45:38+00:00,None,
ilxpcw,Saw a squirrel eating a strawberry off a fork on my way to class,355,https://i.redd.it/ku6da3fj3xk51.jpg,6,2020-09-03 17:14:54+00:00,Splooorky,
f3xzrg,Happy Valentines Day! Here’s a pic of Domino peacefully enjoying the day. He deserves all the love in the world.,353,https://i.redd.it/6ynnhx2s5yg41.jpg,5,2020-02-14 20:12:34+00:00,Naga912,
9sdt3i,Texas is back,354,https://i.redd.it/z2u7rl5h25v11.jpg,6,2018-10-29 14:57:41+00:00,BobBeasta,
pr0k0v,Texas takes their anger out on Rice,355,https://www.reddit.com/gallery/pr0k0v,15,2021-09-19 03:36:11+00:00,None,
k2h3ko,After 5 years on campus I finally got a one on one interaction with Domino!,356,https://imgur.com/vvw5Y0p,18,2020-11-28 04:25:32+00:00,RenegadeBevo,
p748gy,Domino eating tuna after his bushes were cut down,352,https://i.redd.it/gnaa9ilno7i71.jpg,7,2021-08-19 00:45:36+00:00,floodrefugeekitties,
nfqf9d,saw domino for the first time today,352,https://i.redd.it/y7kklp9rxyz61.jpg,17,2021-05-19 00:05:24+00:00,Liberty72521,
hcee11,"It’s tough times, but Hook ‘Em, y’all.",348,https://i.redd.it/tfqdimgjbz551.jpg,3,2020-06-20 02:49:46+00:00,TheRealMe54321,
fbktax,UT from the sky!,350,https://imgur.com/DZXa3sJ,10,2020-02-29 23:08:30+00:00,AustinArmadillo,
hr8fqy,International students can stay in U.S. while taking only online classes,349,https://www.texastribune.org/2020/07/14/international-students-online-classes/,23,2020-07-14 19:45:12+00:00,None,
ffpchh,Fun fact: You can see the Dobie and part of the tower in the background of the final scene of spy kids 3,343,https://i.redd.it/xw86irc4tkl41.jpg,15,2020-03-09 04:38:53+00:00,Drakeadrong,
i4968h,All around me are familiar faces,352,https://i.redd.it/roicdcunt7f51.jpg,7,2020-08-05 17:02:47+00:00,TurboJelly25,
jxzupc,"ACCEPTED 🥳 (4.0 GPA, no SAT scores)",346,https://i.redd.it/hixx7w57ah061.jpg,86,2020-11-20 23:18:20+00:00,viviansalazar,
cewz3n,Saw this squirrel partying hard on campus today,346,https://i.redd.it/541fpyjy44b31.jpg,7,2019-07-18 19:24:48+00:00,annies__boobs,
q8erzb,"After a tough day of midterms, I was blessed to encounter the king",346,https://i.redd.it/mzru14fp0jt71.jpg,4,2021-10-15 02:37:26+00:00,None,
i61853,"UT wants US to donate to support needy students with housing, food, and healthcare. Is this a joke? They have the resources and infrastructure to provide all of these things already--easily, efficiently, and with no significant impact on their bottom line.",345,https://i.redd.it/z3yywsqotsf51.png,49,2020-08-08 15:44:30+00:00,ATXNYCESQ,
o0ngk8,"University of Texas Main Building, Austin, TX",344,https://i.redd.it/xu638wgplh571.jpg,17,2021-06-15 20:12:27+00:00,None,
lhbz4g,Guys I’m dead,347,https://i.redd.it/0gp22wx5rrg61.jpg,8,2021-02-11 03:37:24+00:00,None,
9ft8tk,Jester Wendy's is officially Jendy's,341,https://i.imgur.com/fYynsvE.jpg,21,2018-09-14 16:01:31+00:00,DumpCakes,
fsgsa0,"Group of Austin spring breakers test positive for coronavirus after trip, many are UT students",338,https://www.kvue.com/article/news/health/coronavirus/austin-health-officials-investigating-after-group-of-spring-breakers-return-test-positive-for-covid-19/269-0fc400da-9712-455d-b884-99e7b5c2fa34,41,2020-03-31 17:09:04+00:00,Tunaonwhite,
nbr1w3,Eid Mubarak to all my Longhorn brothers and sisters!! ☪️ 🕌 🕋,337,https://i.redd.it/3pcnijr5ayy61.jpg,1,2021-05-13 20:48:58+00:00,ALYMSTFY,
d15z6j,My Mammary glands!,336,https://i.redd.it/aslcsaww5al31.png,16,2019-09-08 03:34:06+00:00,RTBC5555,
b0qi7r,The turtles have discovered it's spring!,344,https://i.redd.it/17gmjnwsyxl21.jpg,16,2019-03-13 19:56:15+00:00,renegade500,
b00nnq,Being Not-Rich at UT: The Ultimate Guide to Surviving life @ UT,336,https://www.reddit.com/r/UTAustin/comments/b00nnq/being_notrich_at_ut_the_ultimate_guide_to/,17,2019-03-11 23:44:35+00:00,tailoredforservice,"Crowd Sourced Google Document with 50 pages of juicy info on financial and social independence.

[~~https://docs.google.com/document/d/1zH2jZCDEln1lNmSA4XUjaWqQkrLDLf-u8\_0r3wjyJVs/edit~~](https://docs.google.com/document/d/1zH2jZCDEln1lNmSA4XUjaWqQkrLDLf-u8_0r3wjyJVs/edit)

EDIT 
JAN26 2023
NEW LINK
[Being Not Rich at UT](https://docs.google.com/document/d/1G61g7nhmk4qAJHyVO7qM55AMAbjJPAOxeWo1opd1l4A/edit?usp=sharing)"
mmiamg,"Domino encounters 2 raccoons (1837, colorized)",338,https://i.redd.it/zapbfbs05vr61.jpg,5,2021-04-08 02:45:54+00:00,None,
axe2f4,Just wanted to say...,339,https://www.reddit.com/r/UTAustin/comments/axe2f4/just_wanted_to_say/,2,2019-03-04 23:34:07+00:00,None,"Hi guys!
I'm not a student at UT so please forgive me. :')
If you are a UT Austin junior/senior majoring in Mecahnical Engineeeing with a potential double major with something else and have a dad in the Houston area who does Lyft, just know that for my entire Lyft ride with him, he gushed about how hardworking you are and how proud he is of you and it was really sweet and made my day to see him so happy to talk about his son so I hope you just know.

It made me really miss my dad back home :')"
mxdddw,The elevator-button placements are bad.,331,https://i.redd.it/jzfd26hy32v61.jpg,5,2021-04-24 05:24:47+00:00,12_Semitones,
dat3bt,Rainy Speedway at 4 AM is new aesthetic,330,https://i.imgur.com/a9YGdzG.jpg,9,2019-09-29 09:39:48+00:00,Dinoswarleaf,
abpdp4,Bevo knows,331,https://i.imgur.com/saHClxc.gifv,8,2019-01-02 03:30:02+00:00,None,
k0vn5r,P/F Confirmed by Hartzell Fall 2020 and Spring 2021 Semesters,332,https://www.reddit.com/gallery/k0vn5r,56,2020-11-25 16:46:09+00:00,Daboisss,
hjqbj2,Instead of changing to online they made my class an 8am,334,https://i.redd.it/iamjzfm2gd851.jpg,8,2020-07-02 04:28:22+00:00,kylie1945,
9fclhs,I need an A...,331,https://i.redd.it/cfsx9lg20wl11.png,3,2018-09-12 22:52:40+00:00,GuyFromAll,
hdsnvs,Let international students at UT Austin defer their admission to a later semester,327,http://chng.it/GPQsc6FF,12,2020-06-22 13:48:39+00:00,damysus_,
aw6v8k,Sleepy Domino is sleepy.,327,https://i.redd.it/g01x087vbjj21.jpg,19,2019-03-01 16:34:31+00:00,renegade500,
rfll4o,When you completely overlook a trick question on a final,329,https://i.redd.it/smrtsguglc581.png,9,2021-12-13 17:52:15+00:00,Buckeyeback101,
li2sw3,Took this photo of speedway at 7:30. Empty. Pain....,330,https://i.redd.it/zm81n3zqwyg61.jpg,32,2021-02-12 03:41:11+00:00,TurboJelly25,
gnebrj,UT Math PhD student solves famous problem in knot theory,330,https://www.quantamagazine.org/graduate-student-solves-decades-old-conway-knot-problem-20200519/,11,2020-05-20 16:16:51+00:00,None,
ea8bqs,Good Luck with Finals!,328,https://i.redd.it/q4633mq79g441.jpg,5,2019-12-13 19:09:55+00:00,utpics,
ghbxw5,"Domino from afar. I'm sure he misses everyone, but he's still being taken care of.",333,https://i.redd.it/fzoplmzet0y41.jpg,14,2020-05-10 23:18:41+00:00,renegade500,
g3p9jc,Another old campus map (not sure of the date),329,https://i.redd.it/unpxht4rglt41.jpg,26,2020-04-18 15:26:01+00:00,bitnotno,
juypg1,Thought the Moody Bridge and sky looked really pretty this evening.,325,https://i.redd.it/524vwqoriiz51.jpg,7,2020-11-16 02:24:01+00:00,mark_the_manatee,
gxiu99,I'm tired of these motherfuckin' bangs in this motherfuckin' place,327,https://i.redd.it/9ox7hrm7e7351.png,17,2020-06-06 02:46:35+00:00,RubyRed_Cherry,
l5ugv9,"Domino was injured, but he is all healed now!",324,https://i.redd.it/mybxu1s3gsd61.jpg,9,2021-01-27 02:45:47+00:00,floodrefugeekitties,
fhzg37,This is getting out of hand...,327,https://i.redd.it/2maa939gwfm41.png,15,2020-03-13 13:13:23+00:00,Slunchi,
bt58py,Just proud of graduating and wanted to share the best picture I got for the day.,322,https://i.redd.it/4bb4tutiei031.jpg,10,2019-05-26 07:38:05+00:00,ebyoung747,
l7u754,"For the love of Jay Pretzel, is there anything, I mean ANYTHING we can do to ban Proctorio?",324,https://www.reddit.com/r/UTAustin/comments/l7u754/for_the_love_of_jay_pretzel_is_there_anything_i/,44,2021-01-29 14:44:40+00:00,deadface008,"Some schools have already begun banning this extremely invasive software and I'd like for UT to be the next. What would I need to do?

https://www.theverge.com/2021/1/28/22254631/university-of-illinois-urbana-champaign-proctorio-online-test-proctoring-privacy"
dwhwfx,My first time meeting Domino! Domino posed for me and then proceeded to let me pet him :)),325,https://i.redd.it/nxquakm9lqy31.jpg,9,2019-11-14 23:30:29+00:00,zahid_hossain01,
dfpx08,wow proud of him and UT; for jointly developing Lithium Ion Battery,326,https://i.redd.it/bng0luq8wlr31.jpg,10,2019-10-10 00:14:09+00:00,datarainfall,
