post_id,score,url,num_comments,created_utc,author,ColumnID,Text,Segment,WC,Analytic,Clout,Authentic,Tone,WPS,BigWords,Dic,Linguistic,function,pronoun,ppron,i,we,you,shehe,they,ipron,det,article,number,prep,auxverb,adverb,conj,negate,verb,adj,quantity,Drives,affiliation,achieve,power,Cognition,allnone,cogproc,insight,cause,discrep,tentat,certitude,differ,memory,Affect,tone_pos,tone_neg,emotion,emo_pos,emo_neg,emo_anx,emo_anger,emo_sad,swear,Social,socbehav,prosocial,polite,conflict,moral,comm,socrefs,family,friend,female,male,Culture,politic,ethnicity,tech,Lifestyle,leisure,home,work,money,relig,Physical,health,illness,wellness,mental,substances,sexual,food,death,need,want,acquire,lack,fulfill,fatigue,reward,risk,curiosity,allure,Perception,attention,motion,space,visual,auditory,feeling,time,focuspast,focuspresent,focusfuture,Conversation,netspeak,assent,nonflu,filler,AllPunc,Period,Comma,QMark,Exclam,Apostro,OtherP,Emoji
1hpwf08,6,https://www.reddit.com/r/WilliamsCollege/comments/1hpwf08/writing_sample/,6,2024-12-30 20:19:16+00:00,No-Sherbert9701,combinedText,"Writing Sample I plan on submitting a writing sample but I'm stuck in choosing a paper. I took a creative writing class at my school and I wrote two papers for that class that I feel proud of. One is more analytical (a poetry review) and the other is more creative (a one-act play). I feel stuck on which one to submit, both fit the page criteria. If anyone who got admitted to ED could give me some advice or like to view them both that would be great. Note: rn I feel more strongly about the analytical piece since I want to minor in Gender and Sexuality studies(major in biology/biochemistry) and my paper explores more of that. However, I feel like the one-act play shows more of my personality.",1,133,71.62,1.97,91.16,78.21,19,14.29,87.97,75.94,56.39,15.79,11.28,9.77,0,0,0,0.75,4.51,21.8,6.77,2.26,13.53,4.51,2.26,6.77,0,16.54,9.77,10.53,3.76,0,3.01,0.75,18.05,1.5,16.54,8.27,0.75,2.26,2.26,0,4.51,0,3.76,3.76,0,0.75,0.75,0,0,0,0,0,7.52,5.26,0.75,0,0,0,3.76,2.26,0,0,0,0,0,0,0,0,6.02,2.26,0,3.76,0,0,0,0,0,0,0,0,0,0,0,0,0.75,1.5,0,0,0,0,0,2.26,6.77,8.27,0,0.75,3.76,0.75,0,3.01,0.75,3.01,6.77,0.75,0.75,0.75,0,0,0,15.04,5.26,1.5,0,0,0.75,7.52,0
1hovzlr,3,https://www.reddit.com/r/WilliamsCollege/comments/1hovzlr/optional_writing_sample/,2,2024-12-29 13:27:08+00:00,Ms_Brightside777,combinedText,"Optional Writing Sample I want to submit the writing sample, but I’m not sure what an “academic paper” specifically means. I have two options. One is a very well-written creative writing piece from my English class, but it is not a formal essay. And the other is a short essay from my history class, but I think it is not written very well, at least I don’t like it. The guidelines mention that the writing sample can be creative, I’m not sure if the creative writing piece would be appropriate to submit. So which one should I submit?",1,98,16.15,1,66.12,34.6,16.33,19.39,93.88,87.76,61.22,15.31,9.18,9.18,0,0,0,0,6.12,17.35,9.18,3.06,6.12,13.27,5.1,6.12,5.1,25.51,9.18,10.2,3.06,0,3.06,0,20.41,0,20.41,2.04,0,4.08,7.14,0,12.24,0,1.02,1.02,0,0,0,0,0,0,0,0,8.16,8.16,0,0,0,0,7.14,0,0,0,0,0,0,0,0,0,3.06,0,0,3.06,0,0,0,0,0,0,0,0,0,0,0,0,1.02,0,0,0,0,0,0,3.06,2.04,0,0,0,0,0,0,0,1.02,2.04,9.18,0,0,0,0,0,0,17.35,5.1,5.1,1.02,0,3.06,3.06,0
1horprn,7,https://www.reddit.com/r/WilliamsCollege/comments/1horprn/class_size_increase_for_co_29/,1,2024-12-29 08:24:41+00:00,Over-Teacher-6330,combinedText,"class size increase for co 29? Hi! I think I read somewhere that Williams is planning to expand its class size this year (along with all the housing changes, which I guess are to accommodate a possible increase?). Do you know if there’s an estimate for how much bigger the class might be, if it’s happening at all? Just curious because the admitted ED email mentioned approximately 550 students, so… Thank you!",1,72,41.36,32.26,84.06,64,12,23.61,95.83,70.83,52.78,13.89,6.94,4.17,0,2.78,0,0,6.94,15.28,6.94,2.78,9.72,9.72,6.94,5.56,0,16.67,4.17,13.89,1.39,0,1.39,0,26.39,2.78,23.61,9.72,4.17,0,11.11,0,4.17,0,2.78,2.78,0,0,0,0,0,0,0,0,12.5,8.33,2.78,2.78,0,0,5.56,4.17,0,0,0,0,1.39,0,0,1.39,6.94,0,1.39,5.56,0,0,0,0,0,0,0,0,0,0,0,0,0,0,0,0,0,0,0,1.39,2.78,4.17,0,0,4.17,0,0,0,1.39,0,5.56,2.78,0,0,0,0,0,22.22,5.56,4.17,4.17,2.78,2.78,2.78,0
1hobza4,3,https://www.reddit.com/r/WilliamsCollege/comments/1hobza4/debate_opening_speech_for_williams_paper/,1,2024-12-28 18:34:49+00:00,Revolutionary_Cap170,combinedText,"Debate Opening Speech for Williams Paper supplemental I don't have many good English or History papers that I have written that I am truly proud of, but I have put in a lot of time and effort into creating opening debate speeches, speeches that I have spoken at Nationals. Would they be acceptable as it isn't ""academic writing"" in the sense of it wasn't for a class? 

Edit: They are also very short so I was wondering if I could combine the PRO and CON arguments into one document so I can submit them both as they are about the same topic.",1,102,11.57,1.57,73.43,33.97,34,17.65,89.22,73.53,62.75,16.67,11.76,7.84,0,0,0,3.92,4.9,11.76,4.9,0.98,12.75,14.71,5.88,9.8,2.94,20.59,5.88,6.86,2.94,0,2.94,0,13.73,0,13.73,2.94,0,2.94,2.94,0.98,5.88,0,2.94,1.96,0.98,2.94,1.96,0.98,0,0.98,0,0,12.75,8.82,0,0,0.98,0,8.82,3.92,0,0,0,0,0,0,0,0,3.92,0,0,3.92,0,0,0,0,0,0,0,0,0,0,0,0,0,0,1.96,0,0,0,0,1.96,4.9,7.84,0,0.98,5.88,0,0,0.98,0.98,3.92,6.86,0,0,0,0,0,0,10.78,1.96,1.96,0.98,0,2.94,2.94,0
1hkjv8d,4,https://www.reddit.com/r/WilliamsCollege/comments/1hkjv8d/optional_essay_question/,5,2024-12-23 09:00:44+00:00,Fuzzy_duckling555,combinedText,"Optional Essay question!  Hey! I think I've wrote a pretty good essay (20/20 predicted IB HL English essay), however its over the  page number, and was wondering how much the school would care if I exceed 5 pages. 

The essay is double spaced and is approximately 1500 words, so I think would fit the 5 pages in different formatting? Is it best to submit this essay or submit another one (not as good-IB HL Glo Pol IA) that fits the page requirements?

  
Thanks :)",1,85,36.31,1,63.35,88.2,14.17,12.94,76.47,60,42.35,10.59,4.71,4.71,0,0,0,0,5.88,14.12,7.06,7.06,4.71,8.24,4.71,8.24,1.18,17.65,5.88,5.88,1.18,0,1.18,0,20,0,20,5.88,1.18,2.35,8.24,0,8.24,0,4.71,4.71,0,2.35,2.35,0,0,0,0,0,7.06,7.06,2.35,1.18,0,0,5.88,0,0,0,0,0,0,0,0,0,1.18,0,0,1.18,0,0,0,0,0,0,0,0,0,0,0,1.18,0,0,0,1.18,0,0,0,1.18,4.71,3.53,0,0,3.53,0,0,0,0,3.53,3.53,1.18,2.35,2.35,0,0,0,20,1.18,3.53,2.35,2.35,1.18,9.41,0
1hkgzk0,2,https://www.reddit.com/r/WilliamsCollege/comments/1hkgzk0/question_about_optional_essay/,1,2024-12-23 05:29:09+00:00,chocolatecherrymint,combinedText,"Question about optional essay Hi there! I'm a hs senior currently applying to Williams :) The optional essay prompt says I can include 3-5 pages of ""academic"" writing. My strength is in creative writing, but my school doesn't really offer creative writing courses/opportunities so most of my creative writing is written outside of school. Does ""academic"" writing mean I have to include something that I did for school? Thank you so much for your help!",1,76,36.67,5.07,70.28,99,15.2,31.58,89.47,69.74,48.68,14.47,11.84,9.21,0,2.63,0,0,2.63,11.84,2.63,1.32,13.16,9.21,7.89,3.95,1.32,23.68,10.53,2.63,7.89,1.32,5.26,1.32,11.84,0,11.84,2.63,0,1.32,7.89,2.63,5.26,0,7.89,7.89,0,1.32,1.32,0,0,0,0,0,19.74,15.79,2.63,2.63,0,0,13.16,3.95,0,0,0,0,0,0,0,0,6.58,0,0,6.58,0,0,0,0,0,0,0,0,0,0,0,2.63,0,0,0,0,0,1.32,0,3.95,1.32,3.95,0,0,3.95,0,0,0,1.32,2.63,9.21,2.63,1.32,1.32,0,0,0,21.05,2.63,1.32,1.32,2.63,2.63,10.53,0
1hk4yl4,8,https://www.reddit.com/r/WilliamsCollege/comments/1hk4yl4/how_test_optional_friendly_is_williams/,9,2024-12-22 18:53:39+00:00,Bagjan_Yeskhat,combinedText,How test optional friendly is Williams?? What you think how bad it would affect the acceptance. Especially for international students?,1,20,15.41,89.5,63.35,90.5,6.67,35,95,75,50,15,5,0,0,5,0,0,10,5,5,0,5,10,15,0,0,20,15,0,5,5,0,0,35,0,35,15,15,5,5,0,5,0,15,10,5,10,5,5,0,0,0,0,15,5,5,0,0,0,0,10,0,0,0,0,0,0,0,0,10,0,0,10,0,0,0,0,0,0,0,0,0,0,0,0,0,5,0,0,0,0,0,0,0,5,0,0,5,0,0,0,0,0,5,0,0,0,0,0,0,20,5,0,15,0,0,0,0
1hk1tio,5,https://www.reddit.com/r/WilliamsCollege/comments/1hk1tio/optional_essay_application_inquiry/,2,2024-12-22 16:24:20+00:00,LewName,combinedText,"Optional Essay Application Inquiry Ok so I'm a senior applying to colleges blah blah blah but I was really wondering how much benefit submitting an essay for the optional academic essay would bring. I feel like I'm kind of a weaker candidate, GPA and SAT are pretty good but im kind of lacking in EC's. I have some writing that I am proud of from school so would it be a good idea to submit one of those to boost my chances?",1,82,44.79,1.87,68.21,20.23,27.33,17.07,92.68,69.51,54.88,13.41,9.76,9.76,0,0,0,0,3.66,13.41,6.1,1.22,13.41,12.2,6.1,6.1,0,21.95,6.1,3.66,3.66,0,2.44,1.22,23.17,0,23.17,6.1,1.22,3.66,10.98,1.22,4.88,0,9.76,4.88,4.88,7.32,3.66,3.66,0,0,0,0,6.1,3.66,0,0,0,0,2.44,2.44,0,0,0,0,1.22,1.22,0,0,6.1,0,0,6.1,0,0,1.22,1.22,0,0,0,0,0,0,0,0,0,0,1.22,0,3.66,1.22,0,1.22,9.76,4.88,0,1.22,2.44,0,0,1.22,0,2.44,7.32,0,1.22,0,1.22,0,0,8.54,2.44,1.22,1.22,0,3.66,0,0
1hja4pu,4,https://www.reddit.com/r/WilliamsCollege/comments/1hja4pu/do_i_stand_a_chance/,5,2024-12-21 13:45:41+00:00,Infamous_Case2351,combinedText,Do I stand a chance ?? I am a south eastern asian. Do I stand a chance in williams by keeping supplemental essay and sat optional ??,1,25,74.19,1,99,81.12,8.33,20,88,60,48,12,12,12,0,0,0,0,0,12,12,0,8,12,0,4,0,20,4,0,0,0,0,0,12,0,12,0,0,0,12,0,4,0,4,4,0,0,0,0,0,0,0,0,0,0,0,0,0,0,0,0,0,0,0,0,4,0,4,0,0,0,0,0,0,0,0,0,0,0,0,0,0,0,0,0,0,0,0,0,0,0,0,0,0,24,0,0,24,0,0,0,0,4,4,0,0,0,0,0,0,20,4,0,16,0,0,0,0
1hixk7g,4,https://www.reddit.com/r/WilliamsCollege/comments/1hixk7g/should_i_submit_sat_1470_english_680_math_790/,9,2024-12-21 00:09:25+00:00,Ok_Clerk5757,combinedText,"Should I submit SAT 1470( English 680, Math 790 )after got deferred in ED1. I'm thinking to write LOCI

International students needing aid

Test optional ( ED1 )

4.0 gpa(unweighted)

From local city in Eastern Asian country",1,36,89.52,13.82,98.75,,18,27.78,88.89,47.22,22.22,5.56,5.56,5.56,0,0,0,0,0,0,0,16.67,13.89,5.56,0,2.78,0,22.22,8.33,0,2.78,0,2.78,0,11.11,0,11.11,2.78,0,5.56,2.78,0,2.78,0,0,0,0,0,0,0,0,0,0,0,13.89,5.56,2.78,0,0,0,2.78,2.78,0,0,0,0,2.78,0,2.78,0,11.11,0,0,11.11,0,0,0,0,0,0,0,0,0,0,0,2.78,0,2.78,0,0,0,0,0,2.78,2.78,22.22,0,0,22.22,0,0,0,2.78,2.78,2.78,0,0,0,0,0,0,27.78,5.56,2.78,0,0,2.78,16.67,0
1higilp,7,https://www.reddit.com/r/WilliamsCollege/comments/1higilp/should_i_apply_to_williams/,7,2024-12-20 09:54:20+00:00,Putrid-Doughnut5975,combinedText,"Should I apply to Williams?  Im an international student. Just came across the idea of a liberal arts education and I feel like the idea is good. 

Previously Ive always wanted a specialist education. Every course, or at least 95% of it has to be directly related to my major. This seems to be what Oxford offers. 

Compared to the Oxford course for the same major, how much less content is covered in the Williams course? Is Oxford more rigorous than Williams coursework? 

If I want to double major, is Williams a good place?",1,94,86.31,3.21,77.82,53.17,10.44,19.15,84.04,67.02,54.26,9.57,6.38,6.38,0,0,0,0,3.19,17.02,9.57,1.06,15.96,10.64,3.19,4.26,0,17.02,11.7,5.32,0,0,0,0,20.21,2.13,18.09,6.38,1.06,3.19,3.19,3.19,5.32,0,2.13,2.13,0,2.13,2.13,0,0,0,0,0,2.13,1.06,0,0,0,0,0,1.06,0,0,0,0,1.06,1.06,0,0,6.38,1.06,0,5.32,0,0,0,0,0,0,0,0,0,0,0,0,2.13,0,0,0,0,0,0,0,5.32,6.38,0,1.06,4.26,0,0,1.06,2.13,4.26,7.45,3.19,0,0,0,0,0,13.83,5.32,3.19,4.26,0,0,1.06,0
1hiagef,1,https://www.reddit.com/r/WilliamsCollege/comments/1hiagef/supplemental_essay_length/,2,2024-12-20 03:08:47+00:00,Enigma371,combinedText,"Supplemental Essay Length I want to submit a paper explaining the caveats of consumerism. However, the length is 6 pages not including references or MLA header. Even though the length is 3-5, I feel this paper is really good. Should I still submit?",1,43,30.58,1,82.44,56.53,10.75,16.28,81.4,69.77,51.16,9.3,6.98,6.98,0,0,0,0,2.33,11.63,9.3,4.65,6.98,9.3,11.63,6.98,2.33,20.93,0,6.98,0,0,0,0,20.93,0,20.93,4.65,0,4.65,2.33,2.33,9.3,0,2.33,2.33,0,2.33,2.33,0,0,0,0,0,4.65,4.65,0,0,0,0,0,0,0,0,0,0,0,0,0,0,4.65,0,0,2.33,2.33,0,0,0,0,0,0,0,0,0,0,0,2.33,0,0,0,0,0,0,0,6.98,9.3,0,0,6.98,0,0,2.33,0,0,9.3,0,0,0,0,0,0,16.28,6.98,4.65,2.33,0,0,2.33,0
1head02,10,https://www.reddit.com/r/WilliamsCollege/comments/1head02/acceptance_care_package/,3,2024-12-14 19:27:08+00:00,ItsRandxm,combinedText,"Acceptance Care Package Curious to see if anyone else got one, and if they are the same or sort of randomised. I got a tote bag, stickers, socks, and 3 pins.",1,31,41.62,1.48,79.1,97.31,15.5,16.13,77.42,64.52,48.39,9.68,6.45,3.23,0,0,0,3.23,3.23,9.68,6.45,6.45,6.45,3.23,3.23,16.13,0,16.13,6.45,3.23,0,0,0,0,29.03,0,29.03,3.23,0,0,19.35,0,16.13,0,6.45,6.45,0,0,0,0,0,0,0,0,9.68,3.23,3.23,0,0,0,0,6.45,0,0,0,0,0,0,0,0,0,0,0,0,0,0,0,0,0,0,0,0,0,0,0,0,0,9.68,0,0,0,0,0,3.23,3.23,3.23,0,0,0,3.23,0,0,0,0,3.23,0,0,0,0,0,0,19.35,6.45,12.9,0,0,0,0,0
1hdv5m3,7,https://www.reddit.com/r/WilliamsCollege/comments/1hdv5m3/deferred_ed_class_of_2029/,5,2024-12-14 04:38:49+00:00,Old-Confection1476,combinedText,"Deferred ED class of 2029 Hey everyone! I applied ED and got deferred, after looking at the numbers the acceptance rate for the RD round as a deferred ED applicant seems stunningly low and I wanted to ask if any current Williams students who may have been in a similar position while applying have any advice for steps to take moving forward:)",1,63,89.52,31.19,77.17,70.15,31.5,26.98,82.54,68.25,44.44,6.35,4.76,3.17,0,0,0,0,1.59,11.11,7.94,1.59,14.29,6.35,0,9.52,0,17.46,6.35,4.76,0,0,0,0,12.7,1.59,11.11,1.59,0,1.59,7.94,0,3.17,0,3.17,3.17,0,1.59,1.59,0,0,0,0,0,9.52,4.76,1.59,0,0,0,4.76,4.76,0,0,0,0,0,0,0,0,4.76,0,0,4.76,0,0,0,0,0,0,0,0,0,0,0,0,1.59,4.76,0,0,0,0,0,0,7.94,12.7,0,3.17,7.94,1.59,0,0,4.76,3.17,3.17,1.59,3.17,3.17,0,0,0,6.35,0,1.59,0,1.59,0,3.17,0
1hdp0d2,35,https://www.reddit.com/r/WilliamsCollege/comments/1hdp0d2/decisions_are_out/,24,2024-12-13 23:10:25+00:00,Unhappy_Farmer_3781,combinedText,"Decisions are out!!! Share with us the news. If accepted then CONGRATULATIONS !!!!!!, if not don't lose hope you still have a chance to apply for another one, and maybe a better one.

I personally got a deferral ;)",1,38,44.4,7.5,52.19,99,9.5,15.79,92.11,76.32,63.16,10.53,7.89,2.63,2.63,2.63,0,0,2.63,18.42,10.53,5.26,10.53,7.89,5.26,10.53,5.26,15.79,2.63,7.89,10.53,5.26,5.26,0,21.05,0,21.05,2.63,0,2.63,13.16,0,10.53,0,15.79,13.16,2.63,7.89,7.89,0,0,0,0,0,13.16,7.89,2.63,2.63,0,0,2.63,5.26,0,0,0,0,0,0,0,0,0,0,0,0,0,0,0,0,0,0,0,0,0,0,0,0,2.63,5.26,0,0,0,0,2.63,0,10.53,2.63,0,0,2.63,0,0,0,2.63,0,5.26,2.63,2.63,2.63,0,0,0,42.11,5.26,5.26,0,23.68,2.63,5.26,0
1hdnmoj,19,https://www.reddit.com/r/WilliamsCollege/comments/1hdnmoj/one_hour_or_less_to_go/,11,2024-12-13 22:05:31+00:00,ApartmentObjective75,combinedText,One hour (or less) to go 🤞 Good luck to everyone!!!!,1,10,89.52,40.06,98.38,99,10,10,100,70,60,10,0,0,0,0,0,0,10,20,0,10,20,0,0,10,0,10,10,20,0,0,0,0,20,10,10,0,0,0,10,0,10,0,20,20,0,10,10,0,0,0,0,0,10,0,0,0,0,0,0,10,0,0,0,0,0,0,0,0,0,0,0,0,0,0,0,0,0,0,0,0,0,0,0,0,0,0,0,0,0,0,10,0,30,10,0,10,10,0,0,0,0,0,0,0,0,0,0,0,0,60,0,0,0,40,0,20,10
1hd2dz4,7,https://www.reddit.com/r/WilliamsCollege/comments/1hd2dz4/rec_letters/,2,2024-12-13 02:40:36+00:00,Glittering_Apple_45,combinedText,Rec letters Should I submit a peer rec letter? My friend wrote me a very nice letter for Dartmouth but I saw that Williams also accepts peer rec letters and I have room for it. Has anyone else submitted peer rec letters?,1,42,13.76,9.23,39.59,88.66,14,16.67,73.81,59.52,47.62,19.05,11.9,11.9,0,0,0,0,7.14,9.52,4.76,0,4.76,7.14,7.14,7.14,0,16.67,4.76,0,0,0,0,0,9.52,0,9.52,0,0,2.38,2.38,0,4.76,0,4.76,4.76,0,0,0,0,0,0,0,0,11.9,2.38,0,0,0,0,2.38,9.52,0,0,0,0,0,0,0,0,2.38,0,2.38,0,0,0,0,0,0,0,0,0,0,0,0,0,0,2.38,0,0,0,0,0,0,4.76,4.76,0,0,2.38,2.38,0,0,0,4.76,2.38,0,0,0,0,0,0,7.14,2.38,0,4.76,0,0,0,0
1hbbgtk,10,https://www.reddit.com/r/WilliamsCollege/comments/1hbbgtk/ed_date/,21,2024-12-10 20:31:24+00:00,Adventurous-Wait2351,combinedText,"ED Date Hey y'all

The A2C calendar lists Williams as confirmed for the 13th. Has anyone here gotten that confirmed? Just curious as to who/what confirmed it. 

Good luck to everyone!!",1,32,52.84,98.18,15.38,96.74,8,21.88,81.25,59.38,53.13,21.88,6.25,0,0,3.13,0,0,15.63,9.38,6.25,6.25,15.63,3.13,6.25,6.25,0,6.25,0,0,0,0,0,0,9.38,3.13,6.25,3.13,0,0,3.13,0,0,0,6.25,6.25,0,3.13,3.13,0,0,0,0,0,15.63,3.13,0,0,0,0,3.13,12.5,0,0,0,0,0,0,0,0,3.13,0,0,3.13,0,0,0,0,0,0,0,0,0,0,0,0,0,3.13,0,0,0,0,3.13,3.13,9.38,3.13,0,0,3.13,0,0,0,6.25,3.13,3.13,0,3.13,3.13,0,0,0,21.88,6.25,0,3.13,6.25,3.13,3.13,0
1hb5n3s,21,https://www.reddit.com/r/WilliamsCollege/comments/1hb5n3s/current_williamstown_business_owner_what_do/,16,2024-12-10 16:26:55+00:00,Even_Revolution_2846,combinedText,"Current Williamstown business owner , what do williams students want that they don’t have ?!",1,13,1,98.04,1,,13,38.46,84.62,61.54,46.15,23.08,7.69,0,0,0,0,7.69,15.38,7.69,0,0,0,23.08,0,0,7.69,30.77,7.69,0,7.69,0,0,7.69,7.69,0,7.69,0,0,7.69,0,0,0,0,0,0,0,0,0,0,0,0,0,0,23.08,0,0,0,0,0,0,23.08,0,0,0,0,0,0,0,0,15.38,0,0,15.38,7.69,0,0,0,0,0,0,0,0,0,0,0,7.69,0,15.38,0,0,0,0,0,0,0,0,0,0,0,0,0,7.69,0,23.08,0,0,0,0,0,0,30.77,0,7.69,7.69,7.69,7.69,0,0
1h8nvz6,3,https://www.reddit.com/r/WilliamsCollege/comments/1h8nvz6/fy_application_optional_writing_supplement/,5,2024-12-07 08:07:41+00:00,Mathinion,combinedText,"FY Application Optional Writing Supplement - Academic Writing Sample  Hi! I am a hs senior and want to apply to Williams College in my RD round. For 2024-25 college app Williams does not require a writing supplement but I can submit an academic writing example. Since I am applying to math major, should I submit a short work on math? I have the following options which I currently considered:

* exposition (on proving Quadratic Reciprocity)
* paper (by shortening my IB math EE to only 5 pages, it's about a new way to recognize notes in music chords from Fourier Transform)
* problem solution (probably a solution I wrote for SUMaC 2024 application which I am quite satisfied with)

which one do you think I should submit? Thanks!",1,124,69.92,1.48,74.65,70.91,20.67,28.23,83.06,62.9,45.97,12.9,9.68,8.87,0,0.81,0,0,3.23,8.87,5.65,4.03,12.9,8.06,4.03,2.42,0.81,19.35,5.65,3.23,2.42,0,2.42,0,16.94,0,16.94,4.84,0.81,3.23,3.23,0.81,5.65,0,3.23,3.23,0,0,0,0,0,0,0,0,8.06,6.45,1.61,1.61,0,0,5.65,1.61,0,0,0,0,0.81,0,0,0.81,8.87,0.81,0,8.06,0,0,0,0,0,0,0,0,0,0,0,0.81,0.81,0,0,0.81,0,0,0,0,1.61,4.03,0,0,3.23,0,0.81,0,2.42,1.61,5.65,0,0,0,0,0,0,16.94,1.61,1.61,1.61,1.61,0.81,9.68,0
1h7tfay,9,https://www.reddit.com/r/WilliamsCollege/comments/1h7tfay/trans_healthcare_availability/,13,2024-12-06 04:44:54+00:00,ItsRandxm,combinedText,"Trans Healthcare Availability I was just accepted into through QuestBridge with a full scholarship that also includes health insurance. Because I am super low income, I want to take advantage of this, but I have two concerns.

1. As a school as small as Williams, is it even available? If it is, how costly is it? I know that it says health *insurance* is covered under my scholarship, but I'm not sure how extensive that would actually be.
2. I also read on the website somewhere that the student care centre (or whatever it's called idk) is closed during the summer. I would assume that this means that care is both on campus and that it is not available during the summer, so would that effectively mean that care is not provided during the summer or that it is simply used for outside services instead of simply the on-site location.

If anyone on this sub knows or knows a resource where I can found out in more detail how this works kind of in advance I would appreciate it. For reference, I am currently not recieving any sort of HRT or anything related to my transition (not for lack of wanting, I live in Florida), so I will be starting as soon as I leave home and arrive on campus.",1,220,13.83,1,97.64,70.26,20,18.64,94.09,78.18,63.64,19.09,7.73,7.73,0,0,0,0,11.36,13.18,4.09,1.36,14.09,10.45,7.73,9.09,2.73,20.45,5,2.73,1.36,0,1.36,0.45,22.73,0,22.73,5.91,2.27,3.64,7.73,1.36,6.36,0,3.18,3.18,0,0.45,0.45,0,0,0,0,0,5,3.64,1.82,0,0,0,0.91,1.36,0,0,0,0,0.45,0,0,0.45,6.36,0,0.45,4.55,2.73,0,1.36,0.91,0,0,0,0,0,0,0,0,0.91,0.91,0.45,0.45,0,0.45,0.91,0,3.18,8.64,0,0.91,7.73,0,0,0,4.09,2.73,9.55,0.91,0.45,0.45,0,0,0.45,13.18,4.09,4.09,0.91,0,0.91,3.18,0
1h7ernb,11,https://www.reddit.com/r/WilliamsCollege/comments/1h7ernb/early_decision_timing/,10,2024-12-05 17:36:19+00:00,tommytoelivker123,combinedText,"Early Decision timing?  Hi all, I did some research and I noticed that the last two admissions cycles both had decisions on early applicants released around December 6-8. Essentially a week before  the 15th which I believe was also the release date admissions had planned the past two years. Does anybody have any thoughts on this? The counselor email said it was going to be the 13th, so I could be wrong.",1,72,37.3,18.97,99,20.23,14.4,22.22,94.44,70.83,56.94,12.5,5.56,5.56,0,0,0,0,6.94,20.83,9.72,6.94,6.94,13.89,5.56,5.56,0,20.83,5.56,9.72,1.39,0,1.39,0,16.67,1.39,15.28,8.33,0,1.39,2.78,0,1.39,0,2.78,1.39,1.39,0,0,0,0,0,0,0,8.33,5.56,0,1.39,0,1.39,4.17,2.78,0,0,0,0,1.39,0,0,1.39,4.17,0,0,4.17,0,0,0,0,0,0,0,0,0,0,0,0,0,0,0,0,0,0,0,1.39,1.39,4.17,1.39,1.39,1.39,0,0,0,15.28,12.5,1.39,4.17,0,0,0,0,0,11.11,4.17,2.78,2.78,0,0,1.39,0
1h1t1gp,28,https://www.reddit.com/r/WilliamsCollege/comments/1h1t1gp/fingers_crossedddd/,13,2024-11-28 10:24:06+00:00,Rude_Neighborhood120,combinedText,FINGERS CROSSEDDDD I really want this. May December 15th be my luckiest day🪬🪬🪬🪬🪬🪬🪬♥️♥️♥️♥️♥️♥️♥️♥️♥️♥️♥️,1,13,1.3,1,81.58,99,6.5,30.77,92.31,69.23,46.15,23.08,15.38,15.38,0,0,0,0,7.69,15.38,0,7.69,0,15.38,7.69,0,0,23.08,7.69,7.69,0,0,0,0,23.08,0,23.08,0,0,7.69,7.69,7.69,0,0,7.69,7.69,0,0,0,0,0,0,0,0,0,0,0,0,0,0,0,0,0,0,0,0,0,0,0,0,0,0,0,0,0,0,7.69,0,0,0,0,0,0,0,0,0,7.69,0,0,0,0,0,7.69,0,7.69,0,0,0,0,0,0,0,15.38,0,0,7.69,0,0,0,0,0,7.69,7.69,0,0,0,0,0,138.46
1gyl2k4,5,https://www.reddit.com/r/WilliamsCollege/comments/1gyl2k4/ed_1_applicants_important/,9,2024-11-24 06:59:13+00:00,None,combinedText,"Ed 1 applicants important  Has anyone's counselor recived an email from Williams, stating the date when the ED decesion will be out?

(This email came to my friend's counselor)",1,29,76.81,90.41,43.66,74.09,14.5,34.48,82.76,51.72,44.83,10.34,3.45,3.45,0,0,0,0,6.9,17.24,10.34,3.45,10.34,10.34,3.45,3.45,0,13.79,3.45,0,3.45,3.45,0,0,3.45,0,3.45,0,0,0,3.45,0,0,0,3.45,3.45,0,0,0,0,0,0,0,0,24.14,10.34,0,0,0,0,10.34,13.79,0,3.45,0,0,6.9,0,0,6.9,10.34,0,0,10.34,0,0,0,0,0,0,0,0,0,0,0,0,0,0,0,0,0,0,0,0,3.45,6.9,0,3.45,3.45,0,0,0,6.9,3.45,3.45,3.45,0,0,0,0,0,20.69,0,3.45,3.45,0,6.9,6.9,0
1gvr6ya,14,https://www.reddit.com/r/WilliamsCollege/comments/1gvr6ya/ed_1_mates/,23,2024-11-20 14:50:16+00:00,None,combinedText,"ED 1 Mates Hey everyone,
I want to know what are you guys feeling after completing your Ed1 application.
Please tell us your thoughts and feelings at this time.
Let's create a joint manifestation and update it with another reply ""if we got in or not""

😊 I will get into Williams College!

🌹Williams is my first love 💘 

(I will update everyone soon with an acceptance or a move on)",1,69,23.51,85.5,95.6,65.92,17.25,18.84,91.3,68.12,56.52,23.19,14.49,5.8,4.35,4.35,0,0,8.7,13.04,4.35,4.35,11.59,7.25,1.45,8.7,1.45,17.39,1.45,2.9,7.25,5.8,1.45,0,17.39,2.9,14.49,5.8,0,1.45,4.35,0,7.25,0,2.9,2.9,0,1.45,1.45,0,0,0,0,0,21.74,7.25,1.45,1.45,0,0,4.35,14.49,0,1.45,0,1.45,0,0,0,0,2.9,0,0,2.9,0,0,0,0,0,0,0,0,0,0,0,0,1.45,4.35,0,0,0,0,0,1.45,7.25,7.25,0,1.45,2.9,0,0,2.9,5.8,0,4.35,4.35,1.45,1.45,0,0,0,13.04,2.9,1.45,0,1.45,1.45,5.8,4.35
1gtah9k,3,https://www.reddit.com/r/WilliamsCollege/comments/1gtah9k/css_profile_and_idoc_documents/,8,2024-11-17 10:06:17+00:00,Electronic-Map-5844,combinedText,"Css profile and IDOC documents  Im confused because i have submitted my css profile on 15 November as I thought that was the deadline, but williams college says to upload it only if I receive an acceptance? And i should NOT upload documents before. Will that be a big problem in my profile ? When should i upload IDOC documents . Does anyone have any experience ?",1,64,5.64,1,83.28,20.23,12.8,28.13,81.25,64.06,57.81,18.75,12.5,12.5,0,0,0,0,6.25,12.5,4.69,1.56,7.81,14.06,3.13,12.5,1.56,18.75,3.13,1.56,0,0,0,0,17.19,0,17.19,1.56,1.56,3.13,6.25,0,4.69,0,3.13,1.56,1.56,1.56,0,1.56,0,0,0,0,3.13,1.56,0,0,0,0,1.56,1.56,0,0,0,0,4.69,0,0,4.69,3.13,0,0,3.13,0,0,0,0,0,0,0,0,0,0,0,0,0,3.13,0,0,0,0,0,0,4.69,1.56,0,0,1.56,0,0,0,6.25,1.56,4.69,1.56,0,0,0,0,0,9.38,3.13,1.56,4.69,0,0,0,0
1gs9r4q,5,https://www.reddit.com/r/WilliamsCollege/comments/1gs9r4q/is_it_actually_easier_to_get_into_williams_ed/,16,2024-11-15 23:23:00+00:00,brent_paper,combinedText,"Is it actually easier to get into Williams ED? Or is the higher ED acceptance rate due primarily to the number of athletes, legacies and other ""hooked"" applicants applying ED?",1,30,84.21,10.48,39.59,97.84,15,26.67,76.67,63.33,46.67,3.33,0,0,0,0,0,0,3.33,10,6.67,0,13.33,6.67,6.67,6.67,0,10,10,6.67,0,0,0,0,13.33,0,13.33,0,0,0,3.33,3.33,6.67,0,6.67,6.67,0,0,0,0,0,0,0,0,0,0,0,0,0,0,0,0,0,0,0,0,0,0,0,0,6.67,3.33,0,3.33,0,0,0,0,0,0,0,0,0,0,0,0,0,6.67,0,0,0,0,0,0,3.33,6.67,0,0,6.67,0,0,0,3.33,0,6.67,0,0,0,0,0,0,16.67,0,3.33,6.67,0,0,6.67,0
