post_id,score,url,num_comments,created_utc,author,ColumnID,Text,Segment,WC,Analytic,Clout,Authentic,Tone,WPS,BigWords,Dic,Linguistic,function,pronoun,ppron,i,we,you,shehe,they,ipron,det,article,number,prep,auxverb,adverb,conj,negate,verb,adj,quantity,Drives,affiliation,achieve,power,Cognition,allnone,cogproc,insight,cause,discrep,tentat,certitude,differ,memory,Affect,tone_pos,tone_neg,emotion,emo_pos,emo_neg,emo_anx,emo_anger,emo_sad,swear,Social,socbehav,prosocial,polite,conflict,moral,comm,socrefs,family,friend,female,male,Culture,politic,ethnicity,tech,Lifestyle,leisure,home,work,money,relig,Physical,health,illness,wellness,mental,substances,sexual,food,death,need,want,acquire,lack,fulfill,fatigue,reward,risk,curiosity,allure,Perception,attention,motion,space,visual,auditory,feeling,time,focuspast,focuspresent,focusfuture,Conversation,netspeak,assent,nonflu,filler,AllPunc,Period,Comma,QMark,Exclam,Apostro,OtherP,Emoji
qq9smb,0,https://www.reddit.com/r/WilliamsCollege/comments/qq9smb/do_not_attend_if_you_have_even_the_slightest/,3,2021-11-09 18:20:09+00:00,williamsthrowaway000,combinedText,"DO NOT ATTEND if you have even the slightest inkling of mental problems This school will pretend that because of the small community the administration will really take care of you. This is absolutely not true in my experience. If you have a disability they will recommend medical withdrawal before giving you actual solutions to your problems or accommodation. It seems like literally no one is happy here. I know several people who are considering transferring because of how toxic the work culture here is and how damaging it is to the mental wellbeing of the students. Somehow this school costs over 70k a year yet the counseling center and office of accessibility are understaffed.

Additionally, the administration has treats us like actual children. Yes, it is great that with COVID they ensured we did not have an outbreak. However, they put unnecessary measures in place that literally no one supports. For example, there was rumors that someone got roofied a few weeks ago and the school decided that we could only swipe in to our own dorms. And this was at all times. Just a major inconvenience that did 0 to help the situation. And now campus security is shutting down parties in dorms when they never did before, killing the already non existent nightlife here.

And this is not even to consider the additional stress if you are not rich, white, cis, and able bodied.

There have also been 3 suicides in the class of 2024 so far and all the college did was send out the same generic emails with absolutely no changes despite this trend.",1,269,25.42,55.58,53.39,36.11,17.93,22.3,92.19,73.98,60.59,13.01,6.32,0.74,1.49,2.23,0,1.49,6.69,16.36,7.43,1.49,10.78,10.41,9.29,7.43,3.35,17.1,6.32,2.97,5.58,2.6,1.12,1.86,17.84,3.35,13.75,2.97,1.86,0.74,2.97,1.12,4.46,0,4.83,2.97,1.86,1.12,0.74,0.37,0.37,0,0,0,10.78,2.97,0.74,0,0.37,0,0.74,7.43,0,0,0,0,0.37,0,0,0.37,6.69,0.37,0.74,4.83,0.74,0,2.97,2.23,0.37,0.37,0.37,0,0,0,0.74,0,0,0.74,1.12,0,0,0,0.37,0,7.06,7.81,0.37,0.74,6.32,0.37,0,0,4.09,4.83,5.2,1.12,1.12,0,1.12,0,0,8.55,5.58,2.97,0,0,0,0,0
qo4bfn,9,https://www.reddit.com/r/WilliamsCollege/comments/qo4bfn/thoughts_on_williams_experience_so_far/,2,2021-11-06 16:54:19+00:00,blueraft-bluesea,combinedText,"Thoughts on Williams experience so far? ~perspective transfer applicant. I was admitted to Willams in the last cycle through RD, but ultimately chose a school close to home for familial circumstances and the ongoing pandemic. However, I’m quite unhappy at my current institution and am considering re-applying for transfer to Williams. The one thing I wish I had more in high school was insight from current students, so if you have any opinions or thoughts on how awesome or not awesome it has been please share! For reference, I’d like to study a science because im exploring the health sciences and would eventually want to do a MD/MPP program because I am committed to public service as well.",1,119,46.7,5.02,95.94,59.8,19.83,32.77,92.44,68.07,56.3,9.24,7.56,6.72,0,0.84,0,0,1.68,9.24,5.88,0,15.13,10.92,6.72,10.92,0.84,15.13,8.4,0.84,1.68,0.84,0.84,0,22.69,1.68,21.01,8.4,2.52,4.2,4.2,0,5.04,0,5.88,4.2,1.68,4.2,3.36,0.84,0,0,0,0,5.88,3.36,0.84,0.84,0,0,0,2.52,0.84,0,0,0,0,0,0,0,12.61,0,0.84,11.76,0,0,1.68,1.68,0.84,0,0,0,0,0,0,0,3.36,0,0,0,0,0,0,2.52,1.68,5.88,0,1.68,4.2,0,0,0,5.88,4.2,6.72,1.68,0,0,0,0,0,12.61,3.36,3.36,0.84,0.84,1.68,2.52,0
q9qwgo,4,https://www.reddit.com/r/WilliamsCollege/comments/q9qwgo/transfer_student_questions/,1,2021-10-17 03:32:18+00:00,WarwickRI,combinedText,"Transfer student questions I’m currently a sophomore at UNH but I am seriously considering transferring to a smaller school as I’m not a fan of the more party-centered culture here. If I continue this semester on my current path, I should have around a 3.8 GPA. My question is what is the overall vibe and culture at Williams in terms of the student body? How’s the campus? Would I have a good shot at getting in based on my GPA and current situation as a transfer student? Thanks!",1,88,65.33,2.53,95.15,20.23,14.67,27.27,94.32,68.18,57.95,12.5,10.23,10.23,0,0,0,0,2.27,17.05,11.36,1.14,14.77,11.36,5.68,6.82,1.14,17.05,5.68,2.27,3.41,1.14,2.27,0,14.77,0,14.77,4.55,2.27,2.27,3.41,1.14,3.41,0,6.82,3.41,3.41,1.14,1.14,0,0,0,0,0,9.09,3.41,1.14,1.14,0,0,2.27,3.41,0,0,0,0,0,0,0,0,14.77,1.14,0,13.64,0,0,1.14,0,0,0,0,0,0,0,0,0,0,1.14,0,0,0,0,0,0,4.55,5.68,0,0,5.68,0,0,0,5.68,0,10.23,0,0,0,0,0,0,13.64,3.41,1.14,3.41,1.14,3.41,1.14,0
q8bqlo,7,https://www.reddit.com/r/WilliamsCollege/comments/q8bqlo/questions_from_a_prospective_ed_applicant/,2,2021-10-14 23:45:16+00:00,williamsthrowaway22,combinedText,"questions from a prospective ED applicant hey everyone!

i'm planning on applying ED, but before i make the big commitment, i wanted to talk with some current students for their unfiltered opinions of Williams. unfortunately no one from my school has attended Williams in the last 10 years and i'm unable to attend the eph chats because of time differences :( i'm applying as a bio major and specifically wanted to know about research opportunities, what it's like as an Asian-American student/POC at a PWI, and just about the Williams experience in general.

please lmk if you would be down to chat with me over pm!! even if my points of interest don't exactly pertain to you, i'd still love to ask some questions. thanks in advance! :)",1,129,76.62,9.66,59.03,69.02,18.43,23.26,86.05,68.99,55.04,13.18,10.08,7.75,0,1.55,0,0.78,3.1,11.63,6.2,0.78,20.93,6.2,5.43,7.75,1.55,13.18,3.88,3.1,4.65,2.33,3.1,0,17.05,2.33,14.73,3.88,1.55,3.1,4.65,0,3.88,0,4.65,3.88,0.78,1.55,0.78,0.78,0,0,0.78,0,11.63,6.98,1.55,1.55,0,0,5.43,4.65,0,0,0,0,0.78,0,0.78,0,3.88,0,0,3.88,0,0,0,0,0,0,0,0,0,0,0,0,1.55,0,0,0,0,0.78,0,0.78,6.2,3.88,0,0,3.88,0,0,0,3.1,2.33,4.65,1.55,3.1,3.1,0,0,0,18.6,2.33,3.88,0,3.1,4.65,4.65,0
q1rvb9,9,https://www.reddit.com/r/WilliamsCollege/comments/q1rvb9/a_few_questions_as_a_prospective_student/,7,2021-10-05 08:05:37+00:00,Poe10t,combinedText,"A few questions as a prospective student 1. Are ED applications really beneficial?				2. Is there Ethernet in housing? If yes, what speed up and down, and if not wireless up and down?												3. I heard most dorms are single, but shitty, true?	4. Is there A/C or kitchen in housing buildings?	5. 1460 and 3.9 uw is competitive or not? w/ significant financial aid.	6. Is the campus as nice as I perceive it to be?	7. Any 24hr library?								8. Food options are there?						9. Racism/ safety for international (Indian) students?													Thank you if you are reading, and I would appreciate a response!",1,106,40.26,6.31,83.95,88.29,5.05,20.75,94.34,62.26,50.94,6.6,4.72,2.83,0,1.89,0,0,1.89,8.49,4.72,12.26,10.38,9.43,3.77,13.21,1.89,12.26,10.38,2.83,0.94,0,0.94,0.94,17.92,0.94,16.98,2.83,0.94,0.94,7.55,0.94,8.49,0,5.66,4.72,0,0.94,0.94,0,0,0,0,0.94,7.55,3.77,2.83,0.94,0,0,1.89,3.77,0,0,0,0,2.83,0,1.89,0.94,9.43,0,3.77,4.72,0.94,0,1.89,0,0,0,0,0,0,1.89,0,0,0,0,0,0,0,0.94,0.94,0,0.94,11.32,0,0,9.43,0,0.94,0,0.94,0.94,7.55,0.94,0.94,0,0.94,0,0,30.19,10.38,4.72,9.43,0.94,0,4.72,0
pmznko,3,https://www.reddit.com/r/WilliamsCollege/comments/pmznko/williams_optional_writing_supplement/,3,2021-09-12 19:46:03+00:00,None,combinedText,"Williams optional writing supplement Prospective applicant here.

Does not answering the optional writing supplement on Williams college apps hurt your chances?",1,21,70.33,4.61,84.92,1,10.5,61.9,80.95,38.1,28.57,4.76,4.76,0,0,4.76,0,0,0,9.52,4.76,0,4.76,4.76,4.76,0,4.76,14.29,0,0,0,0,0,0,28.57,0,28.57,4.76,0,0,14.29,0,14.29,0,4.76,0,4.76,4.76,0,4.76,0,0,0,0,19.05,14.29,0,0,0,0,14.29,4.76,0,0,0,0,4.76,0,0,4.76,9.52,0,0,9.52,0,0,4.76,0,0,0,0,0,0,0,0,0,0,0,0,0,0,0,0,0,4.76,9.52,0,0,4.76,0,0,4.76,0,0,4.76,4.76,0,0,0,0,0,9.52,4.76,0,4.76,0,0,0,0
plblq9,7,https://www.reddit.com/r/WilliamsCollege/comments/plblq9/williams_optional_supplement/,13,2021-09-10 01:53:59+00:00,None,combinedText,"Williams optional supplement Hello everyone, 

I am prospective Williams college Ed'er and I am little confused about this year's writing supplement. On the common app, it reads that you are to submit an academic paper completed within ""last year"" and that it's entirely optional. I took a gap year and hence I won't be able to write that academic paper since I haven't gotten any academic assignment. I can decide not to submit that, but I am scared it might hurt my chances.",1,84,8.67,1,79.29,3.2,21,21.43,91.67,71.43,53.57,21.43,10.71,9.52,0,1.19,0,0,10.71,11.9,3.57,0,8.33,11.9,3.57,5.95,3.57,21.43,5.95,3.57,1.19,0,1.19,0,19.05,1.19,17.86,2.38,2.38,1.19,7.14,1.19,5.95,0,4.76,1.19,3.57,3.57,0,3.57,1.19,0,0,0,5.95,3.57,0,1.19,0,0,3.57,2.38,0,0,0,0,1.19,0,0,1.19,5.95,0,0,5.95,0,0,1.19,0,0,0,0,0,0,0,0,0,0,2.38,0,1.19,0,0,0,1.19,2.38,3.57,0,0,2.38,0,0,1.19,3.57,3.57,8.33,3.57,1.19,0,0,1.19,0,16.67,4.76,3.57,0,0,5.95,2.38,0
pj39q9,2,https://www.reddit.com/r/WilliamsCollege/comments/pj39q9/astrophysics_major/,2,2021-09-06 16:51:54+00:00,Puzzleheaded-Two5718,combinedText,"Astrophysics major ! How is the undergrad astrophysics major at Williams ? 
Why will you recommend someone to study astrophysics at Williams ( any 5 reasons ) ?",1,23,72.44,95.64,4.38,84.9,7.67,39.13,78.26,56.52,47.83,8.7,4.35,0,0,4.35,0,0,4.35,8.7,4.35,4.35,13.04,8.7,8.7,0,0,8.7,8.7,0,0,0,0,0,21.74,0,21.74,8.7,13.04,0,8.7,0,0,0,4.35,4.35,0,0,0,0,0,0,0,0,13.04,4.35,0,0,0,0,0,8.7,0,0,0,0,0,0,0,0,8.7,0,0,8.7,0,0,0,0,0,0,0,0,0,0,0,0,0,0,0,0,0,0,0,0,0,0,0,0,0,0,0,0,0,0,4.35,4.35,0,0,0,0,0,21.74,0,0,8.7,4.35,0,8.7,0
pgshak,12,https://www.reddit.com/r/WilliamsCollege/comments/pgshak/williams_vs_swarthmore/,5,2021-09-02 22:43:52+00:00,lyd_ahmadi14,combinedText,"Williams vs Swarthmore Hey folks! New here. I'm a high school senior from NY planning on applying ED to either Williams or Swarthmore. Looking to major in history and pursue a PhD and/or JD in the future, but I'm flexible (of course haha).

Was hoping people could shed some light on the differences between the two that I *can't* find on the website. I know all about Swat's honors program and Williams's tutorial program--love both! I like the Williams campus and school spirit more than Swat's, but I feel a more politically left and grad school prep vibe at Swat.

Differences in diversity? Does Williams have a preppy jock vibe? Which is best for someone ambitious but also politically conscious (I am a well-researched and published Marxist). Thanks guys <3",1,132,75.22,1.92,86.68,86.79,12,21.21,82.58,60.61,48.48,7.58,5.3,5.3,0,0,0,0,2.27,13.64,7.58,1.52,12.88,6.82,2.27,10.61,0.76,11.36,6.06,5.3,6.06,0,4.55,1.52,18.94,0.76,17.42,3.79,0,2.27,3.03,1.52,9.85,0,4.55,4.55,0,2.27,2.27,0,0,0,0,0,6.82,3.03,0.76,0.76,0,0.76,1.52,3.79,0.76,0,0,0.76,2.27,1.52,0,0.76,8.33,0,0,8.33,0,0,0,0,0,0,0,0,0,0,0,0,0.76,0,0,0,0,0,0,0,8.33,8.33,0,0.76,4.55,1.52,0,0.76,2.27,1.52,5.3,2.27,2.27,2.27,0,0,0,21.97,4.55,1.52,1.52,1.52,4.55,8.33,0
pdt57h,4,https://www.reddit.com/r/WilliamsCollege/comments/pdt57h/a_question_about_resumescommonapp/,5,2021-08-29 10:51:53+00:00,starlily_17,combinedText,"A question about resumes/CommonApp Hello! I'm applying to Williams via Early Decision this year and I had a quick question :) 
My school uses Common App but I wasn't sure if filling out the activities section of it was enough for my 'resume' or if I had to submit a separate resume! 

Thank you so much!!",1,57,36.67,1,99,92.27,19,19.3,85.96,71.93,56.14,15.79,12.28,10.53,0,1.75,0,0,3.51,15.79,7.02,0,12.28,8.77,3.51,10.53,1.75,17.54,8.77,5.26,0,0,0,0,19.3,0,19.3,5.26,1.75,0,12.28,0,10.53,0,5.26,5.26,0,1.75,1.75,0,0,0,0,0,8.77,7.02,1.75,3.51,0,0,7.02,1.75,0,0,0,0,1.75,0,0,1.75,1.75,0,0,1.75,0,0,0,0,0,0,0,0,0,0,0,3.51,0,0,0,1.75,0,0,0,0,3.51,5.26,0,0,5.26,0,0,0,3.51,10.53,3.51,0,1.75,1.75,0,0,0,19.3,0,0,0,7.02,7.02,5.26,0
p90047,15,https://www.reddit.com/r/WilliamsCollege/comments/p90047/ed_dilemma_williams_college_vs_dartmouth_college/,2,2021-08-21 21:47:28+00:00,LethalVenom1,combinedText,"ED Dilemma: Williams College vs. Dartmouth College Hello!

&#x200B;

I'm a rising high school senior that is applying to colleges this fall. I've narrowed down my ED schools to Williams and Dartmouth and I'm having a bit of trouble deciding between the two schools. I would appreciate any insight that students had that would help me decide. For reference, I will most likely want to study Economics and do something with math, whether that be either doing a double major or getting a minor in math. I will also be cross-posting this to both r/WilliamsCollege and r/dartmouth to get as much input as possible from current students or alumni.

&#x200B;

In terms of the quality of education, I have heard good things about both schools, especially in regards to their econ departments as they are very popular at both colleges. I think the math department at Williams is quite a bit stronger than Dartmouth's, though. Moreover, both schools say they're ""undergraduate-focused"" but I think this is more true of Williams where classes are smaller than Dartmouth and fewer students are competing for research positions and stuff like that especially in a major as popular as econ. Some Wiliams students I have talked to said they even chose Williams over HYPSM because of this and said that Williams has the best quality of education in the world. Does Dartmouth compare? Also, Williams has the Oxford-style tutorials which seem dope.

&#x200B;

The Alumni network also matters to me a lot since I am strongly considering entering ib/consulting after school. I've heard that both schools are targets and that both have fiercely loyal alumni. However, Dartmouth has a much larger pre-professional vibe to it and there are a lot more people in investment banking and consulting that came from Dartmouth than Williams. While Dartmouth is a stronger target and sends more kids to top firms each year, there are a lot more kids that want to go do down the path of finance/consulting so there may be less competition at Williams making it easier to break in. I don't really know which is better, but I would say maybe Dartmouth because they have more resources for these students but I would appreciate any insight that students or alumni have at each school.

&#x200B;

This is kinda unique to Dartmouth but I don't know whether the D-Plan is on net good or bad. I've heard that it can open you up to taking internships or research positions in unorthodox times when there is a lot less competition which sounds cool. Sophomore summer and ""Camp Dartmouth"" sound cool too. I've heard people say it makes academic life easier but others have said it's made it a lot more fast-paced and requires tons of work to keep up with. I've also heard it can rip friendships apart since differences in schedules means you could go a whole year without seeing a friend.

&#x200B;

In terms of the campuses, I, unfortunately, do not have the opportunity to visit either Williams or Dartmouth. Architecture and the ""look"" of a school matter to me a lot though. I really like the rural vibes of both the schools. If anyone can comment on the vibes of each campus that would be great.

&#x200B;

In terms of social life, both again say they foster community and collaboration over competition. However, the people at Williams seem a lot more chill and friendly than the people at Dartmouth, which I've perceived to have a very preppy vibe to it and a lot more fake people. idk tho that's just what I've picked up from the vlogs I've watched and things I've heard. Williams concerns me a bit because I have heard the social scene can be very dead, with most people studying all weekend. However, Dartmouth also concerns me due to the huge prevalence of binge drinking culture and partying.

&#x200B;

That brings me to greek life. From what I have heard, Dartmouth seems to downplay it but over 60% of people are members of some sort of greek life organization. I have tried to look up stuff online about frats but couldn't find much. I don't really think I would enjoy frats and I'm even more concerned since if admitted I will be on lots of financial aid so I don't know if I'll be able to afford to join one if I wanted to down the road. I have also heard some frats have stronger alumni connections than normal students have access to, which is also concerning. I'm just all around very apprehensive of the whole system.

&#x200B;

Lastly, I know this is really stupid, but the ivy league pReStIGe is also something that is very enticing to me, especially since nobody really knows much about Williams but most people know about Dartmouth. I am aware that my perception of prestige is probably different from future employers, but I was wondering if the Ivy League branding that comes with Dartmouth really matters in the future?

I would appreciate any insight from anyone, especially if they had to choose between Williams and Dartmouth, or one of those schools and another top school. Thank you in advance to all who reply!",1,872,36.19,4.79,76.05,55.98,21.27,20.41,89.79,71.9,58.72,13.19,7.11,5.85,0,0.34,0,0.8,6.08,14.79,5.28,1.38,14.11,10.44,6.31,9.75,0.92,17.89,7.68,6.42,3.33,1.26,1.15,1.38,17.32,0.46,16.86,3.56,1.15,1.83,4.36,0.92,6.31,0,3.78,2.98,0.69,1.15,0.69,0.34,0.11,0.11,0,0,8.03,3.67,1.15,0.34,0,0.23,1.72,3.33,0,0.11,0,0,0.34,0,0.23,0.11,7.22,0.23,0,6.42,0.8,0,0.34,0.11,0,0,0,0,0,0.11,0.11,0.34,0.34,0.34,0.34,0,0,0.23,0.23,0.57,6.19,8.26,0.57,1.03,5.16,0.57,1.26,0.23,1.95,3.9,5.39,0.8,0.69,0.69,0,0,0.11,15.25,4.36,2.98,0.23,0.23,2.64,4.82,0
p8k8xv,26,https://i.redd.it/dok396tnsmi71.jpg,6,2021-08-21 03:35:21+00:00,parabolicpineapple,combinedText,Clear skies over campus,1,4,99,,89.39,,4,0,75,50,25,0,0,0,0,0,0,0,0,0,0,0,25,0,0,0,0,0,25,0,0,0,0,0,0,0,0,0,0,0,0,0,0,0,0,0,0,0,0,0,0,0,0,0,0,0,0,0,0,0,0,0,0,0,0,0,0,0,0,0,25,0,0,25,0,0,0,0,0,0,0,0,0,0,0,0,0,0,0,0,0,0,0,0,0,25,0,0,25,0,0,0,0,0,0,0,0,0,0,0,0,0,0,0,0,0,0,0,0
p6vn3h,6,https://www.reddit.com/r/WilliamsCollege/comments/p6vn3h/rugby_and_other_club_sports_at_williams/,2,2021-08-18 17:15:21+00:00,LethalVenom1,combinedText,"Rugby (and other club sports) at Williams? Hello! Im a rising high school senior that is considering EDing to Williams and I am very interested in what the club sport scene is like at the college, especially Rugby.  I couldn’t find much online so I was wondering if anyone had any insight here. How often do these teams practice? Do students actually take them seriously? And what is the community in these teams like? Thank you in advance to everyone who replies!",1,82,14.55,68.54,59.99,76.91,10.25,20.73,93.9,70.73,62.2,17.07,8.54,4.88,0,1.22,0,1.22,8.54,12.2,4.88,0,10.98,12.2,9.76,6.1,1.22,18.29,3.66,1.22,7.32,6.1,1.22,0,18.29,1.22,17.07,6.1,1.22,1.22,6.1,2.44,2.44,0,3.66,3.66,0,0,0,0,0,0,0,0,15.85,6.1,3.66,2.44,0,0,3.66,12.2,0,0,0,0,1.22,0,0,1.22,13.41,7.32,0,6.1,0,0,0,0,0,0,0,0,0,0,0,0,0,1.22,0,0,0,0,0,2.44,7.32,8.54,1.22,1.22,4.88,0,0,0,1.22,2.44,6.1,0,0,0,0,0,0,14.63,2.44,1.22,4.88,2.44,1.22,2.44,0
ow4y4k,10,https://www.reddit.com/r/WilliamsCollege/comments/ow4y4k/no_supplementals/,2,2021-08-02 01:41:08+00:00,None,combinedText,"no supplementals? hi! I am a prospective freshman (current hs senior) and was wondering if there are no supplemental essays for the 2022 application? on the williams website there's only the option to submit an essay you've written for school, but I noticed that last year there were supplemental essays that needed to be written. do you think the school will come out with questions, or should I check williams off my to-do list (or am I completely missing something?) thank you so much for your help and hope everyone's having a good summer!",1,94,24.81,34.01,71.66,92.61,15.67,20.21,87.23,69.15,57.45,13.83,9.57,5.32,0,4.26,0,0,4.26,14.89,7.45,1.06,9.57,12.77,6.38,7.45,2.13,23.4,3.19,1.06,1.06,1.06,0,0,19.15,3.19,15.96,4.26,0,3.19,8.51,1.06,5.32,0,5.32,5.32,0,2.13,2.13,0,0,0,0,0,12.77,5.32,2.13,2.13,0,0,4.26,7.45,0,0,0,0,1.06,0,0,1.06,4.26,0,0,4.26,0,0,0,0,0,0,0,0,0,0,0,1.06,1.06,0,0,0,0,0,0,1.06,6.38,7.45,2.13,1.06,5.32,0,0,0,3.19,7.45,5.32,3.19,0,0,0,0,0,17.02,1.06,2.13,3.19,2.13,3.19,5.32,0
ovyt7s,3,https://www.reddit.com/r/WilliamsCollege/comments/ovyt7s/financial_aid_for_international_students/,2,2021-08-01 19:41:52+00:00,Consistent_Ad_8784,combinedText,"Financial Aid for International Students Hello! I'm a prospective International student from Asia.

My family's ability to pay is very limited. Is an estimated EFC of $2500 very low to be considered for admission? (As an International) I'm gonna apply for RD.
Are there current international students who had EFC as low as mine? (If you don't mind sharing)

I have taken 3 SAT subject tests (Math 2 - 800, Chemistry - 800, Physics - 770). How much may it help in the admission process? 

It will be really helpful if someone can give me some Insights. And please feel free to drop any additional suggestions about admission as an International. (Especially the essay!!)",1,111,48.31,34.92,68.14,86.41,10.09,27.03,89.19,67.57,49.55,9.91,7.21,5.41,0,0.9,0,0,2.7,9.01,5.41,5.41,13.51,12.61,6.31,6.31,0.9,18.92,11.71,6.31,3.6,2.7,0.9,0,13.51,0,13.51,3.6,0.9,0.9,5.41,0.9,1.8,0,4.5,4.5,0,0,0,0,0,0,0,0,13.51,7.21,3.6,1.8,0,0,1.8,6.31,0.9,0,0,0,0,0,0,0,7.21,0,0,5.41,1.8,0,0,0,0,0,0,0,0,0,0,0,0,0.9,0,0,0,0,0,0,5.41,10.81,0,0.9,9.01,0,0,0.9,0.9,4.5,9.01,3.6,0.9,0.9,0,0,0,27.03,5.41,1.8,2.7,2.7,3.6,10.81,0
otob98,7,https://www.reddit.com/r/WilliamsCollege/comments/otob98/ferpa_admission_file_viewing/,7,2021-07-29 02:07:47+00:00,GoingDownAnxietyHole,combinedText,"FERPA Admission File Viewing Has anyone ever tried to view their admission file? If so, could you explain the process? Thanks!",1,21,10.19,97.11,5.94,88.66,7,23.81,80.95,61.9,47.62,14.29,9.52,0,0,4.76,0,4.76,4.76,9.52,4.76,0,4.76,9.52,9.52,9.52,0,23.81,0,0,4.76,0,4.76,0,23.81,4.76,19.05,4.76,0,4.76,9.52,0,4.76,0,4.76,4.76,0,0,0,0,0,0,0,0,23.81,9.52,4.76,4.76,0,0,9.52,14.29,0,0,0,0,0,0,0,0,9.52,0,0,9.52,0,0,0,0,0,0,0,0,0,0,0,0,0,0,0,0,0,0,0,0,0,9.52,0,0,0,9.52,0,0,4.76,4.76,4.76,0,0,0,0,0,0,19.05,0,4.76,9.52,4.76,0,0,0
os8cly,5,https://www.reddit.com/r/WilliamsCollege/comments/os8cly/student_jobs/,2,2021-07-26 21:18:18+00:00,Quiet-End9791,combinedText,Student jobs How are the wages for student jobs or work study?Can one earn enough to make do?I am planning on applying but my financials are not that good hence considering some options of surviving while there.,1,39,24.55,1.53,96.61,60.52,39,20.51,94.87,66.67,58.97,7.69,5.13,5.13,0,0,0,0,2.56,15.38,2.56,2.56,10.26,12.82,7.69,7.69,2.56,17.95,2.56,10.26,7.69,0,7.69,0,25.64,0,25.64,10.26,7.69,2.56,5.13,0,10.26,0,2.56,2.56,0,2.56,2.56,0,0,0,0,0,5.13,0,0,0,0,0,0,5.13,0,0,0,0,0,0,0,0,23.08,0,0,20.51,5.13,0,0,0,0,0,0,0,0,0,0,0,0,2.56,0,2.56,0,2.56,0,0,7.69,2.56,0,0,2.56,0,0,0,2.56,0,10.26,2.56,0,0,0,0,0,7.69,2.56,0,5.13,0,0,0,0
ogbgyu,10,https://www.reddit.com/r/WilliamsCollege/comments/ogbgyu/conservative_faculty_at_williams/,5,2021-07-08 17:01:52+00:00,Havashahaba,combinedText,"Conservative faculty at Williams? I’m a rising freshmen and relatively progressive myself, but I want to make an effort to incorporate at least some conservative professors into my course schedule. Are there some conservative professors, particularly in the Econ, History, and Poli Sci departments that I should look out for when choosing courses?",1,53,65.45,8.26,96.75,,17.67,32.08,88.68,60.38,54.72,11.32,9.43,9.43,0,0,0,0,1.89,15.09,5.66,0,15.09,5.66,7.55,7.55,0,11.32,1.89,5.66,1.89,0,1.89,0,11.32,0,11.32,1.89,1.89,3.77,0,0,3.77,0,0,0,0,0,0,0,0,0,0,0,5.66,0,0,0,0,0,0,5.66,0,0,0,0,5.66,5.66,0,0,15.09,0,0,13.21,1.89,0,0,0,0,0,0,0,0,0,0,0,1.89,0,0,0,0,0,5.66,0,5.66,11.32,1.89,1.89,7.55,1.89,0,0,7.55,1.89,3.77,0,0,0,0,0,0,15.09,1.89,7.55,3.77,0,1.89,0,0
