post_id,score,url,num_comments,created_utc,author,ColumnID,Text,Segment,WC,Analytic,Clout,Authentic,Tone,WPS,BigWords,Dic,Linguistic,function,pronoun,ppron,i,we,you,shehe,they,ipron,det,article,number,prep,auxverb,adverb,conj,negate,verb,adj,quantity,Drives,affiliation,achieve,power,Cognition,allnone,cogproc,insight,cause,discrep,tentat,certitude,differ,memory,Affect,tone_pos,tone_neg,emotion,emo_pos,emo_neg,emo_anx,emo_anger,emo_sad,swear,Social,socbehav,prosocial,polite,conflict,moral,comm,socrefs,family,friend,female,male,Culture,politic,ethnicity,tech,Lifestyle,leisure,home,work,money,relig,Physical,health,illness,wellness,mental,substances,sexual,food,death,need,want,acquire,lack,fulfill,fatigue,reward,risk,curiosity,allure,Perception,attention,motion,space,visual,auditory,feeling,time,focuspast,focuspresent,focusfuture,Conversation,netspeak,assent,nonflu,filler,AllPunc,Period,Comma,QMark,Exclam,Apostro,OtherP,Emoji
zytrc4,9,https://www.reddit.com/r/WilliamsCollege/comments/zytrc4/current_undergrad_here_what_is_considered_a/,13,2022-12-30 06:57:45+00:00,moonloop123,combinedText,"current undergrad here, what is considered a good/competitive GPA here? specifically if you want to go into tech or management consulting industry. current first-year here and i screwed up first semester and my GPA is a 3.3. how badly will this affect me? i dont mean to be annoying about this, but it’s just been rly stressing me out😖",1,60,3.8,2.26,99,1.23,12,23.33,96.67,76.67,63.33,16.67,10,8.33,0,1.67,0,0,6.67,10,3.33,3.33,10,11.67,15,8.33,1.67,18.33,8.33,1.67,6.67,0,5,3.33,13.33,0,13.33,5,3.33,1.67,3.33,0,5,0,6.67,1.67,5,6.67,1.67,5,1.67,1.67,0,0,5,3.33,0,0,1.67,0,1.67,1.67,0,0,0,0,1.67,0,0,1.67,11.67,0,0,11.67,0,0,0,0,0,0,0,0,0,0,0,0,1.67,0,0,0,0,0,0,0,11.67,11.67,0,1.67,11.67,0,0,0,5,3.33,10,1.67,1.67,1.67,0,0,0,16.67,5,3.33,3.33,0,1.67,3.33,1.67
znrjal,3,https://www.reddit.com/r/WilliamsCollege/comments/znrjal/what_if_my_optional_essay_for_my_application_is/,1,2022-12-16 22:52:35+00:00,None,combinedText,what if my optional essay for my application is longer than 3-5 pages?? i have an essay that i’m really proud of but it’s 7 pages. should i try to shorten it or is it okay?,1,36,1.78,1,89.39,64,12,8.33,86.11,75,63.89,27.78,13.89,13.89,0,0,0,0,13.89,11.11,2.78,5.56,11.11,16.67,2.78,11.11,0,19.44,8.33,2.78,5.56,0,5.56,0,22.22,0,22.22,0,0,5.56,8.33,2.78,13.89,0,2.78,2.78,0,2.78,2.78,0,0,0,0,0,0,0,0,0,0,0,0,0,0,0,0,0,0,0,0,0,2.78,0,0,2.78,0,0,0,0,0,0,0,0,0,0,0,0,0,0,0,0,0,0,0,0,5.56,2.78,0,0,2.78,0,0,0,0,0,11.11,0,2.78,0,2.78,0,0,19.44,2.78,0,8.33,0,5.56,2.78,0
zlbkez,2,https://www.reddit.com/r/WilliamsCollege/comments/zlbkez/is_it_easy_to_take_the_32_program/,1,2022-12-14 00:06:38+00:00,newmankindd,combinedText,"Is it easy to take the 3+2 program? Is it competitive or hard to prepare? 

I couldn't find any statistical information...",1,22,32.02,1.08,20.79,,7.33,27.27,95.45,68.18,50,13.64,4.55,4.55,0,0,0,0,9.09,9.09,4.55,9.09,9.09,13.64,0,4.55,4.55,22.73,9.09,0,4.55,0,4.55,4.55,22.73,0,22.73,9.09,0,4.55,9.09,0,4.55,0,0,0,0,0,0,0,0,0,0,0,0,0,0,0,0,0,0,0,0,0,0,0,0,0,0,0,4.55,0,0,4.55,0,0,0,0,0,0,0,0,0,0,0,0,0,4.55,0,0,0,0,0,0,13.64,9.09,0,0,0,0,0,4.55,0,0,9.09,4.55,0,0,0,0,0,31.82,13.64,0,9.09,0,4.55,4.55,0
zkjfwe,4,https://www.reddit.com/r/WilliamsCollege/comments/zkjfwe/did_you_upload_your_paper_as_a_writing_supplement/,6,2022-12-13 02:18:34+00:00,newmankindd,combinedText,"Did you upload your paper as a writing supplement? I'm trying to apply to Williams RD. 

Is submitting an optional paper essential to get into Williams? 

Also, as an IB student, I wrote EE. Should I upload this paper?",1,39,61.17,55.35,2.93,,7.8,20.51,74.36,64.1,48.72,15.38,12.82,7.69,0,5.13,0,0,2.56,12.82,7.69,0,15.38,10.26,2.56,7.69,0,23.08,2.56,0,2.56,0,2.56,0,7.69,0,7.69,0,0,5.13,2.56,0,2.56,0,0,0,0,0,0,0,0,0,0,0,12.82,5.13,0,0,0,0,5.13,7.69,0,0,0,0,5.13,0,0,5.13,2.56,0,0,2.56,0,0,0,0,0,0,0,0,0,0,0,2.56,0,2.56,0,0,0,0,0,0,2.56,2.56,0,0,2.56,0,0,0,0,5.13,5.13,0,0,0,0,0,0,20.51,5.13,5.13,7.69,0,2.56,0,0
ziljmk,3,https://www.reddit.com/r/WilliamsCollege/comments/ziljmk/did_you_get_the_decision_in_the_email_or_you_need/,8,2022-12-11 09:05:03+00:00,PenGroundbreaking737,combinedText,Did you get the decision in the email or you need to login the portal,1,15,96.08,99,19.26,,15,6.67,93.33,73.33,60,13.33,13.33,0,0,13.33,0,0,0,20,20,0,13.33,6.67,0,6.67,0,20,0,0,0,0,0,0,20,0,20,6.67,0,6.67,6.67,0,6.67,0,0,0,0,0,0,0,0,0,0,0,20,6.67,0,0,0,0,6.67,13.33,0,0,0,0,13.33,0,0,13.33,0,0,0,0,0,0,0,0,0,0,0,0,0,0,0,6.67,0,6.67,0,0,0,0,0,0,13.33,6.67,0,0,6.67,0,0,0,0,6.67,0,0,0,0,0,0,0,0,0,0,0,0,0,0,0
zic7cm,4,https://www.reddit.com/r/WilliamsCollege/comments/zic7cm/letter_of_continued_interest/,1,2022-12-11 02:50:50+00:00,No_Syllabub8573,combinedText,Letter of Continued Interest? Hello! I recently got deferred from the ED pool and was wondering if I should be sending a letter of continued interest to Williams. In the deferment letter they said “there is nothing you need to do to assure full consideration of your application later this year” but they also provided an email to send any additional info to add to my file. Is that where I would send the letter? Thanks and congrats to those who got accepted ED!,1,84,60.37,40.06,39.59,75.77,14,20.24,84.52,72.62,53.57,14.29,10.71,4.76,0,2.38,0,2.38,3.57,13.1,5.95,0,14.29,8.33,3.57,5.95,1.19,21.43,5.95,3.57,0,0,0,0,13.1,1.19,11.9,3.57,0,3.57,3.57,1.19,2.38,0,3.57,3.57,0,0,0,0,0,0,0,0,13.1,7.14,1.19,2.38,0,0,4.76,5.95,0,0,0,0,1.19,0,0,1.19,2.38,0,0,2.38,0,0,0,0,0,0,0,0,0,0,0,1.19,0,3.57,0,1.19,0,0,0,1.19,2.38,4.76,0,0,4.76,0,0,0,4.76,3.57,2.38,0,0,0,0,0,0,9.52,2.38,0,2.38,2.38,0,2.38,0
zhux34,6,https://www.reddit.com/r/WilliamsCollege/comments/zhux34/work_opportunities_for_international_freshmen_at/,7,2022-12-10 15:13:59+00:00,None,combinedText,"Work opportunities for international freshmen at Williams Hello, everyone! I (an international student) just got accepted to Williams ED1. I'm super happy to be joining you all next year! 

I got a generous financial aid package, but my family will still struggle to make ends meet, so I'm looking for ways to help them and gain some extra money during my college experience. Could anyone tell me if there are work opportunities for freshmen at Williams, especially international students (given the weekly 20-hour cap)? Any additional would be highly appreciated.

&#x200B;

Thanks in advance!",1,94,55.01,40.06,49.75,99,13.43,27.66,90.43,63.83,44.68,11.7,9.57,7.45,0,1.06,0,1.06,2.13,8.51,3.19,3.19,11.7,8.51,5.32,4.26,0,18.09,10.64,4.26,8.51,2.13,5.32,1.06,11.7,2.13,9.57,1.06,1.06,2.13,3.19,0,2.13,0,13.83,12.77,1.06,2.13,2.13,0,0,0,0,0,18.09,9.57,5.32,2.13,0,1.06,3.19,8.51,0,0,0,0,0,0,0,0,8.51,0,0,7.45,1.06,0,0,0,0,0,0,0,0,0,0,0,0,4.26,0,1.06,0,3.19,0,2.13,8.51,7.45,2.13,0,5.32,2.13,0,0,4.26,1.06,3.19,1.06,0,0,0,0,0,22.34,3.19,4.26,1.06,3.19,2.13,8.51,0
zh1nd6,2,https://www.reddit.com/r/WilliamsCollege/comments/zh1nd6/early_decisions_upload_time/,6,2022-12-09 16:28:10+00:00,PiTaS_aSa,combinedText,"Early Decisions upload time Hey, i wanted to ask if there's a specific time when early decisions notifications are usually released(i heard it's 6pm ET but i just wanna confirm). Also, does everyone get the notifications at the same time or do some get it after a while?",1,49,14.33,1.85,97.09,,24.5,18.37,89.8,75.51,55.1,12.24,6.12,6.12,0,0,0,0,6.12,10.2,8.16,2.04,8.16,10.2,10.2,14.29,0,20.41,8.16,2.04,0,0,0,0,20.41,2.04,18.37,4.08,0,4.08,6.12,0,8.16,0,0,0,0,0,0,0,0,0,0,0,6.12,4.08,0,0,0,0,4.08,2.04,0,0,0,0,2.04,0,0,2.04,0,0,0,0,0,0,0,0,0,0,0,0,0,0,0,0,4.08,4.08,0,0,0,0,0,0,12.24,4.08,0,0,2.04,0,2.04,0,12.24,4.08,8.16,2.04,4.08,4.08,0,0,0,16.33,2.04,4.08,2.04,0,4.08,4.08,0
zh0qoo,2,https://www.reddit.com/r/WilliamsCollege/comments/zh0qoo/standardized_testing/,1,2022-12-09 15:51:15+00:00,NoManagement6459,combinedText,"Standardized Testing Hello! I applied to ED earlier and today stumbled across deadlines for ED. There the deadline for submitting Standardized
Testing is October but I have send my SAT score on Nov 4 (because of loooooong processing). I am a bit worried. Is this ok?😶‍🌫️",1,46,66.69,2.96,96.69,3.88,9.2,32.61,80.43,67.39,45.65,10.87,8.7,8.7,0,0,0,0,2.17,8.7,4.35,2.17,13.04,8.7,2.17,6.52,0,21.74,4.35,2.17,0,0,0,0,6.52,0,6.52,0,2.17,0,0,0,2.17,0,6.52,2.17,4.35,2.17,0,2.17,2.17,0,0,0,2.17,2.17,0,2.17,0,0,2.17,0,0,0,0,0,0,0,0,0,8.7,0,0,8.7,0,0,0,0,0,0,0,0,0,0,0,0,0,0,0,0,0,0,0,0,6.52,8.7,0,2.17,6.52,0,0,0,8.7,6.52,6.52,0,2.17,0,2.17,0,0,15.22,6.52,0,2.17,2.17,0,4.35,4.35
z4fksw,6,https://www.reddit.com/r/WilliamsCollege/comments/z4fksw/are_paresky_or_any_of_the_other_main_buildings/,5,2022-11-25 15:07:30+00:00,capybroa,combinedText,"Are Paresky or any of the other main buildings open without a keycard? Thinking of coming up to visit the old alma mater this weekend and taking some bike rides/hikes in the area. Would be nice if there was a place I could stop in to use the restroom and whatnot. Unfortunately as an alumnus I don't have an ID and I don't know what campus access is like these days for non-students, especially during a break. Please advise? Thanks!",1,81,69.38,1.79,96.88,58.91,13.5,14.81,85.19,72.84,59.26,8.64,4.94,4.94,0,0,0,0,3.7,17.28,11.11,0,14.81,12.35,4.94,7.41,2.47,20.99,6.17,2.47,0,0,0,0,14.81,0,14.81,2.47,1.23,3.7,3.7,0,4.94,0,2.47,2.47,0,0,0,0,0,0,0,0,4.94,4.94,3.7,2.47,0,0,2.47,0,0,0,0,0,0,0,0,0,3.7,2.47,0,1.23,0,0,0,0,0,0,0,0,0,0,0,0,0,1.23,2.47,0,0,0,0,0,7.41,12.35,0,3.7,9.88,0,0,0,6.17,1.23,7.41,0,0,0,0,0,0,13.58,3.7,1.23,2.47,1.23,2.47,2.47,0
ymfume,5,https://www.reddit.com/r/WilliamsCollege/comments/ymfume/easiest_div_1_and_2_courses/,4,2022-11-05 00:59:08+00:00,eskapi,combinedText,"Easiest Div 1 and 2 courses? For context, I have learned that I simply do not have what it takes to read difficult material, form sophisticated thoughts, and write papers on them. I’m in need of a lot more div 1 and some div 2 courses, but the workload of these reading/writing classes is very intimidating (e.g. I’m taking PSCI 203 and it’s absolutely kicking my ass rn). What are the easiest classes that fulfill said div requirements? (And also the WS and DPE requirements haha…)",1,87,17.79,5.1,11.47,36.68,17.4,24.14,85.06,66.67,50.57,14.94,6.9,5.75,0,0,0,1.15,8.05,12.64,4.6,5.75,6.9,9.2,5.75,9.2,1.15,20.69,4.6,3.45,2.3,0,1.15,1.15,10.34,0,10.34,2.3,0,0,0,2.3,2.3,0,9.2,4.6,3.45,1.15,1.15,0,0,0,0,1.15,5.75,4.6,0,0,0,0,3.45,1.15,0,0,0,0,0,0,0,0,3.45,0,0,3.45,0,0,1.15,0,0,0,0,0,0,0,0,5.75,0,2.3,6.9,1.15,0,0,0,1.15,1.15,1.15,0,1.15,0,0,0,0,0,2.3,8.05,0,3.45,2.3,1.15,0,0,24.14,8.05,4.6,2.3,0,3.45,5.75,0
yle6ve,0,https://www.reddit.com/r/WilliamsCollege/comments/yle6ve/summer_break/,1,2022-11-03 20:39:29+00:00,ghaocore,combinedText,Summer break How long is summer break at Williams?,1,9,66.04,,99,,9,11.11,66.67,44.44,33.33,0,0,0,0,0,0,0,0,0,0,0,11.11,11.11,11.11,0,0,11.11,11.11,11.11,0,0,0,0,11.11,0,11.11,11.11,11.11,0,0,0,0,0,0,0,0,0,0,0,0,0,0,0,0,0,0,0,0,0,0,0,0,0,0,0,0,0,0,0,0,0,0,0,0,0,0,0,0,0,0,0,0,0,0,0,0,0,0,0,0,0,0,0,11.11,11.11,0,0,11.11,0,0,0,22.22,0,11.11,0,0,0,0,0,0,11.11,0,0,11.11,0,0,0,0
yl8m4w,1,https://www.reddit.com/r/WilliamsCollege/comments/yl8m4w/no_info_on_school_website_about_current_grad/,5,2022-11-03 17:23:11+00:00,Think_Ticket_9885,combinedText,"No info on school website about current grad students (art history)? Hi! Typically, universities list their current grad students, even their contact info, interests, thesis/dissertation topics, and advisors, but I haven't found a dedicated page for that for Williams. Was wondering if it's not yet posted, like, will there be a list in the future or is it only for internal use? Would really appreciate any info! Thanks!",1,69,27.02,24.56,92.58,95.08,11.5,24.64,91.3,62.32,50.72,8.7,4.35,1.45,0,0,0,2.9,4.35,11.59,4.35,0,10.14,10.14,10.14,5.8,4.35,17.39,5.8,0,2.9,0,2.9,0,26.09,1.45,24.64,8.7,1.45,2.9,8.7,1.45,7.25,0,5.8,5.8,0,1.45,1.45,0,0,0,0,0,17.39,7.25,4.35,2.9,0,0,2.9,10.14,0,0,0,0,1.45,0,0,1.45,14.49,1.45,0,13.04,0,0,0,0,0,0,0,0,0,0,0,0,0,0,0,0,0,0,0,2.9,2.9,5.8,1.45,0,4.35,0,0,0,7.25,5.8,5.8,2.9,0,0,0,0,0,27.54,1.45,11.59,2.9,4.35,2.9,4.35,0
y5tu5i,2,https://www.reddit.com/r/WilliamsCollege/comments/y5tu5i/how_does_winter_study_work/,7,2022-10-16 22:27:43+00:00,No_Syllabub8573,combinedText,"How does Winter Study work? Hello! I’m really interested in Williams (might apply ED) and have a couple of questions about Winter Study. I know that Williams puts a ton of emphasis on how great it is but I was just curious about what actually makes it beneficial to students in comparison to other schools who just have their normal winter break during that period. Some other questions I have are:
- How is long is the normal “Winter/Christmas” break for Williams?
- Do the courses you take during Winter Study go towards graduation requirements?
- How does studying abroad during Winter Study work?

Also on a side note, I was wondering if there are any current students that would be able to talk to me more about their experience at Williams. Thanks so much! :)",1,134,37.12,24.15,98.28,86.16,13.4,17.91,90.3,69.4,56.72,11.94,7.46,4.48,0,0.75,0,1.49,4.48,11.94,3.73,0,14.18,12.69,10.45,3.73,0,18.66,7.46,4.48,2.99,0,2.99,0,14.93,0,14.93,6.72,3.73,0.75,4.48,1.49,3.73,0,4.48,4.48,0,0.75,0.75,0,0,0,0,0,6.72,2.24,0.75,1.49,0,0,2.24,4.48,0,0,0,0,0,0,0,0,8.96,0,0,8.21,0,0.75,0,0,0,0,0,0,0,0,0,0.75,0,0.75,0,0,0,0.75,0,2.24,8.21,6.72,0.75,1.49,5.22,0,0,0,8.96,1.49,8.21,0.75,0.75,0.75,0,0,0,16.42,2.24,0.75,2.99,1.49,0.75,8.21,0
y4azku,12,https://www.reddit.com/r/WilliamsCollege/comments/y4azku/does_williams_offer_accommodations_for_students/,1,2022-10-15 01:26:33+00:00,Official_Monke,combinedText,"Does Williams offer accommodations for students with learning disabilities? Hi Everyone!

I’m considering applying ED to Williams, but I haven’t found any information about learning accommodations. I’m not worried about the rigorous course load, but I have had extra time on tests my whole life. Does anyone have any insight on the experience of studying at Williams with ADHD?",1,59,53.96,1.12,90.74,20.23,11.8,30.51,81.36,61.02,50.85,11.86,8.47,8.47,0,0,0,0,3.39,8.47,3.39,0,16.95,13.56,3.39,3.39,3.39,16.95,6.78,3.39,0,0,0,0,25.42,1.69,23.73,10.17,0,0,5.08,0,6.78,0,3.39,1.69,1.69,1.69,0,1.69,1.69,0,0,0,13.56,6.78,0,1.69,0,0,1.69,5.08,0,0,0,0,0,0,0,0,6.78,0,0,6.78,0,0,1.69,1.69,0,0,1.69,0,0,0,0,0,0,0,0,1.69,0,0,0,0,6.78,0,0,0,0,0,0,0,0,3.39,6.78,0,0,0,0,0,0,16.95,3.39,3.39,3.39,1.69,5.08,0,0
y224fv,16,https://www.reddit.com/r/WilliamsCollege/comments/y224fv/what_is_your_favorite_thing_about_williams/,5,2022-10-12 12:05:02+00:00,None,combinedText,What is your favorite thing about Williams? Prospective student here! Planning on applying ED and I'd love to hear from students. What is your favorite tradition/place/anything about Williams? What makes you grateful for having chosen this college?,1,39,14.06,99,1,99,7.8,33.33,87.18,66.67,53.85,25.64,10.26,2.56,0,7.69,0,0,15.38,7.69,0,0,15.38,10.26,7.69,2.56,0,17.95,7.69,0,5.13,2.56,2.56,0,15.38,0,15.38,2.56,2.56,5.13,2.56,0,0,0,12.82,12.82,0,5.13,5.13,0,0,0,0,0,12.82,0,0,0,0,0,0,12.82,0,0,0,0,0,0,0,0,7.69,0,0,7.69,0,0,0,0,0,0,0,0,0,0,0,0,5.13,0,0,0,0,0,0,0,5.13,7.69,0,0,5.13,0,2.56,0,0,0,7.69,5.13,0,0,0,0,0,20.51,2.56,0,7.69,2.56,2.56,5.13,0
y1zmh1,3,https://www.reddit.com/r/WilliamsCollege/comments/y1zmh1/what_got_you_into_williams/,1,2022-10-12 09:50:46+00:00,None,combinedText,"What got you into Williams? I'm thinking of EDing Williams, but I'm not sure whether my profile is at the level of Williams college. Can you share your stats and extracurriculars that got you in?",1,35,12.97,57.11,91.58,,11.67,22.86,80,71.43,60,25.71,20,8.57,0,11.43,0,0,5.71,11.43,2.86,0,14.29,11.43,0,8.57,2.86,20,0,0,2.86,2.86,0,0,17.14,0,17.14,2.86,0,2.86,5.71,0,8.57,0,0,0,0,0,0,0,0,0,0,0,14.29,2.86,0,0,0,0,0,11.43,0,0,0,0,0,0,0,0,2.86,0,0,2.86,0,0,0,0,0,0,0,0,0,0,0,0,0,5.71,0,0,0,0,0,0,0,8.57,0,0,8.57,0,0,0,0,0,11.43,0,0,0,0,0,0,17.14,2.86,2.86,5.71,0,5.71,0,0
y07yrh,0,https://www.reddit.com/r/WilliamsCollege/comments/y07yrh/business/,2,2022-10-10 06:58:08+00:00,Queenwind,combinedText,Business? I’ve been struggling to find information on it but does Williams have a business major or school  for (Business Information Technology and Marketing?),1,24,37.3,1.71,89.39,1,12,37.5,95.83,58.33,50,8.33,4.17,4.17,0,0,0,0,4.17,4.17,4.17,0,12.5,16.67,0,12.5,0,20.83,4.17,0,4.17,0,0,4.17,20.83,0,20.83,12.5,0,0,4.17,0,8.33,0,4.17,0,4.17,0,0,0,0,0,0,0,4.17,4.17,0,0,0,0,0,0,0,0,0,0,4.17,0,0,4.17,20.83,0,0,20.83,16.67,0,0,0,0,0,0,0,0,0,0,0,0,0,0,0,0,0,0,0,8.33,4.17,0,0,0,0,0,0,0,8.33,4.17,0,0,0,0,0,0,20.83,0,0,8.33,0,4.17,8.33,0
xzfb3f,2,https://www.reddit.com/r/WilliamsCollege/comments/xzfb3f/rural_area_and_internships/,7,2022-10-09 07:19:04+00:00,None,combinedText,"Rural Area and Internships I am thinking of EDing Williams, but the fact that it's in rural area makes me think that I won't have any internship opportunities during the summer. I will be majoring in Physics/Astrophysics. I want to go to grad school. How is Williams for post study opportunities or internships during summer?",1,56,51.48,1,99,75.77,14,19.64,89.29,64.29,50,14.29,8.93,8.93,0,0,0,0,5.36,8.93,3.57,0,14.29,10.71,1.79,5.36,1.79,19.64,3.57,1.79,10.71,0,5.36,5.36,17.86,0,16.07,5.36,3.57,1.79,1.79,0,5.36,0,3.57,3.57,0,0,0,0,0,0,0,0,1.79,0,0,0,0,0,0,1.79,0,0,0,0,0,0,0,0,14.29,0,0,14.29,0,0,0,0,0,0,0,0,0,0,0,0,1.79,0,5.36,0,0,3.57,0,0,1.79,8.93,0,1.79,8.93,0,0,0,7.14,0,7.14,1.79,0,0,0,0,0,14.29,5.36,1.79,1.79,0,3.57,1.79,0
xyzs7c,7,https://www.reddit.com/r/WilliamsCollege/comments/xyzs7c/international_applicant_here_really_insecure/,6,2022-10-08 18:23:38+00:00,SnooDoubts1353,combinedText,"International applicant here, really insecure about my GPA, but am quite proud of my ECAs Kind of a big post is incoming, so I thank anyone for taking the time to read through and maybe dishing out some advice below.

(TL;DR: Edexcel student here, have always been above average as a student and got all 9s in IGCSEs, but flunked my AS-level exams and ended up getting BCC, although, I believe that my true strengths bloom freely with my ECAs. Should I apply ED to Williams, my dream college, or just go for a safer option?)

I am from a LDC in South Asia, and I have received an Edexcel education ever since middle school. All throughout high school, I have been a decent student, ranking in the top single-digit percentage always. The hard work paid off as I got all 9s on my IGCSEs (otherwise, I got a 4.0 GPA in all of my courses for my sophomore year). However, owing to following an improper mode of hybrid education towards to end of 2021 and the first quarter of this year, my AS-level education was severely hit and I ended up getting BCC on my 3 subjects. In retrospect, it isn't the end of the world, as I am retaking a few papers and hoping to bounce back, but the sadness (and I only say this because I haven't been mentally evaluated to be clinically depressed) I suffered through this year has harshly impacted by mental health and wellbeing - which in turn affected my SAT score too.

I retook the SAT on Oct 1, and am expecting a 1450+ hopefully. However, my strengths get fully expressed through my ECAs. I am a Duke of Edinburgh Alum, having completed all the journeys and having received all three certifications. I was also in charge of handling the marketing for 2 F&B giants in my country, and during my tenure, we reached 10s of millions of people across the internet. Being an adept growth hacker, I co-founded (and am serving as the chief editor) a news platform which quickly became the biggest bite-sized media agency in my country, and which reached people in the metric of 100s of millions across Facebook, Instagram, TikTok, YouTube, Snapchat, and even LinkedIn. The success of our bite-sized media agency saw one of our competitors partnering up with us to come under an umbrella company - one that I am a majority stakeholder of, and that has recently been valued at $1.0 million in our seed round (however, we are aiming for a $1.5 million valuation currently). Besides, I have been part of my school's football club and MUN club since middle school, having won trophies and medals for my football team, and serving as the director general at my school's MUN conference. Moreover, I have also appeared on a soap opera on our national TV network, and have acted in multiple OVCs, apart from voicing several commercials and characters over the year. I have also served as an English tutor to a few juniors, over the years.

Williams College has almost been like an exotic dream for me ever since I was in the 8th grade, and learned that my cousins graduated from Bates, Wellesley, and Pomona, while one was soon going to start at W&L. I want to study Economics and Williams have always seemed to match all of my needs and wants from the institution I want as my alma mater. However, my current academic year has seriously strained me mentally and demotivated me drastically. Should I still apply for Early Decision to Williams, or is it too ambitious? Should I instead go for a safer school?",1,614,64.77,5.77,87.99,26.64,27.91,22.96,86.48,68.24,56.51,11.89,9.77,8.63,1.14,0,0,0,2.12,15.8,6.68,3.58,15.96,6.84,6.35,8.63,0.49,13.03,4.72,5.05,5.54,1.79,2.61,1.3,11.4,1.95,9.45,0.98,0.98,1.47,1.95,0.49,3.42,0.16,3.09,1.79,1.3,1.3,0.65,0.65,0.16,0,0.33,0,5.05,1.95,0.65,0.16,0,0.16,1.14,2.61,0.16,0,0,0.16,0.49,0,0,0.49,7.49,0.98,0,5.7,0.98,0,0.81,0.81,0,0.16,0.49,0,0,0,0,0.16,0.81,1.47,0,0.33,0.16,0.49,0.33,0.16,5.37,8.47,0,1.3,7.82,0.33,0,0,3.91,5.21,3.09,1.14,0.33,0.33,0,0,0,16.12,3.58,7.33,0.49,0,0.65,4.07,0
xxj4t3,4,https://www.reddit.com/r/WilliamsCollege/comments/xxj4t3/is_it_easy_to_make_friends_at_williamsfind_things/,2,2022-10-06 23:07:52+00:00,Ressurection2005,combinedText,"Is it easy to make friends at Williams/find things to do? Hi! I'm thinking of applying ED to Williams; I love the small class sizes, access to professors, LAC curriculum, etc., but I'm worried about making friends. The school size is relatively small (especially coming from a larger HS) and it doesn't seem like there's much to do off campus. Would you say it's easy to find people you like, maintain a social life, have some sort of balance? Does the campus feel overly isolating? Do you run out of things to do quickly?

Thanks!",1,96,65.07,58.66,39.59,52.41,12,15.63,88.54,70.83,53.13,11.46,6.25,3.13,0,3.13,0,0,5.21,7.29,5.21,0,17.71,14.58,5.21,2.08,1.04,25,6.25,7.29,2.08,2.08,0,0,14.58,0,14.58,5.21,2.08,1.04,3.13,0,2.08,0,4.17,3.13,1.04,2.08,1.04,1.04,1.04,0,0,0,12.5,4.17,1.04,2.08,0,0,3.13,6.25,0,2.08,0,0,0,0,0,0,6.25,0,0,6.25,0,0,0,0,0,0,0,0,0,0,0,0,0,0,0,0,0,0,0,0,13.54,8.33,0,2.08,4.17,0,0,1.04,1.04,0,9.38,0,0,0,0,0,0,25,3.13,6.25,4.17,2.08,5.21,4.17,0
xxb2z5,4,https://www.reddit.com/r/WilliamsCollege/comments/xxb2z5/favorite_restaurants_and_campus_dining_halls/,7,2022-10-06 17:32:02+00:00,wildswalker,combinedText,Favorite restaurants and campus dining halls? What are your favorite restaurants in town and favorite campus dining hall? I've been on campus before and tried Driscoll dining hall and a a fun pub restaurant in town (name escapes me at the moment).,1,42,70.33,79.51,39.59,98.65,14,19.05,90.48,54.76,42.86,9.52,7.14,4.76,0,2.38,0,0,2.38,9.52,7.14,0,11.9,7.14,0,11.9,0,9.52,9.52,0,2.38,0,2.38,0,0,0,0,0,0,0,0,0,0,0,11.9,9.52,2.38,2.38,2.38,0,0,0,0,0,9.52,0,0,0,0,0,0,9.52,0,0,0,0,0,0,0,0,19.05,11.9,0,7.14,0,0,16.67,0,0,0,0,0,0,16.67,0,0,0,0,0,0,0,0,2.38,0,4.76,7.14,0,2.38,4.76,0,0,0,4.76,7.14,2.38,0,0,0,0,0,0,14.29,2.38,0,4.76,0,2.38,4.76,0
xxaxc3,0,https://www.reddit.com/r/WilliamsCollege/comments/xxaxc3/wife_i_looking_for_a_williams_roomapt_friday/,0,2022-10-06 17:25:38+00:00,wildswalker,combinedText,"Wife & I looking for a Williams room/apt Friday night 10/7 just to sleep My wife and I are visiting Williams this weekend, and looking for a room or apt Friday night just to sleep, from around 9PM and leaving 7AM in the morning. We're considerate, clean and quiet non-smoking professionals and experienced travelers backpacking and cycling. We've also been Airbnb Superhosts with hundreds of great reviews, so you can see what others had to say about us). We find the few motels and airbnb's nearby way overpriced for what they offer (we've stayed in one of the hotels in town before and saw others). If you have a friend's place to crash at and would like to earn some cash, please let us know. We even have our own comfy inflatable doubles size camping mattress. Also appreciate any recommendations you may have. PS Williams is awesome - you're lucky to study there and have the Berkshires at your doorstep.",1,160,37.88,98.18,54.55,94.27,20,19.38,87.5,65,54.38,13.75,10.63,1.88,5,3.13,0,0.63,3.13,10.63,4.38,4.38,13.75,9.38,5.63,10,0,17.5,5,3.75,8.13,6.88,0.63,0.63,8.13,0,8.13,2.5,0,1.88,2.5,0,2.5,0,5.63,5.63,0,2.5,2.5,0,0,0,0,0,16.25,4.38,1.88,0.63,0,0,0.63,11.88,1.25,0.63,1.25,0,0,0,0,0,6.25,1.25,1.88,2.5,0.63,0,1.25,0,0,0,0,0,0,0,0,1.25,0,0.63,0,0,0,0.63,0.63,2.5,7.5,13.75,2.5,1.88,6.88,3.75,0.63,0,5,4.38,3.13,0.63,0,0,0,0,0,16.88,5,3.13,0,0,3.75,5,0
xw0ne6,7,https://www.reddit.com/r/WilliamsCollege/comments/xw0ne6/how_is_astrophysics_at_williams/,3,2022-10-05 04:31:52+00:00,None,combinedText,How is Astrophysics at Williams?,1,5,39.7,,63.35,,5,40,60,60,60,0,0,0,0,0,0,0,0,0,0,0,20,20,20,0,0,20,0,0,0,0,0,0,20,0,20,20,20,0,0,0,0,0,0,0,0,0,0,0,0,0,0,0,0,0,0,0,0,0,0,0,0,0,0,0,0,0,0,0,0,0,0,0,0,0,0,0,0,0,0,0,0,0,0,0,0,0,0,0,0,0,0,0,0,0,0,0,0,0,0,0,0,0,20,0,0,0,0,0,0,20,0,0,20,0,0,0,0
