post_id,score,url,num_comments,created_utc,author,ColumnID,Text,Segment,WC,Analytic,Clout,Authentic,Tone,WPS,BigWords,Dic,Linguistic,function,pronoun,ppron,i,we,you,shehe,they,ipron,det,article,number,prep,auxverb,adverb,conj,negate,verb,adj,quantity,Drives,affiliation,achieve,power,Cognition,allnone,cogproc,insight,cause,discrep,tentat,certitude,differ,memory,Affect,tone_pos,tone_neg,emotion,emo_pos,emo_neg,emo_anx,emo_anger,emo_sad,swear,Social,socbehav,prosocial,polite,conflict,moral,comm,socrefs,family,friend,female,male,Culture,politic,ethnicity,tech,Lifestyle,leisure,home,work,money,relig,Physical,health,illness,wellness,mental,substances,sexual,food,death,need,want,acquire,lack,fulfill,fatigue,reward,risk,curiosity,allure,Perception,attention,motion,space,visual,auditory,feeling,time,focuspast,focuspresent,focusfuture,Conversation,netspeak,assent,nonflu,filler,AllPunc,Period,Comma,QMark,Exclam,Apostro,OtherP,Emoji
1c3h995,44,https://i.redd.it/qqsaj4rcgcuc1.png,2,2024-04-14 01:00:55+00:00,sithteacher,combinedText,This is why I love Williams,1,6,1,1,39.59,99,6,16.67,83.33,66.67,66.67,33.33,16.67,16.67,0,0,0,0,16.67,16.67,0,0,0,16.67,16.67,0,0,16.67,0,0,0,0,0,0,16.67,0,16.67,0,16.67,0,0,0,0,0,16.67,16.67,0,16.67,16.67,0,0,0,0,0,16.67,16.67,0,0,0,0,0,0,0,0,0,0,0,0,0,0,0,0,0,0,0,0,0,0,0,0,0,0,0,0,0,0,0,0,0,0,0,0,0,0,16.67,0,0,0,0,0,0,0,0,0,16.67,0,0,0,0,0,0,0,0,0,0,0,0,0,0
1c37ujn,14,https://www.reddit.com/r/WilliamsCollege/comments/1c37ujn/williams_friendly_medical_schools/,10,2024-04-13 17:57:12+00:00,Initial_Neat921,combinedText,"Williams friendly medical schools  Curious if anyone knows about medical schools that are particularly friendly to applicants from Williams? Or in other words, what medical schools have Williams alums usually gone to in previous cycles? I’m currently a junior that’s applying and working on my school list so any input/advice would be much appreciated :)",1,56,30.7,9.23,94.2,98.65,18.67,35.71,87.5,64.29,50,10.71,3.57,3.57,0,0,0,0,7.14,12.5,1.79,0,12.5,10.71,8.93,7.14,0,16.07,10.71,1.79,5.36,3.57,1.79,0,17.86,0,17.86,5.36,0,1.79,8.93,0,5.36,0,7.14,7.14,0,7.14,7.14,0,0,0,0,0,10.71,8.93,7.14,0,0,0,3.57,1.79,0,0,0,0,0,0,0,0,12.5,0,0,12.5,0,0,5.36,5.36,0,0,0,0,0,0,0,0,0,0,0,0,0,0,0,1.79,1.79,7.14,0,3.57,3.57,0,0,0,7.14,3.57,8.93,0,1.79,1.79,0,0,0,14.29,0,1.79,3.57,0,3.57,5.36,0
1c0wiln,117,https://www.reddit.com/r/WilliamsCollege/comments/1c0wiln/ut_austin_vs_willams_college/,78,2024-04-10 21:03:04+00:00,Regular-Salt9623,combinedText,"UT Austin vs Willams College Hello everyone, I’ve been admitted some colleges, but I’ve narrowed down my choices to UT Austin and Williams. I’m very lucky, but I’m having a hard time choosing where I should go. First I heavily value diversity. I live in a predominantly white area within Texas, and I myself am black. I’ve struggled with racism within school all of my life, and I cannot tolerate this any further, especially in college. Austin is more diverse than my town, but I don’t know much about Williamstown. I also place heavy emphasis on job placement opportunities and pre-professional development. I’ve been admitted to McCombs at UT, and at Williams, I plan on majoring in Political Economy. Williams as a whole is great from what I’ve read online and in the forums, but when I tell people that I’ve been admitted to Williams, i receive blank faces. I have aspirations to attain a  JD-MBA at an T14 after undergraduate school, and I know Williams is excellent for that, but I don’t know much about UT’s placement into top law schools. I know UT isn’t flexible at all in terms of majors, and that is something I heavily dislike. I would also like any current students or alums input on whether or not the academic culture is cutthroat or collaborative. Please talk about other factors that you feel would be appropriate for my decision making, any and all input is very much appreciated.

Edit: Why is this getting so many downvotes, it’s a genuine question? Was there something I said that is inappropriate?",1,264,16.24,1,99,49.16,17.6,23.11,88.64,71.59,57.95,16.29,11.74,11.36,0,0.38,0,0,4.55,12.5,3.03,0.76,12.88,12.12,5.68,9.47,1.89,18.56,9.85,4.55,3.41,0.38,1.89,1.14,18.94,1.52,17.42,6.06,0.76,1.89,3.41,0,6.44,0,4.17,3.03,1.14,1.14,0.76,0.38,0,0,0,0,7.2,4.55,1.14,0.76,0,0.38,1.89,1.89,0,0,0,0,1.14,0.38,0.38,0.38,5.68,0,0,5.3,0.38,0,0.76,0,0,0,0,0,0,0,0,0,0.38,0.76,0.38,0,0,0.38,0.38,0,6.44,10.61,0,0.38,7.58,1.14,0,1.89,1.14,4.92,6.82,0.38,0,0,0,0,0,17.8,4.92,6.06,0.76,0,4.92,1.14,0
1bzpg0g,30,https://www.reddit.com/r/WilliamsCollege/comments/1bzpg0g/people_who_chose_williams_over_an_ivyt20_why_in/,43,2024-04-09 11:10:01+00:00,0xCUBE,combinedText,"People who chose Williams over an Ivy/T20, why? In retrospect, do you regret your decision at all?",1,18,79.79,99,77.17,1,9,16.67,88.89,61.11,55.56,16.67,16.67,0,0,11.11,0,0,0,16.67,5.56,5.56,16.67,5.56,5.56,0,0,11.11,0,5.56,0,0,0,0,33.33,5.56,27.78,11.11,5.56,5.56,0,0,0,5.56,5.56,0,5.56,5.56,0,5.56,0,0,5.56,0,16.67,0,0,0,0,0,0,16.67,0,0,0,0,0,0,0,0,0,0,0,0,0,0,0,0,0,0,0,0,0,0,0,0,0,0,0,0,0,0,0,0,5.56,11.11,0,0,11.11,0,0,0,5.56,16.67,0,0,0,0,0,0,0,27.78,0,11.11,11.11,0,0,5.56,0
1bz5zq4,10,https://www.reddit.com/r/WilliamsCollege/comments/1bz5zq4/clubs_at_wc/,3,2024-04-08 18:54:35+00:00,Longjumping-Slice282,combinedText,Clubs at WC What’re the clubs like at Williams College? At my high school only 5% of the clubs are actually active and the other 95% were created to put on college resumes and virtually dead. Is it a similar club culture at Williams or are most of the clubs actively providing events and resources?,1,55,86.82,8.91,5.07,,18.33,23.64,87.27,65.45,54.55,5.45,1.82,1.82,0,0,0,0,3.64,14.55,9.09,3.64,16.36,9.09,5.45,7.27,0,12.73,10.91,1.82,10.91,9.09,1.82,0,9.09,0,9.09,0,0,0,1.82,3.64,5.45,0,0,0,0,0,0,0,0,0,0,0,1.82,0,0,0,0,0,0,0,0,0,0,0,0,0,0,0,18.18,9.09,0,9.09,0,0,1.82,0,0,0,0,0,0,0,1.82,0,0,0,0,0,0,0,0,1.82,1.82,1.82,0,1.82,0,0,0,0,0,3.64,7.27,0,0,0,0,0,0,10.91,1.82,0,3.64,0,1.82,3.64,0
1bu318i,14,https://www.reddit.com/r/WilliamsCollege/comments/1bu318i/how_happy_are_williams_students/,2,2024-04-02 16:26:52+00:00,First-Cicada5721,combinedText,How happy are Williams students? title.,1,6,10.19,98.75,39.59,99,3,33.33,66.67,50,33.33,0,0,0,0,0,0,0,0,0,0,0,0,16.67,16.67,0,0,16.67,16.67,0,0,0,0,0,16.67,0,16.67,16.67,16.67,0,0,0,0,0,16.67,16.67,0,16.67,16.67,0,0,0,0,0,16.67,0,0,0,0,0,0,16.67,0,0,0,0,0,0,0,0,16.67,0,0,16.67,0,0,0,0,0,0,0,0,0,0,0,0,0,0,0,0,0,0,0,0,0,0,0,0,0,0,0,0,0,0,16.67,0,0,0,0,0,0,33.33,16.67,0,16.67,0,0,0,0
1bu30yd,16,https://www.reddit.com/r/WilliamsCollege/comments/1bu30yd/how_happy_are_williams_students/,13,2024-04-02 16:26:33+00:00,First-Cicada5721,combinedText,How happy are Williams students?,1,5,3.8,99,63.35,99,5,40,80,60,40,0,0,0,0,0,0,0,0,0,0,0,0,20,20,0,0,20,20,0,0,0,0,0,20,0,20,20,20,0,0,0,0,0,20,20,0,20,20,0,0,0,0,0,20,0,0,0,0,0,0,20,0,0,0,0,0,0,0,0,20,0,0,20,0,0,0,0,0,0,0,0,0,0,0,0,0,0,0,0,0,0,0,0,0,0,0,0,0,0,0,0,0,0,20,0,0,0,0,0,0,20,0,0,20,0,0,0,0
1bu2vs0,5,https://www.reddit.com/r/WilliamsCollege/comments/1bu2vs0/williams_at_oxford/,5,2024-04-02 16:20:36+00:00,NovusAdam,combinedText,Williams at Oxford  Hey yall I am a recently admitted student at Williams. I was wondering if anyone has done the Williams at Oxford program junior year or knows anyone who has done it since I would like to learn more about it and what the experience is like. And also the costs associated with the program like what is covered and what isn’t.,1,64,22.41,31.33,32.54,69.4,21.33,18.75,87.5,78.13,68.75,18.75,7.81,4.69,0,1.56,0,0,10.94,9.38,7.81,0,15.63,15.63,3.13,10.94,1.56,21.88,3.13,3.13,0,0,0,0,18.75,0,18.75,6.25,1.56,3.13,7.81,0,4.69,0,3.13,3.13,0,3.13,3.13,0,0,0,0,0,12.5,4.69,0,0,0,0,1.56,7.81,0,0,0,0,0,0,0,0,7.81,0,0,6.25,1.56,0,0,0,0,0,0,0,0,0,0,0,0,0,0,0,0,0,0,1.56,7.81,0,0,0,0,0,0,0,3.13,4.69,10.94,0,1.56,1.56,0,0,0,6.25,4.69,0,0,0,1.56,0,0
1bu0jzc,12,https://www.reddit.com/r/WilliamsCollege/comments/1bu0jzc/study_abroad_program_at_williams/,7,2024-04-02 14:46:31+00:00,NoAvocado3729,combinedText,Study Abroad Program at Williams I am a high school junior hoping to ED Williams next year. I was wondering how Williams is when it comes to Study Abroad programs? Is that a common thing to do? Does Williams cover the expenses? How do we qualify for these programs? Thank you so much!,1,53,27.3,62.44,29.13,78.39,8.83,18.87,84.91,67.92,52.83,15.09,7.55,3.77,1.89,1.89,0,0,7.55,11.32,5.66,0,9.43,13.21,7.55,3.77,0,20.75,7.55,1.89,3.77,1.89,1.89,0,7.55,0,7.55,5.66,3.77,1.89,3.77,0,0,0,3.77,3.77,0,1.89,1.89,0,0,0,0,0,5.66,1.89,1.89,1.89,0,0,1.89,3.77,0,0,0,0,0,0,0,0,18.87,0,0,16.98,1.89,0,0,0,0,0,0,0,0,0,0,0,1.89,0,0,0,0,0,0,1.89,1.89,1.89,0,1.89,1.89,0,0,0,3.77,1.89,9.43,1.89,0,0,0,0,0,11.32,1.89,0,7.55,1.89,0,0,0
1btw9rj,2,https://www.reddit.com/r/WilliamsCollege/comments/1btw9rj/high_school_credit_to_graduate_early_at_williams/,9,2024-04-02 11:24:29+00:00,First-Cicada5721,combinedText,High school credit to graduate early at Williams? I’m an admitted international student with 10 A Levels and just wanted to check how they translate to credits at Williams. Has anyone been able to graduate early with A Level credits?,1,40,94.88,69.2,28.56,,13.33,25,90,67.5,47.5,7.5,5,2.5,0,0,0,2.5,2.5,7.5,7.5,2.5,20,7.5,5,2.5,0,10,7.5,7.5,7.5,0,7.5,0,10,0,10,5,2.5,2.5,2.5,0,0,0,0,0,0,0,0,0,0,0,0,0,10,2.5,0,0,0,0,0,7.5,0,0,0,0,0,0,0,0,20,0,0,12.5,7.5,0,0,0,0,0,0,0,0,0,0,0,2.5,0,0,0,0,0,0,0,0,7.5,2.5,0,5,0,0,0,5,5,5,0,0,0,0,0,0,10,2.5,0,5,0,2.5,0,0
1btvfz4,13,https://www.reddit.com/r/WilliamsCollege/comments/1btvfz4/what_is_a_typical_class_schedule_at_williams/,8,2024-04-02 10:36:07+00:00,AlternativeBasic8558,combinedText,What is a typical class schedule at Williams?,1,8,89.52,,15.38,,8,37.5,87.5,62.5,50,12.5,0,0,0,0,0,0,12.5,12.5,12.5,0,12.5,12.5,0,0,0,12.5,12.5,0,0,0,0,0,0,0,0,0,0,0,0,0,0,0,0,0,0,0,0,0,0,0,0,0,0,0,0,0,0,0,0,0,0,0,0,0,0,0,0,0,25,0,0,25,0,0,0,0,0,0,0,0,0,0,0,0,0,0,0,0,0,0,0,0,0,0,0,0,0,0,0,0,12.5,0,12.5,0,0,0,0,0,0,12.5,0,0,12.5,0,0,0,0
1bt67ge,36,https://www.reddit.com/r/WilliamsCollege/comments/1bt67ge/is_williams_worth_it/,19,2024-04-01 15:09:33+00:00,Old_Channel_1303,combinedText,"Is Williams worth it? Hey! I was recently admitted to Williams class of '28 as an international student. I didn't apply for any financial aid, and my middle-class parents—they have an annual income of around $60,000, but savings in the hundred thousands and family property inherited somewhere in the future—are concerned that the investment of $350,000 is not worth because its unlikely for me to get a well-paying job after Williams as a non-US citizen. I'll have to do a masters, which, if its in law or an MBA, will likely cost $200,000 more.

They're also concerned that its a massive blunder for me to cloister myself in rural Massachusetts, among American elites, when the global centre of power is shifting rapidly from West to East.

Williams does not have global brand, so its unlikely for me to come back to my home country in Asia and get a good job solely based on William's prestige.

My other options are UCL ($188,000), UCSD ($300,000), and Ashoka University ($60,000).

Obviously, if money wasn't an object, I would run to Williams; it's the best fit for a person like me and I see my thriving intellectually and socially over there. However, that's not the only, or even the most important factor for me right now. What do you guys think?",1,220,49.22,3.42,94.26,40.18,20,20.45,89.09,68.64,57.73,13.18,8.18,6.82,0,0.45,0,0.91,5,15.45,7.73,4.09,14.55,9.09,5.91,8.64,2.27,12.73,8.64,3.18,3.64,0.45,1.36,1.82,13.18,0.91,12.27,0.91,0.91,0.45,3.64,0.45,6.36,0,2.27,1.36,0,1.36,0.45,0,0,0,0,0,6.82,1.36,0.45,0,0,0,0.45,4.55,1.36,0,0,0.45,0.91,0.45,0.45,0,6.36,0,0.45,3.18,3.64,0,0,0,0,0,0,0,0,0,0,0.91,0,0.91,1.36,0,0,0,0.45,0,6.82,10,0,1.36,8.64,0.45,0,0,3.18,1.36,5.45,2.27,0.45,0.45,0,0,0,25,3.64,9.09,0.91,0.45,3.64,7.27,0
1bsttkk,1,https://www.reddit.com/r/WilliamsCollege/comments/1bsttkk/academic_prereads/,2,2024-04-01 03:48:01+00:00,worldclassbud,combinedText,"Academic prereads Hi,
I’m a class of 25 who is trying to get recruited athletically. I have a 3.85 uw and 2 Ap soph, 4 junior, prob 4 senior. Also I want to take the ACT over the summer. Lastly, would a free period senior year or calc ab vs Ap stats matter? (Want to major history) 
Thanks",1,58,84,22.04,7.91,91.69,11.6,8.62,82.76,56.9,37.93,6.9,6.9,5.17,0,0,0,0,0,8.62,8.62,8.62,10.34,6.9,3.45,5.17,0,17.24,6.9,0,1.72,0,1.72,0,13.79,0,13.79,0,0,6.9,1.72,0,3.45,0,5.17,5.17,0,0,0,0,0,0,0,0,10.34,5.17,1.72,3.45,0,0,3.45,5.17,0,0,0,0,0,0,0,0,6.9,0,0,6.9,0,0,0,0,0,0,0,0,0,0,0,0,3.45,3.45,0,0,0,0,0,0,8.62,1.72,0,0,1.72,0,0,0,6.9,1.72,3.45,0,1.72,1.72,0,0,0,20.69,6.9,6.9,1.72,0,1.72,3.45,0
1bs8kxl,3,https://www.reddit.com/r/WilliamsCollege/comments/1bs8kxl/visa_for_international_students/,1,2024-03-31 11:50:02+00:00,None,combinedText,"Visa for International Students  Hello! I was recently admitted and I have a question regarding visa processing to those students already at Williams, will the school provide requirements and/or information about the visa processing? or do I have to email the dean and personally ask for information?",1,48,62.1,11.66,89.39,52.41,16,33.33,85.42,56.25,52.08,8.33,6.25,6.25,0,0,0,0,2.08,10.42,8.33,0,12.5,10.42,4.17,10.42,0,14.58,2.08,0,2.08,0,0,2.08,12.5,0,12.5,8.33,0,0,6.25,0,4.17,0,2.08,2.08,0,0,0,0,0,0,0,0,18.75,14.58,0,4.17,0,0,8.33,4.17,0,0,0,0,2.08,0,0,2.08,8.33,0,0,8.33,0,0,0,0,0,0,0,0,0,0,0,6.25,0,0,0,0,0,0,0,0,2.08,2.08,0,0,2.08,0,0,0,4.17,4.17,2.08,6.25,0,0,0,0,0,10.42,0,2.08,4.17,2.08,0,2.08,0
1bs66ad,9,https://www.reddit.com/r/WilliamsCollege/comments/1bs66ad/previews/,8,2024-03-31 09:13:53+00:00,Appropriate_Gap_1186,combinedText,"previews? Hi, I'm a prospective student and I'll be going to the previews in April. I'm super excited and I wanted to hear from some current Williams students who attended previews.

I want to know if typically a lot of prospective students and their families attend the previews, how informative they are, any recommended classes or activities to participate in, and where students stay during the night (there wasn't a whole lot of detail in the website and acceptance letter). Also would it be better to attend alone or with a family member?

Thanks!",1,94,61.33,40.06,64.81,99,15.67,24.47,92.55,71.28,56.38,9.57,8.51,5.32,0,0,0,2.13,1.06,13.83,8.51,0,13.83,8.51,6.38,9.57,1.06,20.21,5.32,6.38,3.19,2.13,1.06,0,15.96,0,15.96,3.19,1.06,3.19,5.32,0,4.26,0,7.45,7.45,0,1.06,1.06,0,0,0,0,0,15.96,4.26,1.06,2.13,0,0,3.19,10.64,1.06,0,0,0,1.06,0,0,1.06,5.32,0,0,5.32,0,0,0,0,0,0,0,0,0,0,0,0,2.13,1.06,0,0,0,0,0,0,5.32,7.45,0,0,6.38,0,1.06,0,4.26,3.19,4.26,5.32,0,0,0,0,0,17.02,3.19,4.26,2.13,1.06,4.26,2.13,0
1bryzfc,8,https://www.reddit.com/r/WilliamsCollege/comments/1bryzfc/anyone_on_campus_easter_sunday/,3,2024-03-31 02:02:10+00:00,Minimum-City-5242,combinedText,"Anyone on campus Easter Sunday? I’m visiting from Oregon with my newly accepted kid tomorrow.  On Monday they have official admissions stuff planned, but if anyone is willing to talk to them tomorrow (Easter Sunday) to show them the amazing qualities of Williams that would be so appreciated and awesome.  I’m an old alum (- like really old - 1985) and there are so many new buildings I don’t know where to start.  They want to study CS, but also have interest in Tech Theater, building stuff, bouldering, etc.  They are trying to decide between CalPoly and Williams.  The answer is obvious to me 🙄, but they are worried they won’t get a deep technical education here.  I’m willing to bribe with whatever snack bar or other items you want.  Thanks for considering.",1,130,25.16,31.46,81.58,68.66,14.44,21.54,86.92,71.54,54.62,15.38,10.77,4.62,0,0.77,0,5.38,4.62,6.15,3.08,0.77,13.85,10.77,6.15,8.46,1.54,19.23,10,0.77,3.08,0,1.54,1.54,16.15,0,16.15,4.62,0,3.08,3.08,1.54,4.62,0,6.15,4.62,1.54,3.08,2.31,0.77,0.77,0,0,0,13.08,4.62,1.54,0.77,0,0,2.31,8.46,0,0,0,0,1.54,0,0,1.54,3.85,0.77,0,2.31,0.77,0,0.77,0,0,0,0,0,0,0.77,0,0,1.54,1.54,0,0,0,0,0,0,6.92,5.38,0,0,4.62,0.77,0,0,7.69,0.77,6.92,3.08,0,0,0,0,0,20,6.15,4.62,0.77,0,3.85,4.62,0.77
1brnzt0,10,https://www.reddit.com/r/WilliamsCollege/comments/1brnzt0/is_the_williams_club_worth_it/,1,2024-03-30 17:59:58+00:00,maddyjulia,combinedText,"Is the Williams Club worth it? I’m considering it as a place to stay when I’m in Manhattan, and also to make use of the reciprocal clubs, primarily in Europe. 
(I’m 57F)",1,32,34.33,4.83,96.5,,10.67,15.63,90.63,71.88,59.38,15.63,9.38,9.38,0,0,0,0,6.25,9.38,9.38,3.13,18.75,12.5,9.38,12.5,0,25,0,0,6.25,6.25,0,0,12.5,0,12.5,3.13,6.25,0,0,0,0,0,0,0,0,0,0,0,0,0,0,0,3.13,3.13,3.13,0,0,0,0,0,0,0,0,0,0,0,0,0,9.38,6.25,0,0,3.13,0,0,0,0,0,0,0,0,0,0,0,0,0,0,0,0,0,0,0,9.38,12.5,0,0,12.5,0,0,0,3.13,0,12.5,0,0,0,0,0,0,28.13,3.13,6.25,3.13,0,9.38,6.25,0
1brn6ui,10,https://www.reddit.com/r/WilliamsCollege/comments/1brn6ui/how_did_you_guys_get_your_things/,5,2024-03-30 17:25:14+00:00,Aggressive-Hornet781,combinedText,"How did you guys get your things? hey guys! I just committed to williams and i’m an out of state student, but was wondering how you guys got your dorm stuff in? I obviously just plan to bring all my clothes and buy all the necessities from walmart, but do i get to walmart by bus? Is there a better way to do it, or is there another place students move their things in? Thank you!!",1,76,17.38,87.2,97.49,61.63,12.67,14.47,93.42,76.32,64.47,21.05,14.47,6.58,0,6.58,0,1.32,6.58,13.16,3.95,0,13.16,9.21,9.21,6.58,0,18.42,1.32,3.95,3.95,0,3.95,0,14.47,2.63,11.84,5.26,2.63,0,2.63,1.32,5.26,0,2.63,2.63,0,0,0,0,0,0,0,0,18.42,3.95,1.32,1.32,0,0,2.63,14.47,0,0,0,3.95,0,0,0,0,3.95,0,1.32,2.63,0,0,1.32,0,0,0,0,0,0,0,0,1.32,0,3.95,0,0,0,0,0,1.32,11.84,11.84,0,2.63,9.21,0,0,0,0,2.63,3.95,1.32,1.32,1.32,0,0,0,14.47,0,3.95,5.26,3.95,1.32,0,0
1brkp6e,3,https://www.reddit.com/r/WilliamsCollege/comments/1brkp6e/loci_advice/,7,2024-03-30 15:37:25+00:00,Waffle_Of_Fury,combinedText,"LOCI Advice Hello everyone!!

I'm an international student that recently got waitlisted from William's. I've been looking into the past common set data and how to approach writing my letter of continued interest.

Has anyone here gotten in from the waitlist, with full aid?

How important is the LOCI, considering I don't have many major updates to my college application?

Thanks!",1,61,60.32,16.05,98.05,89.9,10.17,27.87,85.25,70.49,49.18,13.11,8.2,8.2,0,0,0,0,4.92,13.11,6.56,0,13.11,11.48,4.92,1.64,1.64,21.31,13.11,3.28,0,0,0,0,8.2,1.64,6.56,4.92,3.28,0,1.64,0,0,0,4.92,4.92,0,0,0,0,0,0,0,0,13.11,8.2,4.92,3.28,0,0,6.56,4.92,0,0,0,0,0,0,0,0,4.92,0,0,4.92,0,0,0,0,0,0,0,0,0,0,0,0,0,3.28,3.28,1.64,0,0,0,0,1.64,11.48,0,1.64,8.2,1.64,0,0,6.56,6.56,8.2,0,0,0,0,0,0,21.31,3.28,3.28,3.28,4.92,6.56,0,0
1br4z18,30,https://www.reddit.com/r/WilliamsCollege/comments/1br4z18/williams_vs_cornell/,27,2024-03-30 01:01:21+00:00,DeepAd5366,combinedText,"Williams vs Cornell Hi!

I need some help deciding between Williams college and Cornell.

I’m not sure which kind of school I’ll like. I applied as a Computer Science and Philosophy (but that might change into Government) major. I want to go to law school or business school but I’m not 100% sure about that either. My top priorities out of a college experience is study abroad opportunities and getting internships.

If anyone made a similar decision (or even if you didn’t) I would really appreciate any help. Thank you!!",1,90,22.17,1,99,97.84,11.25,24.44,90,66.67,53.33,15.56,11.11,8.89,0,2.22,0,0,4.44,10,3.33,1.11,12.22,7.78,3.33,12.22,3.33,15.56,5.56,1.11,5.56,2.22,1.11,2.22,31.11,0,31.11,3.33,2.22,3.33,12.22,1.11,14.44,0,6.67,6.67,0,1.11,1.11,0,0,0,0,0,8.89,5.56,4.44,2.22,0,0,2.22,3.33,0,0,0,0,2.22,1.11,0,1.11,11.11,0,0,11.11,1.11,0,0,0,0,0,0,0,0,0,0,1.11,1.11,1.11,0,0,0,1.11,0,1.11,6.67,5.56,0,1.11,5.56,0,0,0,1.11,2.22,3.33,2.22,0,0,0,0,0,20,6.67,0,0,3.33,4.44,5.56,0
1br0flr,4,https://www.reddit.com/r/WilliamsCollege/comments/1br0flr/williams_and_engineeringtransfer/,15,2024-03-29 21:49:05+00:00,Aggressive-Hornet781,combinedText,"Williams and engineering/transfer Hello all!! so I’ve been honored to be apart of the class of 2028, but I personally realized that I would like to go into electrical engineering. Because of this, I plan to transfer after my first year into an engineering specific school, but have heard that the other Ivy League schools consider Williams as a school on the same level. do you guys think transferring to an ivy is a lot easier being at williams? I’m already committed and have full intentions of going, and I was just generally curious! thank you all for your replies!!💜💜",1,101,58.1,19.83,88.55,95.66,16.83,22.77,94.06,71.29,59.41,12.87,9.9,6.93,0,2.97,0,0,2.97,16.83,6.93,1.98,15.84,10.89,3.96,8.91,0,19.8,5.94,4.95,3.96,0.99,2.97,0,16.83,1.98,14.85,4.95,1.98,1.98,0.99,0,4.95,0,5.94,5.94,0,1.98,1.98,0,0,0,0,0,8.91,3.96,0.99,1.98,0,0.99,2.97,4.95,0,0,0,0.99,3.96,0,0,3.96,9.9,0,0,9.9,0,0,0,0,0,0,0,0,0,0,0,0,0,0,0,0.99,0,0,0,0.99,4.95,7.92,0,1.98,5.94,0,0.99,0,1.98,5.94,1.98,1.98,0,0,0,0,0,14.85,1.98,3.96,0.99,4.95,1.98,0.99,1.98
1bqrrtp,7,https://www.reddit.com/r/WilliamsCollege/comments/1bqrrtp/previews/,3,2024-03-29 15:16:35+00:00,AvgeekStan,combinedText,"Previews Hey everyone!

For people travelling to Previews, do you know if we will stay in dorms for free or do we have to book our own accommodation?",1,28,35.59,99,48.09,75.77,14,17.86,85.71,71.43,57.14,17.86,14.29,0,10.71,3.57,0,0,3.57,3.57,0,0,17.86,14.29,0,7.14,0,25,3.57,0,14.29,10.71,0,3.57,14.29,3.57,10.71,3.57,0,0,7.14,0,7.14,0,3.57,3.57,0,0,0,0,0,0,0,0,21.43,3.57,0,0,0,0,3.57,17.86,0,0,0,0,0,0,0,0,7.14,0,3.57,3.57,0,0,0,0,0,0,0,0,0,0,0,7.14,0,0,0,0,0,0,0,0,17.86,7.14,0,0,7.14,0,0,0,0,0,0,10.71,3.57,3.57,0,0,0,10.71,0,3.57,3.57,3.57,0,0,0
1bqddjn,91,https://www.reddit.com/r/WilliamsCollege/comments/1bqddjn/uchicago_versus_williams/,51,2024-03-29 01:55:37+00:00,No_Strawberry6965,combinedText,"UChicago versus Williams Hello everybody! Thank you so much for everyones advice and input on my last post. I was just admitted to UChicago and wanted to know what your thoughts on Williams were in comparison. Things like class difficulty, pre-law opportunities, intellectual engagement, student culture and body etc. From what I can tell differences in prestige are minimal at best so really just trying to get to know the schools writ large. Thank you all so much and I look forward to potentially committing!",1,85,46.7,54.11,23.38,88.2,14.17,25.88,85.88,65.88,52.94,14.12,8.24,4.71,0,3.53,0,0,5.88,7.06,1.18,0,16.47,4.71,8.24,8.24,0,15.29,4.71,4.71,4.71,0,3.53,1.18,18.82,3.53,15.29,4.71,0,3.53,1.18,1.18,3.53,0,7.06,5.88,1.18,0,0,0,0,0,0,0,15.29,7.06,3.53,3.53,0,0,5.88,7.06,0,0,0,0,0,0,0,0,3.53,0,0,3.53,0,0,1.18,0,0,0,0,0,0,0,0,0,1.18,1.18,0,0,0,1.18,0,0,7.06,4.71,1.18,0,3.53,1.18,0,0,1.18,3.53,2.35,1.18,0,0,0,0,0,11.76,4.71,3.53,0,2.35,0,1.18,0
1bpzd8f,1,https://www.reddit.com/r/WilliamsCollege/comments/1bpzd8f/grad_program_decisions_out/,3,2024-03-28 16:10:30+00:00,Muffins-for-All,combinedText,Grad program decisions out? Does anyone know when Williams typically releases decisions for their graduate programs? I’ve gotten decisions from all my other schools and am starting to get nervous that I won’t hear back from Williams before my decisions are due.,1,42,18.12,9.23,99,3.2,14,33.33,92.86,66.67,52.38,16.67,11.9,9.52,0,0,0,2.38,4.76,14.29,0,0,14.29,11.9,4.76,7.14,2.38,23.81,4.76,2.38,4.76,0,4.76,0,21.43,2.38,19.05,11.9,0,0,4.76,0,2.38,0,2.38,0,2.38,2.38,0,2.38,2.38,0,0,0,7.14,0,0,0,0,0,0,7.14,0,0,0,0,0,0,0,0,11.9,0,0,11.9,0,0,0,0,0,0,0,0,0,0,0,0,0,4.76,0,0,0,0,0,0,9.52,7.14,0,0,4.76,0,2.38,0,9.52,4.76,7.14,2.38,0,0,0,0,0,11.9,2.38,0,4.76,0,4.76,0,0
1bpk75d,28,https://www.reddit.com/r/WilliamsCollege/comments/1bpk75d/i_love_the_socks/,10,2024-03-28 02:14:53+00:00,Impossible_Insect_36,combinedText,I love the socks This is not a serious post but I was recently admitted and got sent a congratulations box. These socks look fire but the tote bag feels somewhat illegible ❤️,1,32,34.33,1,89.39,96.74,16,18.75,75,62.5,46.88,12.5,6.25,6.25,0,0,0,0,6.25,18.75,12.5,0,0,6.25,3.13,9.38,3.13,18.75,3.13,0,0,0,0,0,18.75,0,18.75,6.25,0,0,3.13,0,9.38,0,6.25,6.25,0,6.25,6.25,0,0,0,0,0,9.38,9.38,3.13,3.13,0,0,0,0,0,0,0,0,0,0,0,0,0,0,0,0,0,0,0,0,0,0,0,0,0,0,0,0,0,3.13,0,0,0,0,0,0,6.25,6.25,3.13,0,0,3.13,0,3.13,3.13,6.25,6.25,0,0,0,0,0,0,3.13,3.13,0,0,0,0,0,3.13
1bmzbcg,29,https://www.reddit.com/r/WilliamsCollege/comments/1bmzbcg/considering_williams_with_ivies/,27,2024-03-24 23:46:12+00:00,No_Strawberry6965,combinedText,"Considering Williams with Ivies Hello everyone! I was just admitted to williams which has been my top choice for awhile now. However, looking towards ivy day now and it seems like a lot of my friends would rather go to brown or penn than williams for outcome and prestige purposes. Would i get the same opportunities here at williams in comparison to other top schools? Is williams seen as comparable to ivies in terms of employement clout for lack of a better term haha. How does the workload and education look like at williams in comparison to other schools, harder or easier usually? Im planning on going to law school eventually so just wanted everyones opinions on williams law placement as well!",1,122,73.7,3.19,98.05,89.9,17.43,26.23,88.52,71.31,54.92,7.38,4.1,4.1,0,0,0,0,3.28,7.38,3.28,0,21.31,6.56,10.66,8.2,0,15.57,8.2,3.28,5.74,0.82,2.46,2.46,22.95,1.64,21.31,5.74,2.46,3.28,4.1,0,9.02,0,4.92,4.92,0,0.82,0.82,0,0,0,0,0,4.1,1.64,0,0.82,0,0,0.82,2.46,0,0.82,0,0,0,0,0,0,4.1,0,0,4.1,0,0,0,0,0,0,0,0,0,0,0,0,0.82,0.82,0.82,0,0,0.82,0,0,8.2,10.66,0.82,0.82,7.38,3.28,0,0,5.74,3.28,5.74,3.28,0.82,0.82,0,0,0,7.38,2.46,1.64,1.64,1.64,0,0,0
