post_id,comment_id,comment_body,comment_score,comment_author,comment_rank
fmv3yo,fl69kwf,"Extension school is only like ten grand a semester, two bushels of wheat they say.",20,NoEngrish,1
fmv3yo,fl8zqnw,[deleted],5,None,2
fmv3yo,fl7okw3,"So get them all, then some? :)",1,LiveEhLearn,3
gfeydf,fpt6bej,OP this is fucking amazing. Did you make this?,83,ducttapetricorn,1
gfeydf,fptgota,"Harv's full **student** spectrum, on the faculty we have everyone from Banderites to iraq war planners.

a couple of orthodox Marxists hiding in the hard sciences and math as they are capable of grasping the infallible science of dialectical materialism",25,None,2
gfeydf,fptbavv,Stellar work...well done!,17,None,3
d7u9vh,l49uobp,😂,1,BrainStorm_707,1
a64il6,ebtdxf3,Come to Cornell,206,The_Poseidolon,1
a64il6,ebru9eq,"> *and besides, it gives you more opportunities to tell their friends where you go to school.* 

fuck lmao",111,harverdreject,2
a64il6,ebs8r35,"Also important to follow the ""Harvard time"" rule. When speaking to any person that you aren't certain is aware that you are a Harvard student, make sure that you mention it within 7 minutes of meeting them. 
Sometimes this can be tough because people want to talk about things that aren't relevant to your announcement. Getting a Harvard phone case and setting a 7 minute timer is key, if it hasn't come up within the first 6 mins, go ahead and pull up your phone so they can see it and Google whatever subject they are talking about and Harvard, there will usually be something that pops up and work that into the conversation quickly.",95,Nickbarc,3
jg1u67,g9nsuau,"Think about how many service staff salaries that money would pay for before you make too many jokes. Fewer students on campus means fewer buildings open, fewer custodians, tradespeople, dining services, transportation, etc.",22,sambaty4,1
jg1u67,g9npyt0,And 3% of their operating income...,7,ethrael237,2
jg1u67,g9o4d9e,"I’m not sure what an endowment is, but I will figure it out!",7,bennyboy361,3
iyzkqf,g6gdn6e,Looks like a rectangle. No scholarship for you. Have fun at Yale.,46,meatfrappe,1
iyzkqf,g6fqcxt,Welcome to Harvard.,14,None,2
iyzkqf,g6fnmpk,More dream drawings in case anyone is interested: [https://www.instagram.com/alncomics/](https://www.instagram.com/alncomics/) :),3,cuddlesandwich,3
g4o894,fnzb3rd,He dropped the B bomb,50,monsooncloudburst,1
g4o894,fo036xi,"So now people will say “I went to college in Boston, well Texas really, but just for 2 semesters due to that whole Coronavirus thing, but spent most of my time around Boston”",28,Jenbrooklyn79,2
g4o894,kw8e0ax,"No, not Blufts...",2,montym,3
b1lkzz,eimond0,I know someone with a 2.8 and a 1000. She had great ECs though. Haven’t heard of lower,50,UltraYam,1
b1lkzz,eimq8bg,"I got some D's in high school (I kind of never remembered to do my homework) and only got a 1520 on my SAT's, but I still got in.  Not a rich kid, though.  Also, my weighted GPA ended up still top 10 in a class of... 700 or so kids?  Only semester grades counted, so my D's got averaged with A's and ended up as (low) B's.  Except in one class where I got a C because I had pneumonia during the final and/or didn't study enough.  I mostly got better after freshman year, but still, my unweighted GPA was not very much above 3.5.  I don't remember what it was, exactly.  Long time ago.  Also I did win lots of math competitions, so maybe my un-stellar GPA and SAT were ignored.  Long story short, my family wasn't rich enough to bribe anyone but I still got in.  The admissions office must have made a mistake.  Oh well.  Too late now, bitches!",47,xiipaoc,2
b1lkzz,eimyitl,"Yeah but you gotta be RICH rich. Like old money wealthy, like a building on campus is named after your family rich. There's actually not as many as you'd think, though. There are tons of students who can't afford tuition that seem to have great financial aid packages. Hopefully this is because the administration is putting those donation dollars to good use.
",30,the_bririonman,3
fvnli8,fmjk9xv,Wow this looks great,19,None,1
fvnli8,fmjsqkb,"With the situation that’s headed towards us, you could probably make one for each student that graduated with him and still have time left over. 

(_awesome work of art, by the way!_)",16,Osko5,2
fvnli8,fmjfxh0,Please don't raise the bar for untalented parents like me:) Looks great though.,12,skurmus,3
ho8mpi,fxg8dfe,[deleted],20,None,1
ho8mpi,fxgnnh2,"Those damn r/funny reporters, always stealing our memes.",14,None,2
ho8mpi,fxifbdi,"too expensive. make it $50,000 I’ll take it",3,Gwanbuk,3
b9vcqk,ek7b6s0,anxiety,146,randy-lenz,1
b9vcqk,ek75p3v,I got a free Washington post subscription by using my Harvard gmail.,57,InfamousMarzipan,2
b9vcqk,ek7brib,"There’s a page for free software with Harvard ID like Office Suite, Mathematica, Matlab, etc. and then also a special Microsoft store where you can download free Windows and the like.  I think you can also look on tbe library page for a bunch of journal and database subs.  Will update with links when I get home.",28,Philosecfari,3
fgdxf3,fk3y3qq,"Getting the CGI backgrounds is also a great way to show off. You can be on the bridge of the Enterprise, on a tropical island, sitting outside of a Paris cafe, underwater with sharks, wherever you want to be.",28,JimTheBro,1
fgdxf3,fk3wgkc,Three words: Indoors Cowboy Hat.,27,Rabbitary,2
fgdxf3,fk45gg4,10/10 post op,18,ducttapetricorn,3
igogvj,g2vk3n7,[removed],41,None,1
igogvj,g2v29ag,Jeez since when were we allowed to swear in this civil sub?,23,xFlames_,2
igogvj,g2w2qgs,I would like to beat them in rowing. Back to back to back national champs is getting annoying,1,steady_spiff,3
dxyjks,f7y9hvm,"*Having fun isn't hard, when you've got a library card!*",15,-Metacelsus-,1
dxyjks,f800lar,"I can be anythiiiing!

Take a look, it's in a book,

Widener Libraryyy!",7,None,2
dxyjks,f7y7cut,😂😂😂😂😂,3,brokecollegekid69,3
b6sx0u,ejmxjtb,Waitlisted but congrats to everyone who got accepted!,21,lycaonpictus2,1
b6sx0u,ek29v7n,Ps: HOLY SHIT YOU HAVE SO MUCH KARMA.,15,HarverdDropOut,2
b6sx0u,ejmzwcy,[deleted],10,None,3
jll5nn,gappe8o,That is beautiful,3,oajm,1
fjv4bx,fkp6k3v,I’d always wondered about University Hall. Very interesting!,23,Gzideck,1
fjv4bx,fkp6o2b,r/usernamechecksout,11,None,2
fjv4bx,fkpllrw,"What was Loeb before?

Also, everything about Lionel it everyone's worst stereotype of Harvard.",5,pterencephalon,3
jzz35e,gdewgjz,Really cool,9,PhishIndependent,1
jzz35e,gdflo7q,Thanks for sharing! That stein is awesome,8,oajm,2
jzz35e,gdhkylu,"I collect German steins. The Harvard stein is somewhat valuable. $100 to $125 range. It's not an antique or an artisan stein, but it has collectible value because of the subject.",5,meatfrappe,3
fgoi4g,fk6a220,It’s now the Harvard University *online*,23,TradingToni,1
fgoi4g,fk6cg77,"Technically a virus, but the point stands!",4,Willowist,2
hxr9qh,fz7uk3n,"Yes, and it’s *concentration",127,Gzideck,1
hxr9qh,fz7uofr,[deleted],64,None,2
hxr9qh,fz7vtev,"As someone who graduated from Harvard, I can confirm this. LOL

Whenever I meet people for the first time (or generally people I am not close with) I usually say I went to school up in Boston hoping they wouldn't follow up with ""where?""

It's a thing.",62,geoduri,3
b1sxrf,einwj71,very funny,10,mrhaircut34,1
b1sxrf,eipaco0,>doesn’t give a fuck if the statue looks like him or gets the date right,2,crimsonchin68,2
aemaru,edqhcfy,Yalies use *Bing.*,70,Gzideck,1
aemaru,edqor9w,"Harvard and Stanford are close, but I think we definitely beat them on related queries. Jeeezzzus.

https://i.imgur.com/TWxk7sc.png",47,None,2
aemaru,edqgx36,Lol ,10,goldengirl_7,3
dqfq2r,f6356jg,Is it possible to learn this power?,44,Westland1108,1
dqfq2r,f67aric,[deleted],26,None,2
dqfq2r,f64zhs8,Madlad,13,None,3
kc7ccy,gfoddtv,"Thank God for the lovely professors who do this. Nothing is worse than doing all the practice, prep and studying - and the exam has stuff not covered in the class or it focuses on the opposite stuff than the professor said.",14,MillionaireWaltz-,1
kc7ccy,gophses,i am go to big skool,1,Bosswarrior53,2
esje2i,ffao710,"So 🧐 I get off 🏃‍♀️💼 my flight ✈️, I am starving 😣😩😫, I drag 🏋️💪 my shit 🧳💩 into 💼🚣 my dorm 🏘️, and slog 🚶🚶over to Annenberg 🏚️🧱🤮––and it's fucking closed ❌⛔🔒! Excuse me 😠😠 what the fuck 🤔🤬, the only 🥇1️⃣☝️ thing worse 👎👎  than eating 🤢🤮 at Annenberg 🧱⛪ is not ❌ being 🙇 able 🙅 to eat 🗣️🍔 at 👇Annenberg 🕍. Why ❓❓ was I 😤😤 not 🚫 informed ℹ️ of this!?⁉️⁉️

And ➕ for every 👨‍👧‍👦 one 🎯 of you fucking 🤬 narcs 👮🕵️ that are going ➡️ to tell🕺 me that I should 🤷 have read 📖 the emails 📩 about winter❄️⛷️session👩‍🎓, or done 🤹 ""due 👏👏 diligence 👏👏"" or ""practiced 👏👏 basic 👏👏 planning 👏👏/foresight 👏👏👏👏"", I would like ❤️ to issue 📤📤 a hearty 💕 fuck 😡🤬 you 🖕👉. There are a thousand ♾️ fucking 🤬 emails 📧 from those nerds 🧐🤓 and half 1️⃣➗2️⃣ of them are telling 🧏 me to 📒 journal 🙄😴😴 my feelings 😵🤯 about this new 💥✨ phase 🌒 of my life 🙍and the other half 2️⃣➗4️⃣ are telling 🤥😆 me about some obscure 🙈 guest🕴️speaker 👩‍🏫 coming 😩 to talk 👄 about climate change's 🔥🌎🔥affect ☄️ on midichlorian 🦠 counts 🔢 or some ➕ other 😒 inane 🥴 bullshit 💩💩💩. 

I am fuming.",143,isotope-12,1
esje2i,ffakx5d,">	There are a thousand fucking emails from those nerds and half of them are telling me to journal my feelings about this new phase of my life and the other half are telling me about some obscure guest speaker coming to talk about climate change's affect on midichlorian counts or some other inane bullshit.

Im rolling.",55,cbautista103,2
esje2i,ffad794,"Quincy and Lowell are open, and the food is often better in the houses anyway!",43,rob-cs50,3
fgdk8a,fk49ftr,[deleted],37,None,1
fgdk8a,fk5yd0h,I’m dead!!,3,Jenbrooklyn79,2
fgdk8a,fpumxmw,As a class of '21 HUES student...I've been on campus for the last 3 years exclusively. I am NOT liking doing online.,1,MillionaireWaltz-,3
fudc47,fmc3qrm,I love this. Used to date a girl at Harvard & the turkeys always made me so happy to see roaming around.,15,Janko5858,1
fudc47,fmc99ri,Did they close the gates to Harvard Yard or are they still mainly open?,4,brokecollegekid69,2
fudc47,fmdg8o4,Don't know why but I've always been scared of them. So unsure of their intentions... I keep my distance.,1,the_bririonman,3
j9qz8y,g8ld31i,Sometimes I wish to participate in a Harvard class to learn cs.,0,None,1
hnhgmp,fxe5ycy,"[Petition to, ""Allow F-1 and M-1 students to remain in the US with online-only classes""](https://www.change.org/p/student-and-exchange-visitor-program-sevp-allow-f-1-and-m-1-students-to-remain-in-the-us-with-online-only-classes) - 330,000 and counting",1,johnabbe,1
hnhgmp,fxbcthv,[deleted],-42,None,2
jkmztg,gakbs4v,The Autumn scenery is one of the best things about Harvard 🥺,11,Rhys718,1
jkmztg,gakmo5n,Jealous. I still haven’t been. Will campus be open next year?,3,Ve_Ri,2
jkmztg,gak5uug,Have you been to Mt Auburn Cemetery?,2,Dr_Bunson_Honeydew,3
j3a2yc,g7aj0zh,"Thanks for posting! It’s a beautiful and serene evening! 
Missing the campus! 😥",18,life-rendezvous,1
j3a2yc,g7bm20f,No pee streams on the John Harvard statue! Nature is healing,10,aaaalllleeeexxxx,2
j3a2yc,g7bbx8q,Thank you for refreshing my memory. Beautiful,4,beaduck4ever,3
g0kdob,fnad9zw,[deleted],37,None,1
g0kdob,fncc3i2,"This is an ad hominem attack on people who don't agree with her. She can't win on her argument, so she decides to attack the messenger instead. In this case, Harvard Bernie supporters.",5,BigRed1636,2
hphpnz,fxr2odd,"Custom Barber Shop has been on Brattle Street since forever, and it is one of the few places that you can get a decent haircut without breaking the bank. 

However, due to the lack of students (caused by COVID), this icon is in danger of disappearing for good. To make matters worse, the current owner (Nick) has zero experience working with modern media and communications. (The guy doesn't even use a cellphone). 

I was hoping to get the word out through this subreddit and help prevent another long-time, independently owned business to disappear from Harvard.  To help, just go and get a haircut.",42,fepec,1
hphpnz,fxrhq4i,Too bad I’m in home in jersey...... can he take on a student project to create a social media presence? I’d hate to see a small business go out of business.,6,brokecollegekid69,2
hphpnz,fxu036c,How much is a haircut?,1,ethrael237,3
i96zul,g1d5fzq,"I genuinely feel so bad for all the freshmen out there. I know this is the safest option and I think that Harvard shouldn't offer campus housing either, at least until winter quarter, but it really sucks",37,pinkstardust007,1
i96zul,g1exhbs,Wild how harvard made this decision long ago and many people mocked it and now look at every other school delaying until the last minute then following in our footsteps,22,stairwaytokevin23,2
i96zul,g1dizn3,[deleted],-12,None,3
a40lkh,ebbzdfz,"Fucking preach, Seth",23,capnlumps,1
gsjre6,fs5vmog,"As a speech that could only have been given digitally, this is as good as it gets.",37,theeyeguy84,1
gsjre6,fs6tysa,[deleted],8,None,2
fun2a3,fmegeq7,See what coupons the store's financial aid office will give you.,41,JimTheBro,1
fun2a3,fmepz0q,It depends on your specific dish. Some sections are better than others in different fields so it comes down to which store managers and cashiers you want on your panel.,6,None,2
fun2a3,fmf85g2,"Consider the the dish you want to make and consider which cheese will better compliment that palette. 

The task is to think about how your needs will evolve over time and which ingredient will better accommodate your taste.",6,Newnetherlander,3
hr852u,fy2ijon,[deleted],39,None,1
hr852u,fy2jiq1,"The government's attorney just walked into the room and announced they were folding completely, going back to the permissive March rule that suspends the in-person requirement for the duration of the emergency.

Props to everyone involved: Harvard and MIT, their great lawyers, all the students who submitted testimony explaining what a hardship this would be, and *amicus* filers including hundreds of other universities, HGSU, and FIRE. Solidarity works!",36,vegatwyss,2
hr852u,fy2lbln,[deleted],21,None,3
azslj1,eibkxlo,They got me; that’s for damn sure. Peace.,4,JPMorganBoyz,1
azslj1,ei9txzg,"##r/theivyleague
---------------------------------------------
^(For mobile and non-RES users) ^| 
[^(More info)](https://np.reddit.com/r/botwatch/comments/6xrrvh/clickablelinkbot_info/) ^| 
^(-1 to Remove) ^| 
[^(Ignore Sub)](https://np.reddit.com/r/ClickableLinkBot/comments/9wy10w/ignore_list/)",1,ClickableLinkBot,2
bnwy4x,enabat4,I thought Gaben lived in wigglesworth. That's at least what I learned when I looked it up. Guess I've been spreading misinformation for a few years 🤷‍♂️,17,gdavtor,1
bnwy4x,enan4pv,God forbid he transfer Houses and live in residence #3.,7,xiipaoc,2
k471zq,ge7343j,I really like your floor. The pennant is chic too,14,pinkstardust007,1
k471zq,ge74udj,"it’s a very nice wood floor, good color.",7,Jenbrooklyn79,2
k471zq,ge8m4go,"Very cool. Know anything about it? Year, subject matter, etc.?",4,buschcamocans,3
hd9qlz,fvnhhmi,Did you find out what was at the sale?,1,Bearcats_RallyPossum,1
hd9qlz,fvkdkcf,[deleted],1,None,2
hjmklo,fwnbfwg,The tik tok was a bad idea.,56,allende1973,1
hjmklo,fwn7koj,"Black lives matter.  

That being said, her blaming trump supporters for losing her job seems demonstrative of the bubble that she lives in.",41,Sacrificial_Slug,2
hjmklo,fwndk69,"> ""I’m too strong for you. I’m too strong for any of you ‘All Lives Matter,’ racist Trump supporters. It sucks. But it doesn’t suck as much as systemic racism. And I’m not going to stop using my platform to advocate for it. I’m sorry, Deloitte, that you can’t see that. **That you were cowardice [sic] enough to fight somebody who’s going to make an indelible change in the world and is going to have an impact.**""

This was 100% about her ego and 0% about Black people.",33,TheSausageKing,3
df7lbk,f351v3i,"The nicest part was how so many people stopped on the Weeks Footbridge to take it all in. It was filled! I find that most on campus people don’t stop to look up when walking, so it was nice to see everyone taking in the scenery.",3,oajm,1
ge0g28,fpkh8w9,"inb4 we're not all men (or harvard students). Yes, but I couldn't [resist](https://www.youtube.com/watch?v=pObavmn97V0&ab_channel=HarvardUniversityBand-Topic).",32,gdavtor,1
ge0g28,fpkh9mh,bold of the subreddit's moderators to assume everyone goes to Harvard here,31,YoursTrulyBalls,2
ge0g28,fpkqng9,Illegitimum non carborundum,10,montym,3
bhtft6,elwamyw,Fkin legend,7,sormazi,1
bhtft6,elxjxh1,[deleted],4,None,2
diff9k,f3xcsfs,"When Remy applied to Harvard, what did he write in his admissions essays? How did he distinguish himself from all the other cat-applicants? Did he win a national award for catching the most mice?

I'm asking because my cat, ZeeZee (a/k/a Zelda) wants to attend Harvard but is also considering Wellesley as a safety school.",11,Dkennemo,1
diff9k,f3vkueu,How many other people called the owner thinking Remy was a lost cat?,9,oajm,2
diff9k,f3voa8j,Who is Remy and where can I find him/her????,9,None,3
c00l4m,eqzcaue,[deleted],11,None,1
c00l4m,eqzsz4n,I totally BSed my writing placement essay ugh,4,etymologynerd,2
c00l4m,er34gge,A meme on r/Harvard? What happened,2,zdarlights,3
fstest,fm3cx4s,Can we...talk about “the rats”?,30,Osko5,1
fstest,fm4racs,Is Marjorie the one who always says enjoy your dinner and have a great night? If so I would die for Marjorie,8,Omnideficient,2
fstest,fm4uy1q,John from the berg is the best!! I hope he’s doing well.,5,macthepenn,3
aa8szj,ecq722h,r/HarvardShowerThoughts,36,crimsonchin68,1
aa8szj,ecqr7iw,lol,1,mileylols,2
fkhzs1,fkstyvi,Don't say this......I have waited years to have this.,8,andrewcool22,1
fkhzs1,fksu3k8,Oof,2,None,2
eyznku,fgkc0yu,Glad we're able to learn from your mistakes.,28,gearity_jnc,1
eyznku,fgkg6bm,not to be weird about it but age of consent is actually 16 in massachusetts so you don’t really have to worry,15,mackerel2,2
eyznku,fgm4ah2,"Visit..ass??

I'll see myself out.",10,montym,3
fxmtsj,fmvduwb,Eliot Dhall?,11,Gerenjie,1
fxmtsj,fmy3srq,[deleted],3,None,2
fxmtsj,fmw1k65,"Looks the same, except our chairs are a bit different",2,oajm,3
d5q03s,f0nil5t,"I live in Wigglesworth, and I'm not sure how sane I'll be after hearing ""Here Comes the Sun"" every 45 minutes for the next 8 months.",27,None,1
d5q03s,f0odw9j,The drug addicts tend to leave once it gets cold. Don't worry.,3,phdboston,2
d5q03s,f0pnjy6,earplugs?,0,theendiswhat,3
a3hfu6,eb6vbzq,Area man made it into a club and is totally pumped,14,throwfartheraway2000,1
a3hfu6,eb79ppy,"Next up...

Harvard releases official rule stating ""everyone should be included and differences celebrated"" riots ensue as people want the right to segregate. ",13,ayecommentus,2
a3hfu6,eb69tyq,K. ,11,new_whistle,3
kfw3jc,ggb4ftd,Oliver Knill is so awesome,16,radar3699,1
kfw3jc,ggbfkyo,More like math 21c+ amirite,10,weenies_with_bread,2
kfw3jc,ggb87b1,Me and Physics 15b,3,HeliosPh0enix,3
g98627,forz7m4,"I'm most frustrated by their contradictory position that tuition will not be prorated because degrees and course are continuing even though in-person interactions aren't, but that the campus aims to reopen with all haste because everyone understands that much of the value of Harvard is in the people and the interactions.

&#x200B;

Harvard is stealing the words from Ray Liotta's lips: ""Fuck you, pay me.""

[https://www.youtube.com/watch?v=8L4HHPTiZN8](https://www.youtube.com/watch?v=8L4HHPTiZN8)",28,RSchaeffer,1
g98627,fosb1r2,"Full tuition for online semester is not fair. It must be discounted. If they have hardships, so do students. 

Staying home could be a hardship too for many, let alone studying at odd hours without in-person collaboration with peers, and actual on-campus experience. 

If it’s a complete online-semester then it is only fair to have discounted tuition.",23,life-rendezvous,2
g98627,fosdqc3,"This is one of those cases where you yada yada-ed the worst parts.

I needed a stiff one after those two emails. I've never read something that had so many words but said so little.",9,sk8rboiiiiiii,3
ffiqzc,fjz7oar,"Coronavirus, with a .1% fatality rate for the 19-29 age group, has the potential to kill on average of 6 students if everyone gets it. Any other event that threatened to kill 6ish students would get at least as much attention.",18,Gerenjie,1
ffiqzc,fjyv9wp,Visitas😭,9,None,2
e7il3c,fa067tq,You guys are having sex?,67,Gzideck,1
e7il3c,fa0c6qs,Premarital sex? In my.Harvard??? FOH vro,33,RestInPorzingis,2
e7il3c,fa11vbv,In the stacks?,12,JimTheBro,3
fplyxe,fllox7f,I got in!!!,30,mustardAndFish,1
fplyxe,fllr429,[deleted],20,None,2
fplyxe,fllrphb,Congratulations to everybody who got in! Looking forward to meeting some of you next year :),14,etymologynerd,3
bxkn2t,eq8tzg8,"If you’re in NYC, I’ll try to get you an internship with an educational nonprofit. Send me your email/resume.",16,Shuddahailup,1
bxkn2t,eq7n7t2,"Stay the course, young man— you are doing fine. You will have your entire life ahead of you to work, but only a handful of summers with minimal obligations, and even fewer such summers when you are in your prime health. I graduated over 20 years, so you can discount my thinking on this if you want, but I didn’t do much my junior year summer. I rented a house in Somerville with some friends, worked HSA jobs, drank and partied. It was awesome. Did not affect my prospects in the least.",13,Allied_Biscuit,2
bxkn2t,eq7sa6c,Is Harvard like a community College or something?,13,jugeena,3
jr93er,gbs4gan,Can’t wait to get 2 emails about this,53,Gzideck,1
jr93er,gbsdt6f,">they had continued to invite custodians....**well into the first week of the pandemic**  
>  
>the last day they cleaned the Bacow residence was...**.three days before the Bacows began experiencing symptoms**

So, not as terribly bad as it appears - at first glance \[skim\] the article makes it seem like they had housekeepers **after** they tested positive, which honestly would have been resignation-worthy imo.",32,None,2
jr93er,gbsycwq,The Crimson doesn't fuck around. That's all I've got to say.,16,PM-ME-SMILES-PLZ,3
a3zbca,ebabw6z,Seems like a pretty good get,30,crimsonchin68,1
a3zbca,ebb9zuv,Excellent!,10,None,2
a3zbca,ebac1ih,Nice choice.,8,WhoaEpic,3
fb1guo,fj1o9qv,"The system, is down, the system, is down",14,bunkdiggidy,1
fb1guo,fj1ookv,[deleted],7,None,2
fb1guo,fk2ywkn,That ain’t a rave that’s a ghost brev,1,whitehawk295,3
j45zi5,g7hjgax,is this the same company that makes the yale locks on all our doors?,4,NoEngrish,1
cxx3gh,eyp0qhv,"I was trying to sign up for classes yesterday . . . it was just a complete waste of time. HUIT, please get your shit together",6,-Metacelsus-,1
hm9g6y,fx48w89,Honestly a pretty smart solution given the circumstances,24,Grob_Affe,1
hm9g6y,fx3u2rf,F,18,None,2
hm9g6y,fx4o0bs,Think of it this way: Less crowded during caf.,5,Midwest88,3
9v6m4q,e99w71f,This is the best post this subreddit has ever seen,120,mileylols,1
9v6m4q,e99xyb4,There’s a great spot called Lamont Cafe where you’ll find tons of Harvard students on Friday and Saturday nights. It’s right in Harvard Square and definitely walkable from Lowell. ,52,gacdeuce,2
9v6m4q,e99w7jd,"House parties and dorm parties aren’t as big a thing on this campus as you’d think. Especially if you’re not students and trying to just randomly show up somewhere. There’s lots of bars right in Harvard square though, if you’re over 21 you’ll be able to meet lots of students in the bars a block or so from the yard.",20,Nickbarc,3
g6cm4i,fo8y06i,lowkey actually enjoy having relaxing classes from the sanctity of my own room,19,honeymoow,1
g6cm4i,fo970gq,looking forward to donning a hazmat containment suit to get the resources I need from widener. I'll just pretend I'm an alien archeologist searching through the libraries of a long-dead plague world for forbidden and terrible arcane secrets of the chaos gods.,16,None,2
g6cm4i,fogpbv4,Lol take my upvote,1,Bearcats_RallyPossum,3
fh4f0j,fk9yooc,"This never gets old. Honestly, I’ve been following Coronavirus since December and it’s clearly a heavy topic. But the one thing that will cheer me up is thinking about this...seriously it cracks me up! At least I have something that makes me laugh in this crazy time we are living in!",10,Jenbrooklyn79,1
fh4f0j,fk9a6an,But what will they do now to show how much better they are than us?,9,Flash_Discard,2
fa34iq,fivngcg,"While we’re at it, let’s give out lollipops during shopping period.",31,gacdeuce,1
fa34iq,fivwrl5,"This is a good idea. I think it would be fun, and a way to help network with other students.",9,JimTheBro,2
fa34iq,fivlpnv,Great idea! We should do it! We could sell the stickers with proof at the end of the semester,5,Jenbrooklyn79,3
i5lc22,g0pwd82,[deleted],30,None,1
i5lc22,g0qd63b,Your “elite education?”  Well aren’t you just full of yourself?,14,Thoreau80,2
