post_id,comment_id,comment_body,comment_score,comment_author,comment_rank
i5lc22,g0pvtpo,"i'm originally from canada and we don't have this education mentality at all so it always strikes me as funny to see people talking about having an ""elite"" education.

but yea just because canadian education system is very different and employers don't give a shit where you went as long as you got a piece of paper and have good grades (there are probably exceptions for business schools and law schools but it isn't a death sentence if you didn't go to a ""top"" one)

&#x200B;

I didn't know there was a yale and harvard rivalary! harvard is better i assume.....",13,Sea_Explorer2743,3
i2pdro,g0662de,"That’s like, a full paycheck for someone working part time through school",19,impendinggreatness,1
i2pdro,g068771,What happened? Harvard is charging to retrieve possessions for students who left back in March?,14,RSchaeffer,2
i2pdro,g069nyc,Please elaborate.,4,Thoreau80,3
cgj5h0,euibdma,"I was like LOL what part of campus is this

but then I saw Daedalus 

It's a different angle than you usually get, I like it",8,mileylols,1
cgj5h0,euk4xgn,"Next time try to include the pretty parts, like the Leverett and Mather towers.",3,Gerenjie,2
cgj5h0,euihels,"Well, you did get *some* of the Harvard campus in the shot.  There's Clav and Adams and DeWolfe.  It's something, right?

It's a great picture of Cambridge, though.",2,xiipaoc,3
ija9di,g3czy0a,"I know who three of those people are, but I was never in that group. I was in another group though and I remember just watching the drama unfold and asking myself how those idiots got into Harvard in the first place. It was a really big deal at the time and I know a few people deactivated their social media accounts for a while, I'm assuming because they probably had posted offensive things when they were younger and they didn't want that coming back to bite them in the tush. 

With all of that being said, I'm not upset that they get to pursue higher education at top universities without the world knowing what they did. Today's cancel culture is brutal and everything is set in stone, or on Twitter. No matter how much a person apologizes and how hard they commit to changing themselves, very few people will see it as genuine and their name will forever be tied to something moronic they said online. Although change and education should be something you do for yourself, not for the sake of restoring your reputation, clearing your name is still important for any future endeavors. Harvard was absolutely right to cut ties with them, I supported that decision back then and I support it now, just like I support the anonymity of those involved. 

Don't get me wrong, being 17 doesn't excuse their behavior, especially in today's world. But I think it's okay that they got to move on, all we can do now is hope that being told to fuck off by Harvard was a learning experience. I know some people were upset that they ""got away without consequences"", but I'd argue that being set back for a whole year and not being able to attend the university you really wanted to attend is an appropriate consequence for their action of creating offensive memes.",40,pinkstardust007,1
ija9di,g3cxpxz,[deleted],20,None,2
ija9di,i14knut,"just heard this today:

[Hidden Brain: You Can't Hit Unsend](https://hidden-brain.simplecast.com/episodes/you-cant-hit-unsend-11sgheqx-3V_PvT_V)

The episode is an interview with one of those whose acceptance offer had been reneged by Harvard back in 2017.",1,PotentialCucumber217,3
iy3ju9,g6bbydp,"Other Ivies: I feel sorry for you 

Harvard: I don't think about you at all",48,AfterTwo2,1
iy3ju9,g6besln,"Harvard as defined by Urban Dictionary - 

“All I know is that if you put this word on your resume, the HR person will get on their knees and suck your dick.

~

Go to Harvard, son, if you can. It's the door to opportunity, and employers will perform fellatio on you just to hire your magnificent brain.” 

Seems more accurate than Cornell.",14,Harvard_Online,2
iy3ju9,g6b835p,R they trying to say Harvard students work for Cornell students?!,7,brokecollegekid69,3
in67wi,g461mt8,"Given current circumstances, blocking off at least the yard and the house courtyards seems reasonable and prudent.",41,Thoreau80,1
in67wi,g461vat,">Yesterday, I saw a woman let her child **urinate** on the grass in the middle of the Old Yard. Where people (like me) sit and study.

>!You missed the opportunity to bless the child with immediate honorary Harvard College Student status by not directing him to piss on the statute. /s!<",19,None,2
in67wi,g45xghb,They should set up a reservation system for outdoor spaces at the Yard similar to the one they're using for HBS.,15,ocamlmycaml,3
hbqb23,fvadgmh,"Sure the service was old school and the food was basically nonexistant, but this was one of the few places you could get odd espresso drinks besides just lattes and americanos.

Thought the square was already dead, but it looks like it can still lose more",34,None,1
hbqb23,fvc78ak,"That's a shame. It was one of the few relics of the old Square still standing. It's almost died a couple of times before, I think. I hope this turns out to be a false alarm and someone swoops in to save it.

The good news is you can't possibly fit a bank into that basement.",14,None,2
hbqb23,fvais9z,":((((((

Having a roast beef sandwich and a cup of gazpacho in the afternoon here are some of my favorite memories",12,mileylols,3
ips9mk,g4lq7y1,I totally feel this. I had to open a separate safari tab for each of my classes just to have some sense of organization. I feel like there are a lot more deadlines this semester and I have less awareness of when they are.,32,esmthin,1
ips9mk,g4lq2sx,"I think the e-learning model of ""commenting"" on posts and video responses is counterproductive. I really think that is why online education has a bad reputation. I think some instructors are taking a flawed model of online education and bringing it to Harvard.  I have taken online classes like this at another university and this type of education really did not feel good.

That classes as HES are not like that in my opinion. With the exception of one class, all my classes followed a normal schedule of weekly meetings, papers, Zoom session, breakout groups, etc.

I think the type of online education you are describing would frustrate me to no end. While the online technology environment has transferred from HES, I think some teaching lessons and methods have not. TBH, it has got to be hard on instructors & TF's making the shift online also.

It is frustrating, but hopefully you can get back to in-person classes soon.

&#x200B;

Disclaimer: I am speaking of HES in the last few years, don't know what online education was before Zoom.",27,SplamSplam,2
ips9mk,g4mnlfe,"I’m HES and have completed ~15 classes.  I can tell you that it all comes down to the professor.  Some absolutely nail it, and some are rubbish.  I have had the same style professor that OP describes, it’s a nightmare.  It’s even more a nightmare when you have to do all the daily in a 3 week summer intensive.

We’re I HC, I’d honestly look at the profs that have been teaching HES for several terms.  By and large, they’re fantastic and make the online option engaging to the point where there’s little difference between the in-person classroom and the virtual.

Hang in there, and provide honest feedback. As the greenhorn-to-online-learning profs get some experience, and embrace constructive criticism, it will get better.  IMO, in addition to the technical experience HES provided the other schools of HU, they should have had the top 10 HES instructors teach “How to teach via Zoom” classes to all the newbs.  Actually, I wish they’d do this with the first-time non-HU-faculty HES instructors too.",9,SoulCacher,3
gc1cqj,fp8u793,I’m not in the class of ‘24 but I encourage some of you to create a new account. At this point most members of the class are probably aware of the issues with this person and would be receptive to your concerns.,29,KantianCant,1
gc1cqj,fp8u2w9,[deleted],11,None,2
gc1cqj,fp8qtvv,The GC would be a better place to bring up this concern,9,AfterTwo2,3
c0gve4,er4yy8c,Melo is writhing in the irony,8,LESIUREGAMING,1
c0gve4,er5g6id,He played 51 seconds and recorded 0 stats.,4,None,2
c0gve4,er5xjug,Congratulations from Vancouver campus!,3,crapheap,3
ar83en,eglvrd9,Should be other way around tbh,25,KantianCant,1
9oe1d2,e7xor42,"Unbelievable, Harvard went from ""giving Asian Americans lower scores on personality test"" to ""high school teachers write weaker recommendations for Asian American students"". Pretty much discrimination and defamation at the same time.",51,detectiveconan2344,1
9oe1d2,e7te8e3,"Even when harvard was given information by an expert connected with the plaintiffs that showed that they could INCREASE URM concentration and vastly increase socio-economic diversity in incoming classes by doing two things:

1. dropping legacy
2. giving low SES applicants a 'boost' roughly equivalent to half of that received by recruited athletes 

Harvard pushed back. 

Why? Because harvard wants to protect two things. legacy whites and rich blacks. While the URM increase in the aforementioned policy would happen, it would be driven by an increase in latino numbers from present levels and a slight decrease in black numbers.

Harvard's current policy is structured to protect these two groups the most. ",37,None,2
9oe1d2,e7uqq0p,I believe the main reason DJT is pushing this is to cut back the $600 mil in federal funds. Harvard can do whatever it wants if it doesn’t receive federal funds. ,7,None,3
a1ojtd,eas4lpp,*government,16,randy-lenz,1
a1ojtd,easayek,Is this an annual thing now?,3,PeptoBismark,2
a1ojtd,easjcet,"Eh. ‘Unethical’ and ‘inhumane’ are both pretty subjective and non-quantifiable terms, so I suppose we can’t really say whether he’s correct or not. ",-4,None,3
hu0m2g,fyk4d5b,"a 3.7 GPA is very good. College is what you make of it, and if you aren't vibing at H you probably wouldn't have vibed at other places. The illusion of college being some kind of ""golden years"" period is bullshit. 

We have 2 loci of control; internal (themselves) and external (environment). People have a tendency to blame bad things on external loci and give credit to good things with internal loci. Flip the narrative. If you're having buyers remorse, get over it. You go to Harvard. Understand the level of privilege that gives you. 

Also, life tends to suck in general, so, figure it out and instead of complaining, refocus on what's working and deserves more attention to make those things work even better.",95,None,1
hu0m2g,fyk4k6u,"Sophomore year is by far the hardest year.  Keep on trucking and you will see that the people get nicer as the finish line gets closer...and that finals clubs are overrated.  

Of course now there is COVID, too.  Good luck and don’t give up.  

-Brian (‘02)",51,skypetutor,2
hu0m2g,fykbvvs,"Going to pile on the comments that a 3.7 GPA is pretty fantastic. I scraped a 3.3 in ec and life is good a few years out. I’m not sure how it works for doing advanced education, but as far as jobs go, they usually only ask “was it above 3.0?” or “was it above 3.5?”

Not sure what organizations you comped, but my observation was that those are extremely difficult to pass as a frosh or even sophomore.

Lastly, I can guarantee that *elis* are the last people you should be jealous of. Same pressure cooker environment, just in another state (and a way shittier campus). If you’re really thinking that Harvard isn’t the right place to be, maybe it’s not, but I can guarantee that the situation is not wildly better in new haven. Use covid to take stock; maybe you would feel better at another school. It’s not unheard of. But if you decide to stick it out at Harvard, try to focus on the positives and remember why you chose to be there in the first place.",45,crimsonchin68,3
c1qr7a,erf1c0h,"100% agree with this decision. Kashuv says he's being proactive by emailing the office of diversity about his actions, but why was he not proactive with acknowledging and rectifying his offensive comments *before* they were made public and broadcasted on media? He is only ""remorseful"" because he got caught with these messages coming to light. This is not about politics. There are plenty of conservative, pro-gun students enrolled at Harvard. This is about rescinding a student who said some truly racist, hateful things. The last time Harvard rescinded admissions it was about those kids posting offensive memes. This case seems much the same. His excuse that he was  just 16, immature, and never-intending to do harm is laughable. No one cares about your intentions - the effects, outcomes, and perception of your actions are what matter.

&#x200B;

He also criticizes Harvard for not recognizing that someone can ""grow and learn from their actions."" Nowhere did Harvard say that it doesn't believe in a person's capacity to grow. Perhaps Harvard did see growth in Kashuv but did not deem it enough. Keep in mind that there are literally thousands of other applicants who are just as, *if not more*, qualified than Kashuv who did not say such offensive, hateful words. Give the admission spot to one of those.",30,cryotechnics,1
c1qr7a,erfno6i,"All these various comments about lost freedom or things ""used against [him]"" are coming from a very entitled place. When you say awful things publicly in any context, you represent who you are. Nobody is responsible for your words except you. 

Of course we should forgive the remorseful, and I hate the notion that we all live on a cultural knife edge. But if you're a teenager, remember that you may be a minor with respect to the law, but your words and actions are the main things that an admissions committee could use to judge your true character -- not just the way you present yourself on a (highly coached) application. 

I fully support the decision to rescind this admission. The applicant said he wanted to kill jews, for goodness sake. That's not a slip of the tongue. That's not a benign childish joke or pushing the cultural envelope. That's beyond the pale, and I think we can all accept that nobody is entitled to admission at any particular school. Many eligible applicants did not, I assume, threaten to kill any group of people.",23,None,2
c1qr7a,erf6fza,"This makes me realize how much things have changed since when I was 16. I expressed all sorts of ludicrous, communist, terroristic, etc. sentiments online with absolute impunity. And it never would have occured to me that there might be consequences--because why would anyone take what you say on the internet seriously? This guy's probably still a dick, of course, but I can't help but feel that we've all lost some freedom.",12,John-Mandeville,3
hhvs95,fwckawq,GOTTEM,12,Rabbitary,1
hhvs95,fwd59xk,"Well, Harvard still doesn’t have a Hoar House yet, either.",11,Thoreau80,2
hhvs95,fwcxnb7,And that’s why Governor Dummer Academy is now known as Governor’s Academy. That change happened sometime between 2006 and 2016.,4,gacdeuce,3
g6c1ij,fo8mut7,"because trump likes to poke at things he thinks will be easy targets. targeting most prestigious school in the world that most people from far off areas like alabama of michigan dont even dream they can get into makes for an easy political point and vilification of elitism. when at the end of the day, its just a scape goat.",72,brokecollegekid69,1
g6c1ij,fo8tddr,[deleted],48,None,2
g6c1ij,fo91go5,Haters gonna hate. Trump wishes he could’ve bought a Harvard degree.,20,None,3
cmztpo,ew5udz3,"Assuming that we’re all capable of finding a sexual partner is blatant discrimination against STEM students, smh. 

True allies wouldn’t perpetuate the structural oppression inherent in concepts like “people have social skills” and “a sex life is more than just masturbation.” 

STEM bois unite against the chadrarchy!",34,KantianCant,1
cmztpo,ew5xi81,[deleted],31,None,2
cmztpo,ew5ygyo,"I don't know about ten minutes, but I have it on good authority that one can complete all three traditions within 24 hours.",6,aaaalllleeeexxxx,3
bupf66,epfp39a,congrats for making it! coming back on Friday for my 5-year reunion. time will fucking fly now ;P,11,g_lee,1
bupf66,epiaab2,Congrats everyone of ‘19!,2,ChrisH100,2
bupf66,epki80g,Don't go to Harvard but congrats and absolutely loved Merkel's commencement speech!!,1,dunnowativedonest,3
gwro1r,fswsg3w,"It me

Just graduated with my first masters from Penn state.  All online, never been there in person and couldn’t even go up for an in-person graduation.  Now I’m doing another masters program online at Harvard.  Fingers crossed I’ll at least get to come up to Cambridge for graduation this time.",22,HeauxChiMin,1
gwro1r,fsxq10u,"I'm starting a 2-year program.  I totally feel this, even though I'll get at least one year in-person (hopefully? please???)

TBH the one upside is not having to find Cambridge housing.  Instead, I'm planning on visiting campus for a week or two with my partner and just spending time walking the Charles after online classes.  At least that'll give me something to talk about lol",5,Temper03,2
gwro1r,fsyfniw,"Or worse:

""What's Harvard like?""

""Not sure, never been.""",4,AnonymouseIntrovert,3
anbh3f,efs6j2s,[deleted],27,None,1
anbh3f,efsh811,That ID looks too good to be current. Needs more blank card,14,Gzideck,2
anbh3f,efs9e4d,>	1970,11,ChrisH100,3
j6zlsw,g81laj9,indeed,33,pinkstardust007,1
j6zlsw,g81tz5m,You're looking for r/stanford,28,wilsonator02,2
j6zlsw,g820d54,That’s a hot take,14,gun_plun,3
fwt145,fms71be,Ugh. You'd think we could have done better than $250k per school for these poor people riding this out in a parking garage. That amount wouldn't pay for a studio apartment in cambridge.,5,None,1
cq3inv,ewvv1wv,The onion,9,Asdonjuan,1
cq3inv,exd05et,"I mean, isn’t this kind of what we already do with legacies?",1,topsidersandsunshine,2
bbnatw,ekklw52,"Should've had the photography/media people on it because geez it's out of focus...  


(Ok, before you throw rocks at me, I'm joking ...)",9,Dkennemo,1
bbnatw,eknpbm3,"Thanks, I hadn't heard about this!",1,None,2
arls37,ego2cxu,Please don’t dilute our brand.,36,dcistoodamnhot,1
arls37,egsy4bo,"The fact that you were there is disgusting enough, you didn’t have to make this sub filthy too",1,xNamsux,2
arls37,egtvrta,👏👏👏👏,1,tinaaay,3
8s2jdw,e0w0yyj,"Maple wood and JBL sound system.
The chairs are more comfortable than they look.",13,kdoskk6496,1
8s2jdw,e0w4b1e,Is this in the new Allston campus?,11,davidofthedragons,2
8s2jdw,e0wfxtz,There's a new lecture hall?,5,TheGrammarBolshevik,3
79xgbz,dp5kabv,"This picture reminded me that the ""H"" and ""Y"" upvote/downvote sprites should have serif. Fixed!",13,gdavtor,1
79xgbz,dp5l0rr,"sense of humor - an indicator of intelligence
",4,catcreator1,2
79xgbz,dp5q98e,a pretty dank carving ,4,mackerel2,3
j9venh,g8m7ypr,lmao all the comments talking about debt and paying your way in,13,honeymoow,1
j9venh,g8mb6mn,"Took a risk including that barcode, but I like your style G.",11,None,2
j9venh,g8nsrtr,How do we know this isn’t extension,-11,mrmillardgames,3
iigkgi,g36js1r,"Oh and one male turkey that I named Weird Al, I miss him too. One more week and I'll even start missing the wHy cAnT wE gO iN hErE tourists",26,pinkstardust007,1
iigkgi,g36jrrg,What an amazing cat.,11,GoltimarTheGreat,2
iigkgi,g36k7ot,"He has an Insta!

https://instagram.com/remy.the.harvard.cat?igshid=scnsz18qc59q",3,None,3
gluzm4,fr02sax,"or complain about them on the finsta that they follow, to exert dominance",39,honeymoow,1
gluzm4,fr1hbtt,This is terrible advice lmao,18,HeauxChiMin,2
exyo76,fggigis,He'll love the McChickens that Trump serves.,1,thierryornery,1
d14fq3,ezh32m8,LMFAO TOO REAL,6,hugomyasshole,1
ioerw2,g4dgxbm,"Don't be too hard on yourself. The circumstances aren't normal, the campus isn't normal, nothing is normal. The whole situation is most likely amplifying the feelings of loneliness and isolation, but it's absolutely normal to not have it all figured out right away and to feel lonely. I would suggest you organize your time and try to fit in and join clubs or social groups that are still meeting, you'll definitely meet people there. You can't just stand by and hope that people will come to you, you have to put yourself out there. Ask a classmate that seems like a nice person if they want to study together or exchange notes and make small talk with people (I feel like masks definitely make it easier for me personally to start conversations, I'm kind of less anxious when communicating with someone new). Give it time, be proactive and you'll find your people.",46,pinkstardust007,1
ioerw2,g4dicmj,[deleted],25,None,2
ioerw2,g4dmuod,I’m also a freshman that’s been feeling the exact same way as you! Feel free to message me :),23,trixy012,3
gw1i5q,fssjv2e,Now you can get a Master of Public Policy in Extension Studies.,28,JimTheBro,1
gw1i5q,fst59kw,Do you guys think this will impact the decision that Harvard College makes?,10,malpacca90,2
gw1i5q,fss95mq,Bunch of others as well,10,icyprod,3
a60liz,ebreeyr,"Interesting demo breakdown.

Black% fell.
Asian% went up (and markedly up compared to two cycles ago...hmm, I wonder why).
Latinx was roughly unchanged. 



",14,None,1
a60liz,ebt88z8,I got in! so thrilled,11,None,2
a60liz,ebremw0,Deferred boyos,4,thehelper900,3
eq1aex,fen0qru,"I'm afraid they only accept foot pictures as an alternative form of payment, but you can set up your OnlyFans to forward the proceeds of your work straight to the university",21,Gzideck,1
eq1aex,fen2a2y,[deleted],20,None,2
eq1aex,femyr4u,u/be_more_bmore singlehandedly meeting the quality shitpost demand here!,12,SudoUsername,3
imd412,g3zgr32,"I hear you. Fulfillment comes from autonomously choosing goals and projects that matter to you, and seeing them through to prosperous perfection. At Harvard, when people around you are constantly hitting huge benchmarks on their own projects, there's a lot of pressure to cut corners in this journey—to pick projects based on how impressive they'll look on your resumé, to achieve for the sake of achieving rather than because you care about what you're working on.

Drew Pendergrass just had a nice column [in *Harvard* magazine](https://www.harvardmagazine.com/2020/09/jhj-undergraduate-to-catch-crawdad) on this, where he proposes that pandemic isolation can be an opportunity to recalibrate your sense of rhythm and meaning by taking cues from the natural world instead of Harvard's turbo-speed academic grind. That might not be your jam, but I've never regretted taking a step back to let some expectations fall away, go wander in the woods or an art museum or Mt. Auburn cemetery, and reconnect with my own thinking about what is and isn't important to me.",20,vegatwyss,1
imd412,g40hoj4,hang out with me! I'm so chill and non articulate and I'm having trouble finding the hippie vibe I give off,10,PossessionWaste,2
imd412,g3zf5is,"If anything, the pandemic will entrench elitism because the ivory tower of academia is now even more separated from the community at large. I think it will eventually settle back into the way it was after this event dies down. Institutions will always hold meaning because they are steady amongst crisis. People value that which stands the test of time. Revolution, world wars, Great Depression, Vietnam, the 60’s/70’s, 9/11, virus...and still Harvard stands. 

As far as your own loneliness, I think it’s a natural feeling when you have high expectations and have made a huge life transition. Challenge yourself to meet those expectations and when you sometimes fall short, give yourself permission to fail. When the pandemic is a thing of yesterday and we get back to campus, you’ll find much more solace in relationships and community. It will get better!",4,None,3
dznshm,f88vjvp,"I’m Extension, but can I chip in?",15,Gzideck,1
dznshm,f88vfhy,"How about a Fairy Door?

[en.wikipedia.org/wiki/Fairy\_door](https://en.wikipedia.org/wiki/Fairy_door)",7,SelkieSailor,2
dznshm,f8ae0pb,A gate could have an entrance and a departure message.,4,None,3
9y2bvn,e9xvzuu,Nice,4,drewwil000,1
jd7rs5,g96swz4,I love how nice Mem looks when Canaday isn’t next to it,15,be_more_bmore,1
jd7rs5,g962p3k,"A friend and I built Memorial Church in Minecraft! But there's no way we can just stop there!

Minecraft Club is looking for members, especially people to help **build Harvard Yard in Minecraft**! Every Harvard student is welcome to help, and no building experience is required. **Tomorrow**, Sunday, October 18th, at **1:00pm**, we're having our very first meeting. We'll learn to build with a tool called WorldEdit, and then we'll play some minigames together—including a mafia game similar to Among Us!

Check out [https://harvardmc.org/campus-build/](https://harvardmc.org/campus-build/) to participate. See you tomorrow!",12,SynchronousMC,2
jd7rs5,g98m39y,Don't forget to include Remy the Cat.,7,Dkennemo,3
itlse2,g5h3gmj,"Well great, now you can’t comp the Lampoon 😂",6,Mzrog,1
itlse2,g82lsij,"But wait, thats illegal",2,ifeespifee,2
cgxhgw,euntxns,"In other news, T.H Chan School of Public Health professor falls ill after licking bathroom door knobs",21,be_more_bmore,1
cgxhgw,eumaeq5,I’m now questioning everything he taught in Judgement and Decision Making..,19,Gzideck,2
cgxhgw,eunknx6,This is why it's generally better for people to think you're broke.,11,Dkennemo,3
9s9y2p,e8nppfa,Why would you say something so controversial yet so brave?,59,FoulfrogBsc,1
9s9y2p,e8nab0y,Has anyone really been far even as decided to use even go want to do look more like?,34,Gzideck,2
9s9y2p,e8no9s1,Harvard Law is the Harvard Law of law schools.,12,WhoaEpic,3
