post_id,comment_id,comment_body,comment_score,comment_author,comment_rank
bk19rw,emd30am,"I avoid the yard by habit now. 

I also wonder how many tourist photos I'm in 🤷🏼‍♀️

Edit to add: the number of people that stop me for directions is INSANE. I try my best, but half the time I don't even know which building they're looking for. I can get you to the main museums, but I don't know every building on campus people!",30,SampleMeerkat,3
h9l3rp,fuxec1y,it’s nice that they didn’t even bother sending this to us college students,47,honeymoow,1
h9l3rp,fuy4ywz,[deleted],9,None,2
h9l3rp,fuylmmt,[deleted],7,None,3
emzxqw,fdthlae,I'll ask Pinker about this at his office hours,24,randy-lenz,1
emzxqw,fdtt07w,[deleted],10,None,2
emzxqw,fdsh40g,Link: [https://www.insider.com/famous-people-flown-jeffrey-epsteins-private-plane-lolita-express-2019-7](https://www.insider.com/famous-people-flown-jeffrey-epsteins-private-plane-lolita-express-2019-7),7,CaptainMopsy,3
e1qjjy,f8r8nsg,Object permanence.  That's how you know you're Harvard material.,60,SignoreGalilei,1
e1qjjy,f8r73g0,?,-11,notfoundbyname,2
cje5h9,evct51q,It's really not that big a deal. Almost nobody completed their degree in 3 years before the change anyway. And the existing policies for foreign language exemption and for course placement (where applicable) based on AP scores remain unchanged.,39,skieurope12,1
cje5h9,evdbapf,"It's fine. Probably not worth the administrative hassle? Lots of people got enough 5s, etc. to get advanced standing and didn't do anything with it, me included.  Harvard courses are definitely tougher to get an A in than than it is to get a 5 on an AP.

What % of students actually graduate in 3 years?",8,Yazars,2
cje5h9,evcx7fu,"How does this affect the 4-year master's program? I did an AB/SM in 2013, and I'd be sad to see it go away entirely.",4,tmacwilliam,3
gdepln,fphrmgm,"Once a girl on Tinder messaged me asking to hook up bc she “wanted to get with a Harvard guy.” 

Something tells me this wasn’t really what you were looking for, but hey, it’s a fun data point 

Oh, I guess also a free Washington Post and Wall Street Journal subscription",54,be_more_bmore,1
gdepln,fph6w3b,Just the usual discount with an edu stuff plus some free museum tix in the Boston area (like the mfa),12,starfleet_rambo,2
gdepln,fpibkb3,"This HUIT page has links for getting [personal discounts on computer stuff](https://harvard.service-now.com/ithelp?id=kb_article&sys_id=4aa7ab5e3781be009aa163d2b3990e40); the Apple discount is often a little better than their standard edu discount, B&H often gives us really good discounts on a wide variety of products.

You can get [free and discounted access to newspapers](https://ask.library.harvard.edu/faq/82141); Washington Post, Wall Street Journal, and Financial Times are free, New York Times has discounted prices for any .edu address. The is separate from the vast online content available through the Harvard Library.",11,extra88,3
eu6kz6,ffm5m65,"> drown them in a deluge of sternly worded emails

We'd overload the network all trying to send them. Handwritten letters it is!",31,Gzideck,1
eu6kz6,ffn7ysv,You'd think that the university with the highest endowment in the world and closely affiliated with the best technical college in the world (MIT) would have a network capable of handling emails. My fiber connection costs about $40 a month from ATT and clocks in at 150Mbps regularly; I guess $30B gets you 1Kbps download times.,9,OmnemVeritatem,2
eu6kz6,ffmdi71,We’ll have to go back to corresponding via owl.,7,None,3
cwj61q,eyc30ul,[deleted],26,None,1
cwj61q,eydw5vf,Wait... what? It wasn't even this kid's social media posts but his friends??? Like why were customs agents even looking at his social media?,3,ducttapetricorn,2
cwj61q,eyctsvg,This is insane man.,3,colethelion321,3
cl9ps0,evue0y0,Thanks for writing this.,4,throwawayacc2K19,1
cl9ps0,evu9u52,This is fascinating because I graduated from TIE in 2008 and my pro and con list and overall conclusions from that era are \*EXACTLY\* the same. It is crazy to me that nothing has changed since then.,3,FUCK_WATER_DRINK_RUM,2
cl9ps0,eyh8d3l,I find this post very useful as there’re really not that many posts about TIE specifically at HGSE. I’m looking to apply to the course in the coming three months - wondering if anyone has any tips on the application? Is TIE more competitive compared to other courses at HGSE?,2,woodyclassi,3
dz3t3e,f85t7xu,"^ironically, the amount of downvotes on this post just goes to confirm how accurate it is. go look at the mean standardized test scores/gpa for native americans and compare it to white, nigerian, or asian students’. The sad part is that there’s nothing negative being implied in affirmative action alone. Harvard wants diversity, and you contribute to it so you deserve to be here. It’s just these people making the big deal out of it themselves claiming that everyone deserves to be admitted for academics.",11,professahpatterson19,1
dz3t3e,f87q80r,Stop trying to make your stupid faux-Onion instagram account happen.,8,None,2
a1zirh,eau6htv,"this is so disgusting it makes my blood boil. and i do not doubt when they got their Princeton acceptance letter they weren't glad their school helped them and only made them study for the act instead of school so they could prepare. such bullshit

&#x200B;",23,None,1
a1zirh,eauc2dz,"This type of blatant abuse would only stigmatize the students, who after all, would only become the victims of such abuse.",12,Razzeberry,2
a1zirh,eaupfae,"Wow, I wonder how Ayrton is taking this. ",9,SplamSplam,3
9og7at,e7uo3qd,Is that one of those newfangled dot matrix printers? Nice....,4,montym,1
9og7at,e7w12t4,"Don't get left behind.  Larry is going places, and you can too.  Sign up for your tech training now!

&#x200B;

&#x200B;",3,SirTainLee,2
8re2ay,e0rft8z,"The alumni who interviewed the Asian applicants say that their personality are the same as other races, but the actual admissions folks who DIDN'T interview the Asian applicants still gave them a lower personality score? Lol, wut?",51,PurpleCopper,1
8re2ay,e0r8wn4,"If Harvard's defense is that Asian applicants rank lower on personality traits and this is the root cause of a lower than otherwise expected admissions rate, and the plaintiffs choose to meet them head on regarding this point, which it seems they want to do, then the burden of proof is on the plaintiffs to demonstrate that Asian applicants as a group are objectively not weaker in this category. 

Based on an inexperienced reading of their filing (IANAL) it does not appear that they have done this. Rather instead, they have demonstrated that Asian applicants receive lower scores in this area, (using some definitely janky non-standard mathematics, but Harvard does not really dispute it) and then imply that because these ratings are subjective, they must be lower as a result of discrimination. They dismiss out of hand Harvard's witness's contention that Asian applicants are actually weaker in this category, calling it, ""offensive racial sterotyping... legally and factually untenable."" Stereotyping or not, they have to prove it to be false, and that's actually really really hard to do. 

Quotes from leadership who are not directly involved in admissions are not weighty, and it is not hard to think of explanations for why admissions-office ratings can differ from alumni-interviewer ratings. Instead, the plaintiffs try to push the burden of proof onto the defendant, asking Harvard's witness to present a non-race explanation for the lower personality trait scores. While his refusal to do so constitutes a weak defense, it is still plausibly coherent, and the plaintiffs must pierce it themselves. If they are unable to do so, then I'm not sure they have much of a case. 

***

Sideways from the legal stuff, it is clear that Harvard has a system that they implement that consistently produces the student body that they desire. The plaintiffs believe that the process should be different, resulting in a different student body composition. Who gets to make that kind of decision, and how much control should the government have over it? These are some really interesting questions that are going to get answered as all of this plays out. ",27,mileylols,2
8re2ay,e0tlbyt,"So I'm one of those Asians with a  perfect sat score, high class rank + national level competitions/ extracurriculars in math and the social sciences, that likely got rejected due to  the caps 10 years ago. Also I didn't realize it until college but my family was dirt poor compared to my peers (waiter + post-doc salary).  


Ultimately all the Ivies rejected me but luckily I got into another school with similar but not quite as  good career outcomes (like 25&#37; of class goes to iBanking and Management  consulting vs like 40&#37; at Harvard or Princeton). In particular I remember my  UPenn alumni interview went really really well and I was devastated when  I was waitlisted. Also was bitter for a while because Cornell didn't take  me but took my best friend who was an A- student with 300 pts lower on the SAT than me but White.  
10 years later none of this matters much to my career but I can't help but think how different my future would've looked if I went to a non-target school instead. I likely would've ended up pursuing a career in Engineering or Medicine as opposed to Finance simply because the recruiting networks weren't there.   
If Edward Blum wins his case and proves there were racial quotas of around  20&#37; of class for asian americans at most super-selective colleges, will there be class action lawsuits that harmed students can sign up for?  
Also do yall think this would shift the dial on mba admissions at HBS? I would be very happy if the courts forced universities to publish similar data for their business school with race + gender that something reputable like Propublica or Brookings can dive into and analyze. Based on facebook posts (not a great representative sample which is why I want official data) I have like \~10 female asian finance/consulting friends who've gotten into HBS or Stanford GSB in recent years vs like \~0 asian males with similar careers (but the asian guys are still getting into other schools like Michigan or Booth). ",23,asian_throaway,3
kanfmi,gfbltld,[deleted],40,None,1
kanfmi,gfbo1jq,i will also add to the above comments that the actual courses will be completely virtual.,16,honeymoow,2
kanfmi,gfbmt82,Do not get your hopes up too much lol,7,impendinggreatness,3
ir7o2o,g4wqc0e,I really love Todoist for keeping track of my homework (although I’m always looking for better options too),18,Boisson5,1
ir7o2o,g4x7811,Notion!!!!,11,None,2
ir7o2o,g4x211z,Google Calendar is my best friend,7,gaz2468,3
glipti,fqxme4d,"Now you might think I'm just catering to the mainstream, but I prefer a good ol Bic #2B.",19,DevalPatrick2020,1
glipti,fqygm9j,Ticonderogas are the Rolls Royce of pencils.,12,topsidersandsunshine,2
glipti,fqxrg07,"Do you have to change to pencils? I can't go back to using pencils after I started using Uni-ball Signo Um-151, 0.38mm. Literally the best pen I've ever held in my hand.",9,None,3
dceg79,f27njic,I'm pretty sure he's class of 2022 as an amazing track athlete. His jumps are insane.,15,ultrastarman303,1
biorcq,em24vwf,An unnecessary amount of acapella groups,16,None,1
biorcq,em25p03,"Every college I've visited seems to have a weird fetish with a capella. There are way too many extracurriculars offered.

Really liked my visit, though! I think I'll commit",15,etymologynerd,2
biorcq,em1x7w4,How was it!! Impressions it left behind? How did current students feel?,5,livelovelaugherryday,3
acqplo,edb6csm,[deleted],6,None,1
acqplo,edafuo8,"Ah, Pacos's Tacos 'n Things. The Felipe's predicessor  ",3,gdavtor,2
jc44sb,g8z6v5i,"I think when you reflect on your past experiences, you tend to remember the best ones. So yes, I do. But it is the same with any stage of life. Contrary to popular belief, life does not get worse. Harvard is great - life is great.",49,PhishIndependent,1
jc44sb,g8zug6b,"I’m a lot happier now than in college. It wasn’t Harvard’s fault, I was just pushing really hard and didn’t leave much time to have fun, invest in relationships, get a decent night’s sleep, etc.

As someone who got one of those jobs out of college, I’d urge you to think about it in terms of 1) it’s fun to have a successful career, and the best way to do that is to find something you really like doing, 2) it’s ok to want to maximize money and prestige, but you won’t regret having a few other things in the mix, 3) even if those are your main goals, the big-name places usually aren’t the best answer. E.g. you can make a lot more money at the right small hedge fund than at Goldman or KKR. The big places have great summer intern programs, though.",25,john16791,2
jc44sb,g90j8mu,"Sure.  I miss high school, too.  And my elementary school sometimes.  Fuck middle school, though.",13,xiipaoc,3
j8w4zd,g8frl94,"One of the best ways to get an answer on this is to reach out to the Harvard Library and ask to be put in touch with their Archives team. There’s a whole bunch of people that run various archives and systems and someone there may be able to tell you if this is a Harvard flag of some sort.

You can also [try this search function for the archives. ](https://hollisarchives.lib.harvard.edu)",21,JD-4-Me,1
j8w4zd,g8ityed,Looks like a rat so probably from Adams House. They love their rats,13,Draqior,2
j8w4zd,g8fm2g4,"Any more info about it? Like year, where it was found, etc. it could be an old club that disbanded",8,ifeespifee,3
huztou,fyqr8ov,[deleted],12,None,1
huztou,fyrhmse,[deleted],8,None,2
huztou,fyqawlf,Third party API loss caused this account to be deleted.,5,None,3
hn11jv,fxavbku,Name one time a White House website petition changed anything.,7,None,1
hn11jv,fxazkwf,[deleted],7,None,2
hn11jv,fxaks11,You think ICE cares about the impact of this on students or schools? Not a chance. The only way this can be fixed is by court order.,3,None,3
hk1bv8,fwpvkie,Why would they be expected to follow Harvard?,50,Thoreau80,1
hk1bv8,fwq4ano,to be fair they are much more isolated,31,waterbois69,2
hk1bv8,fwq1pcv,Where on earth are they going to get enough tests to test every member of the campus community every 5 days? That's insane.,20,ecphrastic,3
gqy72z,frvja18,"Math 55 is a very good class if you want to do nothing but math on your spare time. It's not too bad if you've been exposed to higher math before (group theory, rings, modules, manifolds, ...). However, if those are foreign words to you, it will be a very hard class. 

Of course the topics covered in Math 55 are eventually covered later in other courses. In fact, math 55 mostly covers sophomore level math. So it's not particularly advanced; it just moves fast as is a good challenge. 

It is not common for undergrads to stay there for the PhD. The reason is that they want you to explore other places and do math somewhere else. However, if you demonstrate a particular interest in working with a professor there, they are okay with that. But it is still very hard to gain admission! (One of the most selective math PhD programs in the world). 

Source: went here for undergrad math, now in math PhD program somewhere else.",29,gdavtor,1
gqy72z,frwx7bd,"I took Math 25 many a year ago (...many a year).  I possibly could have survived 55, but I didn't feel like I was up to it.  55 is for people who are very, very, very good at math, like, IMO level.  The material is supposed to be roughly the same (except much more) as in the other freshman math classes -- multivariable calculus and linear algebra -- except that the material is approached in a much deeper way and the problems are much more challenging and interesting.  You should take Math 55 if you're God's gift to mathkind, because Math 55 is designed to still greatly challenge you at that level, where all other math classes covering the same material will be less challenging and thus less interesting.  Math 55 is why those people go to Harvard, because they want to have the experience of this class.  But if you're only a mortal, it might just be *too* hard to be as rewarding as it is for them.

I have no idea what things are like now because I'm old, and I have even less idea what things are like now because of COVID, but if they're at all similar to when I was an incoming freshman, there will be *plenty* of help on hand to guide you in figuring out which math courses to take.  55 might be for you, or it might not.  Good luck!",8,xiipaoc,2
gqy72z,fry4755,Math 55 is [quite the class](https://www.youtube.com/watch?v=r248xfrEdfk).,6,Eemmaa456,3
fgd28q,fk3rfp6,"Welcome to the HES way of life, everyone",35,Gzideck,1
fgd28q,fk3txd5,"Not cancelled, just virtual. Still, I’m in a one-year graduate program, and it sucks big time that likely a quarter of my time spent here will be in online classes... definitely not what I signed up for. I know they’re in a position where there’s not much else they could do, but it’s still incredibly frustrating.",16,chattahattan,2
fgd28q,fk3rhaz,"We have class today, right?

edit: we have class in-person for the remainder of the week.",10,archimon,3
ef29dy,fby3zk2,[deleted],8,None,1
b93lza,ek1y7mn,There's grad school. Lol,32,None,1
b93lza,ek24834,*Didn't even apply yet still subscribed*,16,CuratorOfYourDreams,2
b93lza,ek27pj9,"You can still earn your way into the Extension School.

https://www.extension.harvard.edu/academics/bachelor-liberal-arts-degree
",12,None,3
8oudkc,e068ps2,"Definitely not, don’t worry about it. 

For me, it was all about finding a group of friends that I could feel comfortable being around. There will always be the sociable crowd and the more reserved crowd. You can definitely find ways to be part of both. ",24,drewwil000,1
8oudkc,e0771gf,"What your grandmother said is what old people say about young smart people. 
Source: am old.",20,KonInter,2
8oudkc,e068y6i,"> I overheard my grandma say ""that kid is book smart and intelligent, but he lacks common sense and judgement"".

Was she saying it to one of your brothers, sisters or cousins?

Don't let others bother you, adcom didn't make a mistake. ",13,themiro,3
76hisc,doe22d0,"I'm sorry to hear that. If I could offer some advice, you are certainly not alone. Almost everyone experiences these feelings to a degree (especially at Harvard). The way I overcame some of these thoughts was to change smaller things before changing bigger things (e.g. the way you walk to class, the food you eat, the places you study). After enough small changes, the big changes come easier. 

I would also encourage you to reach out to UHS mental health services if you feel you would benefit from their help. They are really professional and they can make a big difference. ",26,gdavtor,1
76hisc,doehh6m,"If you're not feeling like UHS is right, consider making a visit to one of the peer counseling groups like Room 13. They're super understanding and they're there just to listen and help you work through things. ",23,the_protagonist,2
76hisc,dofy2fm,"Have you ever seen a psychiatrist? If these feelings have lasted more than a couple of weeks, you could be clinically depressed.

Despite what some people say, medication does help. I used to feel the same way as you ALL the time. But with some medication and a sincere commitment to therapy, it's all been turned around.

I do still get depressed some times. Sometimes often. But it's no longer that soul sucking loathing that I once had.

Good luck on your journey.",6,That_Ditto_Smell,3
jvkkry,gckmrg1,"From coaching it, to being behind it. Good luck my duderino",12,None,1
jvkkry,gckvpd6,"seems that the kids weren’t unqualified, unlike olivia jade etc. went to international competitions, had good scores and grades",1,None,2
jvkkry,gclgz35,[removed],-3,None,3
izyvgg,g6nlcis,"https://web.archive.org/web/20200925151127/http://ephblog.com/

Here's the archived webpage. The professor apparently took it down.

---
I took a quick read, here's some of the content he had:

> A “hate hoax” is an act of hate — racist graffiti, a threatening note — which is a hoax in the sense that it was perpetrated by a member (or ally) of the class of people it purports appears to attack. See Pro Publica and Reason for discussion and examples. Let’s review some examples from Williams history:

> January 1993: Three (anti-black) racist slurs posted on the door of Rice House. Perpetrator turned out to an African-American student. He was suspended for one semester.

> September 2001: Female student reports that she was assaulted in her dorm room. Turns out that she made the whole thing up. I do not think that this truly qualifies as a hate hoax since her intent was probably not to stir up a campus controversy about sexual assault. See discussion below for whether or not the intent of the perp should matter for defining an event as a hate hoax.

> November 2011: Racist note — All Niggers Must Die — attached to a door in Prospect House. Perpetrator was (almost certainly) an African-American/Hispanic student activist. She was not punished and, to this day, the College maintains the public fiction that this was an actual hate crime.

> November 2012: Racist statement — All beaners must die — written on whiteboard in Mission. Perpetrator was of “Mexican descent.” As best I can tell, the student was not punished.

> November 2016: Racist graffiti — AMKKK, “meant to signify AmeriKKKa, a spelling of America that references racism in our society” — written in red paint in Griffin Hall. Three first year female African-American students were caught, all claiming (plausibly!) to have no connection to the KKK. Students were suspended but did return to Williams.

> Are there other examples I should include?

> As best I can tell, there are about as many hate hoaxes at Williams as there are actual hate crimes. What do readers estimate the proportions to be?

> Even the hate crimes that do not seem to be hoaxes — Williams E in 2008, Mills-Dennett 1 in 2009 and Paresky 2014 — often seem to be driven by animus whose original source has nothing directly to do with hate . . . but that is a discussion for another day.

I think insinuating that most hate crimes are actually perpetrated by the victims themselves is.... not the best thing. Jeez.

---
EDIT: another verbatim quote:

>“Committing crimes,” and almost everything else, is heavily influenced by your genes. Blood will tell. Does Cass not know about this literature? Does he really think that it all comes down to “values and beliefs?” Or does he know and disagree? Or does he agree and, yet, for reasons of prudence and cowardice, refuse to mention the role of genes in outcomes? Perhaps mentioning the unmentionable is why we have EphBlog?!

https://web.archive.org/web/20200226230354/http://ephblog.com/2019/12/26/the-culture-problem/",14,Hugo0o0,1
izyvgg,g6on5lw,Can anyone link the most egregious posts?,4,None,2
izyvgg,g6mi52i,Anyone have a link to the content of blog posts? The blog has been take down.,4,TheSausageKing,3
iscx5j,g57bkpk,"Former TF here. My best suggestions, looking back:

* Teach how to triage problems or assignment tasks, i.e. strategies to figure out how to approach a problem. For example, if it's a physics course, how do I figure out which equations are relevant for this problem?
* Give detailed, useful feedback when grading and/or provide a problem set answer key that clearly walks through the process to solving each problem.
* Make your office hours accessible. If it's at a time (or place were it not for remote learning) that's really inconvenient for students, nobody will show. Easier for you if nobody ever comes but not as helpful. If you see someone's struggling, specifically invite them to your office hours to walk through a few problems together.
* If appropriate to the course and you can manage it, think of ways to convey complex concepts that will be relatable to students' real-world intuition. I TFed a thermodynamics course, had some examples about weather that helped people mentally apply the concepts to think about daily life.
* Be aware that if your professor is particularly unskilled instructor (there are a few out there), students will get a lot of their practical learning through you. In such cases suggest taking a very practical approach, looking through a few past tests and figuring out what they would need to do well on them.",27,rough-hewn,1
iscx5j,g5771x8,"Teach what's going to be on the test, be a forgiving grader",25,etymologynerd,2
iscx5j,g57f96c,"Can you provide your general area of study? Humanities? STEM?  I think this is relevant.

My number one suggestion would be to make section more than a recap of lecture (I'm thinking of pset classes here). If you can, provide support for HW or projects. It's good when section is helpful in a tangible way.

If you're a TF for a pset class, try to implement a fair system for helping students during office hours, like a queue. This was one of my biggest frustrations in CS50 and other coding classes, where students weren't really allowed to work together so we pretty much only came to office hours to interact with the TF.",6,None,3
hkrtu8,fwv6124,:(,15,iwantmoresoup,1
hkrtu8,fwvk90t,Drop an F in the chat for shopping week,12,RealPrinceJay,2
hkrtu8,fwv8wmy,Is there a consolidated place to see fall 2020's course listing?,8,randy-lenz,3
f1kii1,fh6uhbt,"Have you tried the WH-1000XM3 yet? God-tier ANC.

Alternative is to use IEMs under ANC headphones. You won't hear a peep out of anyone.",14,Gzideck,1
