post_id,comment_id,comment_body,comment_score,comment_author,comment_rank
9rii0k,e9tdu1h,Idk but the dog picture is pretty cute,2,Manuhteea,1
9rii0k,e8i0q24,yale blows ,2,The_0P,2
9kbn0a,e6y2ehd,Fuck Yale,37,None,1
9kbn0a,e6y9llf,"Well, he did drop out...",11,None,2
9kbn0a,e6yjyuc,[deleted],5,None,3
fd7de4,fjgj7i7,[deleted],10,None,1
fd7de4,fjntmoo,"Funny you mention this. As a TA, we expected those emails to come in on cue.",2,ziggysmsmd,2
erz7jp,ff6t4xk,"DUN, DUN, DUN....",9,be_more_bmore,1
erz7jp,ff7h9f4,Why the emoji tho,7,Mzrog,2
erz7jp,ff7k7sa,Nice dumpster.,6,gacdeuce,3
jmvfca,gayrkpq,[deleted],-1,None,1
jmvfca,gaymilq,"I don't understand what the echo chamber about encouraging people to vote in presidential election is all about

Mass is a diehard blue state so what if you took the time encouraging people to affect the arbitrary popular vote to actually encourage people to volunteer or help the community or some shit

I mean yeah, if your social network is mostly based in a BG state i guess that makes sense... but otherwise it just seems to be a circle jerk about 'being a responsible citizen' whatever the fuck that means",-8,coolcatsarecold,2
jmvfca,gaxzgbo,"True that! Not voting is definitely a problem, let’s let out voices be heard! Don’t worry about the long ass lines, I voted for Trump an hour ago and they weren’t too bad ;)",-12,None,3
i9amvo,g1ebs60,Also named after a slave owner,7,steady_spiff,1
i9amvo,g1elju3,article link please?,5,GENERALPOTATO243,2
gqodi7,fru07h8,Hmm. I think a lot of us here had parents who went the other way entirely and acted like every accomplishment was expected.,37,topsidersandsunshine,1
gqodi7,fru3i9i,"I never fault a parent for being proud of their child nor wanting to share that joy. Sure parents can go overboard sometimes, who can't? But why would you want to rain on their parade and spite their joy... To what end?... Especially on the internet where you can just flick past the post with nothing but a fraction of a second of your time lost for someone else to feel the joy of accomplishment for their child. 

Not an attack on you at all by the way, just my view of these things you speak of.",30,KarmaPoliceT2,2
gqodi7,fru51s9,"I am actually pretty disappointed Harvard doesn’t make “my child is a Harvard honor roll student” bumper sticker. 

It would really be a huge flex to throw that bad boy on the back of our Bentley SUV when we head to the Hamptons this summer",14,be_more_bmore,3
e5kofx,f9l3cmj,Not spicy enough. Gotta up the strike meme game.,5,thierryornery,1
e5kofx,f9mlicj,Someone’s gonna pee on that sign.,2,gacdeuce,2
e5kofx,f9u1kin,Man this strike has really illustrated how white HGSU is. Bad look guys.,0,vickeerooney,3
jdahoa,g96nugr,There are more undergraduates at Harvard today than total degrees given out in its first two hundred years,22,None,1
jdahoa,g97z0cx,"*4,662 Men of Harvard starts playing*",10,Gzideck,2
jdahoa,g98lacr,That's really interesting! which book is this from?,8,None,3
i7vvpz,g14i17i,Thanks for sharing! Any updates specifically regarding graduate students?,10,RSchaeffer,1
i7vvpz,g14f9y0,"Are all internationals going to be brought back, or only those who petition / really need to be on campus?",5,AnonymouseIntrovert,2
dg8b70,f3a5io7,I saw a girl roll down the other day. You're good.,31,ryasaunderox,1
dg8b70,f3a2wd5,Don’t wanna lie.,5,Gerenjie,2
dg8b70,f3acbgd,You just gotta hip and then hop.,5,moldycheddar,3
gq8p9f,frrjyzs,"Just to clarify... the lawn is definitely not getting manicured. It is full of weeds, it is overgrown, and those corners are not growing!",32,approt,1
gq8p9f,frrjg0g,Oh I miss this place 😍,10,gabyufv,2
gq8p9f,frrv3am,"What the heck? Don't you see the exposed patches on the edges? Who calls that ""manicured""?  What is the meaning of this post? What is he trying to say?",9,mrarthurwhite,3
fhzg7q,fke75m2,Whoa law students are being evicted as well? Dang I wonder if/when they are going after vandy hall next...,9,ducttapetricorn,1
fhzg7q,fkf3vr2,[deleted],2,None,2
fgkqm7,fk5dkrf,All of your classes are belong to us,54,Gzideck,1
fgkqm7,fk5ooff,"All your resumes have to say ""in Extension Studies"" now.",45,JimTheBro,2
fgkqm7,fk55g1e,"Nah. But they're using the tech HES invested in heavily over the last several years that made online really work for that school.

So basically think of it this way: HES tech is lending a helping hand ...",29,Dkennemo,3
8v5z5q,e1ksh5s,"It *might* have dropped out around the Sinclair/53 Church St. Computer Lab. Or perhaps the Science Center Plaza.

It's a Legacy brand hat with adjustable strap. 

I'll reward you if you find it, would deeply appreciate it :/",19,JohnHarvardsLeftSock,1
8v5z5q,e1kwyzv,I got it bro. Send me a pm,16,mrhaircut33,2
8v5z5q,e20jb29,Did you find it?,4,KindHeart1,3
dvzy36,f7fx5wj,Excellent. Good planning. Well executed.,13,None,1
dvzy36,f7fu9hl,"note - video only clicks through on mobile - here's the direct link:

https://imgur.com/JhzTPwT",8,Cumzilla-420,2
dvzy36,f7k5lhi,[deleted],3,None,3
ck3ave,evivni4,r/PornhubComments,3,SudoUsername,1
9556bs,e3q9mkt,Username checks out.,44,Progwonk,1
9556bs,e3qwfaw,Low-key? *Laughs in depressed*,18,GoltimarTheGreat,2
9556bs,e4yw05s,OP and anyone else on here that goes to Harvard and needs to get out and have some structured time: I run a store in Harvard Square that is hiring for a few hours a week (8-12 hours). PM me if your interested. ,7,VintageFirstEdition,3
i66z5j,g0tybe2,I wonder if it’s just a matter of time before Harvard does the same.,9,None,1
i66z5j,g0wygvf,Wait what. What are the chances other schools cough mit do this?,2,cheeseontop17,2
gucvc3,fshq00u,"Love the question, good place to ask it, all positive vibes, but also why the heck would anyone have a picture of the Annenberg ketchup trough?",17,Gerenjie,1
gucvc3,fshwmp6,I distinctly remember this lmao,16,gdavtor,2
gucvc3,fshoycl,"Tepid, semi-coagulated, tomato reduction(?)",9,guestiest,3
dnhqf7,f5b84eq,Monumental.,17,moldycheddar,1
dnhqf7,f5fnv4k,"That’s everyday, multiple times a day.",3,gacdeuce,2
bl0u8b,emktihy,"I would go report it yourself! This seems like a serious issue and it might come best from you, given your personal medical condition.",33,None,1
bl0u8b,emku3wh,"I’m very anti-smoking of any kind, so I’m with you, OP, but what are the rules?  ~~When I was a student, the rules were no smoking within 25 feet of a building. As long as they are respecting that, there unfortunately isn’t much you could do.~~

I just saw that the yard is now smoke-free. Use the red phones and report, report, report!",21,gacdeuce,2
bl0u8b,emm4xja,I'd just ask them nicely to stop. It's amazing what you can accomplish just by being polite. Sometimes people forget that Harvard is a workplace and residence and a gentle reminder can be helpful.,6,None,3
k4sdi7,geahwbe,"I miss being on campus so much, I'll start packing right now",11,pinkstardust007,1
k4sdi7,geb6sc9,Lofty ideal.,8,buschcamocans,2
hqnxfv,fxzp4tg,"All those situations are trying and I feel for those students. That said, Harvard isn’t responsible for COVID and the issues preventing these students from being on campus are larger than the institution. I hope to see more progressive policies (eg a room and board credit of $18k vs $5k) and allowing these students on campus.",33,None,1
hqnxfv,fxzbr88,[deleted],10,None,2
hqnxfv,fy02e5u,It’s not the University’s fault there’s a a pandemic. What can you do?,6,None,3
h9x363,fv0a6z7,[deleted],11,None,1
h9x363,fv0hbz5,1.44% union fee,6,kingofthefeminists,2
h9x363,fv0dvjl,"You can read a more complete summary of the contract [here](http://harvardgradunion.org/wp-content/uploads/2020/06/Contract-highlights-20200615.pdf), and an even more complete description [here](http://harvardgradunion.org/contract-summary).

It's not everything we wanted, but it gets us a 2.8% raise and many guaranteed benefits and protections to get us through the next year of pandemic austerity, which is a relief for many—especially international students, who are now protected from losing their jobs due to inability to travel to the US.",5,vegatwyss,3
daoslo,f1rwox0,I feel the same way. Let me know if you want to talk.,18,None,1
daoslo,f1spc2r,"First, I know it’s scary, but you’re going to be okay. Second, go see a doctor. Start by ruling out physical and biochemical issues. I started feeling a similar way to what you described while in my late 30s. Turned out to be an hormonal imbalances. I take a completely painless shot once a week, and I feel perfectly fine now. But I spent 2 years spiraling into suicidal mania before we figured that out. I recommend talking to a primary care physician AND an endocrinologist about what you’re experiencing. At the same time reach out to someone at your school. Tell them what you’re going through. They are there to push you, but not to break you. They care and they know what it means to be human. Trust me, they will 100% understand and work with you to help you.

Important note: when it gets tough, you might find yourself shutting down or even self-destructing. This is normal, though no one ever wants to admit it. This is an illusion; don’t fall for it. Even if you want to crawl under the covers and waste away, please fight it. You have value. People care about you. And you have a talent that the world needs. Fight your way out of this.

If you ever need someone to reach out to, PM me. I’m not far from Cambridge, have Harvard connections, and will help however I can.",12,None,2
daoslo,f1rw1qc,The Fact that you’re talented enough to be a Harvard student is insane you should be proud of yourself that you’ve made it not everyone has this chance. Savour this gift of talent because this doesn’t come to everyone,11,xFlames_,3
7iwaqt,dr9zt4z,"One of my friends built a snowman in the Yard, and then it got knocked down that night. We were sort of wondering who did it when somebody checked Instagram and it turns out it was Lil Pump.",39,Davis518,1
7iwaqt,dr2lt4z,[deleted],1,None,2
k71nxn,geoelzo,I didn't know the Mayor of Whoville was a harvard alum,24,mustacheanonymous,1
k71nxn,gep698f,"Hmm... I’m an proud alum with my share of Harvard swag, but nobody loves seeing these shirts in public, much less on a Christmas card. He might do better to find a shirt that says “RHODES SCHOLAR LOL.” Anyway Mayor Pete’s the best and I’m proud to see him repping the old alma mater.",8,john16791,2
feyxmq,fjtmgos,"didn't make many great connections in class of 23 this year, feelin kinda sad i have to float  


other than that i'm fine, i have great friends in other years but i'm a bit jealous of people w actual blocking groups",29,RestInPorzingis,1
feyxmq,fjthaax,https://i.imgur.com/dTcAHZcg.jpg,17,Rabbitary,2
feyxmq,fjtkukb,You are a true gem,8,brokecollegekid69,3
f6dmtx,fi5h1ze,"> The group is accusing the school of [...] falsely advertising itself as an institution that wants to redress the harms of slavery, while still benefiting from the prison system, which incarcerates more than 2 million people in the United States, about a third of them black.


>""That money funds the opulent lifestyles of Harvard's top administrators who are prison profiteers.""


> Faculty members in the arts and sciences department this month voted overwhelmingly in favor of fossil fuel divestment


> the school did not immediately respond to a request for comment


I'm sure they're fully prepared to be laughed out of court, but this is still a great way of dinging some of Harvard's worst aspects in a national platform. You love to see it!",12,vegatwyss,1
f6dmtx,fi412mw,"It may or may not be a good idea for Harvard to invest in private prisons (with a $40 billion endowment, Harvard invests in everything), but the lawsuit is frivolous, and I hope the students are ordered to pay court costs.",-17,Beliavsky,2
ikctxz,g3jupkj,"It's definitely a real feeling. I find it helpful to decide what I want, and then ignore what everyone else is doing (academic- and career-wise) as much as possible. I also remind myself that success is not a zero-sum game. Your classmates are not your rivals; they're your peers, and you can learn from them. That said, I think it's healthy (and interesting!) to surround myself with people who have interests and ambitions very different than my own. Like if you're pre-med, maybe don't always hang out with the other pre-meds, y'know? It helps a little with comparing yourself to others, which is always a losing battle.

Other times I'll catch myself feeling jealous of a friend getting some cushy  job or something like that, and then have to take a step back and think, ""I literally would rather cut off my right arm than do something like this."" We're just conditioned to value certain paths/careers over others, and I've had to do a lot of deconditioning, if you will, at Harvard.",51,None,1
ikctxz,g3jzu9t,I remind myself that literally everyone feels this way.,39,topsidersandsunshine,2
ikctxz,g3jyamz,"Picture the dumbest person you know at Harvard. If s/he can be a student at Harvard, so can you.",31,RSchaeffer,3
g5ol78,fo4o9pg,"More info: Within the $2 trillion CARES Act, Congress set aside $14 billion in  the Higher Education Emergency Relief Fund to address student needs and  pandemic impacts on colleges.

“By federal formula laid out in the CARES Act, Harvard was allocated  $8.6 million, with 50% of those funds to be reserved for grants to  students,” a Harvard spokesman said in a statement. (Boston Herald)

I don't think Trump has the authority to demand the cash back without changing the law. Otherwise, it's gonna be discrimination, and Harvard won't go down without a fight.",33,Zan_Jr,1
g5ol78,fo4lpkt,Has Trump University paid back what it owes?,29,Thoreau80,2
g5ol78,fo579m3,"This thread looks like it's getting brigaded. There must be some API that notifies trolls when the word ""Trump"" shows up in a post title anywhere on reddit...",12,None,3
fgzywy,fk803p1,Where can I buy the sweatshirt?,4,LunarGames,1
fgzywy,fk8dcd5,"Alexa, play Crossing Field.",2,Rabbitary,2
fgzywy,fkdhoyp,Link Start!!!,1,None,3
e6p6gg,f9s6q8s,The balcony of Annenberg. Let the freshmen see what they have to look forward to.,61,gacdeuce,1
e6p6gg,f9s7dba,"•Single-user bathrooms around campus
•Stacks of the Pusey

And for the REALLY loud crying sessions...

•Music practice rooms in the basement of Paine Hall",27,brawlboy3794,2
e6p6gg,f9se7hm,The zen garden in CGIS South,14,Brinner,3
6faiiv,digyzf6,"Not sure I'm a fan of this -- the posts were made in private correspondence, not pinned to a dining hall wall. Is Harvard going to start expelling anyone who makes a shocking/offensive joke? 

Another question -- Would the students have been treated similarly if they had been making offensive memes about, say, Milo Yiannapolus? What about Trump, or more generally Republican lawmakers? ",86,RGSII,1
6faiiv,digvymb,Good. Met a fair few people at Harvard who were incredibly bigoted behind closed doors and it's about time the school did something about it. I would also be surprised if these kids weren't legacy admits,62,lostlittlebear,2
6faiiv,dii0iw4,"[Relevant Satire V](https://twitter.com/therealsatirev/status/871811887633137664)
",13,ModernMrDarcy,3
i78fkh,g10han3,Nothing isn’t a shitshow right now,52,lakersfan223,1
i78fkh,g10imj7,"I'm actually very happy with the way Harvard has handled the situation. I still think the campus shouldn't reopen, but I get why they're doing this the way they are. I just hope they can successfully manage those who will stay there and avoid a major outbreak.",51,pinkstardust007,2
i78fkh,g10dg30,[deleted],22,None,3
hnwe7n,fxew5g4,[deleted],13,None,1
hnwe7n,fxe1gzw,what a surprise,12,ikimx,2
hnwe7n,fxfkks7,Only 43% ??? I was expecting 56 %,9,LePho72,3
e0nedw,f8g0lc3,Creative and easy way to make a national headline for a smart purpose,21,steady_spiff,1
e0nedw,f947ew6,Stupid whores,0,None,2
e0nedw,f8fwlxp,"Watched with a group of climate conscious alumni. We all agreed: dumb-ass protest. We didn’t care about them. We wished they didn’t slow down the game. If anything, it hurt their cause.",-11,gacdeuce,3
dqaa1t,f61nam1,"It’s hard! I hear you. Do you ask your friends and roomates about what they are up to? Sometimes telling them you’d like to hang out can actually work. Maybe they think you aren’t interested. People here just kinda assume that everyone else is doing something and it might not occur to your roommates and friends to check on you. 

If you want to make other friends perhaps think about how you are spending time and consider if you can give yourself a little space to have fun. I know you think you should always be studying so you can keep up, but it’s important to take care of the other things in your life in addition to academics. Maybe if your academics or possibly extracurriculars aren’t providing that social space for you, consider changing it up. Go to IMs. Shake things up.

You can do better next time on your exams! Talk to your professors and TFs. In my experience, they want you to do well and are willing to help. This won’t be the end. You can recover from a few bad midterms!

Good luck! DM if you want to talk",24,oajm,1
dqaa1t,f61ohgj,"Taking time off, even if you think it’s wasted by having fun, is more important than you may be giving it credit for. You’re upset right now, so have a killer time tonight and go out. You may wake up a little hungover, but I’m telling you, you’ll feel refreshed. 

Work is always there, no matter how much you do theirs always more and it’ll be like that for the rest of your life. You need to know how to balance productivity with time off. Too much work = mental break down (sounds like you’re almost there). Take the time off to recharge your batteries.",11,Readingtobabydeer,2
dqaa1t,f61kyls,"Listen buddy. U’re studying somewhere that people WISH to study there even for a day. So, good luck, and remember that you had good potential that they chose you!",9,None,3
d3roqc,f057p94,[removed],20,None,1
d3roqc,f05qoqm,[removed],-11,None,2
9ku6wf,e739u72,"You can tell MAT 157 is more difficult because

&#x200B;

157 > 55

&#x200B;

In fact, it is approximately three times as difficult.

&#x200B;

Q.E.D.",39,mathter_e,1
9ku6wf,e72dn7w,"Are you actually a U of T student in MAT157, because I am lol",37,oysoyboy,2
9ku6wf,e72kade,Has /r/UofT taken over the Harvard subreddit? Let's fucking goooooo,28,None,3
kf9zrf,gg7ckzv,Damn I guess no one got in,40,yuh5,1
kf9zrf,gg8s84g,I got in!! So excited to be a part of the class of 2025.,21,None,2
kf9zrf,gg7i1vj,"Hello! A Canadian here, got deferred hehe. Are there statistics on how many deferred students are accepted in regular decision? :o Do you stand a better chance having applied early or not really, and what do people usually do to supplement their application between now and March?  
Thanks! <3",9,getrektmakoto,3
b7xe9d,ejuud3j,"you get to campus, stay in some kids dorm, check out an idealized form of the social/academic life (and weather) here, 80% chance you realize 'oh man i wanna be here!', still high from the letter you got from fitzsimmons three weeks back while holding a merch-filled bag from The Harvard Shop surrounded by equally giddy classmates that you'll probably cram into your snapchat with no plans of ever seeing again

then you go home",38,randy-lenz,1
b7xe9d,ejuv679,"When I went to visit Cornell I just studied alone in the basement of the law school, wanted to set realistic expectations for my time there. Im thinking for Visitas that I am gonna speak to no one and study alone in Widener",7,be_more_bmore,2
b7xe9d,ejw3mgh,"didn't do any of the programming arranged here, just kind of wandered around on campus and took a few meetings with people i knew from the boston-area. was only here for less than 24 (i flew in on the red-eye and left the next morning). i'd recommend shadowing your visitas host or getting here a day early so you have an actual idea of what lectures are like and how the campus feel is. make sure you check out your potential department's main building/area (so pierce hall-ish to maxwell dworkin for engineering, emerson for philosophy, etc.) so you know roughly what it's like to get to and from class. check out extracurriculars on campus. pm me for deets.",3,randomnese,3
il11wo,g3q3g9h,You make the thread and then call on others to actually do the work because you're too busy?,48,r-cubed,1
il11wo,g3qg0ih,"Penn State offers a similar program. They call it “World Campus”. You take the same exact courses as students would take on campus, although yours would be online exclusively. 

Obviously you’re limited to what courses you can take. You won’t be able to set up a chem lab in your 1BR apartment. 

I say keep it “Harvard Extension School”. I would be proud to sit next to someone at graduation who took the HES route. They probably have a full time job, children at home, or maybe a veteran. It’s not like HES programs are any easier than on-campus courses.",27,None,2
il11wo,g3qap7r,"> It devalues our diploma

What is this, a suggestion on r/2007scape?

It doesn't ""devalue our diploma"" as we knew what we were signing up for when we entered HES, applied for student status, and continued to pursue our degrees there. They didn't change the name on us. We all knew what we were getting ourselves into.

> people think we are in the same pool as those who have taken one online course some random time period ago

Tell them otherwise. Prove them otherwise.

A prominent HLS alum was the first person who told me that I should consider HES for my bachelors degree over top residential colleges that I was admitted to. A distinguished alum of the college concurred with them upon my asking them for advice. It's not as though knowledgable people consider HES a joke - the people who do, in my experience, are not people I wish to academically or professionally impress regardless.

If you wanted a brand-name degree, perhaps HES wasn't the right choice for you. But, for what it is, it's aptly named.",27,Gzideck,3
i8kf04,g18xiap,"More info: https://www.blackbaud.com/securityincident

""Because protecting our customers’ data is our top priority, we paid the cybercriminal’s demand with confirmation that the copy they removed had been destroyed."" !!!#@!$!!

Joke's on them. I haven't updated my info for years.",16,Yazars,1
i8kf04,g18xq5o,Where’s the class action lawsuit?,11,RichieCunningham,2
i8kf04,g1a6ah5,"This hit the CSA (Catholic one). Hit other non-profits and schools (my high school, for example). This is a massive data breach.",4,gacdeuce,3
fs41ad,fm0riap,"If the descriptions were written by someone not associated with the publication, we are more likely to be persuaded to look. When we are made aware that you have a vested interest in promoting the publication, then the title seems disingenuous. 

By the way, I am also on r/boston and came across a similar discussion on this issue. Your tone in responding is really putting some people off. It certainly feels condescending to me. So you may actually be having a counter productive effect and turning people against both the article and the publication.",15,monsooncloudburst,1
fs41ad,fm0e260,[deleted],13,None,2
fs41ad,flzprhp,[deleted],-8,None,3
ev81uy,ffu70go,Rumor on campus was he treated his grad students horribly. Ridiculous hours expectations and apparently pitted visa students against each other with the threat of no longer supporting the loser’s visa. Anyone care to chime in on this?,21,NICEST_REDDITOR,1
ev81uy,ffua99e,">According to charging documents, Dr. Lieber was paid up to $50,000 per month in salary and $150,000 per year in living expenses by Wuhan University of Technology.

Good news for dual chem-asian language concentrators.",10,None,2
ev81uy,ffu56xa,[deleted],5,None,3
ehhim9,fck0bqz,And he definitely outplayed Tom yesterday too.,6,Dr_Bunson_Honeydew,1
du76zy,f72nfus,[deleted],9,None,1
du76zy,f79284z,"Hang in there, remember you can reach out to residential staff and advisors or peer support groups like Room 13 if you need to. These aren't substitutes for professional help, though, and it's a crying shame that student mental health care services are so stingy.

One of the reasons the grad student union is threatening a strike is that the union is asking for HUHS to hire more mental health specialists or cover more off-campus providers, but so far Harvard has refused to negotiate on this at all...on the grounds that “If we improve[d] health care for graduate students in the bargaining unit, we would have to improve it for all students.” [source](http://harvardgradunion.org/wp-content/uploads/2019/11/Status-of-Bargaining-October-2019.pdf)

So support your local TFs, we're fighting for you too!",2,vegatwyss,2
du76zy,f8dezs5,*,1,FrancesM2,3
c7mht5,esg8pjj,JOHN FISH TIMEEEE,22,None,1
c7mht5,esgd3n6,Drink as much matcha and eat as much acai as humanly possible. Document EVERYTHING and make sure it's in portrait mode for Christ's sake,14,steady_spiff,2
c7mht5,esgdcsc,Where did you see your aid package?,3,InfamousMarzipan,3
bk19rw,emd29o5,"I spent my freshman year in Holworthy Hall (a freshman dorm in Harvard Yard). That was 11 years ago. I can still recite from memory the exact line of the student run tour that passed by my window several times a day. 

“...and the city of Cambridge, in its INFINITE stupidity, decided to build a highway right through the middle of Harvard Yard, separating Harvard’s most beautiful building, Memorial Hall...” 

And then they’d move out of earshot. I’ve always wondered how that sentence ends.",51,gacdeuce,1
bk19rw,emd88ru,"I love it, stokes my ego",38,weenies_with_bread,2
