post_id,comment_id,comment_body,comment_score,comment_author,comment_rank
jsfdi1,hh0o2ip,Stunning!! I feel so blessed to have lived in such a beautiful town during college. Sometimes I still miss walking home at night and seeing the Currier quad eyes glowing 💕,8,Thecharmingmuffin,1
jsfdi1,l7qv167,"Hey! I'm from a town called Waccabuc, NY.  My dad graduated from  Williams and established a Park Ave firm.  reach out!",3,NYCGIRL1020,2
jsfdi1,m4b62ys,Omg soo beautiful 😍😍😍😍,1,Lower_Swordfish1473,3
ijpahp,g3g50my,[deleted],2,None,1
ijpahp,g3gq4ju,I’m in love!,2,Stone2443,2
ijpahp,g5a3ngu,please draw me!,1,SN54HC27N,3
mdb976,gsabz2x,WOHOOOOO 🥳🥳🥳,9,None,1
mlfh4m,gtl3aei,"You can definitely see the stars at Williams, and there’s a lot of open fields (and Stone hill) which give you the perfect viewing spots! One of my favorite things about being on campus is having the ability to star gaze and look at the gorgeous moon too :)",15,Sama12k,1
mlfh4m,gtl5tqt,"Absolutely! I literally go stargazing down on the football field at least once a week. I'm also someone from suburbia, so being able to do this has been one of my favorite parts of being here :)",4,Justyn_With_A_Y,2
mlfh4m,kzsg5jo,"Yes, one of my most amazing memories of Williams is laying on a blanket in Poker Flats with friends, the Milky Way above us. I saw a shooting star for the first time that night too. It was amazing!!",1,Throwaway172892930,3
kbeh8p,gg0oi3e,"Hey thanks so much! I read that Williams prohibits first years from operating a car on campus; however, are there some good off-campus places for first years to park/rent a space long term? Thanks very much good people.",3,EffectiveAct2,1
kbeh8p,gfgtyy8,Welcome everyone! Feel free to dm if you have any questions for a current student!,3,Justyn_With_A_Y,2
kbeh8p,gs8ayx4,"Got in after deferral, excited to meet everyone in the fall!",2,tyto,3
eakhb3,fauklmg,Grats! Yeah this subreddit could be more active lol. I guess everybody is too busy studying to browse Reddit?,7,Stone2443,1
eakhb3,fatzpxa,"Welcome! Class of '21 here, I'm so excited that early decisions are out. I can't wait to see what kind of energy class of '24 brings to campus.",6,jello34,2
eakhb3,fathbww,Congrats!!!! Williams ‘24 🤪💜,4,ven_us,3
ka0895,gf7kzu6,"I just cannot stop thinking about it. Everytime I try to forget something about Williams, I’m bombarded with thoughts about Spring Street and Williamstown, all of it. I hope I receive the better end of the news this week, and get to be an Eph. Here’s to hoping, and good luck to all of you!",12,sleep-deprived16,1
ka0895,gf7hu06,"I'm just waiting for that decision to come back. Does anyone have any idea if it usually comes right on the predicted date (Dec. 15), or the deadline is more loose?",8,JigsawFalling123,2
ka0895,gfeamoz,i’m trying so hard to not think about it but it’s not easy lol,7,None,3
nfruy5,gyvufj3,has anyone heard anything...I'm on the waiting list too,4,MikeRotchIsmusIng,1
p8k8xv,h9r6y0i,wow! how did you take that? stunning,3,None,1
k7lrs8,gertg40,"Hi, congrats on getting in! I’m just about through my first sem here and the workload has definitely been the defining aspect of my life here—that’s not to say I haven’t had time to do anything fun (I’ve made some
of my best memories this semester!), but my plans to generally revolve around making sure I have time to complete assignments. Compared to most of my friends, I seem to have a pretty heavy workload, and how much you have to do definitely depends on number and level of classes. 

I’d say almost none of the work is busy work, I find myself genuinely having to think about most everything I turn in which is probably the biggest difference between college work and high school work. There’s also a lot that isn’t necessarily turned in, but needed for apt class participation or understanding. There have been a few especially rough weekends with psets and a few hundred pages of reading (at least with my schedule, Wed-Fri tend to be more like weekends than the actual weekend) but there are also days with practically nothing. Be prepared to read entire books weekly or even over the period of a day or two. 

Overall, as long as you’re coming here with the mindset that you’re here to work, you should be fine! If you prioritize other things ahead of your work, you can certainly still succeed, you may just find yourself pressed for time in ways you’d rather not be. 

I hope this helps! I’m very open to talking about my experience here so far so feel free to pm if you have any other questions!

As a final note, I will say that some people have managed extremely low workloads this semester by playing off of the fact that we only had to take 3 classes this sem and many were remote, but I imagine this is not indicative of a normal semester.",11,Justyn_With_A_Y,1
k7lrs8,ges647u,"Yay!! Congrats and welcome to Williams :))

To take your points one by one: 

Please don't be intimidated by the prestige of Williams! Once you get to campus, you'll realize that 'prestige' is a pretty meaningless concept and, at least for me, entirely irrelevant to anything I've ever done at Williams. No one on campus ever gloats about our prestige -- thank god -- and the rest of the world hardly knows that we exist, so I really wouldn't worry about anything of that sort.

Imposter Syndrome is, unfortunately, very common at Williams; there's definitely an unhealthy ideal of effortless perfection. As far as I can tell, it's something the student body, faculty, and administration all know about. A lot of students come from big-fish-small-pool type situations, so many have an implicit expectation to remain the best at everything they do, which is neither possible nor the point of going to college. All I can say is that you've just been admitted, so don't stress about this kind of stuff: I can promise you that you *definitely* belong at Williams! 

Workload varies by person, of course, but almost everyone I know has fairly busy schedules. In my experience -- and I believe this is pretty standard -- my workload has increased every year, if not every semester: you start taking harder classes, get involved in more extracurriculars, perhaps pick up a job or two, etc. All this can 100% be draining, especially during finals (which are coming up, ugh!). Throughout my time at Williams, I've had to make active decisions about how I wanted to juggle my time, e.g. going to less parties to get more work done instead. It does help, though, that most of my work is genuinely interesting. And yeah, for the most part the work is pretty serious, especially, I think, in higher level classes. 

That being said, please know that Williams students still have fun! Figuring out how to balance everything can take time, but you'll get the hang of it. If you're worried about this, my one tip would be to give yourself a relatively light first semester, so that you can adjust as smoothly as possible.",8,RaunchyAir,2
k7lrs8,gesa1v1,Were you a QuestBridge applicant?,6,SpongeBobBlab,3
mpq281,gubpxav,"I think the fact that you are self-aware of this participation issue makes you a perfect fit for Williams -- one thing that I wish I could tell my freshman self is that everyone at Williams, regardless of whether they went to Exeter or an underfunded public school, still has a lot to learn and just because someone was educated with the Harkness method doesn't mean they have anything more substantive to say than a student who didn't come from a prep school background. Most students are in a similar position as you, and they are all more self-conscious about how they sound in a discussion setting than they really should be. You'll find most people are too focused on themselves to judge you on what you said in class. 

And to your point about ""not being super smart"" -- I obviously don't know you personally, but if you're smart enough to get into Williams, you're smart enough to excel at Williams. What's much more important at this point is whether you're willing to work hard to make that happen. If you are motivated by learning genuinely, forming relationships with your peers & professors, and working on projects that interest you, then you'll do great.",13,Farquaado,1
mpq281,gubo3bp,[deleted],5,None,2
mpq281,guell2l,"'21 here to jump in: 

4 years ago i would have said ""so true bestie"", but i realize- who said anything about needing to be super smart and prepared? u got in, and since u say ur not a super smart kid-genius extraordinaire, It probably means you are SO so much more- it did for me. so dont worry about imposter syndrome - because theres soooooo much more to life here. plus- the measurements of smart are arbitrary beyond belief here. 

Added bonus: Everyone here is, in their own special way, a HUGE dumbass. Honestly i wouldn't want it ANY other way. enjoy it, embrace it. the expectations they set are impossible without torturing yourself. its not worth that. don't be ""super-smart"": its not worth it. be happy, frolic, create meaning for time here beyond the ""smart"" label. and ofc, i still mean get ur stuff done , but remember that you, as a human, are also a class you take in the background all the time, and it is the most important one. Four years and I only regret not leaving more time for full-frontal clownery. Dumbassery headassery , tomfoolery, idk -u name it. theres plenty of time to suffer here at the hands of academia without the impostor syndrome kicking ur ass too. Lend that time to laughter, joy, and the dog on spring st. (theres many!) trust me.

I hope you go where there is happiness waiting for you. Good luck.",4,bigratbigheart,3
g8jmd2,foo4hy4,We’ve been hiring a ridiculous amount of CS profs recently so you can expect those course offerings to go up the next few years,9,ajax654321,1
g8jmd2,fooftxi,"I majored in CS and thought I got a great education. Williams' program leans theoretical, so you probably won't have a huge catalog of specific technologies under your belt when you graduate - but instead you'll have a deep understanding of common concepts, so you can pick up any tech quickly. 

My first job was full stack .NET (and database heavy), and I had very little experience in any of the languages I was working in - and it was totally fine. 

I also wouldn't discount the ability to do one or more independent studies if there are niche areas you're interested in - I don't know exactly how it works now that there are a lot more majors, but I did an independent study in cybersecurity and research with a professor during my time. Those are opportunities that might be harder to get at a bigger school.

Let me know if you have specific questions I can answer (with the caveat that I graduated 7 years ago when there were far fewer CS majors).",9,karlanke,2
g8jmd2,foorol6,"The Williams CS department is growing pretty rapidly, and Williams as a College is much better funded than Tufts/CMU on a per-student basis (meaning, you will be showered with research opportunities, grants, internship funding, project funding, etc.); while Tufts/CMU definitely have more technical programs (CMU's CS department is world-class), there are more opportunities at Williams to do independent studies with professors, take tutorials (two-person courses), etc. Williams, on-the-whole, would give you much more individualized instruction and the professors would be much more invested in your personal success. However, even if you were to exhaust all of the elective/independent study opportunities, you would still be able to spend one to two semester ""studying abroad"" at MIT, Columbia, Harvard, or some other comparable school (a contingent of juniors do this every year) and you can take the courses to satisfy your academic interests. Lastly, there is WEPO (Williams-Exeter Program at Oxford), which would be a full-year at Oxford (where you can study CS as a full-student at Oxford), and Herschel Smith (six or so fully-funded scholarships for Master's degrees from University of Cambridge, given every year to graduating seniors from Williams), in case you were interested in going to England to continue your CS work. 

Additionally, Williams is pretty well recruited by tech firms given its size; there is a really strong alumni network working in tech (in all roles - product management, software engineering, etc.), and the alumni network at Williams overall is pretty legendary. 

Please don't hesitate to let me know if you have any further questions! Also, you can definitely reach out to current professors at Williams -- they're all very friendly, and I'm sure they would be happy to speak with you.",5,Farquaado,3
oelpbx,h4811jt,"class of ‘21 here, Williams had some high points and some low points. It actually had enough low points for me that I somewhat regret choosing it

- middle of bumfuck nowhere 

- students study too much so social life is kinda eh

- classes are demanding and stressful

- very much a liberal echo chamber, which causes discussions in humanities classes to go in circles with students repeating the same buzzwords and talking points, with no-one willing to actually share a meaningful take

- many students are from wealthy backgrounds and are incomprehensibly out of touch with life

- student body is quite divided- by athletic status, financial aid status, race... A lot of people find their clique early and then stick with them",17,Stone2443,1
oelpbx,h476fvu,"Not a current student, but I was accepted and Williams was one of my top choices.

Ultimately, I don’t think that there are really any objective “cons” to Williams. Rather, you have to look at aspects such as class size, environment, teaching style, etc. to determine whether or not it fits you.

In terms of academics, for example, Williams is geared towards one-on-one teaching with tutorials and small class sizes. Its quality of education is top-notch, but this style will not suit everyone. Williams is also located in a more rural area with a small population, albeit with beautiful surroundings for nature lovers.

Ultimately, I chose a school with a larger class size and a more active city because I prefer that environment (this was my biggest factor), but it varies for everyone. At the end of the day, it’s really up to you. It sounds like you might prefer the rural environment, which is a really good sign that Williams may be perfect for you. Hope that helps!

EDIT: I’d also like to add that the incoming students I met in ‘25 chats and pages were some of the most creative, friendly people ever. One con, however, is that Williams didn’t send me any merch, only some pins :(.",11,xkerd,2
oelpbx,h4a41in,"Honestly, the location. Besides the obvious drawbacks like the lack of off-campus housing or any bar/club/live-music scene, being in such a rural area affects life in other ways that I didn't expect: finding good flights home is tough with the limited options and high prices out of ALB; there's not even really any good road-trip destinations closer than like 3-4 hours away; and nobody really has any sort of off-campus hobbies or social life so the dynamic can feel like a high school.",8,k_dubious,3
rghnx8,hokos5m,"@williamscollege2026 on Instagram, I don’t know about any facebook. Congrats!",4,toxicchips,1
rghnx8,hosnw5e,"I got accepted too! Let's connect  
https://instagram.com/tashrique.official",2,tashriqueahmed,2
rghnx8,hoo6mpd,"It's probably a little too early for any facebook or groupmes to be made. It's currently finals period here, so you'll have to wait at least until finals are over. You can definitely expect them in the coming months.",1,Rob-Barker,3
nlooqb,gzlnlrc,[removed],5,None,1
nlooqb,h1n9ldo,This is pretty general and I'm also a prefrosh but I am so excited to meet people! I feel like everyone is just a cut above and it is going to be amazing to have discussions and make good friends.,1,Slow-Relationship949,2
nlooqb,h912rnw,"Parent perspective here (parent of current student).

Mountain Day. Classes cancelled on a surprise Friday in October so that everyone can go hike up a mountain.

Once a semester, each student gets to invite a favorite professor to a special dinner. Apart from that, professors often dine/ spend time with students, and professors may invite their classes to their homes for dinner.

Freshman entry system and Ephventures orientation system ensure you meet people quickly as a freshman. “Snacks” is a formal Sunday night tradition bringing the entry together once a week, but entries do a whole lot of other stuff together during the year. The Ephventures orientation program is really fun, whether you are doing something like “Where Am I” when you explore what’s available in the beautiful area from world-class art museums to local stores to short drives or walks to lovely waterfalls and viewpoints, or you are doing something more intense like a few nights’ backpacking trip in the mountains (you choose your type of orientation program).

Opportunities based on the school’s endless resources and its loyal alumni: alumni-funding for any unpaid internship you get, alumni network, funding for whatever your club/organization wants to do, funding for research/ travel aboard/ etc., financial aid covers all your textbooks plus weird incidentals like skiing and snowboarding equipment rentals for PE classes and a suit for job interviews.

Winter Study- educational travel trips, individually designed projects can be approved, alumni-run practical courses… plus informal ‘courses’ run by students for students in things like cooking or jitterbug dancing.",1,Wordwoman50,3
n1r3jo,gweron6,Yes.,11,Stone2443,1
mo9ex3,gu3sc76,"I've heard you have the most beautiful and amazing co-chairs, what's their @ :))",2,Gaudlas,1
mo9ex3,jvuuru9,I want know more about financial aid,1,youssefalAref,2
be2b06,el2mvm8,"Hey! There's an admitted students chat that you can join! 
You're invited to my new group 'Williams 2023' on GroupMe. Click here to join: https://groupme.com/join_group/46830535/6sD1im",2,saudkmm,1
o8z6g2,h44xvvy,"Hi! I'm excited to hear that you're considering applying here! There's a lot to say about Williams, and I've only been here during the pandemic, so my time here isn't representative of the standard Williams experience. However, I'll share what I feel about the school!

Life at Williams has been great personally. There are a lot of reasons for this, but I guess it boils down to the people and the size of the school. Almost everyone I've met at Williams is tremendously friendly and is interesting to talk to. Unlike my high school, I haven't really felt the vibes of ""cliques"". There are obviously friend groups but I feel like they're a lot less pronounced at Williams. You meet people through different contexts all the time and a lot of people have friends who are involved in different activities, academics, etc. The entry system is a great conduit for this as well. Basically, around 30-40 of frosh live together and have activities like Sunday snacks (which is food + an activity) at a minimum or other things like dinners, dances, movie nights, etc. Some people don't like their entry, which is unfortunate but valid. There are other ways to make friends too, like through a club or classes. 

On top of your standard array of sports options and extracurricular interests, there are a lot of cultural and minority groups on campus as well, which help foster a sense of community and belonging. Because Williams is relatively small, you often see your friends or acquaintances walking around campus. It's kinda nice to just go out for a meal and end up catching up with someone you haven't seen in a while or just waving at people. Another thing I'm starting to find funny is how many friends you make that you end up being mutual friends with another one of your friends.

Classes have also been great! At least for me so far, all my profs have been super friendly and welcoming. You can tell they want to teach you and that they genuinely care. Divisional requirements might be annoying sometimes, but I do appreciate them for incentivizing me to branch out. People are pretty studious because classes at Williams do take time and can be intense! There are a lot of cute study spots on campus (having said that I'm usually too lazy to go to them lol). People do have fun though and there tends to be a decent amount of parties on weekends. I'm not much of a partier myself, but I found a group that I just hang out w/ when people tend to party/get drunk.

The food is meh. It's not bad by any means (I like it) but a lot of people have mixed feelings about it. Could be hit/miss but the dining staff does seem really nice and open to feedback and improving themselves. There's one street on campus that has a few shops and restaurants, which is kinda cute. The most popular shops include a Thai/Japanese restaurant, Indian restaurant, pizza place, and a market/cafe. 

In my first two months on campus I used to joke there's a scenic view everywhere I looked, especially during fall. There's a lot of accessible hiking trails and campus is very pretty. The downside to being rural though is that cities are a decent distance away. Boston and NYC are around 3+ hours away and can be cumbersome to travel to. There are free buses to North Adams (the nearest city) but it is still pretty rural as a whole. I never found this too much of an issue for me because I felt like for the most part, I was kept busy between classes, extracurriculars, and friends. 

Some Williams specific traditions are Mountain Day and Winter Study. Mountain day happens on a random Friday in October where the weather is good. Classes are cancelled and there are hikes of various intensities all day. It's a pretty fun time! Winter Study takes place during January. Basically we take 1 class (can be serious or for fun) and just spend time with friends on campus. 

I've kinda been rambling but I'm happy to elaborate/answer any specific questions you may have lol 

I hope you decide to apply!",9,WhyDebate,1
mvl55y,gvctan0,"A few years ago, but I picked Williams over UChicago, Columbia, Dartmouth, Brown, Duke, and a few other liberal arts colleges (Amherst, CMC, Pomona).",10,Farquaado,1
mvl55y,gve51ry,"Many years ago and I applied to a lot of schools because I needed a great financial aid package (which Williams provided! I ended up with only $5k in loans): Cornell, Tufts, Amherst, Bowdoin, BC, SUNY-Binghamton, Dartmouth and Franklin and Marshall.",5,ColaRBT16,2
mvl55y,gvduqkh,"Hamilton, Bowdoin, Middlebury, and Colgate.",3,pteroso,3
mqxh96,gukf431,Mine from last year was 700-ish words; my tip would just be really specific in connecting your experiences to what resources you want to utilize here,3,INEEDTOSTUDYYY,1
mqxh96,gujdgc1,"Though I don't have experience with this subject, I'd probably keep it to a page with normal font and spacing sizes. AOs will probably find anything over that a bit burdensome.",3,Rob-Barker,2
mqxh96,gujdned,Mine from last year was 1 page,2,Justyn_With_A_Y,3
