post_id,comment_id,comment_body,comment_score,comment_author,comment_rank
ba1jyc,eka4j7e,"I just want to tell you Congratulations. Statistically speaking, You’re kind of a unicorn. I’m sure this will mean that there will be some challenges along the way, but I hope you enjoy the ride. ",5,Nikonglass,2
ba1jyc,ek8yb4i,"Congratulations on being admitted to Williams! 

I'm just a freshman on campus, but here's my perspective on your question. Success, of course, looks very different for everyone on campus, but I find that Williams tries pretty hard to provide everyone the resources and services to facilitate our individual definitions of success. 

If you're talking about doing well in classes, there are a whole host of resources available -- peer tutoring programs are especially prevalent: the MSRC (math and science resource center), Economics Resource Center, and Writing Workshop are three that come to mind. Practically all of the academic resources are available to everyone on campus (there may be some positions held for ESL students) and all are free. Also, I've found office hours very helpful and honestly super fun. Professors are usually more than willing to meet with you in an appointment outside of their set office hours if you cannot make them. Generally, work at Williams can be pretty intense, but everyone adjusts to it in due time. 

If you're talking more about success after college or in internships, jobs, or research, the '68 Center of Career Exploration is very involved and helpful -- you can schedule a sit-down meeting with a career advisor on your first day on campus if you want. There are also a lot of research opportunities, but you'll learn more about that once you're here.

Feel free to PM me any questions. Have fun at previews! ",5,TheRoyalty,3
rd8t08,hnziey2,It’s 5 PM today. I’ve seen some people say 6 but the majority that I’ve read says 5.,6,toxicchips,1
rd8t08,ho1v7vc,I got deferred ;-; this is so damn painful,3,kissmeorkillme03,2
rd8t08,hnzqphy,Im so anxious daaaaaamn,2,Icy_Criticism_7501,3
qro3zv,hk7vzdx,"the campus itself is incredibly beautiful as you must know, i’ll never get tired of being here and finding nee spots to study/hang out. and the brta buses (covered by the college) take you to north adams and pittsfield where there are other things to do. on campus, the RSOs organize tons of fun activities (the “fun” itself being defined by what type of rso you join lol), as well as the college itself organizing things. i dont go out a lot so it doesn’t feel monotonous unless i want to take the day off? but if you’re the type to go out to the city every weekend (or whatever) then it might get boring after a while",4,alepirela,1
qro3zv,hkaf9e6,"I always suggest physical visit to the campus whenever possible for all Williams applicants. Personally, I wanted to go live in a rural area for undergrad because I had spent most of my life living in cities or adjacent suburbs. The setting of Williamstown, I think, is pretty integral to the whole educational experience. It can get challenging. I had to rely on a lot of expensive shipping and substitutions if I wanted to cook the food I eat at home. It's easy to fill up your weekends with activities with social and cultural events, but sometimes you want to get out of the bubble. Some people I know took the Peter Pan out to Boston or NYC pretty frequently or brought cars, but I couldn't afford to do that. I did take the local buses to go and explore nearby towns. I was lucky that I wanted and enjoyed the remoteness of the community, but I think we should acknowledge that it isn't everyone's cup of tea. You can always transfer out to other schools if you find that Williams is not the best fit for you.",3,purofound_leadah,2
qro3zv,ho80dex,"How often are students able to go offcampus for stuff like motives or whatever activities? I don’t mind a rural college, but I want some relevant activities to be like a hour away or something",1,Bashslash,3
pgshak,hbe8c01,"Both colleges are outstanding. You can’t go wrong here. In fact, there are more similarities than differences between them- all the benefits of a small college, with small classes, close relationships with professors, and deep, rich classroom discussions. In addition, the student bodies at both colleges are intellectually vibrant and enjoy “the life of the mind.”

In response to your questions, I believe that both colleges are similar from a political standpoint. Both lean liberal, and the students who are the most vocal activists are on the left end of the political spectrum.

There are two commonly made comparisons on these forums that just seem not to match reality. 

One view has Swarthmore as crazily intense and Williams as more relaxed. Honestly, I think that Williams now has all the same intensity that is traditionally attributed to Swarthmore. Plan on studying a lot at either college.

The view of Williams as preppy or jock-heavy also rings false. First, athletes don’t dominant at all. Yes, there are a lot of athletes, and yes, there are some ways in which certain athletic team cultures can be a bit isolated from the rest of the students. For example, if you are a male fall helmet sport player, you probably will spend more time with your teammates, while the rest of your freshman entry (dorm group) is spending more time together as an entry. However, if you are a nonathlete, except for cheering on your entrymates at some events, you probably won’t be thinking much about athletics, because you will be busy with other things that interest you, whether those are music groups, theatre groups, a variety of activity or special interest clubs, hiking and the outdoors club, etc., etc. There is so much to do at Williams, and there is a fascinating variety of interests!  The students there tend to be passionate about their intellectual and extracurricular interests, but to have a wide variety of interests!

Second, ‘preppy’ definitely feels wrong. The students come from a wide variety of backgrounds. And the way the freshman entry is set up, friendships are formed between people from very different backgrounds, socioeconomically and otherwise. In terms of clothing and culture, I would say that most kids wear things like jeans and sweatshirts or T-shirts, and, if I were to unfairly stereotype the wide variety of students, I would probably say “nerdy” is much more predominant than “preppy”!

So, how to choose between the schools?

Swarthmore is suburban and a short train trip from Philadelphia for a quick weekend visit. Williams is rural and remote, surrounded by breathtakingly beautiful mountains. Swarthmore has a more uniform stone look, while Williams is more of a hodge-podge of architectural styles. You may be drawn more to one physical environment than the other.

Each has its own hallmarks. I know Williams better, so I will speak to its unique attributes:

1. The tutorials are indeed awesome: just two students and one professor, where each week one student writes a paper based on the readings, taking a stance, and the other student responds to it with a critique.
2. The freshman entry system involves about 40 freshmen living together alongside 3-4 unpaid junior advisors, who have no disciplinary functions but act more like big brothers or sisters. There also is the Ephventures orientation program (where you choose your own adventure, which might involve exploring local attractions like art museums or going on a backpacking trip in the mountains). Between the two, you will begin your Williams experience with a built-in group of people alongside you as you adjust to college— people with whom you will go to dinner, hang out, etc. It’s a nice way to start your college experience.
3. Winter Study - Whether you’ll love it or hate it, you’ll be at Williams in January, taking one pass-fail course, with a variety of fun topics, travel options, independent study options, etc.
4. The Mountains- Where else would the school song be about mountains and a favorite college tradition be Mountain Day? Mountain Day is a random Friday in October when classes are cancelled that morning so that students can go on organized hikes up the local mountains.
5. Opportunities- The resources are incredible. Financial aid covers not just the basics, but every book you need for class, skiing or snowboarding equipment and costs if you take one of these for PE class, even a suit for your interviews if you need one. And even if you are not an aided student, you will benefit from the college’s resources by receiving money for your student club to go on trips to tournaments or events, and from alumni-sponsored internships, and various other benefits. And the alumni network is actively involved and very supportive. 
6. Also, you said you like history. The history department at Williams is absolutely amazing! Great courses, wonderful professors.
7. You also said you might pursue a JD. The Law Society at Williams offers both a Moot Court and a Mock Trial Team, and these provide fun socialization as well as some like-minded peers. And the tutorial system will prepare you well for making and defending an argument and critiquing someone else’s argument!

Two amazing colleges. Try to visit or talk to some current students at each. It may come down to whether you prefer proximity to a city or to the mountains. Or you may just go by your gut feeling, where you feel more ’at home.’ Probably, in truth, most people who would be happy at one of these colleges would be happy at the other.  Good luck!",20,Wordwoman50,1
pgshak,ho3nnoj,Which college did you choose?,1,Bashslash,2
mp2o5x,gu79k1v,wondering this too,5,kairepsiraya,1
mp2o5x,gu88k63,"I don't know of any directly, but you could possibly unearth something if you get creative. Go on Google Maps satellite view and find open parking lots near campus. Then crosscheck those against the [Williamstown property map](https://www.axisgis.com/WilliamstownMA/) to see if the lots are owned by the College or by a private individual. In the latter case, track that person down (the property map contains owner names, which is a start) and contact them to see if they'd rent you a spot. If I were in your situation, the first place I'd try asking is the [Northside Motel](https://northsidemotel.com).",3,AlanShawnFeinstein,2
mp2o5x,gubtq17,"If you're willing to pay the hefty price of having it permanently parked on Spring Street, then yes. Otherwise, all other options are impractical.",2,Rob-Barker,3
i3n3i0,g0f4h20,"Damn, all of this is exactly what im looking for and thinking about doing as well 🤣 (apart from the pre-med bit). We gotta catch up once we get to college!",3,koolpotato21,1
i3n3i0,gdw8d5x,"hiya just a follow up on this, did you find anyone?",1,koolpotato21,2
fzzd3s,fn74ont,[deleted],8,None,1
fzzd3s,fnb25lo,"Definitely not an issue; even though 2,000 students doesn't seem like a lot, especially when compared to state schools, you'll find that there are more than enough people who share the same idea of socializing as you do.  Plenty of folks are more introspective and prefer personal interactions rather than big group activities; even folks who are generally extroverted can be seen by themselves when they need to work, time to decompress, etc.

Also, I think you'll notice that people are a lot less judgmental in college (and especially at Williams).",2,Farquaado,2
fzzd3s,fnbmemf,"No, just make sure u go for a single!!",2,theTJWat,3
fswh04,fm6cnfa,"A few thoughts that might be useful for you:

1. As I'm sure you'll have seen on the Williams website, only 3 people have done this program in the past 20 years. I'm not personally aware of any of them.
2. I imagine this is because relative to the set of options available to most Williams students, this isn't necessarily one of the most attractive ones. For instance, leaving Williams for Columbia after junior year would be pretty disruptive to the roots you'll have made on campus, and the research opportunities and advising available at Williams will likely be far harder to come by there.
3. If you compare completing this program to finishing all 4 years at Williams and then going to a graduate program in engineering, the first option gives you a bachelors in engineering in 1 year and the second gives you a masters in engineering in 2 years. Even ignoring what you'd miss out on during your senior year at Williams, the better of these options to you would depend on how much you'd value saving that one year.
4. All that said, if you're really set on doing this program, you're not going to have a courseload that different to an many normal physics majors. Although it's true that you'd ""have to finish a 4 year degree in 3 years"", graduation requirements at Williams are very lenient compared to many peer schools. Almost all Williams students take 32 courses across 4 years, but to graduate you only need ~10 courses in your major and 6 more to complete distribution requirements. This is why double and even triple majoring are very commonplace at Williams. If you took no electives at all, you could probably finish every requirement in 2 years without taking any extra classes (although that definitely would be difficult and would make no sense at all). 


Hope this helps! If you have any more questions, definitely feel free to shoot me a PM.",8,OpenNewspaper7,1
fswh04,fmq4w4p,"While the 3+2 combined engineering programs with Columbia/Dartmouth are not popular, engineering professions are nonetheless a common path for Williams College students. Students interested in technology-based engineering (software engineering, solutions consulting, data science, OR etc.) generally major in statistics, computer science, and/or mathematics whereas students interested in more physical engineering (civil, aerospace, etc.) generally major in physics and/or any other major/concentration relevant to the career track (e.g. environmental studies, chemistry, material sciences). There are a handful of students each year who go to graduate school for engineering, and a sizable portion of each year's class enter engineering jobs as well. 

Additionally, spending 4 years at Williams and 2 years in engineering graduate school makes more sense for an engineering career rather than 3 years at Williams, 2 years at Columbia/Dartmouth, and an additional 2 years at graduate school. The undergraduate degree in engineering doesn't give you a substantive edge over a research-intensive liberal arts degree when it comes down to graduate school, and the only significant advantage of completing an undergraduate engineering degree is if you want to go directly into a physical engineering profession (and possibly skip graduate school altogether -- which is also a valid career route).

Also, a handful of juniors at Williams every year ""study abroad"" at MIT, Harvard, and Columbia; during these years ""abroad,"" students can take courses in engineering (with few exceptions) which helps prepare them for directly entering engineering post-graduation/entering graduate school for engineering. This is also a more common route than the 3+2 combined program.",3,Farquaado,2
fswh04,fnptyw2,"I am not sure how things work at Williams. At the liberal arts school I started, I just needed to complete most of the requirements of the major while I was there and fulfill the minimum graduating requirements. What the registrar told me is that they will be able to take the upper-class courses I took at Columbia and apply those to the major at my college. To be safe talk to the 3-2 engineering liaison at your college I am sure they will be able to help you with all of this and career paths if you are deciding between a masters.",1,zaizar33,3
ow4y4k,h7r7fl9,"hey lqxin! :) i'm not sure, to be honest. one thing to note is that the supps last year were optional; some people didn't actually need to submit any to get admitted. so that's a good thing to know :). how are you feeling about going off to college? if you're applying to williams, you're probably applying to some pretty big schools. the transition can be very rough. howre you feeling about it? :)",4,betacux,1
ogbgyu,h4hvcqi,Darel Paul,9,chromium0818,1
ogbgyu,h4ixadd,"https://williamsrecord.com/178614/features/conservative-professors-discuss-life-at-the-college/

There certainly are not many openly conservative professors, but it is definitely still possible to get exposure to more conservative viewpoints in classes. In Professor Bohlen’s history courses, for example, you can learn about the American conservative movement and conservative ideas. Most good professors will allow students room to interpret and judge those ideas for themselves.",6,Gavinmo,2
ogbgyu,h4k6j31,There are plenty of conservative professors at Williams but you won’t find fascists among the staff. The diversity of subjects at Williams lends itself to liberal mentalities and healthy social order. Have a great time and drop your prejudices before you get there👍,6,ArrgguablyAmbivalent,3
q1rvb9,hfieu59,"1. Yes. For an international student on financial aid, unless you have a hook (some sort of ultra-stand-out  thing), you should assume the only way you'll be accepted is if you apply ED. 
2. Yes
3. There are many singles, some doubles, some shitty dorms, and some nice ones. You will probably only get a shitty dorm as a sophomore - freshman and upperclassmen typically have quite livable housing situations.
4. No, but most of the year is cold enough that it's not really a problem.
5. Competitive enough, but your SAT is a little low. Unless you have something that really stands out, it is difficult to get accepted, regardless of test scores.
6. HUGE yes on this one. Beautiful campus. It gets even nicer in the fall, and the winter has its own beauty as well.
7. Yes.
8. The food options are good enough. Sometimes it sucks, but generally it's good.
9. You will be safe. Most people on campus are too worried about offending anyone to be racist. You may experience unintentional microaggressions, but it should be a rare occurrence. There is also a tight-knit international community here so you should have no problems making friends. (Confession: in my opinion, international students are the friendliest and smartest people at Williams)",7,KenVatican,1
q1rvb9,hg14zaj,"Just to add to the other comments:

ED is great, if the estimated family contribution on the net price calculator works for your family and you would be happy to attend Williams if you get in. Nearly half the class is admitted ED. Financial aid for internationals is not as sure a thing as it would be at the similar Amherst, which is one of only a very few US colleges to be need blind and meet full need for internationals.

Dorms:  Yes, there is a common area kitchen in many dorms. No air conditioning in the dorms (although I don’t know what they’d do if you have a documented health issue— they very well might accommodate you with a unit— you could ask.) It says on their website that wired Ethernet is turned on only if you request it, but there is a procedure for requesting it. There is WiFi everywhere. There are not problems with using a laptop for schoolwork, but Facetime calls work more smoothly in some locations than others.

60% of freshmen live in singles. Your friend group’s lottery number determines whether or not you will be able to get a single sophomore year— or if you are friends with a housing coordinator, they can pull you up with them. During junior and senior year, everyone can get a single, and seniors can also enter the co-op lottery.

The weak spot for Williams, amid all its many wonderful strengths, is its attention to quality of life aspects. The dorms are often not so well maintained. Plus the dining is much less good than it is at, for example, Bowdoin or Middlebury. And this year, dining is a disaster: they cut back hours, leading to long lines, made it impossible to reenter the serving area at one venue, and temporarily suffered from a shortage of forks (which was brilliantly spoofed in their student humor publication, The Haystack).

The surroundings are beautiful, and the college takes advantage of its location with walls of glass in the library through which to view the mountains, as well as traditions like Mountain Day, a random Friday in October when it is suddenly announced that classes are cancelled and everyone hikes up the local mountains (organized hikes range from easy to difficult, on different trails, and nonambulatory people can take a bus to the top of a smaller mountain/ hill).

Not all parts of the libraries are open 24 hours, but there is a 24 hour study room in the main library.

It is hard to imagine a “safer” setting than the remote, rural, college-centered Williamstown.

And, as another poster noted, it is very cool to be an ‘ally’ and very uncool to express overt prejudice.

The most amazing and satisfying aspect of Williams, though, is its academics. Brilliant professors and peers you will interact with through many small discussion-oriented classes, including the incomparable two-person tutorials.",3,Wordwoman50,2
nlr1bx,gzmqwi3,Not precisely — there’s a shorter summer waitlist they only placed fewer than 30 students on.,3,Practical_Reason7208,1
mwvmfc,gvkirta,"Peter Pan buses are run on the Peter Pan schedule which is independent of the college. So chances are if you wanted to go home, there would be a Peter Pan bus. The college also runs the Williams motorcoach, which is a more direct (i.e. shorter) route, but it’s only run on specific weekends.

I would say freshmen mostly take the motorcoach, since it’s much faster and typically available on weekends people would want to go home, like longer weekends and holidays.",7,dby1014,1
mwvmfc,gvkidtc,the peter pan buses are always available! the school also provides motor coaches to nyc and boston before breaks/long weekends but that’s a separate thing :),5,None,2
mda8nu,gs87oyr,"One of my best friends here at Williams was a waitlist admit. Don’t give up! I think you should use the opportunity to express what you love about Williams and why it’s your top choice. Of course be prepared for the reality that getting off the waitlist is slim, but if Williams is your top school, you should do everything in your power to better your chances. 

I wouldn’t worry about a lesser finaid package. Williams has great finaid and I don’t think being a waitlist admit would decrease your package amount.",7,dby1014,1
mda8nu,gs8opck,"Hi! Last year's waitlist admit here, writing this to remind myself how fast time flows.

While I agree a lot of waitlist admitting does depend on luck/amount of admitted ppl who ends up actually committing, there are definitely things that you can take into control, and I want to reiterate dby1014's points - don't give up! I'd say the restate commitment/continued interest piece is pretty important, treat it like an actual essay - tell the admission officers why do you love Williams, what programs attracted you, how do you envision yourself as a Williams student using the resources, etc. If Williams is actually your top choice, say that in the letter. You can also update the office about recent accomplishments in the letter. In my case I ended up putting more effort into this than the actual application essay, which was probably why I got waitlisted at first place lmao

Anyways, let me know if you have more questions - happy to help, and good luck :)",5,INEEDTOSTUDYYY,2
i2hugp,g05caaf,"No, definitely not. Printers in the library reliable and all students receive a very large print allowance.",11,Ruth_Badar_Ginsburg,1
i2hugp,g05e02i,"Don’t bring a printer. It’s unnecessary. No matter where you end up living as a freshman, you’ll be ~3-5 min away from the library, where there are many printers.",9,dby1014,2
i2hugp,g06ir1b,No. There are heaps of printers all over campus. And freshman dorm rooms aren’t that big so it’s advantageous to pack light.,6,Stone2443,3
g3ei6x,fnqyxjb,"I dont remember exact details but there is some sort of housing form - it allows you to pick your preference of single/double and whether you want to live in frosh quad or mission.  You aren’t guaranteed what you pick but there’s a good chance you get it.  If you want a single/are indifferent to what room you have I strongly strongly recommend mission - made my first year very enjoyable

Also congrats on choosing!  You’re gonna love it here.",7,Maglor125,1
g3ei6x,fns730r,"'24 here too, i'm pretty sure they send us the housing form later this summer",3,guuz2001,2
g3ei6x,fntt6qg,Lots of really useful information in the Bell Book: [https://student-life.williams.edu/bell-book/](https://student-life.williams.edu/bell-book/),3,East_Village_,3
fshgvz,fm1etgy,"I'm a current Asian student, and although it is true that Williams does have a lot of white people, I wouldn't say I feel out of place. The vast majority of the student body is very welcoming and I feel very comfortable no matter who I'm hanging out with, be it my white friends or my non-white friends. Also, before the school year officially starts, Williams invites international first-years to go to campus before everyone else, which allows you to form some social connections with people from all around the world, most of which are people of color. No matter what you decide, I want to congratulate you on your acceptance! That's huge! I hope to see you on campus next fall :)",9,acesun77,1
fshgvz,fm1xsjl,"I’m also an incoming freshman who happens to be Asian, so I’ll offer my two cents: Williams is actually very diverse compared to most other liberal arts colleges! Only around 53% of current students are white. That’s a lot lower than the national average, contrary to what you may have heard. When I visited, I saw a lot of non-white students and felt welcome.",6,Like-A-Phoenix,2
