post_id,comment_id,comment_body,comment_score,comment_author,comment_rank
bxipfa,erg79vn,23 year old non-traditional student here. Attending Williams College in the fall. I dropped out of high school and never took the ACT/SAT. My academics at a local community college + life experience definitely helped get me in. I was also accepted to Amherst. PM me if you have any questions whatsoever; I’d love to help.,3,violizaki,3
8n5mcz,dztlw04,"I'm class of '16 and my family had to switch from T\-Mobile to Verizon when I went to Williams — they may have built new towers since then, though. 

Actually I just googled — the Williams site says that ""**AT&T, Verizon, Sprint, and Nextel provide cell phone service in this area.""** \([https://families.williams.edu/faqs/](https://families.williams.edu/faqs/)\) so I think you will have to switch. \(T\-Mobile sometimes piggybacks off of AT&T but I think you get roaming charges\)",3,doyouoverthink,1
8770ef,dwaqncs,Berkshire quad? You mean Currier quad?,3,RhymeSpit,1
q8bqlo,hgqvsem,i'm a current Asian-American student at Williams — feel free to message me,5,acesun77,1
q8bqlo,hh8mvhg,AAPI student here. DMs are open - shoot me a message!,3,chromium0818,2
plblq9,hc9fkss,"When I applied, there were three options - two prompts, and one option to submit an academic paper. Are you sure that there aren't any essay prompts for the supplement?",2,KenVatican,1
plblq9,hcagvi0,"Are academic papers from an EDx 2 months online course acceptable. It was an assignment where And was graded, can you submit it ?!",1,The_Adam07,2
otob98,h6x00me,[deleted],3,None,1
otob98,h6zrinx,"I emailed them last year and was just curious. Nothing really, you do get to see it in person, by yourself. There was just a copy of your common app stuff and some other tables with your personal infomation, i.e. first-gen? legacy? etc..

They say they do not disclose comments from admission officers, at least for Williams.",3,shen2333,2
otob98,h6wvfno,I wanted to know this too.,2,SpongeBobBlab,3
nwbgrq,h2gt2ml,"I think those changes will help you out. There's one thing that I think could help you out even more, actually! :)
So, I noticed you've been doing a lot of different activities. Yoga, teaching English, website, research paper, and dance... you've got a really diverse skillset. I think it could make for a really strong application if you found some way to tie those activities together in an essay or some other piece of writing, if there's any connection that can be made. For example, imagine writing like, ""I really like helping others, and by teaching this kid English and teaching others yoga, I've been able to help people with both the mental and physical parts of life. I hope to do more like this for others at Williams."" Or something like that haha. When a person ties together the different things they do, it can make them seem like a super powerful character or something, haha

Btw, how come you're planning on making slight changes to the common app essay? Do you feel like it was a good essay and you just wanna tweak a few things, or do you think the Williams peeps didn't like it? I think the essay can be a really strong point to win over the advisors, so I'd recommend showing it to peeps like friends and teachers and see what others think. I'd love to help out with that if I can--you can always DM me for any help with this stuff :) I don't check my reddit very often, but since it's a couple months until the 2022 application opens, I'm sure I could help you out <3

Let me know what you think of my thoughts, I hope they helped :)",1,betacux,1
mnkccf,gty144j,"Here you go:

[https://linktr.ee/Williams2025?fbclid=IwAR27obVLULTFw\_lHYWWTTg2bFxVTZU2eUNRYH2mExXaDSarMwyRzTdWHPDQ](https://linktr.ee/Williams2025?fbclid=IwAR27obVLULTFw_lHYWWTTg2bFxVTZU2eUNRYH2mExXaDSarMwyRzTdWHPDQ)",2,tyto,1
mnkccf,gtynl3h,"There is a GroupMe! I’m not sure how to add people to GroupMe without using phone numbers, so if you’re interested shoot me your number so I can add you to it. Congratulations again!",2,Like-A-Phoenix,2
mnkccf,gtzc84s,You can join the Facebook group and all the other messaging groups should be posted there.,2,Gaudlas,3
mf2b1k,gsl9ofn,"Unfortunately, I’m almost certain that Williams is planning a virtual admitted students event :/",14,TheRoyalty,1
mf2b1k,gsld1qu,"Unfortunately, inviting admitted students to campus during a time like this would be a huge public health risk. I know it’s frustrating to make a huge decision like this without visiting campus in person, but Williams has to prioritize the health and safety of current students, faculty, and staff. I don’t know much about what the school has planned for virtual previews, but I do know that admitted students will have the opportunity to chat with current students over email, so be sure to take advantage of that! When I was making my college decision, I found that talking to current students about their experiences was incredibly helpful.",9,None,2
mdxvdu,gsdc310,"Class of 2024 waitlist admit here, feel free to dm :) also check out my comment here [https://www.reddit.com/r/WilliamsCollege/comments/mda8nu/i\_hath\_been\_waitlistedwhat\_should\_i\_do/](https://www.reddit.com/r/WilliamsCollege/comments/mda8nu/i_hath_been_waitlistedwhat_should_i_do/) , might be useful",5,INEEDTOSTUDYYY,1
mdxvdu,gsfpnlw,On their last published common data set the admitted under 4% from the waitlist. You still have a chance of course but I’d make other plans and if it happens it’s a happy surprise. Sorry to be the downer here. Good advice above - send a letter expressing continued interest. Say explicitly “if admitted I will accept”.,5,OCDaddy11,2
mdxvdu,gschyec,"I cant speak for myself but I know two people personally who are my year and got in off the waitlist - you definitely have a shot!  One thing though - you should definitely write a letter really emphasizing that you really want to come here over other colleges and show your passion for Williams.  Mention specific thing about this campus that make you really want to come here - probably a good idea to make a teacher proofread it too.  

Good luck!",3,Maglor125,3
md0hqi,gs6j1r1,"Today at 6pm or so! Their initial date was the first but they changed it to be earlier, like most colleges do",9,nql4263,1
md0hqi,gs75hhu,Good luck to everyone on here!,8,kingloogie79,2
md0hqi,gs7zkkq,bout to have a heart attack tbh,3,tea-mi,3
lwubpk,gpj9dup,[deleted],4,None,1
lwubpk,gpkohmc,I've heard of them sending likely letters in the past. Haven't heard anything about it this year.,3,skys-thelimit,2
lqy09z,goj4rlc,"There is some stuff but I’ll be honest it’s pretty sub-par.  The Deans and professors can be very helpful, and there’s accesible education and IWS (Integrated Wellbeing Services).  But I wouldn’t hold your breath for anything great.",5,Maglor125,1
lqy09z,gokxgdl,"There's this student run club called Eph Peer health as well, they seem to be pretty nice",4,koolpotato21,2
lqy09z,gppzhyw,"All williams students get a free talkspace account for their 4 years here, even if you aren't on the Williams health insurance plan. So, basically 4 years of free unlimited online therapy :)",3,wyo420,3
kgqbgq,gggi543,"1. Fellow CS major here, although only in my first year. I came in with high expectations, but my expectations have *still* been exceeded. I took the standard second-year CS course (Computer Organization), and the course was excellent. It was challenging, interesting, and enlightening. As far as job opportunities go, the CS department does a stellar job at communicating available opportunities. They frequently send out emails with information about various opportunities for internships and post-graduate research programs. There are also many extremely intelligent CS majors. In conclusion, the Williams CS program does not disappoint.

2. Unfortunately, this question is very difficult to answer, because the ""best and worst things"" are just so dependent on who you are as a person. Some might say that it's the ""jock"" atheltic culture, which comes from 30% of the school being recruited athletes. Others seem to feel that the school is ""stifling"" due to being in a relatively isolated area. For me, neither is actually a problem, and I actually really enjoy the location of Williams. That's why this question is so hard to answer.",8,KenVatican,1
k4bxqb,ge8030s,"This is a great question, and I'm happy to say you shouldn't be concerned at all! Williams has a very well organized student service program organized through the Center for Learning in Action, which is probably one of the best and most active offices on campus. They organize volunteer work of all different sorts, for all different types of people, all times of the year. Many, many students are involved in CLiA's programming and they often make it easy and accessible by providing transportation, connections, resources ect. And this is on top of all of  the service-based student organizations on campus. I would encourage you to check-out CLiA's website [here](https://learning-in-action.williams.edu/), which has a sample of some of their programming. If you're interested in, I can also connect you with a recent Williams graduate who was/is heavily involved in CLiA and service generally. Hope this helps, and feel free to let me know if you have any questions.",6,Ruth_Badar_Ginsburg,1
k4bxqb,ge8mzq4,"The Berkshires are desperately in need of more volunteers, please help",1,ArrgguablyAmbivalent,2
k3jbbi,ge3ca8u,"i think it should be under employer, but i’m a high school student. pretty sure that it’s employer tho i’ll wait for a Williams student to reply. 

have a nice day!",2,sleep-deprived16,1
k3jbbi,ge3q17l,[deleted],1,None,2
jsv89j,gc1pm8n,"Yes. I’m not an international student, but financial aid at Williams in general is very good. Look [here](https://www.williams.edu/admission-aid/apply/international/).",9,dby1014,1
jsv89j,gc1svab,Yes but not need blind,8,shen2333,2
jm0969,gasbm1j,"Lots of people at Williams didn't play sports before coming here/throughout their time here. I wouldn't worry too much about it. Where are you seeing that no playing sports ""hurts"" your chances?",8,purofound_leadah,1
jm0969,gas5pil,"i’ll most probably take up a sport before joining college, but i don’t have one as of right now",0,sleep-deprived16,2
ieev4f,g2fosce,"Independent Studies for Winter Study...had a friend ""study"" California wines on the school's dime. Another went to Australia to observe marsupial physics hah.",14,fatLOKO4,1
ieev4f,g2gji0n,nice try fed,11,richtoddler,2
ieev4f,g2gegl0,"If you’re on Fin Aid you get the book grant (free books) but please also do yourself a favour and price check what the school’s pricing is against what Amazon and Barnes and Noble would have charged you. You get bookstore coupons for the difference, and that’s how I got a new free Mac charger.",8,Wilson_Is_Dead,3
ib6sid,g1ws1uy,"There are two ways in which one could argue that Williams is not need-blind.

1. They are not need-blind for international students. They openly state this.
2. Adam Falk said during an interview  that, when recruiting domestic applicants, one could say that the college isn't need blind in that they actively try to recruit and assist low-income students through the admissions process. When it comes to this, it might actually be more appropriate to say the college is ""need-seeking"", but that ""need blind"" would still be appropriate in that no domestic applicant would never not get in bc. they need financial aid.

It's very unlikely that Williams would be lying about being need-blind. Williams is in a much better place to fund undergraduate financial aid than places like Harvard, Columbia, and UChicago because of its endowment and small size.",6,Ruth_Badar_Ginsburg,1
ib6sid,g1twhqm,"Around 50% of the school receives financial aid. It seems unlikely that Williams is need aware if that is the case. Furthermore, I personally feel that Williams administration is highly benevolent and transparent, so I would be extremely surprised if there was anything sketchy surrounding financial aid admission practices. Anecdotally, I was admitted to the school (although off the waitlist) despite requiring financial aid. 

I think that the sentiments that ""need blind admission is a farce"" may stem from certain deceptive practices that other schools exercise. For example, it is believed that the UChicago waitlist is not need blind, despite the fact that regular admission is. Therefore, in the case of UChicago, it would probably be better to submit your financial aid after you submit your application. Fortunately, Williams explicitly states that their waitlist is need blind, so I believe there is nothing to worry about regarding Williams.",5,KenVatican,2
ib6sid,g1tjiah,International students with their 5 need-blind colleges be like: 👀👀👀👀👀,2,koolpotato21,3
i3jdk2,g0bs8yv,"I use an iPad to take notes and make study guides out of them. There are many videos on YouTube about note-taking systems for the iPad. You can cop a $549 iPad Pro 11 inch 64gb on the Apple refurbished store (looks and works like new) and it’s hella worth it if you’re looking for a semi-budget iPad with incredible performance and productivity. Though, if you can wait, I’d suggest waiting for this year’s iPad Air (which should be released in late Fall or early Winter). It’s rumored to have many of the same features that make the iPad Pro (2018) amazing at a much more reasonable price for students. 

Feel free to pm me if you have any questions about this",2,None,1
i3jdk2,g0btik7,"I personally use just a single 1-subject notebook each semester and manage to fit all my classes in it. Depends on the class, though. In some classes I don’t find it necessary to take notes, and if I do, they might just be in the reading packet. Other comment recommended getting an iPad Pro — that’s a great idea if it’s within your budget. And all professors on campus are tech-friendly so don’t worry about not being able to use it in certain classes.",1,dby1014,2
i3jdk2,g0c0eok,"I usually go for folders over binders, but that's just personal preference. You should also know that there are many events on campus where you can get free pens. Honestly, after I found this out my Freshman year, I never had to buy any during my whole time at Williams. I'm not sure how covid will impact this, though.",1,goatsarepower,3
hnnmwh,fxduhvl,cursed,8,Ghundio,1
hnnmwh,fzoe5g9,In the sciences it's relatively friendly and collaborative from what I have experienced.,5,Quaerendo_Invenietis,2
hnnmwh,g05e5k2,"I went to a very competitive high school in CA and it’s much chiller at Williams. I love the school and the people. It’s still hard, but people are more collaborative.",2,dby1014,3
h9v29c,fv0gniz,"People’s experiences were very different, but I can give my take as someone who has easy access to a high-speed internet connection and who took mostly math and computer science classes last semester. 

Largely, academically, the transition was fine for me. All of my classes were lecture based. The one class that I had that relied more on group work was transitioned toward a tutorial format, which was fantastic and which I hope many professors try if the fall semester ends up being virtual (and I’ve given that feedback to the college). That change definitely gave me a better relationship with the professor, created accountability (because you’re accountable to your group mates and have to have something to show for your work in a face-to-face meeting with the prof once a week) and probably enhanced my learning of the material. 

For the classes that relied only on recorded lectures, it was tougher. I was able to keep myself accountable and watched them more or less on schedule, but I understand that it would be harder overall for some people. I also don’t have too much trouble learning from someone talking at me, but other people who really prefer discussion, q&a, and breakout sessions as part of their learning experience would have been disappointed. 

Finally, the logistics of TA sessions and office hours were different. Arguably, TA sessions and office hours are easier to attend virtually, but there is a lot that is lost in virtual TA sessions. I was a TA last semester, and attendance dropped drastically after the transition. I had like 13 students every Tuesday night, the atmosphere in the room was great, people collaborated on problems on the blackboard. After the transition, I had one or two students each week, who mostly just asked one question and then logged off. Also, if you’re not up to date with the lectures, then TA sessions and office hours can’t help you much. So if you have trouble keeping yourself on track, or some family emergency or something means you end up cramming in a few weeks of lecture at the last minute, you lose the ability to take advantage of those resources.",9,jello34,1
gganvw,fq0fo8l,You don’t really need all that much imo. Pretty much your only expenses will be walmart runs and the occasional night out. I spend about $15-20/week on myself,6,CraneCranium,1
gganvw,fq1ki7l,"Depends on the person. My expenses were mostly snacks or occasional dinner at Sushi Thai with friends. If you drink, that's also another expense. I felt that between working during the summer and picking up shifts for work-study couple of days a week, I was comfortable. You can also hold extra work-study jobs. I was a peer tutor on top of working at the language lab.",1,purofound_leadah,2
gg6w0b,fpxxm7a,"Congratulations! I got off the waitlist as well, but I haven't enrolled yet. I checked my portal, and found the following info that might be helpful:

""Once you’ve enrolled, the Dean’s Office will be in touch with information about housing, registering for courses, academic advising and more.""

It seems that for housing, just hold tight until you get contacted. As I haven't enrolled yet, I can't speak about whether the Williams account is set up yet.",6,KenVatican,1
gg6w0b,fpy6eu6,"we haven't really done anything yet, i guess you can send official test scores and stuff on the portal

im thinking they'll do housing and accounts once the june commitment deadline passes

also congrats!",3,guuz2001,2
gg6w0b,fpy78pq,congratulations! can't wait for the fall :))),3,glssy,3
rk9ltk,hp8om5f,pm me!,2,veryloudstupidlaughs,1
rk9ltk,hp8ood9,pm me!,2,alepirela,2
rk9ltk,hp8rtjo,Sure,2,tajuice,3
qteslf,hkk5w31,"You don't necessarily have a good chance even if you have a 1600 SAT, because Williams looks for more. In my opinion (as a current student), Williams cares less about SAT than people would expect. By far, the more important factor for admission is demonstrated passion for something and/or wealth (yes, I know, it's unfair).",6,KenVatican,1
qteslf,hkl2krz,"If you have time to study and take it again, I’d do it 🤷‍♀️",2,raidiantlimerence,2
qteslf,hl6xweq,"From what I read in the comments, I'd focus more on bolstering your application with more things you care about. Maybe start a project, like learning a language, doing community service, or taking an EdX course. Anything could work.",2,kqueenstar,3
p6vn3h,hagc7x4,"You can actually read about the Williams Rugby club here ([https://williamsrugby.com](https://williamsrugby.com)) and here ([https://en.wikipedia.org/wiki/Williams\_Rugby\_Football\_Club](https://en.wikipedia.org/wiki/Williams_Rugby_Football_Club)). It's actually a pretty famous collegiate rugby club (ex. a current Connecticut senator played for the club), and they have a lot of unique traditions. 

During my time there, they take the sport very seriously, and they have two coaches, compete in two seasons per year, have medical trainers, etc. But anyone can join, so there are guys in the club who are there for the social life as well. The club has a lot of fun social events as well, and as such, is one of the more tightly-knit groups on campus.",1,Farquaado,1
nvzr5w,h16oqyz,There is! It's kind of dead though. Here's the invite link to the class of 2025 discord: https://discord.gg/heqrq3AP,3,Bex9,1
nvzr5w,h430ted,"My gf is in the class of 2025 discord and it's still active right now, but to get in you have to message someone from the class of 2025 instagram page (https://www.instagram.com/williamscollege_2025/?hl=en) i think",1,betacux,2
mvf5eh,gvbjxrt,"There is a mock trial on the most current list of Williams activities: [https://sites.google.com/williams.edu/purplekeyfair2020/purple-key-fair](https://sites.google.com/williams.edu/purplekeyfair2020/purple-key-fair)

DM me if you need contact information.",6,chromium0818,1
mvf5eh,gvbrb3z,"There is an active Mock Trial, and I'm on it! Not sure where you got the stopped functioning stuff. It's super fun and everyone is really chill and friendly, I definitely recommend it :)",6,EnderFlash,2
mi3re5,gt51o9n,"This is a very common path, and Williams is very well-connected in government, law, and policy. Williams has one of the highest number of current alumni serving in office (4 in the House of Representatives, 1 senator, tons of state congresspeople, a few members of the extended presidential cabinet, etc.), not to mention the College is very well-respected in DC and several prominent lobbying/PR firms and law firms were founded by Williams alumni. There is an annual trek to DC that the career center organizes (paid for by the College) where students go to DC and meet alumni working in government, policy, and think-tanks. I can give you more info on how well Williams is represented on Capitol Hill to assuage any concerns you may have, but given how strong the alumni network is and how well alumni do in this field, Williams will give you a huge advantage when trying to enter this field down-the-line.

Generally speaking, the political science major at Williams works like this -- you major in Political Science, but you have to specialize in one of four subfields (international relations, political theory, etc.). Additionally, you can also concentrate in global studies and/or double-major in a language/ethnic studies, leadership studies, etc. Further, there is a Political Economy major, which is fairly unique, and is essentially a Public Policy major, and you can double major in PoliSci and Econ if you were interested in both. The major itself is really flexible like that.

Lastly, Williams offers tremendous opportunities outside of academics to gain exposure to foreign policy, policy research, etc. Williams showers undergrads with grants for research, travel, foreign language study, policy research, etc., and this aspect of Williams can't really be found at other colleges. All-in-all, Williams will help you tremendously with trying to enter the foreign policy/government field.

Hope this was helpful-- happy to elaborate on any questions you may have.",6,Farquaado,1
mi3re5,gt3dne2,"I’m just a student, so not really a super knowledgeable source, but I’d say a Williams education would set you up extremely well for such a career, given the catalog of courses available and the presence of the CDE. I don’t have statistics, but anecdotally I’ve known a few people who went into such careers after graduation and afaik are doing well.

A lot of political science classes at Williams are very much foreign policy related as well. I think a major in political science or political economy coupled with electives in economics, sociology, and environmental studies might be your best option.

Economics is a bit more abstract and quantitative than I think a lot of people realize before coming, especially in the core courses.",3,Stone2443,2
mi3re5,gt5kdke,"You've gotten some good responses here, but I just want to add that if you're interested in foreign policy at Williams you're right, there is no specific global affairs program, but Williams prides itself on staying at its Liberal Arts roots.

It's not a school where many people specialize early on. Sure you have some people going on one path early and sticking to it, but you can save your specialization for your graduate program. I would recommend using Williams as a place to learn how to learn, and a place to expand your horizons. You want to take courses from professors that interest you, and courses you might not have chances to take in the future. 

As was mentioned elsewhere Williams has connections and courses that will set you up well for a career in politics both foreign and domestic. But take your time working out how you want to achieve those goals. You could go into public policy, go into a think tank, get a masters or phd degree, get a law degree and practice, or even use Williams as a jumping off for a political career. My one recommendation would be to not limit yourself because they don't have 'X' major. Take your time, experiment with courses and professors and with your idea of what you want to do. Then when you find your direction you'll have the network and skills to make that idea reality. 

I hope that helps and isn't too vague or long winded! Good luck! Also that guy who just said those jobs don't exist is an idiot lol.",2,None,3
kuna0q,gisvkhn,hey! lmk if you need to be added to the groupme :) we have like 150+ kids in c/o 25 and we've been doing some zooms already. it seems like a lot of people are planning on going to both zooms! also look up williamscollege\_2025 on insta,3,skys-thelimit,1
kuna0q,gitp9vr,I’m going to both ^^,3,Gucci-As-Always,2
