post_id,comment_id,comment_body,comment_score,comment_author,comment_rank
ksu2c6,gii9mmk,"I honestly don't even remember that being an option when I applied (class of 23), but I could be wrong. I personally wrote my supplemental essay in response to the prompt about the entry system.  

You're absolutely right to doubt that the supplemental essay is really optional. Although I'm sure it's possible to get in without writing one, putting in the extra effort and doing it is a great way to reaffirm your interest in Williams. With a school as selective as Williams, it's best to do everything possible to give your application an edge.  

All in all, I think it's a better idea to write a new essay responding to one of their prompts than to submit an academic paper. Submitting a paper you've already written takes less effort than writing an entirely new essay, and it's best to avoid anything that could be interpreted as laziness/lack of interest in Williams. Also, since the supplemental essay prompts are specific to Williams, you can use the essay as an opportunity to show the admissions officers what you love about Williams and why it's the right school for you.",4,None,1
ksu2c6,giiatms,If you're submitting an academic paper it should probably be published somewhere or up for an award from your school or region etc. Otherwise I would simply go with the prompts.,2,None,2
ksu2c6,gikbxsw,"I am an admitted student for this cycle and I did not submit an academic paper. However, because I participated in WOW, I’m not sure if that counted since I had to submit an essay for the fly in program.",2,English_Space,3
kc9kxi,gfpxy1p,[deleted],2,None,1
kc9kxi,gfrhwmw,"Your field of interest sounds interesting, and while my time at Williams is well in the past (class of '94), I did a senior independent study in the department despite not being a music major and felt well supported. The department is strong but there aren't a lot of music majors, so at least in my day everyone who was had pretty specialized interests. If you think you have an exceptional talent as well as a strong overall application, that's a profile that would have been a good candidate for admission. 

If you feel *that* strongly that you have something special to offer and that Williams is the right place to explore it, I don't think it would be bad at all to email a professor or adjunct in the music department whose interests overlap with yours. It would probably be neutral for actual admissions purposes but you can get some information on whether there's a faculty member who can support studies in that area.",2,EggCzar,2
k5rlxo,gegyb94,"it shouldnt matter too much tbh, u have until your 2nd yr to decide and can always change in/out of a major, so i doubt admissions take it too seriously as long as it matches with the rest of your profile",5,koolpotato21,1
k5rlxo,gehed64,"No majors at Williams are any more or less competitive than each other. With that being said, your chances of getting accepted are *probably* best if you choose the major that most closely aligns with your extracurriculars and demonstrated interest.",3,KenVatican,2
k5rlxo,gf7plzq,"Also an insight to the on-campus reality of a CS major, i might be biased but it has one of the best communities. Everyone's collaborative and there's no cut-throat competitive spirit you might see at other colleges. Profs are super chill and pretty friendly. 10/10 would major again.",2,Gaudlas,3
jmmyz4,gaxaw7p,"My brother went to Colby and I went to Williams. Here's the good news, you can't make a wrong choice here. Both schools give you a good education, have thought provoking and caring professors, and a vibrant student body. The upside of Colby is that because they are so intensely remote there is a very strong campus connection. This is true at Williams as well, but moreso at Colby. The benefit of Williams is easier access to places like Boston etc. if you want to get away even though it is still remote and in the mountains for the most part. Both have January terms, Williams does have Mountain day which I think is an absolutely phenomenal tradition. You should also consider that Williams is a more difficult school to get into, and ED is your best shot of getting into your stretch in general.

I think overall there's not a huge difference in the two. If I were you I'd think back to my visits, think about the things you liked and didn't like at each place, and don't be afraid to just decide on your gut or a small opinion. You can't go wrong here either way. Good luck!",7,None,1
jeefxw,g9eq55a,I’d say go for the older teachers who you had a good relationship with.,4,Stone2443,1
ibj0mc,g1z1tm3,"All 4 sections of Mission are more or less identical in every way.

I lived in Frosh Quad so have no further comment.",8,Stone2443,1
ibj0mc,g22de8b,"Pratt is the same as the rest of Mission (Armstrong, Pratt, Mills, Dennett). It’s pretty nice. The common rooms are big and the rooms are small, but not too small. The big disadvantage this year is that Mission is further from a dining hall, but the walk to Paresky dining hall is still not bad.",2,Gavinmo,2
ibj0mc,g2hbqp5,"Pratt is part of Mission, which means there is a dining hall within the dorm (the biggest dining hall too), there are three other dorm buildings that are connected to Pratt (Armstrong, Mills, and Dennett), and the building is mostly singles (like 99% singles) with large common rooms. As other commenters have mentioned, the rooms are on the smaller side for Williams, but since Williams has so many singles, you're almost guaranteed your own space all four years.",1,Farquaado,3
i5dvwz,g0ohguh,"Iirc you enroll in the lab section on sarah.williams.edu at the same time as you add the course. It’s weird that I don’t really remember the enrollment process since it wasn’t that long ago that I took a lab...

The lab and lecture combined form a single course that you get one grade for, one credit, etc.",5,Stone2443,1
i52bpj,g0magrg,[https://discord.gg/F8aM5eE](https://discord.gg/F8aM5eE),3,None,1
i52bpj,g0m94od,"THERE IS A DISCORD  
i'll try to reach out to one of the higher-ups to get the invite link hang on",2,guuz2001,2
i52bpj,g0mpo7y,"Probably FB is a better bet- every class has an FB group which is pretty easily findable.

Discord is still pretty niche.",2,Stone2443,3
fyeg46,fmzo7do,"There’s fairly fast wifi all over campus, and it isn’t really regulated at all in my experience (not that I’m doing anything too crazy).",3,Stone2443,1
dv2gvz,f7akb1h,"It may be obvious, but the Observatory near Currier is easy to access by a spiral staircase outside the building. For star gazing, Cole field is great but 200 feet behind poker flats gets the job done. Better still, stone hill behind the clark is a magical place year round. 

Basements are really where it’s at. Dodd basement is spooky fun. Bronfman basement was the tits, but now the whole building is a ghost. Basically anywhere that doesn’t get traffic is a gem. Explore all the basements. 


The water street grill isn’t hard to climb onto but it’s illegal and stupid, so don’t get caught. Doughty house has great porches only accessible through windows. Garfield had some great stuff too but I guess they tore it down too. 

Also go to the Mt Hope estate when the wildflowers are growing.",8,ArrgguablyAmbivalent,1
dv2gvz,f7aernb,bro go to cole field at night and u can see the milky way on clear nights and css wont roll up on u and kill ur vibe literally no one will roll up on u,3,richtoddler,2
dv2gvz,f9f2bp6,"Might be a little late, but I've gotten on the roof of Schow, Clark Hall, West, Mission, '62 Center, and Stetson. As other people mentioned, it's probably to get away from Williams if you want to view the stars given that there's a not insignificant amount of light pollution from the campus.",2,purplecheph,3
bgb3mk,eljqqv8,"It is possible to triple major, but I wouldn't worry about it too much. From an employment perspective downstream I agree it's probably good to have a STEM degree on your resume if you want to go into e.g. a tech job (probably CS if you want to do ML, but probably math and/or stats could work too). Beyond that, I'd just focus on taking courses you're interested in and getting the most you can out of them. If you wind up with a second or third major or a concentration (or something close enough that it's worth finishing) then great, but I wouldn't kill yourself to get there unless you really want to do it.

As an aside, you might like to explore the cognitive science concentration at Williams, given your interests. There are some good professors / classes involved, and it does a nice job of bridging between some of the fields you've expressed interest in (CS, philosophy).

For background: I was a math & philosophy double major and did a cog sci concentration (and took a bunch of CS) at Williams and subsequently worked in tech.",3,JFoss117,1
rjwbnj,hp5yfq4,"I ws deferred as well and I I wondering. I applied optional with 3 gap years, yet with fantastic ECs and essay. Getting deferred made me think my profile is worth it knowing I asked for a full ride.",4,Icy_Criticism_7501,1
q9qwgo,hgzfltu,"Of 356 transfer applicants last year, Williams admitted only 9, as per the Common Data Set ([https://www.williams.edu/institutional-research/files/2021/09/2020-2021\_CDS\_Williams\_College\_tuit-2.pdf](https://www.williams.edu/institutional-research/files/2021/09/2020-2021_CDS_Williams_College_tuit-2.pdf)).

But your grades are good, so there is no harm in giving it a try, even though the odds are slim. Perhaps also try for many other similar small schools.

The campus has some great aspects, with gorgeous mountain views, a beautiful library, an attractive library quad, a walkable campus also with walking distance of hiking trails… and two less nice aspects:  Route 2 bisecting the campus (not too terrible- it is a two lane road that is much less busy than the double yellow lined two lane road in my suburb at home) and dorms that are in various stages of aging/upkeep.

Students vary, as is true anywhere, I suppose. Lots of nerdy types, lots of athletes (and somewhat different cultures between those two groups)… people who like to party, people who like to play board games or video games, people who like to hike or bike or canoe, people who like to sit and around and talk with friends, lots of attendance at concerts and plays and speeches and campus sporting events. The students are nicely diverse, from a wide variety of backgrounds. You can expect to have friends from different racial, cultural, national, state, sexual preference, and socioeconomic backgrounds from yourself. 

As a transfer student, you won’t have the unifying experiences of the freshman entry experience, so I would recommend getting involved quickly in an organized club or group or a club sport, in order to make friends. That’s the best way to meet people, although you also can ask someone you’ve been talking to in a class to join you afterwards for lunch. You will meet people and find friends, *though it will take effort and initiative to do so.*  In general, though, people are friendly and nice.

But the reason to go to Williams is the academics. IMO, that’s where you will love Williams. If you crave intellectually stimulating conversations with brilliant, caring professors and bright, interested peers, Williams is THE place to go. It is hard to imagine that a college education could be better anywhere else. For deep thinkers, Williams is nirvana.",12,Wordwoman50,1
os8cly,h6o9vp0,"You will earn enough if you make the time for it. I worked in the dining hall, as a baby/house sitter and as a tour guide and made enough to buy my tickets home, eat out occasionally and pay for my other living expenses. I had no help from family and made do. Another trick is to drop your meal plan down to 10 meals/week and get the extra $$ back for the full meal plan. Hit up all the free meals and/or get friends to swipe in for meals to make it up.",6,EphWilly,1
os8cly,h6munn2,Student jobs are somewhere around 13.50 an hour.,6,KenVatican,2
o3vmx8,h2fae6h,Hi! I’m not exactly enrolled yet but I’ll be a frosh soon so you can DM me and I’ll try and do my best! It’s also rare to see Singaporeans around here so that’s always a sight for sore eyes :D,2,notquantityofmoney,1
o3vmx8,hece668,Good luck dude,1,RomulusJLupin,2
mxic1l,gvp7yef,"I'm not sure I understand your question, but if you are accepted off the waitlist, you simply need to email your current college and tell them that you will not be attending. They can't force you to go to their college instead.",4,KenVatican,1
ktld87,gimy8el,Yeah you still get a chance to discuss.,2,Last_Eph_Standing,1
krxchd,gictc1t,"Hey! I'm an ED '25 admit and I wrote this essay :) You can make up any class you want -- it doesn't have to be one that's already in the curriculum. Once you decide what you'd want to learn, definitely focus in on just that idea. Choose something that highlights an interest of yours (writing about your intended major would be good, unless it's already represented in your commonapp essay, in which case choose a different academic interest). I'd recommend reading the Williams website tutorial page & watching the tutorial video to understand more about how they work!",5,skys-thelimit,1
krxchd,gicn9xs,"Yes, they are considered a class. Normally there are 10 people per tutorial divided into 5 pairs. There’s no limit to how many we can take every year but people generally take only one per semester since they are very writing intensive. They are offered both in the fall and spring across various departments.",2,No_Professor_7319,2
kag9ww,gfaa9qt,"Dont worry about stats tbh, honestly it doesn't help too much haha I used to do this a lot (and can relate with the intl w/aid fact), but as the decisions rolled in, I realised all the stats ppl told me, all the chance mes were all useless for one reason alone:   
Each applicant is admitted for their unique strength and bring something to the table.   


So, everyone is different, and stats alone say nothing. Some tips would be to show how you're different and unique. Think about these:  
What makes you, YOU and not anyone else? How are you different than any other applicant? Why should a college take you in? While it's true you gain a lot from the college, try thinking about what the college can gain from admitting you and having you as their student?

If you can show the answer to these in your applications, Im sure there will be at least one AO during your application season who will vouch for you :)) Good luck!",9,koolpotato21,1
jfds1i,g9l1wsd,"Just wanna emphasize that tons of Williams students don’t have stats like the other comment- I personally had a 3.7 gpa, high act, awful subject test/ap scores, and had a specific field that I had a few strong extracurriculars in.",2,MrLynxi,1
jfds1i,g9m44v5,"4.5 gpa (rank 2), 1440 sat

couple 5s on ap, ib diploma

chaired a couple clubs, did sports",2,varifice1,2
jfds1i,g9ll8x3,"1600 SAT and 4.0 GPA (valedictorian) but basic white kid with ordinary ECs (sports) and a terrible essay.

I also trolled on the Williams supplement because I didn’t think I’d want to go to Williams anyway.",2,Stone2443,3
j631dv,g7wb31q,"Hey! I’m an international student who’s a freshman at Williams right now, and I applied ED last year. Feel free to DM me!",3,Like-A-Phoenix,1
hdlf3u,fvlwabn,"Best pay- nude model (yes)

Easiest- prob manning one of the help desks that no-one uses

Most enjoyable- depends on the individual.

Research assistant for a professor is probably the most “prestigious” job you can have.",15,Stone2443,1
godkeh,frgefk9,"That sounds good, just be aware that some professors will only let you take notes on paper.",4,wordflow,1
fue0t9,fmdgp40,"Images in Williamstown is an arthouse sort of movie theatre that plays a lot of foreign films and so on.

If you want to watch blockbusters there is a movie theater or two in north adams which is a ~10 min drive away.",3,Stone2443,1
fue0t9,fmc6bj0,Ok. Thanks,2,fae-movies,2
fue0t9,fmf1wew,"To add to what Stone2433 wrote, Images also plays blockbusters fairly regularly.  Organizations in campus will also sometimes provide students free tickets as well.",1,goatsarepower,3
dzkupi,f8si73p,"A liberal arts education makes you a well-educated, global citzen. The education isn't streamlined for pre-med students, if that's what you're into. I'm not pre-med, though, so I can't say much.",3,raidiantlimerence,1
dkli8e,f4i3mfd,"I used to go to Thompson Chapel and sit there to finish papers. Do they still have the study room in Paresky, on the second floor? That's a good study spot, too.",4,purofound_leadah,1
dkli8e,f4idurz,"Monkey carrels....  
and the MCC were my favorite",3,EphWilly,2
dkli8e,f4l91jv,"There should be a study room for your major as well, I usually studied there as it was also more likely to find someone to help if needed.",1,None,3
bxwh0w,eqbpnt7,"I consider myself moderately intelligent and still graduated from Williams. While I leaned more heavily on the B-sides of grades, I still had a wonderful and enriching time learning in my classes and from my peers. There were a few students who were practically geniuses--and I was always awed by them--but they weren't the norm. You will notice that the student culture definitely prioritizes studying with students hanging around Paresky and other common buildings and areas to study, but being in that environment helped me acclimate and prioritize studying myself (which I needed to do to keep up with my classes). As long as you stay aware of what your classes are asking of you and meeting those expectations (some classes are more time-intensive than others, for sure), you should be fine!",6,aesthete17,1
bxwh0w,erlqain,"As a recent alumnus, I will say that Williams College, across the board, is extremely academically rigorous and is part of an echelon of colleges that includes Princeton, UChicago, MIT/Caltech, Swarthmore/Harvey Mudd. It is possible to coast by (by not writing a thesis, by not taking tutorials or seminar classes, by not taking many science/math classes, etc.) and still graduate, but you still have to work harder than your peers at larger, less personal universities just to get through your assignments. Further, you will be surrounded by people who are determined to work hard (Williams has a palpable ethos of over-the-top work ethic) and from what I've experienced, the minimum that most students spend each week on studying/doing coursework is roughly 40 hours. You simply can't bullshit your way through seminar classes or tutorials, and most lecture courses involve long problem sets, labs, etc. 

However, it's all extremely rewarding. The College is not full of fake intellectuals, and the kind of intellectual engagement you will experience from your peers, professors, and community is profound and authentic. You will really, truly appreciate the luxury of that intellectual experience once you're out in the working world.",3,Farquaado,2
bxwh0w,er1ajjm,"Thx all - Davidson is actually one of the other schools I’m considering but also heard that it’s at least, if not more, academically focused than Williams. Funny comment about kids griping about the intensity because I got the same impression talking to tour guide and current athletes.  Great school though - you guys consider it at same level or notch below Williams in terms of reputation? Say for a nyc employer",2,Islandlaxer,3
bkyjzc,emkqkn9,[deleted],4,None,1
bkyjzc,emkgzl5,"There’s a Peter Pan bus that goes there (also to Boston and some other cities) daily from the Williams Inn. ~5 hour ride including a couple of transfers, costs 40-50 bucks one way.

Or you can bum a ride from another student- a lot of people will ask for rides in the class facebook groups.

Also the workload is high enough that most people don’t leave campus on too many weekends. It’s totally doable though and I’ve headed to the city for concerts a few times in my time here.",3,Stone2443,2
aecph5,edquei1,"Hey, class of '22 here. Go out and meet people! I'm quite introverted so that was difficult for me, but try out meeting different groups of people. Meet people in each of your classes and try to find a study group quickly. Everyone is very friendly and you can walk up and start a conversation with basically anyone.

Set up a schedule quickly and stick to it. Classes can get pretty hectic and if you don't have a good study schedule including extracurriculars (working out, faith groups, music, etc) set up early, if you don't it won't get done.

You are smart. There are a ton of very intelligent people here just as at any top college and most of us haven't been around this many smart people. Remember you are meant to be here, enjoy the company of awesome people, and learn tons from them!",8,emotionalthief,1
aecph5,ee08h7q,[https://www.reddit.com/r/WilliamsCollege/comments/8lzkdl/any\_social\_or\_general\_tips\_for\_an\_incoming/](https://www.reddit.com/r/WilliamsCollege/comments/8lzkdl/any_social_or_general_tips_for_an_incoming/),2,Quaerendo_Invenietis,2
adm6dj,edjhoib,Maybe it’s because the college buys big fucking marble slabs in stead of staffing the humanities departments. ,9,ArrgguablyAmbivalent,1
adm6dj,ee5kvc6,"I am a current senior (Just finished applying to my schools), and while Williams was in fact #1 on my list for almost a year, I came to the realization that dishing out the stupendous amount for college tuition was just not feasible. While the tuition cost into a problem, the “un-feasible” part about applying to the school is due to a variety of variables. One of them being the student loan debt crisis the United States is facing. As I look to the people who are 10-20 years older than me, and continually receive the advice of “DO NOT GO INTO DEBT” or well at least enormous debt, it had an off putting vibe to it which ultimately resulted in  my decision to not apply to the “elite” LAC’s. 

Another reasoning for revoking my own application from most of the NESCAC schools, is due to the schools environments. While I know Williams is undeniably elite in its academic rankings, and social connection ratings, one thing I couldn’t overcome was the overall emphasis on school to work ratio. After all, its college, and with that I don’t want to delve into a four year program filled with un-healthy amounts of stress, depression and binge drinking at a relatively smaller school, which seems to have a culture similar to a high school environment. Yes, Williams may set me up for a nicer job in life, and place me into a higher social network, but the average 18 year old (aside from myself) is most certainly not thinking about the long-game. Applicants nowadays I believe, have woken up to the notion that maybe their dreams aren’t obtainable anymore, so instead of paying the application fee (unless you have a waiver fee), they have given up entirely and set goals which are more obtainable and bring satisfaction. Not only this, but kids are also looking at more value schools. From a general consensus of my friends, everyone is either opting for a state school, or banking on over 1/2 tuition. 

Hopefully this mess is somewhat coherent, and if not just Pm me to ask any further questions! ",3,Peltremous,2
adm6dj,edjg9yk,"If I were to guess, marketing/advertisement wasn’t as good or big this year",2,TheRoyalty,3
aap56b,ecumvtt,um i get litty,3,richtoddler,1
aap56b,ecuuah9,"Play Xbox with friends, board games, watch some movies. If you're into parties those are available as well.",3,emotionalthief,2
aap56b,ecu9fnp,"Alcohol, ennui, books, generally in that order",1,ArrgguablyAmbivalent,3
9bzl5t,e5sym8p,"It's great! Pretty theory-heavy, at least when I was there, but I think that's common amongst Liberal Arts schools - the idea is to teach you to be a Computer Scientist, not specifically a database person or web person or whatever. Personally, I jumped into a full stack job after graduation with no problem, even though I had never touched C#, SQL, or Javascript. The professors go by their first names, and are very accessible. There are (or at least were) a couple of tutorial options, which I highly recommend. Do you have any specific questions?",3,karlanke,1
